PassageID,Title,Author,Total termFreq,termFreq(appear),termFreq(believ),termFreq(blood),termFreq(bodi),termFreq(cafe),termFreq(caus),termFreq(christ),termFreq(dead),termFreq(death),termFreq(die),termFreq(divin),termFreq(end),termFreq(etern),termFreq(faith),termFreq(fall),termFreq(father),termFreq(fear),termFreq(follow),termFreq(foul),termFreq(friend),termFreq(gener),termFreq(glori),termFreq(god),termFreq(grace),termFreq(grave),termFreq(hall),termFreq(hand),termFreq(heart),termFreq(heaven),termFreq(holi),termFreq(hope),termFreq(jesu),termFreq(kill),termFreq(king),termFreq(know),termFreq(law),termFreq(life),termFreq(littl),termFreq(live),termFreq(love),termFreq(mean),termFreq(natur),termFreq(noth),termFreq(peopl),termFreq(person),termFreq(power),termFreq(present),termFreq(reason),termFreq(receiv),termFreq(sin),termFreq(soul),termFreq(spirit),termFreq(state),termFreq(taken),termFreq(think),termFreq(thought),termFreq(wife),termFreq(word),termFreq(work),termFreq(world),Publication Year,Volume Number,Total Volumes,Imprint,Publication Place,Total Pages,Gender,Birth Year,Death Year,Popular Authors,short_excerpts
0265800400_000101,"A spiritual treasury, for the children of God: consisting of a meditation for each day in the year, upon select texts of Scripture. Humbly Intended To establish the Faith, promote the Comfort, and influence the Practice of the Followers of the Lamb. By William Mason. With a recommendatory preface by the Rev. William Romaine, A. M. Lecturer of St. Dunstan's in the West.",William Mason,122,0,2,1,5,0,0,2,2,3,0,0,2,4,3,1,4,1,0,1,1,0,4,14,3,0,0,0,4,2,3,2,7,0,0,6,1,4,2,1,4,0,2,2,0,0,0,1,0,0,9,5,1,1,0,3,1,1,1,1,5,1765,1,1,"London : printed: and sold by M. Lewis, in Pater-Noster-Row; and E. and C. Dilly, in the Poultry, MDCCLXV. [1765].",London,369,male,1719,1791,TRUE,"to the soul by the everlafing Spirit Consolation and comfort of heart is iueparable from a flabi in the good word of the Lord and in works of riehteourieis and TRUE holiness ; "" to the praik of the glory of his own grace ."" Ephi. 6 ( cot) JULY"
0850700500_000085,"The afflicted man's companion: or, a directory for persons and families, afflicted with sickness, or any other distress. With Directions to the Sick, Both under and after Affliction. Also, Directions to the Friends of the Sick, and others who visit them. And likewise to All, how to prepare both for Sickness and Death; and how to be Exercised at the time of Dying. To which is Added. A Collection of Comfortable Texts of Scripture, very suitable for dying Believers. - The Choice Sayings of many Eminent Dying Saints. - The Author's Last Advice to his Wife and Children: And his Dying Words, written by himself, and found among his Papers after his Death. By the Reverend Mr. John Willison, Late Minister of the Gospel in Dundee. Very Necessary for all Families.",John Willison,112,0,3,3,0,1,0,9,1,1,2,0,0,1,6,1,1,0,1,0,3,0,0,15,3,2,0,1,2,3,2,2,4,0,2,1,2,4,0,2,2,1,1,0,1,4,0,0,0,0,3,5,3,1,1,1,1,1,1,3,5,1790,1,1,"Falkirk : printed and sold by Patrick Mair, MDCCXC. [1790].",Falkirk,341,male,1680,1750,FALSE,"When we observe their professions of love to Christ , and their hope in him to the last, it doth contribute to the quick cning and strengthening of our faith . A right sight of dying persons , is a good mean to increase the Spirit of grace and supplication"
1089300100_000007,"A dying pastor's legacy to his people. Being a collection of divine and moral sentences, taken from a multitude of sermons preach'd among them; and design'd for their Establishment in the Truths of the Gospel; and for their Furtherance in Grace, Holiness, and Comfort: Prepared for this Time of great Declension from the Truth; and Decay of the Power of Godliness. By the Revd. Mr. W. Notcutt.",William Notcutt,111,0,2,2,5,0,0,4,0,3,2,2,3,3,4,2,1,3,0,0,0,1,3,11,5,1,0,1,3,2,2,0,4,0,0,0,0,2,1,2,1,0,3,4,1,0,0,2,0,1,3,9,1,1,0,2,1,0,2,4,2,1744,1,1,"London : printed for J. Oswald, at the Rose and Crown in the Poultry, near the Mansion-House, [1744].",London,107,male,1672,1756,FALSE,"Word of God to say, by the Grace of God I am what I am; by Grace are ye faied through'. Faith , and that not of your selves, it is the Gift of god . By their Scheme it is unceftaih,  whether' any one Soul'of all Adam's Adam's"
0134602200_000005,"The life and death of a Christian, opened and applied, in a sermon Occasioned by the death Of the late Reverend Mr. James Wood, Who departed this Life May the 15th, 1742. Preached At the King's Weigh-House in Eastcheap. By W. Langford, M. A. Published at the Request of the Congregation.","Langford, William",113,0,0,1,4,0,1,6,3,3,4,3,3,1,2,0,1,0,0,0,1,0,6,5,1,1,1,0,0,2,3,2,6,0,0,4,0,11,1,9,2,1,0,0,0,2,3,1,0,1,3,0,5,2,0,1,1,0,1,1,4,1742,1,1,"London : printed for Joseph Davidson, at the Angel in the Poultry; and Richard King, at the Bible and Crown in Forestreet, [1742].",London,30,male,1704,1775,FALSE,"State in the vtprld and Church here below., And he speaks in the Name of all TRUE Christians; southeast are alwayi c^.f2ident (or courageous)' knowing it'tt whik we are at, e in the Body , we are abjent from the Lord; (for .', walk by Faith , and not by"
0357400802_000045,"Miscellanea sacra, or, the theological miscellany.",,105,1,5,1,0,1,0,3,1,1,1,4,2,1,2,0,1,0,1,1,0,0,10,7,4,0,0,1,4,2,4,2,3,0,1,3,1,2,1,2,7,0,1,0,1,1,4,1,0,0,1,2,1,0,0,2,7,0,2,1,1,1797,2,2,"[Ewood Hall] : Printed and sold at Ewood Hall, near Halifax [by John Fawcett] Sold also by T. Wills, Stationer's Court, Ludgate Street; Johnson, St. Paul's Church Yard; W. Button, Paternoster-Row; Knott, Lombard Street, and Martin, No. 27, Great Russel-Street, Bloomsbury, London, 1797-99.",Midgley_eEwood Hall,436,unknown,,,FALSE,"unto death was periec and complete; that his blood cleanfeth from all sin ; that his righteousness renders those who believe accepted: with the Father , unto eternal life ; that his power and grace are sufficient to conquer, al.loau difor 4erly passions, to support: us unde alli our.tempta tions,"
0389100300_000083,"The afflicted man's companion: or, a directory for families and persons afflicted with sickness or any other distress. With Directions to the Sick, Both under and after their Affliction. Also, to the Friends of the Sick, and Others Who Visit Them: and Likewise to All, How to prepare both for Sickness and Death; and how to be exercised at the time of Dying. With A Collection of the Dying Words of many choice and eminent Saints. Necessary for Families. To which are Added, The Dying Words of the Author, written by himself, and found among his Papers after his death. By the Rev. Mr. John Willison, Late Minister of the Gospel at Dandee.",John Willison,97,0,5,3,1,0,0,3,3,3,1,0,0,2,3,1,1,1,0,0,0,0,1,14,2,1,1,2,1,3,2,2,3,0,1,1,2,3,0,3,1,0,1,0,1,3,0,1,0,0,2,4,0,2,1,1,1,1,1,3,5,1800,1,1,"Falkirk : printed and sold by T. Johnston, 1800.",Falkirk,288,male,1680,1750,FALSE,"neediul; promie s may be adlnilii liered, lhen threatcilngs arc r: cre lroper. II bev.are of flatte; irg the lick itlh vain hopes of L fe, V hcn ie is r.ore likely to die ; Il:. lte le thereby tel; : Fp; CD to (ielay cr fickeln his ifrcparaticn for"
0400202800_000020,"The scripture-Doctrine of divine grace. By the Reverend John Andrews, LL. B. Vicar of Marden in Kent, and Chaplain to his Grace the Duke of Dorset.","Andrews, John",104,1,1,1,5,0,2,4,2,2,0,2,1,4,2,0,0,0,1,0,0,0,8,4,3,2,2,1,4,4,2,1,2,0,0,0,0,3,0,3,5,1,2,0,1,0,2,0,4,0,4,2,5,1,0,0,1,0,1,2,6,1769,1,1,"London : printed for Edward and Charles Dilly, in the Poultry near the Mansion-House, MDCCLXIX. [1769].",London,209,male,1729,1813,FALSE,"virtues were planted there by the holy Spirit ; if men loved one another, as CHRIST hath commanded them, and in consequence of their love to GOD ; if the mild and peaceable tempers of the Gospel universally prevailed; this world would be a paradise compared to what it is,"
0892400103_000130,"The Methodist magazine, for the year ... ; being a continuation of The Arminian magazine, first published by the Rev. John Wesley, A.M. consisting chiefly of extracts and original treatises on general redemption.","Story, George",100,2,2,0,1,1,0,2,1,1,0,2,0,1,1,0,2,2,3,1,4,0,2,12,4,0,1,2,1,1,2,1,4,0,0,4,0,3,1,1,6,2,1,0,1,5,3,1,0,2,1,2,2,1,0,1,0,0,2,0,5,1798,3,3,"London [England] : printed for G. Whitfield, City-Road, and sold at the Methodist Preaching-House in town and country, 1798-",London,595,unknown,,,FALSE,"to the world , the holy lives and happy deaths of many of our fiiends in the present age, is to induce others to take up their cross, and become followers of them, who through faith and patience, now inherit the promises.. Some of the dispensations of heaven seem to"
0329100300_000017,"Christ precious to those that believe, a practical treatise on faith and love. By John Fawcett, A.M.",John Fawcett,104,1,5,1,0,1,0,7,1,1,1,3,2,1,1,0,2,0,1,1,0,0,9,6,4,0,0,1,4,2,4,1,3,0,1,5,1,1,0,1,4,0,1,0,1,1,5,1,0,0,3,5,1,0,0,1,5,0,2,1,1,1799,1,1,"Ewood Hall : printed and sold at Ewood Hall near Halifax, [by John Fawcett] Sold also by Wills, Stationers' Court, Ludgate-Street; Johnson, St. Paul's Church Yard; Button, Paternoster-Row; Knott, Lombard-Street; Martin, No. 27, Great Russel-Street, Bloomsbury, London; by Edwards, Holden, &c. Halifax; Smith, Sheffield; Jones, Liverpool; Dunn and Biggs, Nottingham, and Rawson, Hull, 1799.",Midgley_eEwood Hall,307,male,1739,1817,FALSE,"unknown Redeemer. ""They that know thy name,"" 10 God our Saviour, "" will put their truift in thee."" This {  This trust confilts in a committing of the guilty helpless soul to the care of Christ , who is commissioned by his almighty Father to take care of lost"
0448600600_000006,"Free grace exalted, and the proper use of the moral law evinced: in a sermon, On Romans, chap. viii. ver. 3, 4. By W. Moore, Minister of Glass-House-Yard Meeting, Aldersgate-Street.","Moore, William",129,5,0,0,3,0,0,5,1,1,1,2,1,4,3,1,1,1,1,0,0,0,1,20,3,1,0,1,3,2,5,5,5,0,0,3,16,5,0,4,1,0,4,1,0,1,1,2,0,1,3,0,3,0,1,0,2,0,2,1,2,1794,1,1,"London : printed for the author, by W. Smith, King-Street, Seven-Dials; sold by J. Mathews, No. 18, Strand; W. and J. Stratford, No. 112, Holborn-Hill, and E. Elliot, Falmouth, [1794].",London,31,male,1748,1798,FALSE,"body ) in sanctification and honour."" I Theff IV 4 The Law could not give peace of conscience But, ( being justified by faith , we have peace with God , through our Lord Jesus Christ ."" Rom. V I. even, the peace of God which passeth all understanding."" The"
0281900700_000116,"Familiar letters to a gentleman, upon a variety of seasonable and important subjects in religion. By Jonathan Dickinson, A. M. President of the College at New Jersey.",Jonathan Dickinson,118,0,7,1,1,0,9,7,0,1,0,2,0,6,2,3,3,6,1,0,3,0,0,11,3,0,2,2,1,1,1,2,1,0,0,0,1,2,1,2,2,1,1,0,1,0,2,0,2,0,15,2,2,1,0,1,2,1,0,0,3,1784,1,1,"Edinburgh : printed for and sold by W. Gray, M,DCC,LXXXIV. [1784].",Edinburgh,401,male,1688,1747,FALSE,"Christ , reconciled to God , fieed from all condemnation, arid made heirs according to the hope of eternal life The satisfying evidences of which blessed state must: carry them above any tormenting fears of hell and eternal perdition; and deliver them from that legalrepentance which is the product of"
1647800400_000082,"The afflicted man's companion: Or, A directory for families and persons afflicted with sickness or any other distress, with directions to the sick both under and after their affliction. Also to the friends of the sick, and others who visit them; and likewise to all how to prepare both for sickness and death, and how to be exercised at the time of dying. With a collection of the dying words of many choice and eminent saints. Necessary for families. By the Reverend Mr. John V Villison minister of the Gospel at Dundee.",John Willison,103,0,5,4,1,0,0,4,3,3,1,0,0,2,3,1,1,1,0,0,0,0,1,16,2,1,1,2,1,3,2,2,3,0,2,0,2,3,0,3,2,0,1,0,1,3,0,1,0,0,3,3,0,0,1,1,1,1,2,4,6,1752,1,1,"Glasgow : Printed by John Robertson and Mrs M'lean, sold at their Shops, Salt Mercat, M,DCC,LII. [1752].",Glasgow,300,male,1680,1750,FALSE,theistreain~gs southeast · more proper II Beware of flattering the sick with Ivainl hopes es ife when he is mnore likely to die ; i self he be t hereby thereby tempted to delay or slacken his preparation for another world It is fit that plainners be used with refpea
0265800400_000172,"A spiritual treasury, for the children of God: consisting of a meditation for each day in the year, upon select texts of Scripture. Humbly Intended To establish the Faith, promote the Comfort, and influence the Practice of the Followers of the Lamb. By William Mason. With a recommendatory preface by the Rev. William Romaine, A. M. Lecturer of St. Dunstan's in the West.",William Mason,125,0,2,1,1,0,0,4,2,4,0,0,1,2,6,0,5,6,1,1,1,0,5,8,3,0,0,1,5,0,3,2,13,0,2,4,0,4,1,0,10,0,1,2,1,0,1,2,0,0,7,2,7,0,0,1,0,0,1,1,1,1765,1,1,"London : printed: and sold by M. Lewis, in Pater-Noster-Row; and E. and C. Dilly, in the Poultry, MDCCLXV. [1765].",London,369,male,1719,1791,TRUE,"prescribes methods of convition, and refules to submit to thorfeof infinite wisdom. Through a life of thirty years Jesus had afforded them the fulled convision to their senses, and they believed notoil him; neither would their hearts have been persuaded though he4lad coma down from the cross; yea though he"
0872300400_000122,"The christian's defence against the fears of death. With seasonable directions how to prepare ourselves to die well. Written originally in French, by the late Reverend Divine of the Protestant Church of Paris, Charl. Drelincourt. Translated into English, by Marius D'Assigny, B.D.",Charles Drelincourt,122,2,2,1,4,1,3,2,1,12,1,4,1,5,2,1,2,1,0,0,0,0,7,4,1,0,1,1,4,4,5,1,7,0,0,0,1,10,0,2,2,0,0,1,0,0,1,3,0,1,0,9,7,0,1,0,1,0,0,0,3,1756,1,1,"London : printed for R. Ware, W. Innys and J. Richardson, W. and D. Baker, J. Knapton, J. Clarke, C. Hitch and L. Hawes, J. Hodges, E. Wicksted, B. Dod, John Rivington, James Rivington and J. Fletcher, J. Ward, R. Baldwin, W. Johnston, T. Caslon, S. Crowder and H. Woodgate, M. and T. Longman, P. Davey and B. Law, C. Corbett and M. Cooper, MDCCLVI. [1756].",London,531,male,1595,1669,FALSE,"h1s Bowels with a serious and repeated Meditation, we shall find the sweetest and most ravishing Comforts. As when the Prophet Elias was carried up to Hea en in a fiery Chariot, he let fall his Cloak, with which elijja separated the Waters of Jordan, so that he passed through'"
0441500200_000101,"The catechism of the church of England explained, by short and practical discourses to each question and answer. In five parts. Containing I. What must be done by every Christian, with regard to the three great Duties, which he promised, by his Godfathers and Godmothers, in the most solemn Manner, at his Baptism to perform. II. An Explication of the Apostles Creed, in separate Articles, according to the Order in which they stand in the said Creed. III. An Explication of the Decalogue or Ten Commandments, as they stand divided into two Tables. IV. An Explication of the Lord's Prayer in separate Petitions, with the Reason why the Doxology is omitted in that Prayer, as placed in the said Catechism. V. An Explication of the Two Sacraments. viz. Baptism, and the Lord's Supper, according to the Notion that the Church of England has of them, in Contradistinction from other Churches, but especially the Church of Rome, and the People called Quakers. To all which is subjoin'd an appendix in three parts. I. Concerning the Nature and Use of Confirmation in the Christian Church. II. Concerning the Last Day, or great and general Day of Judgment. III. Containing some Devotions, both for the Family and the Closet. The whole designed to be read, not only in private Families, but in Schools, by Boys of a superior Class, to the rest in the same School, to enable them to pronounce their Words with proper Emphases and Cadences, and thereby banish from thence all idle Plays, which are too apt to give an ill Turn of Thought, and therefore are very dangerous. By Thomas Dilworth, Author of the New Guide to the English Tongue, Schoolmasters Assistant, &c. &c. and Schoolmaster in Wapping.",Thomas Dilworth,99,0,3,0,1,0,0,3,2,2,1,1,2,2,7,0,1,1,1,0,3,0,2,7,3,2,1,2,1,1,3,1,4,0,0,2,1,3,0,3,6,0,0,0,1,0,0,1,1,1,5,4,2,0,0,1,2,0,1,2,6,1772,1,1,"London : printed and sold by Richard and Henry Causton (successors to the late Mr. Henry Kent) at the Printing Office, No. 21, in Finch-Lane, near the Royal Exchange, MDCCLXXII. [1772].",London,239,male,,1780,FALSE,"Health and Cheer. fuinefs to prai(e Thee both in Soul and Body in the Miornirg, 0 that our Friends and all thy People in every Place, may partake of the same Mercies we desire for ourselves: And howsoever we are severed one from another. in this World , grant us"
1446100100_000081,"The afflicted man's companion: Or, A directory for families and persons afflicted with sickness or any other distress. With directions to the sick, both under and after affliction. Also to the friends of the sick, and others who visit them: and likewise to all how to prepare both for sickness and death, and how to be exercised at the time of dying. With a collection of the dying words of many choice and eminent saints. Necessary for families. By the Rev. Mr. John Willison, Late minister of the Gospel at Dundee.",John Willison,105,0,6,3,1,1,1,8,3,3,1,0,0,1,4,1,1,0,1,0,0,0,1,14,2,1,1,1,2,3,3,2,4,0,1,1,1,4,0,3,1,0,1,0,1,3,0,0,0,0,3,4,0,1,1,0,1,0,1,3,6,1783,1,1,"Kilmarnock : Printed and sold by J. Wilson, bookseller, M.DCC.LXXXIII. [1783].",Kilmarnock,301,male,1680,1750,FALSE,"careful to drop in wholesome infirucions into it; and, when the heart is made tender by sickness, it is a fit season for good counsel to make impressions on it. Let the opportunity then be impro ven with faithfulness and prudence. And, in order thereto, observe the following advices. L"
0039400103_000045,"Posthumous works of the Rev. Thomas Adam, late Rector of Wintringham. In three volumes. ... . Containing his Private Thoughts on Religion, and Sermons on different Subjects. To which is prefixed A Short Sketch of his Life and Character.","Adam, Thomas",101,1,0,2,4,0,0,3,1,5,1,0,2,2,4,0,0,2,1,0,0,1,1,11,2,2,0,1,1,1,2,1,3,0,0,5,0,1,0,3,5,1,3,4,1,1,1,0,0,1,8,3,2,2,0,1,1,0,2,1,1,1786,3,3,"York : printed by A. Ward, and sold by J. Buckland, Pater-Noster-Row; C. Dilly, in the Poultry; and J. Matthews, in the Strand, London; by all the booksellers in York; and T. Browne, Hull, MDCCLXXXVI. [1786].",York,420,male,1701,1784,FALSE,"they arole only to appear to others, and then lie down in their graves again, but to ascend with him, soul and body , into heaven . Per. 54 Now when the Centurion, &c. it is remarkable that the hearts of this heathen captain and his soldiers were thook with"
0661800100_000809,"The new and complete book of martyrs, or, an universal history of martyrdom: being Fox's Book of martyrs, revised and corrected with Additions and great Improvements. Containing Not only a New, Copious, Complete, Universal and Authentic Account of the Lives, Actions, Characters, Trials, Religious Principles, Sufferings, Tortures, and Triumphant Deaths, of the English Protestant Martyrs, In the Reign of Queen Mary the First. But also a Genuine, Full, and Circumstantial History of all the many dreadful and cruel Persecutions against the Church of Christ, in all Parts of the World, by Papists, Pagans, Jews, Turks, and Others, From the very Earliest Ages of the Church, to the Present Period. Comprehending the Life, Meritorious Sufferings, and Martyrdom of our Blessed Lord and Saviour Jesus Christ, with the Martyrdoms of the Apostles, Evangelists, Disciples, and other Primitive Martyrs. - And including the Ten Great Persecutions, under the Roman Emperors, and many other Particulars under the following General Heads: An Ecclesiastical History of the Persecutions in Persia, under Sapores: and the Persecutions under the Arian Vandals. - The horried Persecutions under the Papacy; particularly the Martyrdoms of the Waldenses and Albigenses in France. - The Persecutions in Germany and Poland. - The Cruelties exercised in Bohemia and Lusatia. - The Martyrdoms in Italy. - The shocking Barbarities practised by the Inquisitions of Spain, Portugal, Goa, &c. and the Popish Persecutions of the Protestants during the Massacre of Paris. - A full Account of all the English Martyrdoms, particularly those in the Times of King Henry Viii. and Queen Mary I. wherein are amply displayed all the Butcheries, Tortures, and Cruelties exercised by the Roman Catholics against the Protestants, in the Reign of that tyrannical King and bloody Queen. - The Persecutions of the Quakers, &c. - Persecutions in the West of England by Judge Jeffreys. - Persecutions in Holland, Flanders, Scotland, &c. - The bloody Irish Massacre. - The great Spanish Invasion. - The dreadful Fire of London. - The shocking Gunpowder Plot. - The horrid Conspiracies in 1678. - The barbarous Murder of Sir Edmundbury Godfrey, and the Designs of Perkins, Friend, and Fenwick, for the Re-Establishment of Popery, and the Extirpation of Protestantism. - The Martyrdoms of the Missionaries in China. - The Persecutions in the East-Indies. - The Barbarities exercised in America. - The Cruelties practised on the Christians of Abyssinia and Georgia. - The late Persecutions in France against the Calas Family. - Also the final Establishment of the Reformed Religion in the various Protestant Countries. - With a great Number of other Cruelties exercised against the Christian Martyrs, not related in any other Work of the Kind. Together with the Martyrdoms of The Faithful and Virtuous in the first Ages of the World; the Persecutions of the Maccabees by the Greeks; of the Hebrews by the Egyptians; and of the Children of Israel by the Philistiries, and other barbarous Nations. Throughout this Work will be Interspersed Accounts of several singular Judgments against Persecutors, a great Variety of Original Anecdotes, the Letters which passed between the Martyrs, Letters from Bishop Bonner, and other Papists, to the Magistrates, &c. concerning the Methods of Indictment and Treatment, Translations of Popish Bulls, and other Deeds of Destruction, levelled against the Protellants, in England, Scotland, Ireland, &c. &c. suitable Notes and practical Reflections adapted to the various Subjects, and many curious Lives and Memoirs; to which will be added; an Account of the Life and Death of the original Author, the Rev. Mr. John Fox. The Whole Forming At Once A General Christian Martyrology, and Complete History of Persecutions. A Work Calculated to promote the Protestant Religion, and expel Romish Superstition, and by giving a pious and Christian Turn to the Mind, be general Use and Advantage to Mankind. The whole originally composed by the Rev. Mr. John Fox, M. A. formerly of Magdalen College, Oxford, And Prebendary in the Church of Balisbury; And now revised, corrected and improved, with many necessary additional Articles relating to the Acts and Monuments of the Church, not to be found in any other Publication of this Sort, and written in a clear intelligible Stile, free from that Obscurity of Language, and Tediousness of Diction, as well as that impertect Brevity and Coheiseness, which have been so much complained of in former Works of this kind. By Paul Wright, D. D. F. S. A. Vicar of Oakley and Rector of Snoreham in Essex. late of Pembroke-Hall, Cambridge; and Author of the Complete British Family Bible, and of the New and Complete Life of Our Blessed Lord and Saviour Jesus Christ, elegantly printed in Folio; both of which Works (with the inimitable Sets of fine Copper-Plates) have met with universal Approbation, as the best and most perfectly complete Works of the Kind, for the Use of all Christian Families. Embellished with a great variety of copper-plates, representing the various Modes of cruelly torturing the Christian Martyrs for their Constancy.",John Foxe,138,3,5,1,7,0,1,12,5,1,0,1,1,1,6,0,5,0,3,0,1,1,5,18,2,0,0,2,3,2,4,1,8,0,1,0,0,6,0,4,0,0,2,0,2,0,3,1,0,0,2,3,7,0,0,0,0,0,4,3,1,1800,1,1,"London : printed for Alex. Hogg & Co. at the King's-Arms, No. 16, Paternoster-Row. By M. Allen, Paternoster-Row, [1800?].",London,793,male,1516,1587,FALSE,"to the community: and here we are led to confider their tenets, with refpece to the grand articles of the Christian faith , and their discipline concerning church communion. They profess faith in God , by his only begotten Son Jesus Christ , as being their light and lite, as"
1428600104_000020,"Sermons on the chief doctrines and duties of the Christian religion, in their natural order. By William Dalgliesh, D.D. Minister of Peebles.",William Dalgliesh,126,1,1,0,3,0,0,1,0,7,3,2,3,9,6,0,2,4,1,0,2,1,2,8,11,1,0,2,0,3,2,5,1,0,0,3,0,9,2,1,1,0,3,1,0,4,1,1,0,2,4,6,3,2,0,1,0,0,0,0,1,1799,4,4,"Edinburgh : printed for the author, by J. Ruthven and Sons. Sold by W. Creech, J. Dickson, and other booksellers, Edinburgh; Brash and Reid, Glasgow; and C. Dilly, London, M.DCC.XCIX. [1799].",Edinburgh,443,male,1733,1807,FALSE,"an end . * Eph. II 12 t a Pet. i. 10o, 11 end . The inquiry, which our departing spirit will then make, will no more be, What riches have I gotten? What honours have I acquired? or, What improvements in human learning have I made? The infinitely more"
