1565301000_000043,A collection of hymns universally sung in chapels of the late Countess of Huntingdon.,Countess of Huntingdon's Connexion,101,0,0,3,2,0,0,6,2,4,1,1,0,0,3,0,3,4,2,0,2,0,2,8,5,2,3,0,7,2,3,1,4,0,0,1,0,4,0,4,5,0,0,0,0,0,3,0,0,1,2,4,4,0,0,0,1,0,1,1,0,1793,1,1,"[London] : Published July 1st 1793 by G. Thompson, Old Bailey. Sold also by J. Parsons Paternoster Row; Scatchard & Whitaker Stationers Court, and I. Evans. No. 41 Long Lane West Smithfield, London, 1793.",London,458,unknown,,,FALSE,"his blood . With wondering joy they recollect Their fears and dangers past; And bless the wisdom, power , and love , Which brought them safe at last. They follow the exalted Lqmb, Wherever they see him go; And at the footstool of his grace Their blood bought crowns they"
0808700400_000003,"A pocket hymn book, for the use of Christians of all denominations.",John Wesley,116,1,1,2,0,0,1,1,5,2,7,0,0,1,3,0,3,1,0,1,0,0,1,12,8,0,0,3,1,5,1,1,7,0,1,4,0,2,0,6,12,0,0,0,0,0,2,0,0,2,4,4,4,1,0,0,1,0,2,2,1,1794,1,1,"Dublin : printed by R. Napper, No. 29, Chapel-Street; and sold at all the Methodist preaching-houses in town and country, [1794].",Dublin,260,male,1703,1791,TRUE,"being give, Made you with himself to live ; He the fatal cause demands, Asks the work of his own hands , Why, ye thankless creatures, why Will ye cross his love and die ? _ Sinners, turn, why will ye die ? God , your Saviour, asks you why?"
1666100800_000841,"The whole practical works of the Reverend and learned Mr. John Willison: Late minister of the Gospel in Dundee. Namely, a treatise on the sabbath. Meditations for the sabbath. An help for prayer. Scripture songs. Gospel hymns. A sacramental directory. Meditations and ejaculations. Sacramental meditations. Sacramental catechism. Materials for meditation. The balm of gilead. An example of catechising. The afflicted man's companion. Popery another Gospel. A letter to a religious society. The mother's catechism. Sum of Christian doctrine. A synod sermon. Three sermons on various subjects. Communicant's catechism. With an account of the life, character and writings of the author. As also an index of the principal matters contained in the whole work.",John Willison,82,0,1,1,1,0,2,6,0,5,1,0,1,4,1,1,1,4,2,1,1,0,3,3,0,2,0,2,1,1,0,3,4,0,3,0,0,4,1,0,4,0,0,1,0,0,0,1,1,2,1,3,2,0,1,0,0,0,2,1,3,1781,1,1,"Aberdeen : Printed and sold by J. Mennye, M.DCC.LXXXI. [1781].",Aberdeen,685,male,1680,1750,FALSE,"let me find it a gate of all the enjoyments of the world are as nothing to me,, glory , a door opened into the everlasting kingdom and and I am to take an everlasting farewell of them all. joy of the Lord. Lord Jesus receive my spirit , and"
1039800400_000019,A pocket hymn book. Designed as a constant companion for the pious. Collected from various authors.,,115,1,1,1,0,0,0,4,0,1,1,0,1,1,3,4,1,1,2,1,0,0,2,6,3,0,2,0,6,2,5,4,2,0,0,3,0,4,1,0,17,0,1,10,1,0,1,0,0,0,5,6,4,0,0,0,3,0,2,1,1,1789,1,1,"York : printed for, and sold by R. Spence, in Ousegate; and sold also by T. Scollick, in the City-Road, London, M.DCC.LXXXIX. [1789].",York,217,unknown,,,FALSE,"all my sins consume; Come, Holy Ghost, for thee I call, Spirit of burning, cime,, fire, go through my heart , Illuminate my soul ; Scatter thy life through every part, And fantify the whole. 7 Sorrow and sin stall then expire,  While, entered intort, I only lve my"
0132201600_000020,"A plain, earnest address to all professing Christians, duly to consider what they are by nature, and what they must be by grace, before they can be saved. Under the following Heads: I. Of Original Sin, and its dreadful Fruits and Effects, as the Cause of all actual Sin and Misery in Man. II. The Necessity, Nature, and Effects of Regeneration, or being born again of the Spirit of God. III. Of believing in Christ for our whole Salvation. IV. The Necessity of Sanctification as a Meetness for Heaven, and the great Danger of resting on a Seeming, or false Conversion. To which is added, a prayer, Which will serve for a Family, or Private Person, for Morning and Evening. Also, a letter found amongst the papers of the author after his decease.","Glover, John",133,0,3,4,1,0,1,5,0,1,1,2,0,1,3,0,1,0,1,0,0,0,4,13,8,0,4,1,8,0,3,1,7,0,0,1,0,4,0,5,4,0,1,2,0,3,4,0,0,0,6,9,10,0,0,1,0,0,8,1,1,1775,1,1,"Norwich : printed by J. Crouse and W. Stevenson, [1775?].",Norwich,67,male,1714,1774,FALSE,"far his blessing, while I live , my prayers ( hall daily follow it. 0 mny God , grant that it may be in the hands of rhy spirit , to awaken, convince, undeceive, and bcnie sit many souls , f., r Chrilt Jesus's sake. Amen. Though I would undeceive,"
0281100400_000024,"Hymns and spiritual songs. In two books. I. Collected from the scriptures, and suited to the Gospel. II. Prepar'd for baptism and the Lord's supper. To which is added, a poem on the death of Dr. Gill. By Edward Trivett.","Trivett, Edward",125,1,2,2,0,0,0,11,2,1,4,2,0,1,6,1,1,0,0,0,0,0,2,18,7,0,1,1,6,1,1,0,7,1,3,0,1,0,0,6,4,1,1,1,0,0,0,1,0,0,7,9,6,0,0,0,1,0,2,3,0,1772,1,1,"Norwich : printed by R. Beatniffe, in Cockey-Lane; and sold by the author at Worstead, and by J. Gurney, opposite Hatton-Garden, London, [1772?].",Norwich,391,male,1735,1785,FALSE,"didst thou arch the spacious Sky; Immense the Treasures of thy Love , Those boundless Flows rise far above 5 The narrow Thought , by which we trace The Footsteps of thy wondrous Grace ; Lost! when we try for to survey, The glorious Plan Jehovah lay. 6 Express by"
1291601100_000053,"Hymns and spiritual songs, in three books. I. Collected from the Scriptures. II. Composed on Divine Subjects. III. Prepared for the Lord's Supper. By I. Watts, D.D.",Isaac Watts,88,2,1,3,0,0,1,2,2,2,1,2,0,2,6,0,2,2,2,1,0,0,3,6,5,0,0,3,3,2,1,1,1,0,1,0,2,2,0,3,3,0,1,0,0,0,1,0,0,2,4,5,2,0,0,0,0,0,5,0,1,1792,1,1,"London : printed for J. Bruce, D. Burnet, R. Hopper, R. Pennington, and L. Martin, M,DCC,XCII. [1792].",London,391,male,1674,1748,TRUE,"Abrah'm, the saint, rejoiced of old When visions of the Lord he saw! lmofes, the man of God , foretold This great Fullfiler es his law . 3 The types bore witness to his name, Obrain'd their chief design and ceased; The incense and the bleeding Lamb, he ark, the"
0547900800_000009,"Memoirs of the life of the late pious and learned Mr. John Reynolds. Chiefly extracted from his manuscripts. To which is added, his view of death: or the soul's departure from the world. A philosophical sacred poem. With a Copious Body of Explanatory Notes, And some Additional Composurts, Never before printed.",John Reynolds,100,0,13,1,2,0,1,1,3,4,0,0,0,4,2,0,6,2,0,0,0,0,4,5,4,1,0,3,0,2,5,2,4,0,1,0,0,1,0,2,3,1,3,0,1,0,2,2,0,0,3,2,3,0,0,0,0,0,3,1,3,1735,1,1,"London : printed for R. Ford, at the Angel, R. Hett, at the Bible and Crown, J. Oswald, at the Rose and Crown in the Poultry, and J. Gray, at the Cross-Keys in Cheapside, MDCCXXXV. [1735].",London,329,male,1667,1727,FALSE,"Obnoxiou: nefs to eternal Misery. But I believe (.Oh that I might believe more firmly, more  constantly!) that God has had abundant Compafion  on Mankind; particularly has of his Rich and Free · good Pleasure, given some unto his own Son to be  redeemed, justified, andified, and"
0134601200_000008,"For the benefit of six orphans. A funeral discourse on the death of Mr. John How, who departed this life the 17th day of November, 1767; (having buried his wife but a fortnight before) and hath left behind him six children quite destitute, the eldest about fourteen Years old, and the youngest not yet four Months. By R. Elliot, A.B.","Elliot, Richard",106,0,2,0,0,0,0,11,1,2,0,0,0,3,5,0,1,3,0,0,3,1,1,11,4,0,0,0,2,0,6,1,6,0,0,0,2,4,1,3,1,2,2,0,1,1,4,3,1,2,4,1,2,0,0,0,1,1,1,4,2,1767,1,1,"[London] : The ser-mons are Sold (where Donations also for the Benefit of these Orphans will be received) at Mr. Parker's, No. 69, in Fleet-Street; Mr. Cleaver's, No. 63, in Cornhill; Mr. Richardson's, No. 180, in the Borough; and at Mr. Bishop's, stationer, the Corner of Newport-Street, [1767].",London,33,male,,,FALSE,"diligently to be justi fled from the guilt, and saved from the power of fin: for as long as sin remains unpardoned, aud unsubdued, we cannot but be subject to the fearful curse due unto it. 3 Is eternal life the gift of God ? then look and expect to"
0056300100_000066,"Epistles of faith, or, spiritual letters on various subjects. Second part. By William Huntington, S.S. Minister of the Gospel at Providence Chapel; and Monk-Well Street, in the City.",William Huntington,102,2,2,1,0,0,1,2,2,1,1,2,0,1,0,0,1,0,0,2,0,0,1,21,1,0,1,3,3,5,1,0,0,0,1,1,3,3,0,4,0,0,0,1,0,1,1,0,1,1,2,8,3,0,0,1,3,1,5,4,4,1790,1,1,"London : printed for G. Terry, Bookseller, No 54, Paternoster Row ; J. Davidson, No 7, Postern Row, Tower Hill ; and J. Baker, No 226, Oxford Street.Sold, also, at Providence chapel; and at Monkwell-Street Meeting, every Tuesday Evening, MDCCXC. [1790].",London,398,male,1745,1813,FALSE,"out. The hands can work for men, while God keeps possession of the heart ; and, as heavenly things gain eiteem, the things of the world grow into contempt: "" Now we "" have received , not the spirit of the world , but ""the Spirit that is of God"
0132201700_000011,"The hidden and happy life of a Christian, Amidst a Variety of Trials and Afflictions Incident to the Present State, exemplified, in an extract from the diary of Mr. John Glover, Late of Norwich, published by John Carter.","Glover, John",104,1,4,0,1,0,4,10,1,5,4,0,0,2,9,0,1,0,0,0,1,0,6,8,4,1,0,0,2,2,1,2,4,0,0,0,0,3,2,4,1,0,0,0,0,1,1,0,0,0,3,3,1,3,0,1,2,0,2,0,4,1780,1,1,"London : printed by R. Hawes, (no. 40.) Dorset-Street, Spitalfields, and sold by Mr. Buckland bookseller, Paternoster-Row, and Mr. Keith, Gracechurch-Street, London; Mr. Booth, at Norwich; Mr. Punchard, at Ipswich; Mrs Rogers, at Bury, and the rest of the booksellers in town & country, [1780?].",London,132,male,1714,1774,FALSE,"and Supreme Jehovah. This is the cause we have such poor, short conceptions of the glorious. mystery of the Person of Christ ; that wr see no more of the glory of the Father , in Christ , and are no more changed ( 3i) changed into the same Image."
0605500202_000011,Sacred poetry: comprising an entire system of divine truth. ...,M. D.,92,0,1,1,0,0,1,1,1,1,0,3,0,3,12,1,0,1,0,0,0,0,3,6,4,1,0,1,3,4,1,1,0,0,2,1,1,2,1,1,3,0,1,1,0,0,2,0,1,1,2,8,1,2,0,0,3,0,3,2,4,1790,2,2,"London : printed by T. Rickaby. Sold by Mess. Edwards, Pall-Mall; Scatcherd and Whitaker, Ave-Maria-Lane; and Mathews, Strand, MDCCXC. [1790].",London,179,unknown,,,FALSE,"now, This his faithful word of promise Made while sojourning below; Where I enter,, Thither shall my servant come."" VIII Him we praise for his ascension, Conqueror of Sin and Death ; Gone up to prepare a mansion For his ransomed flock beneath: They shall quickly Reign with him in"
0287100500_000184,"The christian's defence against the fears of death. With seasonable directions how to prepare ourselves to die well. Written originally in French by the late Reverend Divine of the Protestant Church of Paris, Char. Drelincourt: translated into English by Marius D'Assigny, B.D.",Charles Drelincourt,104,6,0,1,5,1,2,2,2,0,0,2,0,0,4,2,1,0,0,1,0,0,10,15,0,1,6,1,0,4,2,3,2,0,2,1,0,4,0,0,1,0,0,1,0,0,2,1,2,0,0,4,4,1,1,0,0,0,2,2,3,1724,1,1,"London : printed for R. Wilkin, D. Midwinter, R. Robinson, B. Cowse, S. Tooke, B. Motte, J. Peele, and J. Lacy, M,DCC,XXIV. [1724].",London,529,male,1595,1669,FALSE,"more certain, that this Confusion and Difference shall be altogether taken away, and that nothing Shall be said in Heaven , but hallll be very well understood by all the glorified Saints. I may add, moreover, that in cafe we should speak so well all manner of Languages, which have"
0267100200_000026,"Discourses delivered in the publick assemblies of the people called Quakers, by Thomas Story. Taken in short-hand; and, after being transcribed at length, examined by the said T. Story, and published by his permission.",Thomas Story,133,0,7,4,3,0,0,11,0,1,0,6,1,3,3,1,2,0,1,0,1,1,0,23,2,0,1,0,1,4,3,0,3,0,0,0,1,3,1,0,0,1,13,0,0,0,6,1,2,5,1,3,5,1,0,0,0,0,5,2,1,1738,1,1,"London : sold by T. Cooper, at the Globe in Pater-Noster Row, MDCCXXXVIII. [1738].",London,120,male,1662,1742,FALSE,"Nature ? No truly; but that the Human Nature , a reasonable Soul , clothed with a Human Body , was assumed by the Divine Word , the Wisdom and Power of God , in a fubfantial Union, the Word and reasonable Soul , or Mind, never separable any more"
1117700202_000007,"The North British intelligencer; or, Constitutional miscellany;","Dick, R.",99,1,3,1,4,0,0,3,2,0,0,3,1,4,2,0,1,1,1,0,0,0,5,16,2,1,0,0,1,2,0,2,1,0,1,0,0,5,0,1,2,0,5,0,1,0,1,2,3,1,1,3,2,1,0,0,0,0,4,3,6,1776,2,4,"[Edinburgh, Scotland : s.n., 1776- ].",Edinburgh,431,unknown,,,FALSE,"Spirit . Let us view them in the covenant promise, "" I will.he thy God , and the god.ofthy feed."" Let us view them in Christ's invitation to come unto him, for of such is the Kingdom of Heaven . Let us view them by us devoted to God ,"
1670401400_000117,"Familiar letters to a gentleman, upon a variety of seasonable and important subjects in religion. By Jonathan Dickinson, A.M. minister of the Gospel at Elizabeth-town, New Jersey.",Jonathan Dickinson,100,0,7,2,1,0,3,8,0,1,0,2,0,4,4,5,2,3,1,0,3,0,0,8,3,0,0,1,1,1,2,1,1,0,0,0,1,1,1,4,2,1,0,0,1,0,2,0,3,0,10,2,4,0,0,1,1,1,0,0,1,1757,1,1,"Dublin : Printed for Robert Johnston, bookseller in Belfast, M,DCC,LVII. [1757].",Dublin,398,male,1688,1747,FALSE,"Name, the v~iiola tion of his Law , the Abuse of his Mercy and Love ,. the Afflont and Provocation to his Holy Spirit , the Diliance procured between God and us; and the Prejudice to others, as well as to our own Souls , oc cationed .by our ininmg"
0378502500_000011,"A collection of hymns for social worship, more particularly designed for the use of the Tabernacle congregation in London. By George Whitefield, Late of Pembroke College, Oxford, and Chaplain to the Rt. Hon. the Countess of Huntingdon.",George Whitefield,120,2,0,3,0,0,0,4,0,0,0,3,1,4,2,2,5,1,0,0,1,0,6,16,7,0,1,2,2,4,5,1,6,0,4,0,2,0,0,1,6,0,1,0,0,2,3,0,0,1,4,7,1,2,0,0,0,0,3,2,3,1767,1,1,"London : printed by Henry Cock, And to be sold at the Tabernacle, near Moor-Fields, 1767.",London,242,male,1714,1770,TRUE,"bear To take a mortal Form, Made lower than his Angels are, To save a dying Worm! Jesus , our Lord, how wondrous great Is thine exalted Name I The Glories of thy heavenly. State Let the whole Earth proclaim, HYMN LX Faith in'christ. H OW our State by Nature"
0270700100_000123,"The christian's defence against the fears of death. With seasonable directions how to prepare our selves to die well. Written originally in French by the late Reverend Divine of the Protestant Church of Paris, Char. Drelincourt; translated into English by Marius D'Assigny, B.D.",Charles Drelincourt,108,1,0,2,3,0,1,0,2,8,2,0,1,1,2,0,3,1,0,0,1,0,4,6,2,0,1,1,6,5,3,1,4,0,2,1,0,5,0,5,0,2,0,4,0,1,0,0,0,4,2,7,8,0,0,0,1,0,1,1,3,1707,1,1,"London : printed by W. S. for R. Clavel at the Peacock, J. Robinson at the Golden Lion, in St. Paul's Church-Yard; and A. and J. Churchill at the Black Swan in Pater-Noster-Row, 1707.",London,537,male,1595,1669,FALSE,"it shall appear without fpor or blemifl. That same Peace of Conscience that'preferves our. Hearts and Senses, shall be without the leaftdifurbance. Infhort, the same Jesus thatis conceived in'our Hearts , and that is formed and grown in us by Degrees, shall then ap. pearin a perfet Stature, that fhallwant"
0197300502_000050,"Short hymns on select passages of the Holy Scriptures. By Charles Wesley, M. A. And Presbyter of the Church of England. ...",Charles Wesley,118,0,7,4,0,0,1,0,3,1,2,1,1,3,4,0,1,0,1,0,1,0,1,5,5,0,1,0,4,3,2,0,2,0,0,2,0,5,0,7,5,1,0,1,1,0,5,0,0,3,5,5,10,0,0,0,0,1,10,3,1,1794,2,2,"London : printed by G. Paramore, North-Green, Moorfields; and sold by G. Whitfield, at the Chapel, City-Road; and at the Methodist preaching-houses in town and country, 1794-96.",London,360,male,1707,1788,TRUE,"he that eateth me, even he Shall live by me. VI 57 STUPENDOUS miracle of love ! Archangels cannot tell me how I live by thee, my life above, As by the living Father thou! But sure as thee through faith I eat, Thy Spirit's fubifance I receive , And"
0125100804_000067,"Village sermons; or, sixteen plain and short discourses on the principal doctrines of the Gospel; intended for the use of families, Sunday-Schools, or companies Assembled for Religious Instruction in Country Villages. To which is added, a general index to the whole work. Vol.IV. By George Burder.",George Burder,103,1,1,2,0,0,1,6,3,15,3,1,0,0,1,3,0,1,0,1,0,1,1,9,0,0,2,0,2,2,2,7,3,0,0,0,3,5,1,3,0,0,1,0,0,1,0,0,0,1,9,1,0,0,0,3,2,0,1,2,2,1800,4,4,"London : printed for T. Chapman, 151, Fleet-Street, by T. Gillet, Salisbury-Square, [1800].",London,204,male,1752,1832,FALSE,"is a bad cempanion in life , but ho terrible w\ili it be in death i It lies now, perlaps, hike c(ld brimllone on their belnmbed cornlckrnccs; but wlien death opens the way for the sparks of divine vengealnce t fall upon it, it will make dre; tii: il flamncs"
1226101100_000008,"Hymns and spiritual songs, intended for the use of real Christians, of all denominations. Published by John and Charles Wesley.",Charles Wesley,104,1,4,4,1,0,0,3,1,1,1,4,0,1,2,0,6,1,0,1,0,0,2,7,2,0,0,1,6,3,1,2,4,0,0,1,0,4,1,2,13,0,0,3,0,0,1,1,0,1,7,4,4,0,0,1,1,0,0,0,1,1782,1,1,"London : printed by J. Paramore, at the Foundry, Moorfields: and sold at the New Chapel, City-Road; and at the Rev. Mr. Wesley's preaching-houses in town and country, 1782.",London,135,male,1707,1788,TRUE,"let me free, And swallow up my soul in thee? 2 Come, 0 thou Universal Good, Balm of the wounded conscience, come, The hungry, dying spirit's food, The weary wandering pilgrim's home, Haven to take the ship wrecked in, My everlasting rest from sin . 3 Be thou, 0 Love"
0844501000_000081,"A collection of hymns, for the use of the people called Methodists.",John Wesley,118,0,3,5,1,0,0,4,2,2,0,2,1,0,5,0,2,1,1,0,0,0,2,5,6,0,1,1,2,3,1,1,4,0,1,2,0,2,0,4,11,0,0,1,1,0,11,1,0,3,8,9,4,0,0,0,0,1,2,0,2,1780,1,1,"London : printed by J. Paramore, at the Foundry, 1780.",London,520,male,1703,1791,TRUE,"of righteousness, The sin fubduing power : Power to believe and go in peace, And never grieve thee more. 2 I ask the blood bought pardon sealed, The liberty from fin: The grace infuscd, the love revealed, The kingdom fixed within. 3 Thou heardft me for salvation pray: Thou seest"
0261701800_000010,"A collection of psalms and hymns, for public worship.","Day, William, M.A.",111,1,1,1,0,0,0,4,0,1,1,1,1,0,4,2,2,1,1,0,1,0,4,2,8,0,1,2,5,5,1,1,8,0,2,1,0,1,0,1,13,1,2,0,2,0,5,0,0,1,6,7,4,1,0,0,1,0,2,2,0,1795,1,1,"Evesham : printed and sold by John Agg, 1795.",Evesham,253,unknown,,,FALSE,"quickly, Hallelujah! Come, Lord, come! HYMN ( 31) HYMN XXXV THE SAME. Rev. XI 15 L M. H E comes! he comes! the Judge severe! The seventh Trumpet speaks him near; His Lightnings flash, his Thunders roll, He's welcome to the faithful Soul . From Heaven , angelic Voices sound,"
0224300500_000022,"Hymns and spiritual songs, for the use of the Lord's new church, signified by the new Jerusalem in the revelation. By Joseph Proud.","Proud, Joseph",114,0,1,2,9,0,0,0,0,4,0,4,0,3,8,1,0,0,0,0,0,0,1,3,2,2,0,1,1,10,3,3,3,1,0,2,1,2,1,4,12,0,2,0,0,0,4,0,0,1,5,7,4,1,0,1,0,0,2,1,2,1790,1,1,"London : printed and sold by R. Hindmarsh, Printer To His Royal Highness The Prince Of Wales, No. 32, Clerkenwell-Close, 1790.",London,284,male,1745,1826,FALSE,"give us more, And teach us by thy word . While here below We would improve, And daily grow In truth and love . H Y M N CXXVIII On the Natural and the Spiritual Body . 1 B ORN in a world of sin and death , DI Soon"
0395901301_000036,"The world to come: or, Discourses on the joys or sorrows of departed souls at death, and the glory or terror of the Resurrection. Whereto is prefix'd, An essay toward the proof of a separate state of souls after death. Vol. I. II. By I. Watts, D.D.",Isaac Watts,96,0,0,1,3,2,0,2,0,8,1,1,1,7,1,1,1,0,0,0,2,1,3,9,1,0,0,0,1,3,5,2,2,0,0,1,0,1,0,3,5,0,1,2,0,0,1,2,0,2,2,4,1,6,0,0,2,0,1,0,4,1748,1,2,"[Boston] : London: printed. Boston: New-England, re-printed and sold by Rogers and Fowle in Queen-Street, M.DCC.XLVIII. [1748].",Boston,188,male,1674,1748,TRUE,"Thoughtlelikefi and Indo: : he is solicitous to know his own State and hath good Hope through Grace , he lives in the View of heavenly Things, and keeps his Eye open to future and eternal Glories , He is awake from the Sleep of Security, he is upon his"
0281900500_000019,"Addresses, devotional and sacramental: by some eminent ministers, residing in London. The whole either taken down in short hand, or furnished by the authors themselves.",,105,1,1,0,0,0,0,3,0,0,3,2,0,5,7,1,2,0,1,0,4,0,4,9,1,1,2,3,6,2,1,5,5,0,0,1,0,5,0,9,3,0,1,0,0,1,2,0,0,1,1,3,2,1,1,0,0,0,0,1,4,1787,1,1,"London : printed for W. Lowndes, No. 77, Fleet Street, M,DCC,LXXXVII. [1787].",London,215,unknown,,,FALSE,"us to set our hands to this covenant, and to give ourselves to this Saviour, to profess ourselves his followers , and to give this public tefimony to the truth, and glory , and felicity of a religious life : Then shall we recollect with holy rapture, that God gave"
1053800100_000045,"Cheap repository tracts for Sunday reading. To which are added, some prayers for individuals and for families.",,102,2,4,1,0,0,0,11,0,4,1,1,0,2,1,0,2,1,2,0,0,2,2,11,2,1,0,1,3,1,3,3,3,0,1,3,1,2,0,2,3,0,4,0,0,0,0,1,1,1,6,3,1,0,0,1,2,0,0,0,6,1800,1,1,"London : sold printed by Bye and Law, St. John's Square, Clerkenwell; and sold by F. and C. Rivington, No. 62. St. Paul's Church-Yard; J. Evans, No. 41, Long Lane, West-Smithfield; J. Hatchard, No. 173, Piccadilly; and S. Hazard, Bath, 1800.",London,405,unknown,,,FALSE,"also, the holy spirit of God is granted to us. And, to crown all, he died for us. He was nailed to the cross, and suffered a cruel death for our sakes, bearing the wrath of God in our stead. "" Herein is love , not that we loved God"
0599800600_000162,"Magnæ Britanniæ notitia: or, the present state of Great Britain; With diverse remarks upon The Ancient State thereof. By John Chamberlayne, Esq; To which is added, A Compleat List of the Queen's Houshold; as also those of their Royal Highnesses the Prince of Wales, and the Duke of Cumberland; their Highnesses the Princess Emelia, the Princess Carolina, the Princess Mary and Princess Louisa. With His Majesty's Royal Privilege.",John Chamberlayne,113,0,1,0,1,0,2,8,2,4,0,1,2,3,4,3,4,0,0,0,0,0,0,17,4,0,2,1,0,2,6,0,2,0,2,0,0,3,0,1,1,2,4,0,0,3,1,0,0,1,6,2,5,3,1,0,0,0,3,3,3,1735,1,1,"London : printed for D. Midwinter, J. Tonson, B. Motte and C. Bathurst, A. Ward, T. Wotton, S. Birt, and H. Lintot, 1735.",London,837,male,1666,1723,FALSE,"or rather againfthel Mn who had exercised it among them. The Presbyterians therefore, in i6s9, laid hold of that Opportunity, and prevai!ed upon King 1liuiam and Queen amary to establish their Churbch Government once more by Lawj which Eftablilhment fill continues. I shall now proceed to give a State of"
0479600101_000125,"Sermons on various subjects, divine and moral: with a sacred hymn suited to each subject. In two volumes. ... By I. Watts, ...",Isaac Watts,112,1,7,2,3,0,0,11,3,4,1,1,1,0,0,0,2,0,0,0,0,0,2,7,2,2,2,0,3,5,2,5,3,0,0,0,0,1,0,3,0,0,2,0,0,0,3,1,0,4,5,3,14,1,0,0,0,0,4,1,1,1740,1,2,"London : printed for R. Hett, and J. Beackstone [sic], 1740.",London,492,male,1674,1748,TRUE,"add in the fifth Place, Tis the Gospel of Christ  that.brings Believers to the final Poseion of Heaven . Then, and not till then, is the Salvation perse. Tis the Gospel that has given us an unchangeable Promise of Heaven , when our State of Trial is ended here"
1057400403_000003,"Practical sermons by the late Reverend Mr. Daniel Wilcox, Preacher of the Gospel in Monks-Well-Street, London. Printed at the earnest Desire of the Congregation, and others that were his Occasional Hearers. To which are added, The Confession of Faith delivered at his Ordination to the Ministry; and a Discourse on the Duty of holding fast the Form of sound Words. In Three Volumes. ...","Wilcox, Daniel",101,0,0,2,0,0,0,5,2,1,0,3,1,2,3,1,3,0,0,1,0,0,2,15,8,0,0,0,7,1,1,2,2,0,0,2,2,5,0,1,2,0,1,0,5,0,4,0,2,1,2,2,2,1,0,0,0,0,0,3,4,1757,3,3,"London : printed for Edward Dilly, at the Rose and Crown, in the Poultry, near the Mansion-House, MDCCLVII. [1757].",London,479,male,,,FALSE,"the'text give us the reason of the different desires and choice of the godly and the wicked. The wi(h, that each of them make, you have, Psalm IV 6 There be many that pay, Who will hew us any good? This is the cry of the men of the world"
0332700100_000008,"Hymns and spiritual songs, intended for the use of real Christians, of all denominations. By John Wesley, M.A. Late Fellow of Lincoln-College, Oxford.",Charles Wesley,109,1,4,4,1,0,0,2,1,1,1,4,0,1,2,0,7,1,0,1,0,0,1,7,2,0,0,1,7,4,1,1,5,0,0,1,0,3,1,3,14,0,0,3,0,0,4,1,0,2,7,4,3,0,0,1,1,0,0,0,1,1767,1,1,"Bristol : printed by William Pine, 1767.",Bristol,135,male,1707,1788,TRUE,"in a pure believing heart , The name inscribe in the white stone, The life divine , the little leaven, My precious pearl, my present heaven . Part thefecond. 6 \ Love divine , what hast thou done! Th' immortal GOD hath died for me; The Father's co eternal Son"
