1694300108_000234,The Missionary magazine.,Greville Ewing,110,1,2,3,0,1,0,5,1,6,1,0,2,8,2,1,0,3,0,0,1,0,1,11,4,0,0,0,5,6,4,3,6,0,0,1,0,7,0,2,1,0,4,1,1,0,1,0,1,2,1,2,1,0,0,1,1,0,0,2,4,1796,8,18,"[Edinburgh, Scotland : s.n. ; 1796-1813].",Edinburgh,584,male,1767,1841,FALSE,"on the way to h'eavren? CC Every main that hath this hope in him purifieth himfelif, even as God is pure,"" I John III 3 But you say, "" I thall have peace though I walk in the imagination of mine heart ,""j Daut. XXIX 1 Your confidence must be"
0042100205_000052,"Works of the late Reverend William Romaine, A.M. Rector of Saint Andrew by the Wardrobe, and Saint Ann, Blackfriars, and Lecturer of Saint Dunstan, in the West, London. In eight Volumes. ...",William Romaine,105,1,3,0,1,1,1,3,0,1,1,1,0,5,10,0,1,0,0,0,4,0,2,9,3,1,1,0,2,3,1,5,4,0,0,3,1,0,0,3,10,0,0,0,0,0,1,4,1,2,6,3,2,0,0,1,0,0,0,2,2,1796,5,8,"London : printed for T. Chapman, Fleet-Street, MDCCXCVI. [1796].",London,411,male,1714,1795,FALSE,"saw your want of it yourselves. At present you dispute against the certainty which faith gives, because because you have not received it, nor have any desire for it. Is not this the cafe ? This fllews your want of that faith , which is the operation of God ."
1056700200_000040,"The throne of grace discoursed of, from Heb. IV. 16. By Robert Trail, M. A. Minister of the Gospel.",Robert Trail,117,4,5,1,1,0,0,12,9,7,2,4,0,1,5,0,3,0,0,0,0,0,3,9,1,3,2,1,2,1,0,0,2,0,0,0,1,5,1,4,1,0,0,1,0,1,10,0,0,2,3,1,1,1,1,0,0,0,3,1,2,1713,1,1,"London : printed by Ph. Gwillim in Austin-Fryars, for Nath. Hiller at the Prince's Arms in Leadenhall-Street, over against St. Mary-Ax, 1713.",London,303,male,1642,1716,FALSE,"besides. They that were fared in the Ark, were saved from drowning in the Water, and were saved by Water. The lile Figure hbereunto, Bptifm now faverth us. Will bare Water baptifm save? No: (Not the putting away the filth of the flh, br the answer of a good Confci"
0771000100_000147,"The christian's defence against the fears of death. With seasonable directions how to prepare ourselves to die well. Written originally in French, by the late Reverend Divine of the Protestant Church of Paris, Char. Drelincourt. Translated into English, by Marius D'Assigny, B.D.",Charles Drelincourt,118,1,2,2,24,1,1,7,6,5,1,3,1,3,2,0,1,0,1,0,0,0,3,11,0,2,0,0,0,2,4,1,5,0,0,2,0,3,0,2,1,2,0,0,0,1,1,0,2,1,2,6,3,0,0,0,0,0,0,0,3,1751,1,1,"London : printed for R. Ware, J. Peele, J. and P. Knapton, S. Birt, T. Longman, C. Hitch and L. Hawes, J. Hodges, S. Austen, E. Wicksteed, J. Davidson, B. Dod, J. and J. Rivington, J. Ward, W. Johnston, and M. Cooper, MDCCI. [1751].",London,531,male,1595,1669,FALSE,"ever detain our Bodies in the Grave , we could not say, to speak properly, that our Saviour hath swallowed up Death in Victory, and that he hath destroyed the Sepulchre; for, in such a Cafe , Death and the Grave would remain viao rious, and triumph eternally over these"
0844800107_000060,"The works of the Right Reverend Thomas Wilson, D.D. Lord Bishop of Sodor and Man. Compiled by the Rev. C. Cruttwell. To which is Added, His History of the Isle of Man.",Thomas Wilson,117,1,1,3,1,1,0,10,0,10,1,0,0,2,6,0,1,2,2,0,0,1,1,15,1,0,0,1,3,3,2,4,7,0,0,3,0,2,0,2,2,0,1,1,1,0,2,1,2,0,11,3,1,0,0,0,1,0,1,1,3,1796,7,8,"Bath : printed by and for R. Cruttwell; and Sold by C. Dilly, Poultry, London, MDCCXCVII. 1796-[97].",Bath,429,male,1663,1755,FALSE,"a God infinitely holy , just, and powerful , and who hates all iniquity, did we not know he is to be appeared when offended. Now, this is the cafe of every man living , without the knowledge of Jesus Christ , and what he has done for us. And,"
1666100800_000954,"The whole practical works of the Reverend and learned Mr. John Willison: Late minister of the Gospel in Dundee. Namely, a treatise on the sabbath. Meditations for the sabbath. An help for prayer. Scripture songs. Gospel hymns. A sacramental directory. Meditations and ejaculations. Sacramental meditations. Sacramental catechism. Materials for meditation. The balm of gilead. An example of catechising. The afflicted man's companion. Popery another Gospel. A letter to a religious society. The mother's catechism. Sum of Christian doctrine. A synod sermon. Three sermons on various subjects. Communicant's catechism. With an account of the life, character and writings of the author. As also an index of the principal matters contained in the whole work.",John Willison,105,1,0,1,0,0,2,8,2,2,1,0,1,2,0,0,6,1,0,1,2,0,0,14,2,2,0,1,6,1,4,0,4,0,0,1,1,3,0,0,3,0,2,1,2,0,1,1,0,1,4,5,5,0,0,1,0,1,3,0,6,1781,1,1,"Aberdeen : Printed and sold by J. Mennye, M.DCC.LXXXI. [1781].",Aberdeen,685,male,1680,1750,FALSE,"thy protection, I hlefsthee, olord, whohafl keptme from (ins, snares, and put the hands of mercy upon me and bless me. and dangers through this day: do thou likewise preserve O give me a new heart , and a new nature ; and let « me through the silent watches"
1752000102_000141,"Faith and practice represented in fifty-four sermons on the principal heads of the Christian religion; preached at Berry-Street, London. By I. Watts, ... D. Neal, ... J. Guyse, ... S. Price, D. Jennings, ... J. Hubbard. ...",,120,2,1,1,8,1,0,9,2,7,5,0,1,1,2,0,0,0,1,0,0,2,4,8,0,1,1,2,0,1,1,0,3,0,0,0,0,2,1,3,0,0,0,1,3,2,1,4,1,7,0,15,4,2,0,1,3,0,2,0,4,1757,2,2,"London : printed for J. Buckland, and T. Longman; J. Waugh; J. Ward, and E. Dilly, 1757.",London,455,unknown,,,FALSE,"Heb. XII 23 And the Apostle John had a Visionary Representation of the Souls of them under the Altar, who were slain for the Word of God , and for Lbe ""Tefimony q'eftimony which they held; and they cried with a louid Voice, saying, How long, 0 Lord holy and"
1026100200_000011,"Letters on spiritual subjects, and Divers Occasions; sent to relations and friends. By one who has tasted that the Lord is gracious.",Anne Dutton,111,0,5,0,1,0,0,12,0,2,2,0,1,2,2,0,3,1,1,0,1,0,4,20,3,1,1,0,2,0,1,2,3,0,0,2,0,5,0,0,7,0,1,0,0,2,1,1,1,0,5,5,2,3,1,0,0,1,1,1,2,1748,1,1,"London : printed by J. Hart, in Popping's-Court, Fleet Street: and sold by J. Lewis, in Bartholomew-Close, near West-Smithfield, [1748].",London,288,female,1692,1765,FALSE,"your Debts; He hath bought you, and your Inheritance. He hath brought you unto God , in Himself: He hath begun to bring you unto God by Himself, here in Grace ; and He will shortly bring you unto God , to be with Him in Glory . Your Soul"
0132201800_000014,"Some scriptural directions and advice to assist the faith and practice of true believers, to promote a life of faith and holiness, and An Increase of all Grace and Peace in their Souls. The third edition, corrected and much enlarged. To which is added, two consolatory letters, written by an eminent Christian, (now with God to one who seemed to be near his dissolution.","Glover, John",116,0,0,0,2,0,1,6,0,3,0,3,3,5,4,0,2,2,0,0,1,0,11,12,12,0,1,1,2,3,4,1,2,0,0,2,0,2,1,1,3,1,1,2,3,0,3,0,0,1,1,2,9,1,0,0,0,0,0,1,1,1791,1,1,"London : printed by R. Noble, Great Shire-Lane, Temple-Bar, MDCCXCI. [1791].",London,35,male,1714,1774,FALSE,"to pray the Lord to bless and apply them to their hearts by his Spirit before they read them (as they should all books, if they expect any benefit by them); for it is the blessing and grace of Christ is ALL in ALL. It is by the Lord's Power"
0343600400_000053,"A practical discourse concerning death. By William Sherlock, D. D Late Dean of St. Paul's, London.",William Sherlock,144,0,0,0,12,1,0,4,6,16,9,3,2,3,0,2,0,1,0,0,0,1,0,7,2,1,1,0,0,1,2,2,0,0,0,3,3,12,1,6,0,0,0,1,0,0,3,1,1,1,6,7,5,4,0,1,0,0,0,3,10,1766,1,1,"London : printed for J. James, T. Thomson, R. Bull in Paternoster-Row, and J. Thomas in the Strand, MDCCLXVI. [1766].",London,296,male,1641,1707,FALSE,"good offices for others, but what the law commands, there would be very little good done in the world , for laws are principally intended for the preservation of julice; but the aas of a generous and bountiful charity are free; and men may be as charitable as though law"
0410201001_000047,"Sermons on several occasions: in four volumes. By John Wesley, M. A. Late Fellow of Lincoln-College Oxford. ...",John Wesley,132,0,2,2,4,0,0,6,1,2,0,1,4,1,1,0,3,6,0,0,0,0,2,26,4,0,1,2,5,3,1,1,4,0,0,4,1,2,0,4,8,0,0,0,1,0,5,0,1,1,11,3,6,0,0,0,0,0,1,1,1,1796,1,4,"London : printed for G. Whitfield, New-Chapel, City-Road, and sold at the Methodist-Preaching-Houses in town and country, 1796-99.",London,257,male,1703,1791,TRUE,"that God answers the wretched man, crying out, "" Who hall deliver me "" From this bondage of sin , from this body of death ? "" The grace of God , through Jesus Christ thy Lord."" III i. Then it is that this miserable bondage ends , and he"
1629200500_000003,"A Charge and sermon together with an introductory discourse and confession of faith delivered at the ordination of Mr. Christopher Hall. At the Meeting-House in Boar's-Head Yard, Petticoat-Lane, October 3, 1769. Published at the request of the church.",,99,1,11,1,4,0,1,8,4,2,1,2,1,1,4,0,1,0,0,1,1,0,2,8,3,0,0,1,1,1,3,1,3,0,2,0,4,1,0,3,4,0,0,0,5,2,2,0,0,0,3,1,2,0,0,0,0,0,3,0,0,1769,1,1,"London : Printed for Joseph Gurney, No. 54, in Holborn, M.DCC.LXIX. [1769].",London,74,unknown,,,FALSE,"took upon him the prepared body , in which he was manifeit to take away sin , God wars mannzflef in the feph s and as God man mvediator, he obeyed the precept, and endured the penalty, or curse, of the broken covenant, as his people's fabftitute. By his obedience"
1330901700_000005,"A practical treatise upon Christian perfection. By William Law, A.M.",William Law,111,1,1,1,3,0,0,4,4,2,0,1,1,3,2,1,1,2,2,0,0,1,1,12,2,0,0,1,2,2,3,2,3,0,0,0,0,11,0,2,0,1,8,2,0,1,0,1,0,1,1,0,6,11,1,1,1,0,0,0,5,1783,1,1,"London : Printed for G. Robinson, in Pater-noster Row, MDCCLXXXIII. [1783].",London,479,male,1686,1761,TRUE,"once confounds the Pride, and relieves the Misery of Man. How fallen muff he be from God , how disordered and odious his Nature , that thould need to great a Mediator to recommend his Repentance! -- And on the other Hand , how full of Comfort, that to high"
0392400105_000889,"A fifth volume of sermons preached by the late reverend and learned Thomas Manton, D.D. In two parts. ...","Manton, Thomas",85,1,2,5,3,0,0,7,1,4,0,1,1,2,3,0,0,3,1,0,0,1,3,7,2,2,0,1,0,4,2,1,1,1,2,0,0,2,0,0,1,1,0,1,0,0,1,0,1,0,3,3,0,1,1,1,2,0,2,0,4,1701,5,5,"London : printed, and sold by Jonathan Robinson, 1701.",London,1164,unknown,,,FALSE,"Grace , upon condition of Repentance and Faith in Christ . Upon this Blood the Covenant is grounded, and all the Promises of it made firm, unalterable, and effetual. Let us therefore with firohg Confidence trust to the Efficacy thereof, and be incouraged thereby to wait upon God for Grace"
1149200200_000104,"The book of common prayer, and administration of the sacraments And Other Rites and Ceremonies Of The Church, According to the Use of the Church of England: together with the Psalter OR Psalms Of David, Pointed as they are to be sung or said in Churches.",Church of England,103,0,0,1,5,0,0,4,2,7,3,0,0,5,2,1,5,1,0,0,0,1,1,8,1,2,4,0,1,4,7,3,5,0,0,1,1,5,0,3,2,0,1,0,0,0,0,0,0,2,5,3,3,0,0,0,0,0,0,2,2,1745,1,1,"Oxford : printed by Thomas Baskett, Printer to the University, 1745.",Oxford,493,unknown,,,FALSE,"a quickening Spirit . Howbeit, that was not first which is spiritual; but that which is natural , and afterward that which is spiritual. The first man is of the earth, earthy: the second man is the Lord from heaven . As is the earthy, such are they that are"
0298802100_000008,"Hymns and spiritual songs, intended for the use of real Christians, of all denominations. By John Wesley, M.A.",Charles Wesley,102,1,4,4,1,0,0,3,2,1,1,4,0,1,2,0,6,1,0,1,1,0,2,7,2,0,0,1,5,4,1,1,4,0,0,1,0,4,1,2,11,0,0,3,0,0,2,1,0,1,7,3,3,0,0,1,1,0,0,0,1,1763,1,1,"Edinburgh : printed by A. Donaldson, and J. Reid, for John Traill, in the Parliament-Close, MDCCLXIII. [1763].",Edinburgh,156,male,1707,1788,TRUE,"dying spirit's food, The vweary, wandering pilgrim's home; : Haven to take the fhipnwr.eck'd in,. My everlasting rest from sin .. : 3 Be thou, O Love , whatever I want, -  Support my feeblnefs of mind. : Relieve the thirsty soul . the saint,  . Revive, illuminate"
0136000700_000008,"Sickness comfortable, and a dying bed easy. A sermon at the funeral of Mrs. Frances Lobb, late wife of the Reverend Theophilus Lobb, M.D. delivered at Chelmsford. ... By John Green. Attended with a poem by another hand.","Greene, John",108,0,3,0,0,0,0,7,0,0,2,1,2,1,6,1,0,2,0,0,0,0,1,10,6,0,1,0,3,1,2,5,4,0,0,1,1,0,0,6,4,1,1,0,2,4,0,3,0,3,4,3,1,1,1,2,2,0,2,6,2,1723,1,1,"London : printed for R. Ford, 1723.",London,44,male,1708,1767,FALSE,"* ·.~~.., ~~~., ~ ~ tirely on the Grace of God in c.rifi, on the riguteourlefs, Merits, and Mediation of chirifz Jefis my Lord. Ihave no Confidence in the Flesh. I rejoice in Christ ylef/as, and trufl through him to be saved. And, which I looked upon as an Argument"
1022900800_000107,"The divine right of church government: wherein it is proved, by fair and conclusive Arguments, that the Presbyterian government, by Preaching and Ruling Elders, in Sessional, Presbyterial, and Synodical Assemblies, may lay the only lawful claim to a divine right, according to the Holy Scriptures. A new edition corrected and amended. By sundry ministers of Christ within the City of London. To which is added, an appendix, Containing Extracts from some of the best Authors, who have written on Church Government, concerning the scriptural qualifications and Duties of Church members; the sole Right of Gospel Ministers to preach the Gospel; the People's Divine Right to choose their own Pastors; together with an Abstract of the Arguments of the great Dr. Owen (though a professed Independent) in Favours of the Divine Right of the Office of the Ruling Elder.",,123,1,7,1,0,0,2,13,1,1,0,0,2,2,1,0,2,0,0,0,0,1,2,23,4,1,0,2,1,4,4,1,7,0,2,0,5,0,0,0,2,0,2,0,2,7,2,0,1,1,4,1,1,1,0,0,0,0,0,6,3,1799,1,1,"Paisley : printed by Neilson and Weir, 1799.",Paisley,268,unknown,,,FALSE,"between God and man, and to reconcile their to God , by his active and passive obedience; that Jesus Christ gave himself, and became a propitiation for their sins ; -- that he assumed our nature into a personal union with himself, whereby there are two natures in one person"
0159801102_000142,"Faith and practice represented in fifty-four sermons on the principal heads of the Christian religion; preached at Berry-Street, 1733. By I. Watts D.D. D. Neal M.A. J. Guyse D.D. S. Price. D. Jennings. J. Hubbard. Published for the use of families, especially on the Lord's-Day evenings. ...",,107,3,0,1,4,0,0,4,1,9,7,0,1,4,1,0,0,1,0,0,0,0,2,7,2,0,1,0,1,3,1,5,1,0,0,3,0,4,0,2,1,1,1,2,0,2,1,5,0,0,3,5,4,5,1,1,3,0,0,0,4,1735,2,2,"London : printed for R. Hett at the Bible and Crown, and J. Oswald at the Rose and Crown, both in the Poultry, MDCCXXXV. [1735].",London,597,unknown,,,FALSE,"these two persons in the other World , is evidently managed in the figurative Way; and therefore we need not ywonder that, a separate Spirit flould be here de fribed, as having Eyes and a Tongue in Dif frefs,, ard as being tormented in Flames. These gre iftong : pathetic"
0332700400_000008,"Hymns and spiritual songs, intended for the use of real Christians, of all denominations. Published by John and Charles Wesley.",Charles Wesley,107,1,3,4,1,0,0,1,1,1,1,4,0,1,2,0,7,1,0,1,1,0,1,7,2,0,1,1,6,4,1,1,4,0,0,1,0,3,1,2,14,0,0,3,0,0,4,1,0,2,7,4,4,0,0,1,1,0,0,0,1,1774,1,1,"London : printed by R. Hawes, (no. 34.) Lamb-Street, Spital-Fields, [1774?].",London,136,male,1707,1788,TRUE,"name inscribe on the white flon.. The life divine , the little leaven, My precious pearl, my present heaven . Part the f/cond. 6 \ Love divine , what hast thou done! O Th' immortal God hath died for me; The Father's co eternal Son Bore all my sins upon"
0385601000_000004,"The watchful Christian prepared for early death. A sermon on occasion of the decease of Mrs. Sarah Abney, daughter of the late Sir Thomas Abney, Knt. And Alderman of London. Preached at Theobalds in Hertfordshire, April 2. 1732. By I. Watts, D.D.",Isaac Watts,102,0,0,1,3,2,0,1,0,10,1,1,1,7,1,1,1,0,0,0,2,1,3,9,1,0,0,1,3,3,7,2,1,0,0,1,0,1,0,3,5,0,1,2,0,0,1,2,0,2,2,4,1,5,0,0,3,0,1,1,4,1732,1,1,"London : printed for E. Matthews at the Bible in Paternoster-Row ; R. Ford at the Angel, and R. Hett at the Bible and Crown, both in the Poultry, [1732].",London,42,male,1674,1748,TRUE,"of a watcfill Chrifian: He is awake from the Sleep of Death and made spiritually alive; he hath the Work of vital Religion begun in his Heart . He is awake from the Sleep of Thought lefnefs and Indolence, he is solicitous to know his own State and hath good"
0872200400_000009,"The country parson's advice to his parishioners of the younger sort. Explaining what they are to believe, and do, in order to be saved.","Holmes, William",104,0,10,1,3,0,1,8,2,0,2,0,1,2,5,0,1,1,0,0,0,0,0,14,1,1,2,0,1,3,6,1,6,0,0,0,1,2,0,3,2,0,0,0,0,1,1,0,0,1,5,3,0,4,1,0,1,0,2,2,3,1742,1,1,"Oxford : printed at the Theatre, MDCCXLII. [1742].",Oxford,72,male,1689,1748,FALSE,"partake of the same Happiness in the glorious Kingdom of God . Ye do farther profess to believe , that That part of Christ's Church, which is here on Earth, ( hall never entirely cease, but that there Shall always be a number of faithful Persons continuing to believe ,"
0409800600_000005,"The reasonableness of believers dying, and the greater advantage they will have by Jesus Christ, ... than if they were not to die; ... Consider'd in a sermon on John xi. 25, 26. occasioned by the death of the late Revd. Mr. John Asty, ... To which is added, a postscript relating to the Reverend Mr. Samuel Chandler's second letter to the author ... By John Guyse.",John Guyse,93,0,7,0,5,0,1,6,3,4,7,1,1,4,0,0,1,1,0,0,1,1,3,4,0,1,1,2,0,2,0,1,1,2,0,1,2,4,1,2,0,0,0,0,0,0,1,2,0,0,4,3,2,1,0,0,3,0,1,1,5,1730,1,1,"London : printed for Richard Hett, and John Oswald, 1730.",London,43,male,1680,1761,FALSE,"glory in their Father's kingdom. And tis but half the man, and that his Mat. so. meaner part, that dies. They that kill the 12 body , are not able to kill ejbul. When the 7 dust returns to the earth as it was, the spirit returns to God who"
0875400100_000007,"A compassionate address to the Christian world: divided into six sections. I. Serious considerations. II. Self-Examination derived from the Creed. III. Self-Examination derived from the Lord's Prayer. IV. Self-Examination derived from the Ten Commandments. V. Enquiries relating to the Gospel of Christ. VI. An affectionate paraphrase on these words, ""why will ye die?""",John Reynolds,108,2,8,1,4,0,0,4,7,6,1,1,1,3,1,0,2,0,0,0,0,0,0,14,2,2,0,2,0,3,2,0,6,0,0,0,1,3,1,1,4,0,3,0,1,1,3,0,0,1,3,5,1,0,1,1,1,0,1,0,4,1797,1,1,"London : printed and sold by T. Wilkins, No. 23, Aldermanbury, M.DCC.XCVII. [1797].",London,72,male,1667,1727,FALSE,"and endeavour to underaland it? Do I really believe that there was once such a Perfoi in the World , as jest:!. Chrit? thar, about Seventeen Hundred yt~s ago. he lived in the Jews Country, called Canaan; that there he was born, particularly at a Town called Bethlehem P that"
0924601900_000065,"The psalms of David in metre. Translated, and diligently compared with the original text, and former translations. More plain, smooth, and agreeable to the text, than any heretofore. Allowed by the authority of the General Assembly of the Kirk in Scotland, and appointed to be sung in congregations and families.",,107,1,1,0,3,0,1,2,1,7,2,0,5,2,7,1,2,0,0,0,2,1,2,9,2,3,0,1,2,4,1,7,5,0,0,3,2,4,0,3,4,1,0,0,0,0,2,2,0,0,2,5,1,0,0,0,0,0,2,1,1,1795,1,1,"Edinburgh : printed by Mark & Charles Kerr, His Majesty's Printers, MDCCXCV. [1795].",Edinburgh,60,unknown,,,FALSE,"face to face, and God shall be unveiled. 13 Faith , Hope , and Love , now dwell on and earth by them is blessed; [earth, But Faith and Hope must yield to Love , of all the graces best. 14 Hope shall to full fruition rise, and Faith be"
1166000600_000111,"The book of common prayer, and administration of the sacraments, And other Rites and Ceremonies of the Church, According to the Use of The Church of England: together with the Psalter or Psalms of David, Pointed as they are to be sung or said in Churches.",Church of England,105,0,0,1,5,0,0,6,3,7,3,0,0,5,2,1,5,1,0,0,0,1,1,8,1,2,1,0,1,4,7,3,6,0,0,1,1,5,0,3,2,0,1,0,0,0,0,0,0,2,5,3,3,0,0,0,0,0,0,2,3,1794,1,1,"Cambridge : printed by John Archdeacon and John Burges, Printers to the University; sold by C. Dilly, F. & C. Rivington, and B. & J. White, in London; and J. & J. Merrill, in Cambridge, 1794.",Cambridge,419,unknown,,,FALSE,"the last Adam was made a. quickening Spirit . Howbeit that was not first which is spiritual, but that which is natural ; and afterward that which is spiritual. The first man is of the earth, earthy: the second man is the Lord from heaven , As is the earthy,"
0135503100_000005,"A remarkable narrative of Whiting Sweeting; who was executed at Albany, in the state of New York for murder. [Two lines of Scripture text].","Carter, William",127,0,3,0,1,0,2,3,0,12,0,0,1,3,2,1,0,0,1,0,1,0,0,12,3,0,1,3,2,0,4,1,3,0,2,1,5,6,1,3,2,1,4,0,0,1,0,1,0,1,14,5,8,0,0,1,1,1,2,2,6,1794,1,1,"Printed at Exeter [N.H.] : by Henry Ranlet, and sold at his book-store, in Main-Street, 1794.",Exeter,53,unknown,,,FALSE,"feelings I have had, and now have of the solemn approach of death . I intend likewise to drop a word to those who deny the offices of Jess Christ , and have the hardness to confider the Saviour of sinners, an importer, and religion a mere notion. I think"
0963300700_000050,"Time, and the end of time; in two discourses: the first about redemption of time; the second about consideration of our latter end. By John Fox.","Fox, John",102,0,4,0,1,1,1,2,3,11,1,0,4,3,2,0,0,3,0,0,2,0,1,4,2,3,0,0,7,1,0,0,2,0,2,2,0,0,1,6,1,0,1,1,2,1,1,2,0,0,3,8,2,0,0,3,5,0,1,0,2,1779,1,1,"London : re-printed for J. Wilkie, in St. Paul's Church-Yard, M.DCC.LXXIX. [1779].",London,246,unknown,,,FALSE,"the memory of your departed Relations, Husbands, Wives, Children, Friends , Neighbours, and look beyond the Chambers of the Grave , converse with those miserable departed souls , give the Prisoners of the pit a visit. Meditate on the raging furious flames, that dilimal darkness, finoak and stink of the"
0770301900_000065,"A scriptural exposition of the church catechism; containing the young Christian's account of the doctrines and duties of his religion, and of those divine Authorities, upon which he builds his Faith and Practice. With Sacramental and other Devotions, gathered out of Holy Writ. And the Offices of the Church The fourth edition improved. By Joseph Harrison, Minister of the Parish Church of Cirencester[.]","Harrison, Joseph",110,1,1,5,2,0,2,10,1,5,0,1,0,2,1,0,6,1,1,0,0,0,6,18,2,1,0,0,0,2,1,4,10,0,1,0,3,1,0,1,1,1,1,0,2,0,2,1,0,2,3,1,1,0,0,0,0,0,3,2,1,1738,1,1,"Dublin : printed by and for Sylvanus Pepyat, Bookseller in Skinner-Row, MDCCXXXVIII. [1738].",Dublin,265,male,1669,1753,FALSE,"hath redeemed us from the curse of the: law , being made a curse for us; and by him I. will offer up the sacrifice of praise to God , continually, giving thanks through' his Name, who. hath redeemed us, not with corruptible things, as silver and gold, but with"
0196102000_000014,"A sermon, preached in the Presbyterian Church in Newbury-Port, April 7, 1793; occasioned by the much lamented death of the Rev. John Murray, A.M. Pastor of said church, who departed this life March 13, 1793, in the 51st year of his age. (Published at the desire of the hearers.) By James Miltimore, A.M. Pastor of a church in Stratham.","Miltimore, James",106,0,2,2,4,1,0,4,0,20,1,6,0,2,1,2,0,0,0,1,0,0,3,12,3,7,0,0,1,1,0,1,5,0,1,0,1,2,0,1,3,0,1,0,0,0,2,1,0,1,1,3,2,1,0,0,0,0,1,2,4,1793,1,1,"Exeter [N.H.] : Printed and sold by Henry Ranlet, 1793.",Exeter,56,male,1755,1836,FALSE,"of enjoying existence, independent of the body . Who then can question the foul's immortality? Or who can say that the consequences of dying to this immortal part, are trilling or unimportant? Our soul drops not into the duff, when she renounces her present correspondence with the body . No,"
0714501300_000028,"Sermons on various subjects, published at the request of A congregation of Protestant Dissenters in Wakefield. By William Turner.","Turner, William",107,2,4,1,3,0,0,1,5,2,0,0,0,3,3,1,2,1,2,0,0,1,2,11,1,2,1,1,1,1,2,11,4,0,0,2,0,7,0,1,7,0,1,2,0,2,1,2,0,3,2,1,4,0,0,0,0,0,0,0,4,1793,1,1,"London : printed for Joseph Johnson, St. Paul's Church-Yard, MDCCXCIII. [1793].",London,463,male,1714,1794,FALSE,"life . For his profpes. are not now (like the wicked man's) dark and dreadful; nor (like the careless and inconsiderate person's , whose life hath been influenced more by the principles and views of this world , than those which relate to another) doubtful, hesitating, and disturbed with fears"
0844001000_000034,"Serious essays on the truths of the glorious gospel, and the various branches of vital experience. For the use of true Christians. By John Ryland, Junior, of Northampton.",John Ryland,96,0,1,2,3,0,1,7,6,10,0,1,2,4,2,0,0,2,0,1,2,0,1,6,2,0,1,1,3,2,2,0,1,3,0,0,0,3,0,1,3,0,2,0,1,0,1,0,0,0,7,4,2,1,0,1,1,0,0,1,2,1775,1,1,"London : printed by J.W. Pasham, in Black-Friars; for J. Dermer, Horslydown-Stairs, Shad-Thames; and G. Keith, Gracechurch-Street, MDCCLXXV. [1775].",London,316,male,1753,1825,FALSE,"filthy too, Like holy Bunyan, I must cry, L With lelf abhorrence just and true, ""LORD, what a dog am I! i.no thought can paint, no tongue can tell, What countless lusts within me dwell I What boundless floods of grace I need, I'm soul , I'm filthy, black as"
