1082300100_000012,"Dying thoughts, in three parts. Part I. A memorandum, in order to a serious Preparation for Dying. Part II. The Believer's Pleasant Prospect through the Valley of Death. Part III. A Contemplation of Heaven, or the Believer's Pisgah-Sight of the Heavenly Canaan. Together with a conclusion, shewing what will make the Heaven-Born Soul to be often groaning and panting for the Glory that is to be revealed. By the late Reverend Mr. William Crawford Minister of the Gospel at Wilton.","Crawford, William",92,0,2,1,1,0,0,3,1,4,1,2,1,12,1,0,0,1,1,2,0,0,0,5,3,1,0,1,2,2,1,0,0,0,0,1,1,11,0,4,2,0,0,2,0,0,3,0,0,0,5,4,2,1,0,1,1,0,0,2,4,1769,1,1,"Paisley : printed by A. Weir and A. M'lean: for A. Weir Bookseller at the Cross, 1769.",Paisley,238,male,1676,1742,FALSE,"his will to do mine own? Or would it be a righteous thing, when the Son of God came into the world , and died to redeem mefrom all iniquity, and that  might live to him who died and roj/ again, again, if I should keep off from him;"
1678301702_000123,"Sermons on practical subjects. By Robert Walker, late one of the ministers of the High Church of Edinburgh. To which is prefixed, A character of the author, by Hugh Blair, D.D. The sixth edition, containing all the sermons of the former editions. In two volumes.","Walker, Robert",84,7,2,1,7,1,0,4,1,5,0,1,2,1,1,0,2,1,0,0,0,0,2,4,0,2,1,1,1,4,1,3,1,0,0,0,1,0,2,5,0,0,0,1,1,0,2,2,0,0,2,4,1,1,0,1,2,0,0,1,2,1787,2,2,"Dublin : printed by and for W. Sleater, No. 51 Castle-street, and for W. Gilbert, No. 26 Great George's-street, M.DCC.LXXXVII. [1787].",Dublin,454,male,1716,1783,FALSE,"that holy ordinance? "" For "" as often as we eat this bread, and drink this "" cup, we do show the Lord's death till he "" come "" that is, we commemorate his death in the faith of his second and glorious appearance . This, my brethren, is an"
0924401400_000004,Funeral hymns.,Charles Wesley,101,0,1,0,1,0,0,3,1,4,7,0,3,2,4,1,0,1,1,0,3,0,2,3,3,1,0,1,2,3,1,2,6,0,2,4,0,5,0,2,7,1,0,0,0,0,0,0,0,1,4,8,4,0,1,0,0,0,1,1,4,1747,1,1,"Dublin : printed by S. Powell, and sold at Mr. Verney's in Little Ship-Street, by Mrs. Crump in Marlborough-Street, opposite to the Society-House, and Mr. Watts in Park-Street, near the Camb, MDCCXLVII. [1747].",Dublin,24,male,1707,1788,TRUE,"Her Soul was cleansed below, And fav'd from Sin's Remains, Whiter on Earth than Salmon's Snow, She now with JESUS reigns; Long in the Furnace try'a, Long in the Vale distressed, The Lamb at last hath called his Bride Up to the Marriage feaft. V With steadfast Faith and Hope"
0872300400_000147,"The christian's defence against the fears of death. With seasonable directions how to prepare ourselves to die well. Written originally in French, by the late Reverend Divine of the Protestant Church of Paris, Charl. Drelincourt. Translated into English, by Marius D'Assigny, B.D.",Charles Drelincourt,111,1,2,2,21,0,2,6,6,3,1,3,2,3,1,0,1,0,1,0,0,0,3,11,0,0,1,0,0,1,4,2,4,0,0,2,0,3,0,2,1,1,0,0,0,1,1,0,2,1,2,5,4,0,0,0,0,0,1,0,4,1756,1,1,"London : printed for R. Ware, W. Innys and J. Richardson, W. and D. Baker, J. Knapton, J. Clarke, C. Hitch and L. Hawes, J. Hodges, E. Wicksted, B. Dod, John Rivington, James Rivington and J. Fletcher, J. Ward, R. Baldwin, W. Johnston, T. Caslon, S. Crowder and H. Woodgate, M. and T. Longman, P. Davey and B. Law, C. Corbett and M. Cooper, MDCCLVI. [1756].",London,531,male,1595,1669,FALSE,"a Price;, glorify therefore God in your Bodies , and in your Souls , C C 4 that that belong unto Gcd. From hence we muss conclude, that this glorious Saviour would be deprived of Part of that which he hath purchased by his ineftimnable Sufferings, if our Bodies always"
0395800301_000048,"Sermons on several occasions, in two volumes, by Henry Wolstenholme, M. A. Late Rector of Liverpool. ...","Wolstenholme, Henry",90,1,2,1,0,0,0,6,2,1,2,2,0,2,5,0,1,0,1,0,1,0,2,7,3,0,0,1,1,4,1,14,1,0,0,1,0,2,0,2,1,2,2,2,0,0,3,1,2,0,2,1,3,0,0,1,0,0,1,1,2,1790,1,2,"Liverpool : printed at Smith's navigation shop, MDCCXC. [1790].",Liverpool,356,unknown,,,FALSE,"he purifies hinmfelf as he is pure, and endeavours to be per see, as his Father which is in Heaven is perfect. You will not however so far mistake the meaning of these texts, as to suppose that he, who hath the strongest faith and hope will, or can, by"
0075300400_000021,A collection of Psalms and hymns from various authors: chiefly designed for the use of public worship.,"Robinson, Thomas",108,0,1,4,1,0,0,4,2,3,2,1,0,2,3,0,3,1,0,0,1,0,2,5,10,0,0,2,4,0,1,2,4,0,2,0,0,3,0,4,9,0,2,0,0,0,5,0,0,1,5,5,3,1,0,0,1,0,6,2,1,1797,1,1,"A Leicester : printed and sold by J. Brown, 1797.",,354,male,1749,1813,FALSE,"word , Shall lead us in thy ways. 2 We reverence our High Priet above, Who offered up his blood , And lives to carry on his love , By pleading with our God . 3 We honour our exalted King ; How sweet are his commands! He guards our"
0812100600_000028,"Select portions of Dr. Brady's and Mr. Tate's version of the Psalms; together with a few selected from the old version. Also a collection of hymns and sanctuses, for the use of St. Ann's Church, Manchester. To be had of J. Kay, clerk, only.","Saint Ann's Church (Manchester, England)",103,2,0,2,1,0,0,1,4,2,2,0,2,3,2,0,4,0,0,1,0,0,7,14,4,1,0,1,2,5,0,1,3,0,2,3,0,7,0,2,7,0,1,0,0,0,1,1,0,0,3,4,3,0,0,1,1,0,1,1,1,1798,1,1,"Manchester : printed by C. Wheeler and Son, 1798.",Manchester,235,unknown,,,FALSE,"Heavens resound, Shouted from earth's remotest bound, 4 Saints, who his full salvation know , Saints, who but taste it here below, Join every angel's voice, to raise Continued, never ending praise: : i log HYMN 94 1 IF any pity dwells on earth, If any cries can call it"
0721300200_000049,"Discourses upon Solomon's song. Preached at St. Dunstan's Church, in the west, London; by W. Romaine, M. A. Lecturer of the said Church. A new edition, revised by the Author.",William Romaine,107,4,2,2,1,1,1,11,4,1,0,1,0,1,0,0,0,0,0,0,3,1,2,8,4,0,0,0,3,2,3,1,3,0,0,1,0,3,0,1,12,0,1,1,1,2,0,0,2,0,9,6,4,1,0,0,0,0,1,2,1,1790,1,1,"London : printed by T. Chapman. Sold by H. Trapp, and G. Terry, Paternoster-Row, and J. Pridden, Fleet-Street, MDCCXC. [1790].",London,375,male,1714,1795,FALSE,"Cod, and the lovers of pleasure prefer the empty periihin; joys of sense to the solid and everlaalfig joys of his heaven . In what relates to the loul they ad against that very intfino:, by which they are invariably guided in what relates to the body . What can"
1611600100_000157,"Magnæ Britanniæ Notitia: or, The present state of Great Britain; with divers remarks upon the antient state thereof. By John Chamberlayne, Esq; the thirtieth edition of the south part, called England; and the ninth of the north part, called Scotland. To which is added, a compleat list of the Queen's houshold; as also that of their Royal Highnesses the Prince of Wales, the Princess Royal, the Princess Emelia and the Princess Carolina, never yet printed. In two parts. With His Majesty's royal privillege.",John Chamberlayne,140,0,2,0,1,0,3,11,2,5,0,0,2,4,7,3,4,0,0,0,0,0,1,21,8,0,0,1,1,2,7,0,0,0,1,0,0,5,0,1,1,2,4,0,0,2,1,0,0,2,9,3,7,3,1,0,0,0,5,5,3,1729,1,1,"London : printed for D. Midwinter, J. Tonson, T. Wotton, B. Motte, T. Osborn, and J. Shuckburgh, MDCCXXIX. [1729]",London,807,male,1666,1723,FALSE,"are the Rule of Faith and Life . Scriptures derive their Authority from God their Anuthor 3 are an adequate Rule of Faitht may, by a due otie of the Means , be understood by Unlearned as well as earne4: The Holy Ghost speaking in the Scriptures, is the Supreme"
0332900200_000425,"Explanatory notes upon the New Testament. By John Wesley, M. A. Late Fellow of Lincoln-College, Oxford.",John Wesley,103,1,3,4,0,0,0,4,0,1,0,1,1,3,8,0,2,0,2,1,0,0,9,8,4,0,0,1,2,1,7,3,2,0,0,0,1,3,3,4,2,3,1,0,0,0,3,0,0,3,2,4,4,0,0,0,0,0,0,0,2,1788,1,1,"London : printed for the author: and sold at the New-Chapel, City-Road, and by all the Booksellers in Town and Country, M,DCC,LXXXVIII. [1788].",London,916,male,1703,1791,TRUE,"immediate power of the Holy ghofr: not an evidence at all; but a mere notion. Neither is faith made any longer a means of holiness ; but something that will do without it. Chrij is no more a Saviour from sin ; but a defence, a countenancer of it. He"
0251301200_000009,A select collection of hymns universally sung in all the Countess of Huntingdon's chapels; with a supplement as used at the Adelphi Chapel.,"Selina Hastings, Countess of Huntingdon",98,2,2,5,1,1,0,2,0,1,1,1,0,2,1,1,3,1,0,0,1,0,3,6,3,0,0,0,4,5,2,0,5,0,0,1,4,3,0,1,8,0,0,3,1,0,3,0,0,2,8,3,1,0,0,2,1,0,2,1,1,1796,1,1,"London : printed and sold by W. Smith, King-Street, Seven-Dials, 1796.",London,497,female,1707,1791,FALSE,"crowd thy gates with thankful songs, High as the heavens our voices raise; And earth, with her ten thousand tongues, Shall fill thy courts with sounding praise. Wide as the world is thy command, Vast as eternity thy love ; Firm as a rock thy truth 1m1i stand, When rolling"
0444800300_000040,"Psalms and hymns, collected by William Bromley Cadogan, M. A. Rector of St. Luke's, Chelsea, St. Giles's, Reading; and Chaplain to the Right Hon. Lord Cadogan.",William Cadogan,94,1,1,2,2,0,0,5,3,6,0,0,0,2,1,1,3,1,2,0,0,0,5,4,2,3,1,0,3,6,3,0,3,0,6,1,0,3,0,3,4,0,0,0,1,0,2,0,0,3,1,3,1,0,1,0,0,0,3,1,1,1794,1,1,"Reading : printed and sold by A. M. Smart and T. Cowslade ; sold also by J. Mathews, No. 18, Strand, and J. F. and C. Rivington, St. Paul's Church-Yard, London; by R. Snare, and H. Waugh, Reading ; and Mrs. Davenport, and Lewis and Fienes, Chelsea, MDCCXCIV. [1794].",Reading,290,male,1751,1797,FALSE,"The temple's vail is rent in twain, While JESUS meekly bows his head; The rocks resent his mortal pain, The yaw ning graves give up their dead : The bodies of the saints arise, Reviving as their SAVIOUR dies. And hall not we his death partake, In sympathetic anguish groan"
0735601200_000055,"The pious country parishioner instructed how to spend every day, through the whole Course of his Life, in a religious and acceptable manner. Advice how to keep the Lord's-Day holy. A Course of Reading the Holy Scriptures, wherein is shewn how much they out-do in Eloquence, all the Rules of human Art. A right Method of Education; the ill Consequence of withholding Instruction from Children; how to subdue their Passions, and make them a Comfort to their Friends, and a Blessing to the World. The Feasts and Fasts. To which are added, Collects on several Occasions. Also, a Discourse concerning the indispensible, though, in Country Parishes, much-neglected Duty of receiving the Blessed Sacrament of the Lord's-Supper. Wherein the Nature of it is described. The Obligations of Frequenting it enforced. All the Excuses, usually brought for the Neglect of it, answer'd. The Ignorant Person taught what he must do in order to be A Worthy Communicant. And because all must die, Rules are given for a devout Behaviour in the Time of Sickness; and Directions laid down how to prepare for a happy Change at Death.",,89,2,0,0,4,0,0,1,1,7,3,1,0,2,2,0,1,1,1,0,0,1,1,4,1,0,2,0,3,4,6,1,0,0,1,0,0,1,0,3,2,0,1,1,0,1,1,1,1,2,4,6,3,2,0,1,3,0,3,0,3,1753,1,1,"London : printed for S. Birt, in Ave-Mary-Lane ; and M. Cooper, in Pater-Noster-Row, [1753].",London,255,unknown,,,FALSE,"makes you better, more holy ani patient, if it increases your Faith , and excites in you a Hunger and Thirt after Righteousness, this will make you dearer to God , and will set you forward in your Way to Heaven . They who have no Sorrow, no Sickness, no"
0265300900_000026,"Sacred hymns for the children of God, in the days of their pilgrimage. By J. C.",John Cennick,107,1,0,0,1,0,0,2,3,0,0,1,4,1,9,0,1,0,1,0,2,0,0,4,3,1,3,2,1,2,3,5,4,0,1,0,1,2,1,5,13,0,0,1,0,0,1,0,0,1,2,8,4,1,0,0,2,1,5,3,1,1741,1,1,"London : printed and sold by B. Milles, over against the Cock Distil-House in Houndsditch, near Bishpsgate, MDCCXLI. [1741].",London,246,male,1718,1755,TRUE,"The Spirits fly away. 2 How blessed are they whose Work is done, Who iear the saviovu's Word ; Enter my Joy, and share my Throne, And banquet with thy LORD. 3 What What Peace must such a Soul possess, Who views with faithful Eyes His Pardon sealed, his Righteousness"
0395902200_000012,"Dying thoughts, in three parts. Part I. A memorandum, in order to a serious Preparation for Dying. Part II. The Believer's Pleasant Prospect through the Valley of Death Part III. A Contemplation of Heaven, or the Believer's Pisgah-Sight of the Heavenly Canaan. Together with a conclusion, shewing what will make the Heaven-Born Soul to be often groaning and panting for the Glory that is to be Revealed. By the late Reverend Mr. William Crawford Minister of the Gospel at Wilton.","Crawford, William",98,0,2,1,1,0,0,5,1,5,1,2,1,13,1,0,0,1,1,1,0,0,1,4,3,1,0,1,3,1,1,0,0,0,0,1,1,10,0,4,2,0,0,2,0,0,3,0,0,0,6,7,2,0,0,1,3,0,0,2,3,1756,1,1,"Glasgow : printed for, and sold by Robert Smith, at the Sign of the Gilt Bible, opposite to the New Church Salt-Mercat. And by W. Gray, printer in Edinburgh, 1756.",Glasgow,240,male,1676,1742,FALSE,"might live to him who died and rojt again., again, if I hold keep off from him, refute his of sers, and not submit to his laws ? Well then, if I would die the death of the righteous, and have my latter end in peace, I must be daily"
0240100400_000011,"The christian remembrancer: or, short reflections upon the faith, life, and conduct, of a real Christian.",Ambrose Serle,93,0,5,1,3,0,0,5,0,2,0,1,1,3,4,0,0,0,1,0,0,0,4,7,2,0,1,1,3,4,6,2,4,0,0,0,0,1,0,1,1,0,2,1,4,1,3,1,0,3,2,3,3,0,1,0,0,0,1,2,3,1789,1,1,"London : printed and sold by H. Trapp, No. 1. Pater-Noster-Row: also sold by J. Mathews, No. 18, in the Strand, MDCCLXXXIX. [1789].",London,285,male,1742,1812,FALSE,"more strongly. He was suffered to fail in his faith , that my faith , and that of all thy children after him, might be improved and confirmed. But the mere evidence of sense can draw no blessing. His bodily view of thy resurrection was was indeed followed by faith"
1118400800_000166,"Fifteen discourses upon doctrinal, connected subjects, with practical improvements, viz. On the primitive covenant of work, or law of nature. On the eternal obligation of the law of nature. On the universal condemnation of sinners by the law and covenant of works. On the impossibility of the sinner's justification, by the law, in the sight of God. On the imputation of righteousness without works. On the covenant of grace in general, or divine reconciliation. On the covenant of redemption, or mediation. On the first covenant, or law of Moses. On the second or bette covenant of our Lord Jesus Christ. On faith and its connection with justification and holiness. Objections to the doctrine of justification in the vicarial way answered, and its consistence with the reward of virtue demonstrated. On Christian obedience as a new-covenant condition. On the perseverance of the saints, and final salvation of believers. On the final judgment, and justification and condemnation in that day. Recapitulation and reflections relative to the whole. By John Mellen, A.M. Pastor of the Second Church in Lancaster.",John Gill,121,1,4,1,1,0,0,13,3,3,0,0,1,2,7,2,3,0,1,0,0,4,3,10,4,0,0,0,0,0,2,2,11,1,0,0,18,3,0,0,0,2,4,0,0,0,1,1,1,1,1,0,2,1,0,0,1,0,0,4,2,1765,1,1,"Boston: N.E. : Printed and sold by Edes and Gill, in Queen-Street, MDCCLXV. [1765].",Boston,568,male,1732,1785,FALSE,"kingdom and covenant of the Son of God . By means of grace , the darkness and confusion .of nature is cleared and set right, and her religion placed upon a proper and conliftent basis. MOREOVER., that christian obedience, as flowing from faith in Jesus Christ , and supposing reconciliation"
0767000300_000009,"Hymns and spiritual songs, intended for the use of real Christians, of all denominations. Published by John and Charles Wesley. Ye have put off the old man with his deeds, and have put on the new man, which is renewed in knowledge, after the image of him that created him: where there is neither Greek nor Jew, circumcision nor uncircumcision, Barbarian, Scythian, bond or free; but Christ all and in all. Col. iii. 9-11.",Charles Wesley,96,0,2,4,0,0,0,2,1,2,1,1,0,1,3,0,3,1,0,2,1,0,1,5,2,1,0,2,5,2,1,3,3,1,0,1,0,2,0,4,12,0,0,0,0,0,4,0,0,3,7,7,2,0,0,0,1,0,0,2,1,1775,1,1,"London : printed by R. Hawes, (no. 40) in Dorset-Street, Spitalfields, MDCCLXXV. [1775].",London,137,male,1707,1788,TRUE,"am; Excluded is my every boast, My glory fwallow'd up in (hamle. Guilty I stand before thy face; I feel on me thy wrath abide: Tis jut the sentence flould take place, Tis juft but 0 thy son hath died. 6 Jcfus, the Lamb of God , hath bled, i"
0192701200_000044,A selection of hymns from various authors.,,99,2,4,2,1,0,1,2,2,0,1,1,0,0,1,0,4,1,1,1,0,0,4,5,3,0,1,1,6,6,2,0,12,0,1,2,0,2,1,1,10,0,0,0,1,0,3,0,0,1,3,3,2,0,0,0,1,0,2,1,1,1795,1,1,"Macclesfield : printed and sold by Edward Bayley, 1795.",Macclesfield,434,unknown,,,FALSE,"HYMN LXIX 1 LET earth and heaven agree, Angels and men be joined, To celebrate with me The Saviour of mankind, To adore the all atoning Lamb, And bless the sound of Jesu's name. 2 Jesus , transporting sound! The joy of earth and heaven ! No other help is"
1305700200_000001,The principles of the Christian religion: divided into lessons and adapted to the capacities of children.,"Thomas, Isaiah",98,3,2,1,2,0,0,3,0,4,2,3,0,1,2,0,1,1,0,0,2,0,1,10,5,1,2,2,2,1,1,1,3,0,0,1,1,2,0,1,5,1,5,0,0,0,2,0,0,3,8,6,2,0,0,0,0,0,3,1,1,1799,1,1,"[Worcester] : Printed at Worcester [Mass.] By Isaiah Thomas, Jun. Sold wholesale and retail at his store, 1799.",Worcester,24,male,1773,1819,FALSE,"THE PRINCIPLEES OF THIE CHRISTIAI N RELIGION. lesson I. Of our nature and its chief, ppincfs I AM the Creature of th L rd, ihe made me by his powerful word ; O may I love anri serve him fill!, And form my aelions by h: is will. Then he"
0329600600_000003,"The poor man's help, and young man's guide: containing I. Doctrinal instructions for the Right Informing of his Judgment. II. Practical directions for the General Course of his Life. III. Particular advices for the Well-Managing of every Day. With Reference to his I. Natural Actions. II. Civil Imployments. III. Necessary Recreations. IV. Religious Duties. Unto which is added principles of religion, useful to be Known, Believed and Practised, by such as desire to receive the Holy Communion with Benefit and Comfort; with Forms of prayer for Families, and single Persons: also Divine hymns on several Occasions. By W. Burkitt,",William Burkitt,121,1,2,0,4,0,0,12,2,4,0,2,1,6,3,3,2,0,0,0,0,1,1,17,2,0,1,2,1,3,2,0,4,0,0,1,0,4,0,2,1,3,7,0,0,2,2,0,1,0,14,1,1,3,1,0,0,0,1,0,1,1715,1,1,"London : printed for J. Laurence at the Angel in the Poultry; J. Nicholson at the King's Arms; J. and B. Sprint at the Bell in Little Britain; and; S. Clift at the Bible and Three Crowns in Cheap-Side, near Mercer's-Chapel; and D. Jackson, 1715.",London,190,male,1650,1703,FALSE,"State , yet in a mutable Condition, and under Possibility of falling , being tempted by Satan, and left to the Freedom of hisown Will, did actually fall from his Estate of Innocence and Integrity, into a State of Sin and Misery; Gen. 3 6 And when the Woman fapn"
0710700100_000003,"A sermon occasioned by the decease of Mrs. Mary Stillman; who departed this life, March 17. 1768. in Charles-Town, South Carolina. In the 57th year of her age. Preached at Boston, April 17. By her son. [Two lines from Psalms].",Samuel Stillman,86,0,4,1,1,1,1,4,1,6,6,4,0,1,1,0,2,0,2,1,2,2,1,10,0,0,1,1,0,0,3,0,5,0,0,0,0,4,0,1,3,0,2,0,1,2,1,2,1,0,1,1,2,1,0,0,0,0,0,1,2,1768,1,1,"Boston : Printed for Philip Freeman in Union-Street, MDCCLXVIII. [1768].",Boston,29,male,1738,1807,FALSE,"God , my God , zvby hast thou forsaken sme? It by comes us to be silent, when the reasons of the divine conduet are hid from us. But, alas, how apt are we at such times to say, "" Why is it thus?"" ?"" this instance of our blessed"
1186900100_000111,"The book of common prayer, and administration of the sacraments, and Other Rites and Ceremonies of the Church, According to the Use of the Church of England: together with the Psalter or Psalms of David, Pointed as they are to be sung or said in Churches.",Church of England,99,0,0,1,5,0,0,6,1,7,3,0,0,4,2,1,5,1,0,0,0,1,1,8,1,2,1,0,1,4,7,3,6,0,0,1,1,5,0,3,2,0,0,0,0,0,0,0,0,2,5,3,2,0,0,0,0,0,0,2,2,1791,1,1,"Oxford : printed at the Clarendon Press, by W. Jackson and A. Hamilton, Printers to the University: sold by W. Dawson, at the Bible Warehouse, Paternoster Row, London, MDCCXCI. [1791].",Oxford,392,unknown,,,FALSE,"that which is spiritual. The first man is of the earth, earthy; the second man is the Lord from heaven . As is the earthy, fuel are they that are earthy: And as is the heavenly, such are they also that are heavenly. And as we have born the image"
0287100500_000120,"The christian's defence against the fears of death. With seasonable directions how to prepare ourselves to die well. Written originally in French by the late Reverend Divine of the Protestant Church of Paris, Char. Drelincourt: translated into English by Marius D'Assigny, B.D.",Charles Drelincourt,107,2,1,1,2,0,3,1,1,13,2,2,1,5,3,0,2,2,0,0,0,0,7,4,1,0,1,1,4,5,3,1,0,0,0,0,0,11,0,3,2,1,0,1,0,0,1,3,0,3,0,4,6,0,1,0,1,0,0,0,2,1724,1,1,"London : printed for R. Wilkin, D. Midwinter, R. Robinson, B. Cowse, S. Tooke, B. Motte, J. Peele, and J. Lacy, M,DCC,XXIV. [1724].",London,529,male,1595,1669,FALSE,"Names are written in the Lamb's Book of Life , not only our pi&ures are printed upon the Palms of his Hands with the Blood of the Covenant, but we are as a Signet upon his Hearty Cant. i. so that we cannot be separated from him, any more than"
0564101700_000021,"Directions for weak distempered Christians, to grow up to a confirmed state of grace; with motives opening the lamentable effects of their weaknesses and distempers. Originally written at the request of the learned, Godly, and Peaceable Archbishop Usher, by the Rev. Mr. Richard Baxter. Whereto is subjoined, Directions for a daily walking with God! or Being in his Fear all the day Long. Written by that Eminent Minister of Christ Dr. Doddridge, at the request of A pious young Person in a letter to him.",Richard Baxter,118,1,2,2,1,0,0,8,0,2,0,1,5,1,5,0,2,1,0,0,0,0,0,12,3,0,0,0,5,4,4,4,2,0,1,2,1,8,0,4,11,4,2,3,0,1,0,2,0,0,0,4,2,0,0,1,2,0,2,1,2,1783,1,1,"London : [s.n.], Printed in the Year MDCCLXXXIII. [1783].",London,107,male,1615,1691,FALSE,"christianity doth confifi, upon this your iuftification and salvation lie; this is the fumt cf or conversion, and the very heart of the new crcatlre. Christ isthc end and fulfilling of the law , the ulbtancc of the Gospel, the way to the Father , the life , tilehcll, the"
1015400300_000026,"A book of devotions. In three parts. Revised, corrected, and enlarged by the Rev. John Shaw, Author Of The Methodical English Grammar, And Minister Of ST. Mary's Rochdale, Lancashire.",,82,1,0,1,2,0,1,3,1,1,1,1,1,1,2,0,2,1,0,1,1,2,0,2,3,0,0,1,5,2,4,2,5,0,0,1,0,5,0,2,4,2,0,1,0,1,0,2,0,5,3,3,3,0,0,0,0,0,1,0,2,1794,1,1,"London : printed for W. Richardson, Under The Royal-Exchange, M.DCC.XCIV. [1794].",London,202,unknown,,,FALSE,"was good for me, that I was in trouble."" Unto thy infinite mercies we recommend him, and to the compassionate kindness of our Lord Jesus Christ ., who we hope will hear all the prayers of his friends for him everywhere, and send his good angels to be his guardians,"
0357400802_000037,"Miscellanea sacra, or, the theological miscellany.",,102,0,11,3,0,0,0,3,1,2,0,2,0,2,9,0,2,2,1,0,0,0,3,9,2,0,0,0,2,0,4,2,3,0,0,1,2,4,0,1,3,0,5,0,2,0,5,0,1,1,4,1,1,1,0,2,1,0,1,3,0,1797,2,2,"[Ewood Hall] : Printed and sold at Ewood Hall, near Halifax [by John Fawcett] Sold also by T. Wills, Stationer's Court, Ludgate Street; Johnson, St. Paul's Church Yard; W. Button, Paternoster-Row; Knott, Lombard Street, and Martin, No. 27, Great Russel-Street, Bloomsbury, London, 1797-99.",Midgley_eEwood Hall,436,unknown,,,FALSE,"to come, the terrors of the law have no.more such, a dreadful aspet.. We know that. the sword of justice has awoke against the man who was God's fellow, and that all. its vengeance was executed upon..him4 as our Surety. The threatenings of the Almighty are therefore. now, disarmed,. and"
0812701200_000030,"The triumph of faith. By W. Romaine, M. A. Rector of St. Andrew Wardrobe, and St. Ann, Black Friars; and Lecturer of St. Dunstan's in the West, London.",William Romaine,91,1,3,0,3,0,0,4,1,6,0,0,1,2,5,0,1,0,0,0,2,0,1,10,2,2,0,2,1,0,2,3,4,0,1,2,3,2,1,1,0,0,1,1,1,1,3,0,1,0,7,1,3,0,0,0,2,0,1,2,1,1795,1,1,"London : printed for the author by T. Bensley; and sold by Priestley, No. 1, Paternoster Row ; Chapman and Pridden, Fleet-Street ; and Mathews, Strand, 1795.",London,286,male,1714,1795,FALSE,"Jesus will God bring with him. For this profpea, for believing views of it, for the earn es[, [ 209 ] eft, and for some little foretaste of it, to the eternal Three be eternal praise. Amen. Such are the hopes of a real. chriptian, which he is warranted, which"
