0104000306_000016,The works of J. J. Rousseau. Translated from the French. In ten volumes. ...,Jean-Jacques Rousseau,73,0,0,3,1,0,0,0,0,1,0,1,0,0,0,5,0,2,1,0,1,4,1,4,2,0,6,1,1,1,0,2,2,1,1,3,0,1,1,1,2,1,2,0,1,3,1,0,3,1,2,0,2,0,1,2,2,1,1,1,1773,6,10,"Edinburgh : printed for J. Bell, J. Dickson, and C. Elliot, M.DCC.LXXIII. [-M.DCC.LXXIV. 1773-1774].",Edinburgh,328,male,1712,1778,TRUE,"immense the distance! When will this space be filled up? God is a spirit ! And what is a spirit ? Shall I go and engage a child in this dark maze of metaphysics, from Mhich even grown up persons find it so difficult to extricate thenifelves? It does not"
0039400101_000056,"Posthumous works of the Rev. Thomas Adam, late Rector of Wintringham. In three volumes. ... . Containing his Private Thoughts on Religion, and Sermons on different Subjects. To which is prefixed A Short Sketch of his Life and Character.","Adam, Thomas",97,0,0,0,0,1,0,1,3,0,1,1,1,0,1,1,0,1,0,0,0,17,5,1,1,2,3,1,0,5,0,1,4,0,1,0,1,3,0,6,2,0,2,0,0,1,2,0,1,0,5,4,4,3,3,1,2,1,2,2,1786,1,3,"York : printed by A. Ward, and sold by J. Buckland, Pater-Noster-Row; C. Dilly, in the Poultry; and J. Matthews, in the Strand, London; by all the booksellers in York; and T. Browne, Hull, MDCCLXXXVI. [1786].",York,404,male,1701,1784,FALSE,"restored by the reduction of our wills to the order of God's . Peace with God , and peace with all the world , and with all nature , See Hosea II 18 and the parallel places. How How happy is the soul that has got above the prevalence of"
0114300300_000007,"The divine authority of the Christian religion, and the natural deity of Jesus Christ, the author of it, asserted in eight sermons, preached at the cathedral church of St. Paul London, in the years 1730, and 1731. ... By John Browne, ...","Browne, John",90,0,0,3,1,0,0,1,0,0,1,0,0,0,0,3,0,1,1,2,0,7,1,2,0,1,1,1,1,1,11,0,0,6,4,0,3,0,2,7,3,3,2,1,2,0,1,3,1,3,3,0,0,0,0,1,4,0,0,2,1732,1,1,"London : printed for W. Innys, 1732.",London,310,unknown,,,FALSE,"there is it capable, fippofing it ever so per set n, to discover all the Relations we bear to the other Parts of the intelligent Syfjem; to God the Father , the Son, and the Holy Ghof; to Angels, and Arch angels, the several Orders of the ccle/fial Hierarchy; and"
0271100600_000017,"An essay on the fundamental or most important doctrines of natural & revealed religion. By J. Wood, B.D.","Wood, John, Rector of Cadleigh",116,0,3,2,0,6,0,0,2,1,0,1,0,0,3,8,0,0,5,1,3,13,4,13,0,0,1,0,4,0,0,2,0,0,0,0,0,1,3,3,0,1,2,2,1,7,1,0,0,2,4,0,5,1,0,3,0,3,0,5,1774,1,1,"Exeter : printed for the author, by R. Trewman, and sold by B. Law, London; and E. Score, in Exeter, 1774.",Exeter,133,unknown,,,FALSE,"the gualification of di/enting Minitiers, and on thereafonablnefs of repealing them. On the famous German or Dutch Latin Letter ont Toleration, which was tranjated by Mr, Locke, from whence were taken the late Parliamentary Objegtions against the Rear fonablenefs of a religious Subscription, ERE we muss take Notice of what"
0577800502_000072,"A view of the evidences of Christianity. In three parts. Part I. Of the direct Historical Evidence of Christianity, and wherein it is distinguished from the Evidence alledged for other Miracles. Part II. Of the Auxiliary Evidences of Christianity. Part III. A brief Consideration of some popular Objections. By William Paley, M. A. Archdeacon of Carlisle. In Two Volumes. ...",William Paley,76,4,0,1,2,0,0,3,2,1,0,0,1,2,0,2,0,1,0,2,2,1,0,5,0,0,1,0,3,2,0,0,0,4,1,1,2,1,6,5,1,1,1,2,2,5,1,0,0,0,1,1,0,1,1,0,0,1,1,2,1796,2,2,"London : printed for R. Faulder, New Bond Street, M.DCC.XCVI. [1796].",London,429,male,1743,1805,TRUE,"caused also to be acknowledged the divine original of their institution, and by those who before had altogether rejected it. Accordingly we perceive in there writings, various intimations concurring in the person and history of Jesus, in a manner , and in a degree , in which passages taken from"
1543800300_000005,"A brief exposition of the doctrine of the New Church, which is meant by the New Jerusalem in the Apocalypse. Translated from the Latin of the Hon. Emanuel Swedenborg, a native of Sweden. Originally published at Amsterdam in the year 1769.",Emmanuel Swedenborg,98,3,0,4,2,1,0,3,0,0,2,0,0,0,0,7,0,1,0,5,4,4,1,8,4,0,0,1,0,0,1,0,2,5,0,0,3,2,0,2,1,3,0,3,0,3,0,0,1,2,1,3,0,2,0,0,1,11,0,2,1789,1,1,"London : Printed and sold by R. Hindmarsh, printer to His Royal Highness the Prince of Wales, No. 32, Clerkenwell-Close, sold also by J. Denis, No. 6, Middle-Row, Holborn, 1789.",London,253,male,1688,1772,FALSE,"natural Truth, would be gradually elevated, and admitted into the internal or spiritual Sense of the Word , which is the genuine Heaven. Light of Ilavrn, and Having premised these general Observations , let us now confider that Article of Faith, which of all others is the fundamental and most"
0269100100_000180,"The medical works of Richard Mead, M.D. Physician to his late Majesty King George II. Fellow of the Royal Colleges of Physicians at London and Edinburgh, and of the Royal Society.",Richard Mead,68,1,0,2,1,1,0,1,1,1,1,0,0,1,1,3,0,2,1,0,3,2,0,1,0,2,1,1,2,1,0,2,0,2,2,2,2,3,1,3,2,0,2,0,0,4,1,0,0,1,3,2,1,1,0,1,0,1,1,1,1762,1,1,"London : printed for C. Hitch and L. Hawes, A. Millar, J. Whiston and B. White, J. Buckland, J. Rivington R. Baldwin, W. Johnston, J. Richardson, S. Crowder, B. Law, and J. Robson, M.DCC.LXII. [1762].",London,717,male,1673,1754,FALSE,"i o. his command; than by the expulsion of evil spirits out of the bodies of men? Certainly all the wonderful things done by him for the good of mankind , such as restoring sight to the blind, firmness and flexibility to relaxed or contrated nerves, calling the dead to"
1407800402_000176,"Sermons on important subjects, by the late Reverend and pious Samuel Davies, A.M. sometime president of the College in New-Jersey. In two volumes. The sixth edition. To which are now added, three occasional sermons, not included in the English editions; memoirs and character of the author; and two sermons on occasion of his death, by the Rev. Drs. Gibbons and Finley. Volume I[-II].","Campbell, Robert",114,1,0,1,0,1,0,0,1,6,0,0,2,0,3,6,0,0,1,1,0,4,12,0,0,0,1,0,1,10,1,1,2,1,3,3,2,0,6,10,0,1,0,2,0,0,6,14,1,1,2,0,1,1,2,1,1,0,1,0,1794,2,2,"Philadelphia : Printed for Robert Campbell, bookseller, M.DCC.XCIV. [1794].",Philadelphia,556,male,,,FALSE,"the concurrence of divine providence, common to mankind , to quicken it into act; yet it is a power of reason frill, because it is capable of rational acs, under common providential influence. But should we fiuppofe a beast the objec of that influence, it would frill continue incapable of"
0136300101_000010,"Ninety-six sermons on plain and practical subjects. By the late Reverend Thomas Pyle, ... Published by his son Philip Pyle, A.M.",Thomas Pyle,74,0,0,0,1,0,0,1,1,1,0,4,0,1,2,0,1,1,0,2,1,9,1,3,0,1,0,2,0,5,2,1,2,1,2,0,1,2,1,1,1,0,1,0,2,1,3,0,1,2,0,1,1,1,2,0,2,0,4,2,1785,1,3,"London : printed for G. Robinson: and R. Beatniffe, Norwich, 1785.",London,520,male,1674,1756,FALSE,"by maxims of wisdom, by the joint motives of interest and conscience; his own passions, inclinations and desires, to subdue by reason , to keep them in orderly and just bounds. An arduous work , even this alone! But no man is born for himself only: he has others to"
0403500200_000044,"The rule of life: in select sentences, collected from the greatest authors, antient and modern.",,89,1,1,0,0,0,0,1,0,1,2,0,1,1,0,1,1,0,0,1,3,8,0,1,0,1,1,2,1,3,1,1,0,3,0,0,0,1,1,3,6,1,0,0,1,2,1,5,0,9,11,2,0,1,1,2,1,0,2,3,1755,1,1,"London : printed: and sold by J. Hinton, at the King's-Arms, in Newgate-Street, M.DCC.LV. [1755].",London,309,unknown,,,FALSE,"in the main Requisites of a Chriffian, and turn Infidel in a Society of Believers? Col. Our Our present Sticklers for Atheism confit chiefly of such who never troubled them Selves tb much as to understand the firftl Principles of Religion : Their Study hath been employed another Way, viz."
0125600201_000009,"One hundred and twenty popular sermons, by Philip Pyle, M. A. Rector of Castle Rising, and Lynn St. Edmund, in Norfolk. And Editor of his Father's Sermons. In Four Volumes. ...","Pyle, Philip",83,1,1,1,1,9,1,1,0,1,2,2,0,0,3,0,0,2,0,2,1,5,0,1,0,1,0,0,0,2,1,2,0,0,1,1,2,4,2,6,3,1,0,0,2,0,5,1,2,4,1,3,0,1,1,0,0,0,1,2,1789,1,4,"Norwich : printed for the author, by R. Beatniffe, M,DCC,LXXXIX. [1789].",Norwich,523,male,1722,1799,FALSE,"Cod's railing men, (whether with the body or without it) to a future life of  reward or punifhlcmnt, for their behaviour in this prclient one.' St. Paul had. fonctimcs to deal with people, such as the Jcwifhl fadducces; who, thougl they acknowledged the trutl of Rc velation, yet diflllowcl,"
0287800301_000005,"The benevolence of the Deity, fairly and impartially considered. In three parts. The first explains the sense, in which we are to understand benevolence, as applicable to God. The second asserts, and proves, that this perfection, in the sense explained, is one of His essential attributes. The third endeavors to answer objections. ... By Charles Chauncy, D.D. Senior Pastor of the First Church of Christ in Boston.",Charles Chauncy,82,0,0,1,1,0,1,1,0,2,0,0,0,3,1,1,1,0,0,1,3,6,0,1,4,1,0,1,0,0,0,1,2,1,2,0,2,2,4,6,0,1,2,1,5,0,1,9,4,0,2,1,0,3,1,1,0,1,0,1,1784,1,1,"America: Massachusetts; Boston : Printed by Powars & Willis, MDCCLXXXIV. [1784].",Boston,298,male,1705,1787,FALSE,"they mean ; when attributed to inferior motal agents,. is to ralk in the dark, using words without any ideas : The tendency of which must be to deifroy all real lk.nowledge of the moral character of thesu premn Creator, and consequently all religion ; for if ive have no"
0125500202_000020,Sermons on practical subjects; by the Rev. Philip Holland. In two volumes. ...,"Holland, Philip",80,0,1,4,1,0,0,1,1,0,1,3,0,0,0,1,1,0,1,0,1,3,1,2,0,1,0,1,0,4,6,1,4,2,0,1,0,0,1,3,1,0,0,0,3,4,0,0,2,2,3,2,0,0,2,3,6,0,0,6,1792,2,2,"Warrington : printed by W. Eyres, and sold by J. Johnson, St. Paul's Church-Yard, London, J. Haslingden and I. Clarke, Manchester, S. Crane, Liverpool, and Kay, Bolton, MDCCXCII. [1792].",Warrington,436,male,1721,1789,FALSE,"man may be a sincere christian, who yet wants those graces, which give a peculiar lustre to the christian conversation, so as to make it conspicuous in the eyes of the world , and render it the object of their affection and imitation. Some, from their obscure ltation, want the"
0668000400_000009,"The guardian of health, long-life, and happiness: or, Doctor Graham's general directions as to regimen, &c. for the cure or alleviation of all nervous, scorbutic, scrophulous, bilious, gouty, and rheumatic diseases, for the Preservation of Health, for the happy Prolongation of Life,-For the Improvement and Preservation of Youth and Beauty,---and for the Enjoyment of temporal Peace, and of eternal Felicity; affectionately addressed to every reasonable and candid Person who wishes to be healthy, respectable, and truly happy both here and hereafter. To which are added, the Christian's Universal, being a Paraphrase on our Lord's prayer; and a complete and infallible Guide to everlasting Blessedness in Heaven!",James Graham,75,0,2,0,0,3,0,0,1,0,1,1,1,0,0,1,0,0,2,2,1,5,0,4,2,2,1,1,1,2,2,1,2,0,0,2,0,4,1,6,1,1,0,1,0,0,2,0,2,0,3,0,1,0,0,4,2,4,1,2,1790,1,1,"Newcastle upon Tyne : printed by S. Hodgson; and sold by the author; - by Mr. Richardson, Royal Exchange, London; - Mr J. Guthrie, Nicholson-Street, Edinburgh; and by Mr Cruttwell, Bath, MDCCXC. [1790].",Newcastle upon Tyne,30,male,1745,1794,FALSE,"what we profefs the church we attend nor in the posture and ceremonies we observe , that TRUE religion and devotion conlift: -- No. It consists in living a pure, ijunocent, chaste, temperate, felf denving, and useful life !andin the general frame of our mind towards the Deity, and towards"
1421600700_000003,"Discourses on personal religion. By Samuel Stennett, D.D.",Samuel Stennett,90,0,1,1,2,0,0,0,2,0,4,4,0,2,2,2,1,0,0,4,3,12,3,2,1,0,1,0,1,1,0,1,2,0,0,1,1,4,0,5,0,0,1,1,3,0,2,2,1,0,11,0,1,2,0,0,0,3,0,0,1796,1,1,"London : Printed by Bye and Law; and sold by C. Dilly, Poultry; T. Cadell; Jun. and W, Davies, Strand; W. Button, Pater-Noster-Row; and T. Knott, Lombard-Street, M.DCC.XCVI. [1796].",London,554,male,1727,1795,FALSE,"first introduced and established, but as descriptive of the nature and tendency of the Christian ldoatrine itself. The gospel, if received in truth and love , produces effects which are substantial and important. A new Kingdom is set up in the heart of the real Christian. And that kingdom is"
1546500101_000086,The philosophical principles of natural and revealed religion. Unfolded in a geometrical order. By the Chevalier Ramsay author of The travels of Cyrus.,Andrew Michael Ramsay,103,0,0,0,0,0,1,0,0,1,0,4,0,0,3,6,1,3,1,2,1,10,3,0,0,1,0,2,3,1,4,0,15,0,2,4,0,0,3,8,2,0,5,3,1,0,1,4,1,1,0,1,2,1,0,1,0,0,0,1,1751,1,2,"London : Sold by J. & P. Knapton, in Ludgate-street; T. Longman, C. Hitch, in Pater-noster-row; J. Ward, near the Royal-exchange; A. Millar, J. Nourse, St. Paterson, D. Wilson, in the Strand; J. Millan opposite to the Admiralty-Office, & R. Dodsley in Pall-Mall. Edinburgh: Sold by Mess. Kincaid, Hamilton, Gordon, & Ross. Dublin: Sold by J. Smith, & R. Main, MDCCLI. [1751].",London,560,male,1686,1743,TRUE,"a natural knowledge and love of God , but not the supernatural knowledge and love we are speaking of. If this were otherwise, the soul might beget within itself the eternal Logos, and the Holy Ghost; be its own light , and its own love ; its own perfeaion, and"
1228600500_000022,"The preaching of Christ crucified, recommended to Gospel-Ministers. A sermon on I Cor. ii. 2. Preach'd at the ordination of James Smith A.M. at Stockport in Cheshire, by James Sloss A.M. Minister of the Gospel at Nottinghame. And also, Mr. Smith's Confession of faith: together with the charge or exhortation given to him, by Mr. Peter Walkden Minister of the Gospel at Holcome in Lancashire.","Sloss, James",93,0,0,2,1,1,1,0,8,0,1,1,0,0,0,4,5,0,0,1,2,11,2,3,1,0,1,2,1,0,5,0,0,1,1,4,1,2,3,9,0,0,2,0,1,0,0,0,2,2,4,0,0,0,3,0,0,2,1,2,1742,1,1,"Edinburgh : printed by J. Lumisden and J. Robertson: and sold by G. Crawfurd and J. Traill in the Parliament-Closs, J. Stark in Dundee; and also by R. Whiteworth in Manchester, and other booksellers in town and country, M.DCC.XLII. [1742].",Edinburgh,75,male,1698,1772,FALSE,"difinguilh between what is natural , and what is miraculous. This will great ly help a Divine to think andfpeak morejuftly on any Sub jec that occurs. And particularly, it is useful, if not necessary, that a Divine have some Acquaintance with Human Nature , and its conifituent Parts viz."
0399500400_000027,An essay concerning the human rational soul. In three parts. ... With an introduction in defence of reveled [sic] religion.,"Langton, Zachary",77,1,3,0,1,4,0,0,0,0,1,2,0,0,1,2,0,0,0,4,0,3,0,3,2,1,1,2,0,2,1,2,1,0,3,1,0,1,2,11,1,1,0,1,0,0,2,0,2,2,2,0,2,0,0,3,2,0,3,1,1759,1,1,"Dublin : printed in the year, 1759.",Dublin,287,male,1698,1786,FALSE,"MASTER of Nature , in whose hands are what we call Fate and We see tlis our earth and the heavens going, as they have gone for several thousands of years, ( according to the most ancient and authentic hifory) their several courses after the lamie manner and affording us"
0210600100_000048,"The procedure, extent, and limits of human understanding.",Peter Browne,91,1,0,2,0,2,2,3,0,0,3,4,0,3,4,0,2,0,0,1,1,2,0,3,4,5,1,9,0,1,0,0,0,1,0,2,0,1,3,8,2,5,0,0,2,0,3,0,0,1,3,1,0,1,0,0,1,0,0,4,1728,1,1,"London : printed [by James Bettenham] for William Innys, at the West End of St. Paul's, MDCCXXVIII. [1728].",London,486,male,1665,1735,FALSE,"the Minutest Parts of Matter , it would perhaps answer no other end P but ment. 2 FROM our Ideas of Sensation we infer the certain Existence of those external obje&s which cause or occasion them in us; from the Existence of these again, we infer a first Cause of"
0251500402_000037,"A defence of natural and revealed religion: being an abridgment of the sermons preached at the lecture founded by the Honble Robert Boyle, Esq; by Dr. Bentley Bp. Kidder Bp. Williams Bp. Gastrell Dr. Harris Bp. Bradford Bp. Blackhall Dr. Stanhope Dr. S. Clarke Dr. Hancock Mr. Whiston Dr. Turner Dr. Butler Dr. Woodward Mr. Derham Dr. Ibbot Bp. Leng Dr. J. Clarke Archd. Gurdon Dr. Burnet Dr. Berriman. In four volumes. With a general index. By Gilbert Burnet, Vicar of Coggeshall, Essex.",,106,3,1,0,0,1,0,2,0,0,0,2,0,0,4,2,0,1,0,2,1,15,0,3,2,0,4,1,3,1,0,0,0,2,0,8,2,0,7,4,1,0,0,4,2,0,10,1,0,4,1,0,0,1,0,1,1,0,0,9,1752,2,4,"London : printed for Charles Hitch and Lacy Hawes, at the Red-Lion, in Pater Noster-Row, MDCCLII. [1752].",London,475,unknown,,,FALSE,"may be reconcileable to a firm Belief of God , and his Providence; yet to fancy that he created at first a certain iranttily of zt ter aid imotion, and left them to frame a World at Adventures, is certainly downright Atheifin, and discovered to be FALSE in. For, not"
0504300300_000123,"A discourse concerning the being and attributes of God, the obligations of natural religion, and the truth and certainty of the Christian revelation. In Answer to Mr Hobbs, Spinoza, the Author of the Oracles of Reason, and other Deniers of Natural and Revealed Religion. Being sixteen Sermons, Preach'd in the Cathedral-Church of St Paul, in the Years 1704, and 1705, at the Lecture Founded by the Honourable Robert Boyle, Esq; By Samuel Clarke, D. D. Rector of St. James's Westminster. The sixth edition, corrected. There is inserted in this edition, A discourse concerning the Connexion of the Prophesies in the Old Testament, and the Application of them to Christ. There is also added, An answer to a seventh letter, concerning the Argument à priori.",Samuel Clarke,88,1,0,0,1,0,0,0,0,0,0,1,1,0,0,3,3,2,0,0,1,20,1,1,0,0,0,1,2,2,1,2,1,2,1,1,1,1,1,5,0,0,1,1,1,0,3,3,1,1,4,2,1,0,1,8,1,0,1,3,1725,1,1,"London : printed by W. Botham, for James Knapton, at the Crown in St Paul's Church-Yard, 1725.",London,507,male,1675,1729,TRUE,"bpy n  M re^¢*asyom~ 9 ptiurx(. Orien. adverf. Ce. li' 3 In the next place; Every one of these do&rines, Every One has a natural Tendency, and a direct and powerful of them nfluence, to reform Mens Lives , and correct their, re2ln Manners . This is the Great"
0177800204_000067,"Sermons on several subjects, by Thomas Secker, LL.D. Late Lord Archbishop of Canterbury. Published from the original manuscripts, by Beilby Porteus D.D. and George Stinton D.D. His Grace's Chaplains. ... . to which is prefixed, A Review of his Grace's Life and Character.",Thomas Secker,70,1,0,0,1,3,1,0,1,1,0,0,0,0,2,3,0,1,0,2,2,2,0,0,1,2,0,1,1,1,0,2,0,1,1,0,3,1,3,4,0,2,0,2,1,1,1,1,0,3,2,2,5,1,0,1,0,3,2,2,1771,4,4,"London : printed for J. and F. Rivington, in St. Paul's Church-Yard; and B. White, at Horace's Head, in Fleet-Street, MDCCLXXI. [1771].",London,398,male,1693,1768,FALSE,"different Turn of Thought and Style. Hence proceeds the surprising Warmth and Boldness of Figure, the abrupt Transitions, the sudden lofty Flights of the Eastern Writers and Speakers, utterly contrary to the cool and regular Genius of the European Languages. And amongtl the former, the Compositions of the Jews must"
0303900102_000057,The philosophical principles of natural and revealed religion. Unfolded in a geometrical order by the Chevalier Ramsay Author of the Travels of Cyrus.,Andrew Michael Ramsay,75,1,1,0,0,3,0,0,0,1,0,1,2,0,2,3,0,3,1,0,2,11,1,1,6,0,0,0,0,1,2,0,0,1,1,0,1,0,1,4,1,0,1,1,0,1,1,3,1,1,2,0,1,2,0,2,1,0,0,7,1748,2,2,"Glasgow : printed and sold by Robert Foulis, MDCCXLVIII. [1748]-49.",Glasgow,466,male,1686,1743,TRUE,"can we suppose, that they adored the fun, the planets and the fire, as the ultimate and supreme objeas of their worship? Is it not far more reasonable to conclude, that in the beginning, these celestial bo dys were only looked upon as images or symbols of the Deity, especially,"
0309200802_000024,"Sermons, by the late Reverend George Carr, Senior Clergyman of the English Episcopal Congregation in Edinburgh. In two volumes. ... . The seventh edition; to which is prefixed, some account of the author.","Carr, George",79,1,0,3,1,0,0,0,0,2,1,1,0,1,4,2,0,1,2,2,4,3,3,1,0,0,0,0,1,1,0,1,1,1,2,1,1,2,3,7,0,4,0,0,0,0,1,1,0,1,7,2,1,1,0,1,4,0,0,3,1795,2,2,"Dublin : printed by H. Colbert, No. 136, Capel-Street, opposite Abbey-Street, 1795.",Dublin,183,male,1705,1776,FALSE,"Nature , and render them holy as mt is holy . Public worship, we may also observe , may naturally be expeted to be promotive of peace and goodwill. When we here assemble in the duties of devotioin, W ought all to confider ourselves as allied to each other, as"
1478200100_000547,"Family lectures; Or, Domestic divinity, being a copious collection of sermons, selected from the polite writers and found divines, of the present century; for the use of schools, and for general instruction.",,77,1,1,3,3,1,1,0,3,2,0,0,0,0,0,1,1,0,0,2,1,5,1,1,0,1,0,0,1,1,1,2,1,0,1,4,0,0,8,2,3,0,2,1,0,0,1,2,0,1,2,3,4,0,1,3,0,4,0,1,1791,1,1,"London : Printed for C. Dilly, published as the act directs. Jan. 18, 1791.",London,899,unknown,,,FALSE,"peculiar in the soil of Judea, that the purest and most genuine fruits should flouriflh there? How comes it to pass, that all antiquity has delivered down to us but one book, that is free from all blemish, or defect? And yet this book was compiled by various authors ,"
0388602100_000013,"A companion for the festivals and fasts of the Church of England: with collects and prayers for each solemnity. By Robert Nelson, Esq;",Robert Nelson,85,2,0,4,1,1,0,0,6,1,0,1,1,0,1,0,4,3,1,0,5,4,3,1,0,2,1,2,0,2,1,2,0,2,0,0,3,3,0,4,0,0,0,0,1,0,0,4,2,2,1,0,1,1,0,0,4,1,1,6,1766,1,1,"London : printed for T. Osborne, J. Buckland, J. Fuller, J. Beecroft, J. Hinton, W. Strahan, J. Rivington, R. Baldwin, L. Hawes, W. Clarke,and R. Collins, W. Johnston, W. Owen, T. Caslon, S. Crowder, T. Longman, P. Stevens, B. Law, C. Rivington, C. Corbett, E. Johnson, G. Keith, Z. Stuart, C. and R. Ware, W. Nicoll, J. Johnson and B. Davenport, J. Roberts and G. Robinson, W. Griffin, [and 23 others in London], MDCCLXVI. [1766].",London,599,male,1656,1715,FALSE,"Scripture. Glory be to thee for instilling holy 7jhpiughts into my Soul, for all the Gholtly Strength ail land Support, Comfort and Illumination I receive from thee; for all thy preventing, and restraining, and sanctifying Grace. Glory be to thee, Blessed Spirit ! let me never more by my Sins"
0840900102_000081,"Discourses concerning the being and natural perfections of God, in which that first principle of religion, the existence of the deity, is prov'd, From the Frame of the Material World, from the Animal and Rational Life, and from Human Intelligence and Morality. And the Divine Attributes of Spirituality, Unity, Eternity, Immensity, Omnipotence, Omniscience, and Infinite Wisdom, are explain'd. ... . By John Abernethy, M.A.",John Abernethy,83,0,1,4,3,0,0,1,0,2,2,3,0,3,3,1,1,0,2,1,0,0,0,2,2,0,1,2,1,0,2,1,1,0,1,0,1,4,3,7,0,1,8,3,1,0,4,0,0,1,0,1,0,0,2,0,0,0,3,4,1743,2,2,"[London] : Dublin, printed: London, re-printed for H. Whitridge, at the Royal Exchange, M.DCC.XLIII. [1743].",London,453,male,1680,1740,FALSE,"sheltering a multi. tude of feeble inhabitants, yet safe; the valleys overspread with herbage and corn, for the sustenance of man and beast; the vast ocean circumscribed by limits, which its waves in the greatest fury of them cannot pass over; the celestial orbs preserving their original ditfances from, and"
0773700102_000086,"Discourses concerning the perfections of God; in which his holiness, goodness, and other moral attributes, are explained and proved; ... Volume II. By the late reverend John Abernethy, M.A.",John Abernethy,90,2,0,1,0,0,0,0,0,0,0,1,0,2,1,0,0,0,2,2,1,4,3,4,2,0,1,1,0,0,1,2,9,3,4,1,0,4,11,8,0,3,1,0,1,2,1,4,1,0,2,0,0,1,0,1,2,0,1,0,1742,2,2,"Dublin : printed by A. Reilly, for J. Smith, 1742.",Dublin,461,male,1680,1740,FALSE,"there is a constant intercourse between him and us, we have daily opportunities of observing his conduat, the manifestations of his amiable attributes, and on the other hand, our behaviour is continually in his view; that we have received innumerable benefits, indeed our all from his bounty, and constantly depend"
1175000100_000013,"Principles of taste, or the elements of beauty. Also reflections on the harmony of sensibility and reason. The second edition, much improved. To which is annexed a short analysis of the human mind. By J. Donaldson.","Donaldson, J. (John)",80,1,3,1,0,7,1,3,0,2,1,0,1,2,4,0,1,1,0,0,0,0,0,3,2,1,1,1,0,3,3,1,1,0,1,5,1,3,1,1,0,1,0,1,1,0,6,1,1,1,0,10,0,1,0,1,0,0,0,0,1786,1,1,"Edinburgh : printed at the Apollo Press, by Martin and M'dowall, for the author. Anno, 1786.",Edinburgh,168,male,1737,1801,FALSE,"less diretly, with malevolence and dtftrfi. These objervations particularly refpec an imperfect or perverted knowledge of the human underf/anding; hence the nature of evil is confounded with that of good; hence merit or blame are unjifi ly attributed: and in proportion to the bigoted love of error in the ignorant,"
0508600500_000013,"Sermons, chiefly intended to promote faith, hope, and charity. By Vicesimus Knox, D.D.",Vicesimus Knox,82,1,2,0,0,2,0,1,3,0,0,2,10,0,0,3,0,1,0,3,0,1,5,4,1,0,0,1,0,7,2,1,0,1,0,0,1,2,0,5,0,1,0,2,0,1,1,1,1,2,1,0,4,4,1,0,1,0,0,3,1792,1,1,"London : printed for Charles Dilly, MDCCXCII. [1792].",London,527,male,1752,1821,TRUE,"fluid animates the natural ; It is health, joy, and life ; and the want of it, disease, despair, and death . When our Saviour had accomplished the benevolent purpose for which his Spirit as fumed a human form , and visited our planet, he left us not comfortless in"
