0627000202_000028,"Moral discourses on providence and other important subjects. By Thomas Hunter, M. A. Vicar of Weaverham in Cheshire. ...","Hunter, Thomas",88,0,0,1,1,1,0,0,1,0,2,1,0,0,0,3,1,0,3,0,1,17,0,2,1,1,0,1,0,2,4,1,5,3,1,0,1,0,2,9,0,1,2,2,0,0,1,3,2,1,1,0,2,2,0,2,2,0,0,2,1774,2,2,"Warrington : printed by William Eyres, MDCCLXXIV. [1774].",Warrington,475,male,1712,1777,FALSE,"bleed, perhaps they die in order to be raised, to be distinguished, to be crowned with superior honour and glory, with immortality and eternal life . THE patriot and philosopher of the pagan world seem to have breathed this aethereal spirit , this pant after immortality; and by their conduc"
1441000104_000095,"The elements of commerce, politics and finances, in three treatises on those important subjects. By Thomas Mortimer, Esq. author of a treatise on the funds, entitled, Every man his own broker.",Thomas Mortimer,107,1,0,0,1,0,0,0,0,1,2,2,0,1,6,2,1,1,0,1,0,6,0,5,0,2,0,5,18,1,0,0,0,1,1,1,1,2,3,11,0,1,1,2,0,0,3,3,1,7,0,4,0,0,3,1,0,2,3,0,1774,4,5,"London : Printed for S. Hooper, No. 25, Ludgate-Hill; Messieurs Payne, Mew's-Gate; Wilson and Nichols, Strand; Flexney, Holbourn; Robson, and Parker, Bond-Street; Ridley, St. James's-Street; and Richardson and Urquhart, Cornhill, MDCCLXXIV. [1774].",London,637,male,1730,1810,FALSE,"alone the objeat of appetite and passion. But as soon as their reason is formed , they discover the momentous difference between pleasure and happiness. Experience and refleaion bring them acquainted wvithl the iyfiem in which they are placed, and with the essential, I do not say eternal differences of"
0340501300_000064,"The principles of natural law. In which the true systems of morality and civil government are established; and The different Sentiments of Grotius, Hobbes, Puffendorf, Barbeyrac, Locke, Clark, and Hutchinson, occasionally considered. By J. J. Burlamaqui, Counsellor of State, and late Professor of Natural and Civil Law at Geneva. Translated into English by Mr. Nugent.",Jean-Jacques Burlamaqui,112,0,0,1,1,1,1,1,0,0,0,3,0,1,4,2,0,4,0,1,1,4,0,6,3,3,1,1,9,1,2,0,1,0,0,0,0,1,14,12,0,1,3,2,1,0,0,14,1,5,0,3,0,1,0,1,1,0,0,0,1748,1,1,"London : printed for J. Nourse, opposite Katherine Street in the Strand, M.DCC.XLVIII. [1748].",London,352,unknown,1694,1748,FALSE,"by the laws of nature . The idea of morality , say they, necessarily includes that of obligation; obligation supposes law ; and law a legifator. If therefore we abftraa from all law , and consequently from a legislator, we stall have no such thing as right, obligation, duty, or"
0124600800_000035,"Twenty sermons on the following subjects. I. of God incomprehesible. II. Of the Being and Attributes of God. III. Of our Being in God. IV. Of the Sovereignty of God. V. VI. Of the divine Providence. Vii. Of the Beauty of God's Works. Viii. Of the Reasons of Good and Evil. IX. Of fulfilling the Righteousness of the Law. X. God is Love. XI. Of God's Love in our Redemption. XII. Of the Universality of Christ's Redemption. XIII. XIV. Of Happiness. XV. Of the Government of our Thoughts and Passions. XVI. Of the Government of our Passions. XVII. Of Charity. XVIII. Of doing to others what we would have done to ourselves. XIX. Of Righteousness. xx. of the origin of evil. By Christopher Hussey, D. D. Rector of All-Hallows the Great in Thames-Street, London; and Chaplain to His Grace the Duke of Dorset.","Hussey, Christopher",111,5,0,1,1,0,3,0,0,1,2,5,0,0,0,1,1,2,0,2,5,12,0,0,1,1,0,1,4,0,1,1,2,2,1,0,0,1,3,18,1,0,3,1,0,3,1,1,0,9,4,0,0,1,0,2,1,0,0,7,1755,1,1,"London : printed for J. Ward at the King's-Arms in Cornhill, MDCCLV. [1755].",London,425,male,1683,1761,FALSE,"fential Properties and Qualities, without which it is impossible to be; so when Things are compared together, there necessarily arise certain Relations and Proportions between them, whereby some are perceived to be equal to, some greater, some less than others: Which Relations are as constant and immutable, as the Nature"
1198900104_000090,"The works of Jonathn. Swift, D.D.: D.S.P.D. with notes historical and critical. By J. Hawkesworth, L.L.D. and others. Vol. I.",Jonathan Swift,83,0,1,0,2,6,0,0,0,0,3,1,0,3,5,2,1,1,0,2,0,0,0,6,1,0,1,1,1,1,1,0,0,1,2,2,0,5,1,8,1,1,2,2,0,1,3,1,2,1,0,0,5,0,1,0,3,0,1,1,1774,4,15,"[Dublin] : Printed for J. Williams, Dublin, 1774.",Dublin,425,male,1667,1745,TRUE,"if I' could have learned the lesson ol knowing when I was well. I left my. poor wife big with child, and ac -- K cepted * In this lafl part of his imaginary travels, Swift has indulged amifanthropy that is intolerable.. The representation which he has; given us of"
0135900100_000049,"Discourses on important subjects. By the late Reverend Edward Stone, A. M. Formerly Fellow of Wadham-College, Oxford. Revised for the press by the author, and published by his son, the Reverend Edward Stone, A.M. chaplain to The Rt. Hon. Lord Viscount Hampden, and Rector of Hartwell, and Horsendon, Bucks.","Stone, Edward",112,0,0,3,2,0,2,0,0,3,3,0,0,0,0,4,0,0,0,1,3,2,0,4,2,3,0,4,2,0,3,0,1,5,2,1,0,1,4,12,0,0,1,0,0,1,9,2,3,12,8,4,0,0,0,0,1,0,2,2,1784,1,1,"Oxford : printed for J. and J. Fletcher, in the Turle; and sold by Messrs. Rivington, in St. Paul's Church Yard, London, M,DCC,LXXXIV. [1784].",Oxford,431,male,1743,1811,FALSE,"Ideas , it still proceeds to abltracd others, and infer the Duties of Reverence, Love , Gratitude, Thanksgiving, Resignation, oaedience, and every other Part of pious Devotion. Thus, are we indebted for the whole Sum and Subitance of natural Religion to the Powers of Reason ; and it is called"
0255900100_000056,"The holy Scriptural doctrine of the Divine Trinity in essential unity, and the supreme Godhead of Jesus Christ being one and the same with His Father's: Shewn to be not only demonstrative, but most clearly conceivable spiritual, and Scriptural Truths. wherewith is occasionally shewn, that although the Newtonian philosophy be formally and mathematically true; yet it i materially and physically false. To which is prefixed A Prefatory Discourse, wherein the Physical, Metaphysical, and Theological Errors of a late Treatise, entitled, an Essay on Spirit, are clearly shewn and confuted. By John Scott, D. D. Author of the late Notes and Observations on the Three First Chapters of Genesis.","Scott, John           1753",113,0,1,1,0,0,0,2,0,0,0,0,0,1,7,7,0,0,0,9,0,8,10,1,5,1,4,2,0,0,1,0,0,4,2,0,0,0,1,6,0,4,3,2,0,2,1,1,1,1,2,0,1,5,0,10,0,1,2,4,1754,1,1,"London : printed for the author, and to be had at his house, in Orchard-Street, Westminster; and at Mr. Woodfall's, Printer, at Charing-Cross; and at Mr. Hawkins's, Bookseller, at Milton's Head, between the two Temple Gates, Fleet-Street, [1754].",London,489,unknown,,,FALSE,"the material Heavens, subsisting in each of these three different Forms and States , by which we will obtain a right and TRUE , although not an adequate Idea . of them; and know so much concerning them, as is necessary for us to know , in order to our"
0451700800_000008,"The doctrine of a future state, and that of the soul's immortality, asserted and distinctly proved; in a second letter to a free-thinker. Occasion'd by the late D. of Buckinghamshire's epitaph. By Richard Fiddes, D. D. Rector of Halsham.",Richard Fiddes,86,2,1,0,1,0,1,1,0,0,1,1,0,0,0,0,3,0,0,0,3,3,0,2,0,1,1,0,3,5,0,1,2,3,0,1,1,1,5,5,0,1,2,1,2,2,1,2,5,5,0,1,1,4,0,1,6,1,1,2,1721,1,1,"London : printed for J. Pemberton at the Golden Buck over-against St. Dunstan's Church in Fleetstreet, 1721.",London,123,male,1671,1725,FALSE,"supposed there are such Rules, for what is not, cannot, in any proper Sense , either be dispensed with or relaxed. And, if'god governs Mankind , and there are, upon your own Concession, certain Rules, whereby Mankind ought. to be go yern'd; then I infer upon : a Supposition, the"
1052700302_000004,Sermons on the following subjects. viz. Of moral and natural evil. ... The peculiar guilt and infamy of prevailing wickedness ... By James Foster. Volume II.,James Foster,68,3,1,0,1,2,1,2,0,0,0,1,2,4,2,1,1,2,0,1,3,4,0,2,1,1,1,1,1,0,0,0,0,3,0,0,0,3,3,3,0,0,2,1,0,0,1,1,1,2,1,0,0,2,2,1,1,0,1,2,1737,2,2,"London : printed for John Noon; and John Gray, 1737.",London,401,male,1697,1753,FALSE,"ily conceived to be vailly preferable to not being; nay, it may, in in many circumstances, be a very dejireable S E R A. and eligible state : For inifance, where I the temptations to vice are so few and in 1 S considerable, that they are not likely to"
1138100100_000007,"An analysis of the philosophical works of Lord Bolingbroke, by the late unfortunate Earl Ferrers, for his private entertainment; to which is prefixed, a parallel of Earl Ferrers's case, with that of Lord Santry, a Peer of Ireland, both convicted of Murder: and a sentimental letter to a friend.","Ferrers, Lawrence Shirley, Earl",98,0,1,1,2,1,2,0,0,0,1,0,0,0,2,1,2,1,1,0,0,3,1,3,0,1,1,5,9,2,0,0,0,3,1,0,2,0,1,15,3,0,1,2,1,0,1,3,0,11,6,0,1,0,1,3,1,1,0,1,1760,1,1,"London : printed for J. Burd, opposite St. Dunstan's Church, Fleet-Street, MDCCLX. [1760].",London,110,male,1720,1760,FALSE,"been able to preserve the purity of the do&trines they taught, nor an uniformity in the pracice they prescribed. crl jiaziify [ 25 ] Chriltianity has been, from the institution of it, in a perpetual flux; not relatively to certain opinions alone, that may be deemed indifferent, or what not"
0025700100_000210,"Observations on man, his frame, his duty, and his expectations. In two parts. Part. I. Containing Observations on the Frame of the Human Body and Mind, and on their Mutual Connexions and Influences. Part. II. Containing Observations on the Duty and Expectations of Mankind. By David Hartley, M.A. Reprinted from the author's edition in 1749. To which are now added, notes and additions to the Second part; translated from the German of the Rev. Herman Andrew Pistorius, Rector of Poseritz in the Island of Rugen. Also a Sketch of the life and Character, and a Head of the author.",David Hartley,94,1,0,1,0,0,3,2,0,3,1,0,0,1,2,3,0,1,0,0,7,3,0,1,0,1,2,2,3,0,1,0,0,3,0,2,1,2,3,12,0,5,4,0,3,2,0,0,2,1,4,1,1,1,1,4,0,1,1,2,1791,1,1,"London : printed for J. Johnson, No. 72, St. Paul's Church-Yard, MDCCXCI. [1791].",London,806,male,1705,1757,TRUE,"reason to disallow the evidence of their particular effects attested by eyewitnesses, as there is now to disallow the particular miracles recorded in the scriptures; and yet we see that such a disallowance would have been a hasty conclusion, would have been quite contrary to the TRUE nature of things."
0297200102_000171,"The works of the late reverend and learned Isaac Watts, D.D. published by himself, and now collected into six volumes. In which are also inserted the second part of the Improvement of the mind, An essay on education, and some additions to his Miscellaneous thoughts in prose and verse. Now first published from his manuscripts, and, the Direction of his Will, revised and corrected by D. Jennings, D.D. and the late P. Doddridge, D.D. ...",Isaac Watts,87,2,0,2,2,0,0,0,1,0,0,1,0,0,2,1,0,0,1,0,0,5,1,1,2,1,1,0,0,3,2,1,0,2,1,3,1,2,5,4,0,1,0,0,1,0,3,0,1,8,9,1,1,0,2,2,5,0,4,2,1753,2,6,"London : printed for T. and T. Longman at the Ship, and J. Buckland at the Buck, in Pater-Noster-Row; J. Oswald at the Rose and Crown in the Poultry; J. Waugh at the Turk's-Head in Lombard-Street; and J. Ward at the King's-Arms in Cornhill, MDCCLIII. [1753].",London,775,male,1674,1748,TRUE,"of a wife, a holy , and a righteous God ? I mean , is the reason that is in them sufficient to do it in a practical and experimental sense , according to the diftintion with which sophronit's has endeavoured to reconcile our present controversy? log. I acknowledge we"
0196900201_000044,A series of discourses on the principles and evidences of natural religion and the Christian revelation. And on some proper practical subjects. By Samuel Bourn. ...,Samuel Bourn,86,1,2,0,1,9,0,0,0,1,0,3,3,1,1,2,0,0,2,1,1,3,2,2,1,2,1,1,0,4,0,0,0,8,2,0,0,0,0,2,0,1,2,0,2,0,2,0,2,0,1,2,2,8,0,1,1,0,0,6,1760,1,2,"London : printed for R. Griffiths, in the Strand, MDCCLX. [1760].",London,475,male,1714,1796,FALSE,"are able to form of the immense system of the univerfe.t -- This sentiment, abstracted from the fi&jitious and corrupt additions made to it by tie Yews and Heathens, is ponfirmed by our holy religion : and those benevolent spirits are described as rejoicing at the repentance of ever yfinner;"
0854700600_000051,"The analogy of religion, natural and revealed, to the constitution and course of nature. To which are added two brief dissertations: I. Of Personal Identity. II. Of the Nature of Virtue. By Joseph Butler, LL. D. now Lord Bishop of Durham.",Joseph Butler,98,1,0,3,1,0,0,0,2,2,0,2,0,3,0,0,1,0,0,2,3,3,0,1,0,1,0,0,5,2,2,1,0,4,1,1,2,0,5,10,1,0,2,0,3,3,2,1,0,2,10,2,0,2,0,0,1,1,2,8,1750,1,1,"London : printed for John and Paul Knapton, at the Crown in Ludgate Street, MDCCL. [1750].",London,495,male,1692,1752,FALSE,"It inflruas Mankind in the moral System of the World : that it is the Work of an infinitely perfect Being, and under his Government; that Virtue is his Law ; and that He will finally judge Mankind in Righteousness, and render to all according to their Works , in"
0267100200_000004,"Discourses delivered in the publick assemblies of the people called Quakers, by Thomas Story. Taken in short-hand; and, after being transcribed at length, examined by the said T. Story, and published by his permission.",Thomas Story,106,1,0,3,0,1,0,0,1,0,1,2,0,0,0,2,1,0,1,3,1,12,4,0,8,0,1,4,0,1,4,2,3,3,3,1,1,10,0,1,0,0,0,0,2,1,2,0,6,0,0,1,3,3,1,1,0,6,3,2,1738,1,1,"London : sold by T. Cooper, at the Globe in Pater-Noster Row, MDCCXXXVIII. [1738].",London,120,male,1662,1742,FALSE,"ought. We are at a Distance still; there is a vast Chafin, and as a fixed Gulf between the Creator and us, all these things notwithstanding. THE Scripture declares, as from the Mouth of Christ , that God is a Spirit , and we believe it; but who can conceive"
0585400900_000064,"Jesus Christ the mediator between God and man, AN Advocate for us with the Father, and a Propitiation for the Sins of the World. The second edition. To which is now added, by another gentleman, An essay to prove the credibility of the Gospel, from the Doctrine of the Efficacy of Christ's Death for the Redemption of the World.",J. T.,98,1,0,2,3,0,0,1,13,0,1,0,10,0,0,7,1,1,1,1,0,13,2,0,1,0,0,1,0,2,2,1,4,1,2,0,0,0,2,1,0,0,2,1,1,0,4,1,1,3,3,1,0,0,1,1,3,0,0,2,1761,1,1,"London : printed for T. Piety, at the Rose and Crown, Pater-Noster-Row, M.DCC.LXI. [1761].",London,190,unknown,,,FALSE,"and periflhing World And our Redemption through his Blood seems to be a noble, grand and considerable Part of the same Plan of the divine Government: and consequently that Revelation, that opens our Prospects and enlarges our Views with the farther and more illustrious Execution of the same Method of"
0278401300_000015,"A short history of the state of man, with regard to religion and morals; from the beginning of the world to the Reformation. Drawn from scripture, and adapted, in easy, familiar diction, to the capacities of the younger sort; with useful observations: To which are subjoined several Examples of Wickedness punish'd, and Virtue rewarded, as set forth in Holy Writ. The Design of the Whole, being to give Youth such a previous View of Sacred History, and the Principles of the Christian Religion, as may qualify them for hearing Sermons, and reading pious Books to full Advantage; and, at the same Time, to impress on their tender Minds an affecting Sense of God, and the great Mercy of Redemption by Christ. By the Rev. Mr. Wetenhall Wilkes, Minister of Hounslow in Middlesex.","Wilkes, Wetenhall",94,1,2,0,1,7,0,2,0,1,2,1,1,2,0,4,0,1,0,4,0,12,2,2,1,0,2,5,0,1,1,0,1,0,0,5,1,0,0,6,2,2,0,1,0,2,2,4,1,2,1,0,4,0,4,0,0,0,1,0,1746,1,1,"London : printed for the author, by T. Gardner, at Cowley's Head, in the Strand, M,DCC,XLVI. [1746].",London,390,male,,,FALSE,"Wisdom, Power and Goodnets of its Author ; which flould infpicr him with Gratitude, Aldmiration, Love , Duty, Dependance, Adoration, and a Desire of a more intimate Union with him. The Scripture expressly tells us, that God created Man in his own (b) Image, and after his own Like nei,;"
0431100200_000443,"A journal of the life of Thomas Story: containing, an account of his remarkable convincement of, and embracing the principles of truth, as held by the people called Quakers; And also, of his Travels and Labours in the Service of the Gospel: With many other Occurrences and Observations.",Thomas Story,96,1,0,1,0,0,0,0,2,0,0,0,0,4,0,2,3,0,6,0,0,5,3,1,4,2,4,11,0,6,1,0,2,3,2,0,1,1,0,5,0,0,1,0,0,1,2,1,4,3,0,2,2,3,0,1,1,2,2,1,1747,1,1,"Newcastle upon Tyne : printed by Isaac Thompson and Company, at the New Printing-Office on the Side, MDCCXLVII. [1747].",Newcastle upon Tyne,783,male,1662,1742,FALSE,"what Means Mankind may arrive at it; in which I was drawn out to this Purpose, "" That many wise and ingenious "" Men apply themselves, with Success, to the Knowledge of Things in this "" Life , and relating thereto, and yet keep not within the ftri& Rules of"
0834900901_000019,The system. A poem. In five books. By the Rev. Joseph Wise. Vol. I.,"Wise, Joseph",98,1,0,3,2,0,0,0,0,0,0,5,1,1,2,8,4,1,0,1,0,12,2,3,1,0,1,2,0,1,0,1,10,1,1,2,1,0,4,5,2,2,5,1,0,0,0,2,3,0,2,0,0,0,1,0,3,0,0,1,1781,1,1,"London : printed for the author: and sold by R. Faulder, New Street; T. Evans, Pater-Noster-Row; and J. Johnson, St. Paul's Church-Yard, MDCCLXXXI. [1781].",London,345,male,1766,1779,FALSE,"be satisfied from the / _, -;, .t i: i e, F 4, account, by feeing things applied to that purpose (probation for the _ M An; t. '<?- glory of God ) for which their natures appear eminently to bed *-' ittedt Such an account ofp and aure is"
0679501602_000073,"Sermons preached upon several occasions. By W. Sherlock, D. D. Late Dean of St. Paul's, Master of the Temple, and Chaplain in Ordinary to His Majesty. In two volumes. ...",William Sherlock,143,0,0,0,2,0,0,0,0,0,0,2,0,3,3,5,1,0,0,0,1,6,0,2,0,1,0,1,17,10,1,3,6,1,1,0,0,0,3,23,1,1,0,3,3,0,0,1,1,12,1,1,1,6,2,3,7,0,0,8,1755,2,2,"London : printed for R. Ware, J. Walthoe, J. and P. Knapton, S. Birt, D. Brown, T. and T. Longman, C. Hitch and L. Hawes, J. Clarke, J. Hodges, J. and J. Rivington, R. Baldwin, J. Ward, and W. Johnston, MDCCLV. [1755].",London,394,male,1641,1707,FALSE,"Principles of Life and Manners , are received into the Christian Religion , but not made the adequate Rule of the Christian Life . The Names of these moral Virtues are generally the same, both in Philosophy and Chriftia nitv, which makes most Men think that their their Nature and"
0134800200_000050,"The analogy of religion, natural and revealed, to the constitution and course of nature. To which are added two brief dissertations: I. Of Personal Identity. II. Of the Nature of Virtue. By Joseph Butler, L. L. D. Rector of Stanhope, in the Bishoprick of Durham.",Joseph Butler,103,1,0,3,1,0,0,0,1,2,0,2,0,1,0,0,1,0,0,1,3,3,0,2,0,1,0,0,5,2,2,1,0,4,2,1,2,0,5,15,1,0,2,0,3,3,2,1,0,2,11,3,0,2,0,0,2,1,2,7,1736,1,1,"London : printed for James, John and Paul Knapton, at the Crown in Ludgate Street, MDCCXXXVI. [1736].",London,337,male,1692,1752,FALSE,"vita mea aliquid quod reprehendatur, ct qui rcprehcnderit faciat Chrilianum. gp. in Pal. XXXI But P A R T But the Importance of Christianity will more diffinaly appear , II by considering it more diftinaly: firfj, as a Republication, LB ^ .and external Institution, of natural or essential Religion ,"
0271300600_000005,"A packet for youth, or evidences of Christianity drawn from the mind. By a lady.","M. P., Lady",84,1,2,0,0,2,0,0,0,2,1,2,0,1,0,4,1,3,0,0,1,2,1,4,3,1,0,1,0,1,2,2,2,0,0,0,1,1,6,9,3,1,4,4,0,0,4,1,0,6,0,1,1,0,0,0,2,0,0,1,1799,1,1,"Hanley : printed and sold by Mort; also by Knott, Lombard Street, Chapman, Fleet Street, Heptinstall, Holborn, London, ---- Chester, Newcastle, ---- Jones, Birmingham, ---- Pritchard, Derby, ---- Smith, Sheffield, Boden, Manchester ; and may be had of all Booksellers, [1799].",Hanley,122,female,,,FALSE,"is nothing accidental: With respect to his providence there is nothing contingent. In his hands, are the issues of the human will; and the course of the moral world , receives from him final direction. The meanest individual, is the objeet of his peculiar concern; and not a sparrow falls"
0266000602_000022,"Discourses concerning the being and natural perfections of God, in which that first principle of religion, the existence of the deity, is prov'd, From the Frame of the Material World, from the Animal and Rational Life, and from Human Intelligence and Morality. And The Divine Attributes of Spirituality, Unity, Eternity, Immensity, Omnipotence, Omniscience, and Infinite Wisdom, are explain'd. ... . By John Abernethy, M.A.",John Abernethy,93,2,2,3,1,0,0,3,0,0,1,2,0,1,0,4,0,10,1,0,1,10,0,1,0,4,0,1,0,1,1,1,0,4,0,0,2,0,4,5,0,2,0,1,0,1,4,4,2,0,3,0,0,1,0,2,1,0,4,3,1746,2,2,"[London] : Dublin, printed: London, re-printed for H. Whitridge, at the Royal Exchange, M.DCC.XLVI. [1746].",London,421,male,1680,1740,FALSE,"· i Pet. III 20, tue there, zwhoje righteousfoul was long vexedserm. with their unlawful deeds; while God conii tinued such a warning to them, unwilling ""r that they should perish; and at last represented himself as ready to spare the city, if there were found in it but ten"
0801700500_000019,"A course of lectures on oratory and criticism. By Joseph Priestley, LL. D. F. R. S.",Joseph Priestley,80,0,0,0,1,0,4,0,0,1,4,1,1,1,4,0,0,0,0,3,2,1,0,4,1,1,0,1,1,2,1,0,0,3,3,0,1,4,3,4,1,2,1,1,4,1,0,4,0,1,1,1,0,1,0,0,5,2,3,0,1777,1,1,"London : printed for J. Johnson, No. 72, St. Paul's Church-Yard, MDCCLXXVII. [1777].",London,328,male,1733,1804,TRUE,"gratification of those affections which have the happiness of our fellow- creatures for their objec, or are con neaed with it; which affetions are termed virtuous.. Virtue , thus explained, he branches out into its several kinds , and particularly (hews the extent of it, .as refpecing God , mankind"
0960400100_000007,"The infallibility of humane judgment; its dignity and excellency. Being A New Art of Reasoning, and discovering Truth, by reducing all disputable Cases in Philosophy, Morals, Politicks, or Religion to general, irresistible, and self-evident Truths. The Second Edition, With some material Corrections and Additions. The Method also further illustrated and apply'd, in an appendix, deciding some well-known Disputable Cases, by reducing them to Self-Evident Propositions, particularly that of the A-n C-d.","Lyons, J.",79,2,1,1,6,0,5,1,0,2,0,0,0,0,2,1,1,0,0,0,2,1,0,2,1,1,1,3,1,0,4,1,0,3,1,1,0,4,1,3,2,0,0,1,0,4,1,0,0,4,1,5,2,1,0,3,0,1,1,1,1721,1,1,"London : printed for J. Wilcox, at the Green Dragon in Little-Britain, 1721.",London,96,unknown,,,FALSE,"and reasonable , and the Good of the People governed doth require an Alteration of those Laws or Customs, for the preventing so great a mitchief.. When a Cafe is thus clearly viewed and exa mind , udgmeint makes a Decision involuntarily, and the Argument is at an end ,"
0270100300_000019,"Observations on our Lord's conduct as a divine instructor: and on the excellence of his moral character. By William Newcome, D. D. Bishop of Waterford.",William Newcome,81,0,1,1,1,1,0,0,6,0,0,1,0,0,1,2,0,2,4,0,1,11,1,2,0,2,0,0,2,3,1,0,2,2,1,1,4,1,4,5,0,3,0,1,1,0,1,1,0,2,1,1,2,0,1,0,1,2,0,1,1782,1,1,"London : printed for G. Robinson, Pater-Noster-Row, MDCCLXXXII. [1782].",London,493,male,1729,1800,FALSE,"SOUTHEAST T .' : -. - H SECT. I t s0 1 S E C T. XI Ds the obligation, motives, and means to the praciice of their duty, which our Lord affrds his followers. L L that our Lord advances is resolved by him into the will and authority"
1404100101_000006,"A new history of the Holy Bible, from the beginning of the world, to the establishment of Christianity. With answers to most of the controverted questions, dissertations upon the most remarkable passages, and a connection of profane history all along. To which are added, notes, explaining difficult texts, rectifying mis-translations, and reconciling seeming contradictions the whole illustrated with proper maps, &c. By the Rev. Thomas Stackhouse, A.M. late vicar of Beenham in Berkshire.",Thomas Stackhouse,100,2,1,0,2,0,2,1,0,2,1,0,0,0,2,1,0,2,0,2,1,0,2,7,0,0,1,4,2,3,6,1,0,0,0,1,1,2,4,11,2,0,0,1,1,0,1,6,0,14,3,3,0,0,0,1,3,1,0,0,1796,1,6,"Glasgow : Printed by Joseph Galbraith, 1796.",Glasgow,489,male,1680,1752,FALSE,"this cafe , seems L highly needless and superfluous?"" ?"" readily grant, indeed, that the great principle of ac. Anrwered tion in human nature is reafbn; insomuch that to judge bhy thein according to its dire~tions, is not the privilege of the philo if innper fopher only, but a thing"
0359100402_000034,"Discourses concerning the being and natural perfections of God, in which that first principle of religion, the existence of the deity, is proved, From the Frame of the Material World, from the Animal and Rational Life, and from Human Intelligence and Morality. And The Divine Attributes of Spirituality, Unity, Eternity, Immensity, Omnipotence, Omniscience, and Infinite Wisdom, are explain'd. By John Abernethy, M. A. ...",John Abernethy,79,1,0,0,0,0,1,0,0,1,2,1,0,2,2,1,3,0,2,3,2,4,1,3,3,4,1,0,0,1,1,0,4,2,1,0,1,2,2,4,1,2,1,0,5,0,3,4,1,1,0,3,0,2,0,0,0,0,0,1,1757,2,2,"London : printed for H. Whitridge, D. Browne, J. Whiston and B. White, J. Ward, W. Johnston, P. Davey and B. Law, and M. and T. Longman, M.DCC.LVII. [1757].",London,423,male,1680,1740,FALSE,"holiness consists, is perfectly agreeable to reason , we may make the same observation concerning the attribute ofgoodnefs in particular . For the scripture constantly represents God as good, in the same determinate sense in which other free agents are called good, though' in a more perfeat degree ; that"
