PassageID,Title,Author,Total termFreq,termFreq(accord),termFreq(anim),termFreq(appear),termFreq(author),termFreq(bodi),termFreq(cafe),termFreq(caus),termFreq(christ),termFreq(common),termFreq(confid),termFreq(creatur),termFreq(death),termFreq(degre),termFreq(differ),termFreq(divin),termFreq(end),termFreq(evil),termFreq(father),termFreq(form),termFreq(gener),termFreq(god),termFreq(holi),termFreq(human),termFreq(idea),termFreq(kind),termFreq(know),termFreq(knowledg),termFreq(law),termFreq(life),termFreq(light),termFreq(live),termFreq(love),termFreq(mankind),termFreq(manner),termFreq(matter),termFreq(mean),termFreq(mind),termFreq(moral),termFreq(natur),termFreq(noth),termFreq(observ),termFreq(order),termFreq(origin),termFreq(particular),termFreq(person),termFreq(power),termFreq(principl),termFreq(proper),termFreq(reason),termFreq(religion),termFreq(sens),termFreq(spirit),termFreq(state),termFreq(think),termFreq(true),termFreq(virtu),termFreq(word),termFreq(work),termFreq(world),Publication Year,Volume Number,Total Volumes,Imprint,Publication Place,Total Pages,Gender,Birth Year,Death Year,Popular Authors,short_excerpts
0507702200_000001,"Common sense; or, the plain man's answer to the question, whether Christianity be a religion worthy of our choice in this age of reason? In two letters to a deistical friend. By Philalethes.",Philalethes,119,1,0,0,1,1,1,0,1,3,1,0,0,0,1,2,2,1,1,0,3,8,0,3,4,0,1,0,3,1,0,2,2,5,2,1,4,4,7,7,2,0,1,0,2,0,8,2,0,4,10,3,1,2,2,2,3,0,0,4,1796,1,1,"London : printed for the author; and sold by T. Knott, No. 47, Lombard Street; and J. Marsom, No. 187, High Holborn, London, [1796?].",London,30,male,,,FALSE,"- I. -, 1 /. i  COMMON - SENSE ; OR, SHE PLAIN man's ANSWER TO THE QUESTION, WHETHER CHRISTIANITY Be a Religion worthy of our Choice in this AGE of REASON ? TWO LETTERS TO A DEISTICAL FRIEND. BY PHILALETHES. PRINTED FOR THE AUTHOR ; AND SOLD BY"
0045900700_000061,"The providential history of mankind opened, by the key ""of the knowledge of good and evil."" Applied to the Holy Scriptures, by the Rev. James Stronge, A. M. Of the Diocese of Armagh.","Stronge, James",101,1,1,0,0,6,0,1,1,0,2,1,1,0,2,2,2,4,0,2,1,2,0,2,1,0,0,1,7,6,0,4,0,2,1,0,0,0,3,5,0,1,3,1,1,0,0,11,1,2,3,4,0,1,0,4,2,1,1,4,1764,1,1,"London : printed for J. Dodsley, in Pall-Mall, MDCCLXIV. [1764].",London,532,unknown,,,FALSE,"Ihewing or dilcoserig vihat :. is; tor as the principle is the work of in: rn ation ai framnl, every man's imagirrt on mulb, i: to v. rk, and iat is doue by a confident asllrtion of .lithinc, the idea of which is left to us at large io frime"
0849500300_000028,"The immortality of the soul: a poem: from the Latin of Isaac Hawkins Browne: translated by John Lettice, ... To which is added the original poem; with a commentary and annotations, by the translator.",Isaac Hawkins Browne,87,0,2,0,3,2,1,1,0,1,0,3,0,0,3,2,1,1,1,0,1,0,0,2,2,1,0,2,6,2,0,2,2,1,0,2,1,1,4,5,1,4,6,2,0,0,1,2,0,3,1,2,2,1,1,0,1,1,0,4,1795,1,1,"Cambridge : printed by John Ardhdeacon [sic] and John Burges; and sold by F. & C. Rivington; Cadell & Davies; and Clarke, London; J. Deighton, and W.H. Lunn, Cambridge, 1795.",Cambridge,331,male,1705,1760,FALSE,"Decrees, demands the Poet, is this, which thou hast devised for the Almighty Governor of the world ? Recoilet, that, within our own contracted Sphere of Observation , we manifestly discern a variety of Laws and a difference of Orders in the different parts of this lower Creation. Man is"
0046700700_000003,"A view of revealed religion; a sermon, preached at the ordination of the Rev. William Field of Warwick, July 12, 1790. By Joseph Priestley, LL.D. F.R.S. With a charge, delivered at the same time, by the Rev. Thomas Belsham.",Joseph Priestley,103,2,0,1,3,0,0,1,3,0,0,1,0,1,1,3,0,1,1,0,1,13,0,1,0,0,0,3,1,4,1,0,1,6,2,0,1,2,3,8,2,1,3,1,0,5,1,1,1,1,4,1,0,3,0,3,2,0,2,7,1790,1,1,"Birmingham : printed by J. Thompson; and sold by J. Johnson, St. Paul's Church-Yard, London, MDCCXC. [1790].",Birmingham,73,male,1733,1804,TRUE,"find ourselves destitute of power to carry us through revere trials and sufferings in the cause of truth and a good conscience. But an habitual respect to the being, the presence, and the providence of God , extending through this life and the next, is abundantly sufficient for all these"
0907100300_000008,"The doctrines of a trinity and the incarnation of God examined upon the principles of reason and common sense. With a prefatory address to the King, ... By a member of the Church of England from birth and education, ...",Edward Evanson,77,0,0,1,2,2,0,1,3,2,1,1,0,2,2,3,0,1,2,0,0,6,1,1,1,0,0,1,2,1,1,2,2,1,0,0,1,2,4,3,0,0,0,1,1,1,3,1,1,3,2,2,1,1,0,3,1,1,0,3,1772,1,1,"[London] : Printed for the author; and sold by S. Bladon, in Pater-Noster Row, 1772.",London,186,male,1731,1805,FALSE,"world , they D have [ 50o 3 have no more claim to Divinity than yourselves; and as members of a kingdom which is of this world , they have not near so much; and with respect to either, they can have no other means of information, light , and"
0196100400_000004,"The christian a new creature: being the substance of a discourse of Mons. Superville, deliver'd on a New-Year's-Day. With a preface to the reader concerning regeneration. This Subject is very important, and always seasonable, and ought to be thoroughly meditated by People of all Persuasions and Parties; that thereby they may judge what Advance they have made in true Christianity, or what they chiefly ought to labour after, under all external Performances in Religion.",Daniel de Superville,113,1,2,0,1,2,0,1,6,2,0,5,0,0,0,5,1,1,1,1,0,13,10,0,0,0,2,1,1,5,0,2,4,1,1,0,2,1,1,11,2,0,2,1,0,2,2,2,0,0,0,1,3,1,2,3,0,3,1,4,1739,1,1,"London : printed for C. Rivington in St. Paul's Church-Yard, MDCCXXXIX. [1739].",London,31,male,1657,1728,FALSE,"it signifies our being united to him by a real, internal and vital Union, as Members are in the Body , which live by the same Soul; as flou rifling Branches in the Vine, which are animated and nourished by the same Sap, and vegetative Nature . For to all"
0031701100_000008,"Logical tracts, comprising observations and essays illustrative of Mr. Locke's treatise upon the human understanding: With Occasional Remarks on the Writings of the Two Scottish Professors, Reid and Stewart, Upon the Same Subject: and a Preface in Vindication of Mr. Locke, Against the Mistakes and Misrepresentations of the Late Mr. Milner, of Hull, Dr. Horne, Bishop of Norwich; Mr. Kett, Fellow of Trinity College, Oxford; and Dr. Napleton, Canon of Hereford. By Thomas Ludlam, M.A.",Thomas Ludlam,100,0,1,0,2,2,2,0,0,1,0,0,1,3,5,0,2,1,2,3,1,5,1,1,4,0,0,1,3,1,0,0,0,3,1,3,2,2,0,7,2,1,1,1,2,1,9,0,3,3,3,2,1,1,3,0,0,4,2,1,1790,1,1,"Cambridge : printed by M. Watson: for J. Nicholson, Cambridge; sold also by Rivington's, St. Paul's Church Yard, London; Cooke, Oxford; and Gregory, Leicester, [1790?].",Cambridge,107,male,1727,1811,FALSE,"their private families? what is the use of such a.power, and why is it given to the father only, and not to the mother of whom the Bishop says nothing ! Or is it meant only to show thatfaome fjti of 29 power does,, and must exist amongst mankind ."
0812201300_000028,"The main argument of a late book, intitled, Christianity as old as the creation, fairly stated and examined. Or, a short view of that whole controversy.","Atkey, Anthony",107,0,0,2,4,0,2,1,0,2,0,1,1,1,1,3,0,0,0,0,3,3,1,5,0,0,0,2,9,1,2,0,0,4,2,1,1,1,7,16,2,1,0,1,1,2,3,0,0,3,4,1,0,2,1,1,4,1,1,3,1733,1,1,"London : printed for S. Lobb, Bookseller in Bath; C. Rivington in St. Paul's Church-Yard, and J. Roberts in Warwick-Lane, [1733].",London,94,male,1702,1734,FALSE,"God ; but that Sincere Per ibns, who never enjoyed that Advantage, if they acted agreeable to the Light which they had, may be happy. And thus much also may, 1 think , be concluded ficm the want of an Universal Revelation; which, had it been absolutely necessary, would never"
0539400200_000100,"The moral philosopher. In a dialogue between Philalethes a Christian deist, and Theophanes a Christian Jew. In which The Grounds and Reasons of Religion in general, and particularly of Christianity, as distinguish'd from the Religion of Nature; the different Methods of conveying and proposing Moral Truths to the Mind, and the necessary Marks or Criteria on which they must all equally depend; the Nature of positive Laws, Rites and Ceremonies, and how far they are capable of Proof as of standing perpetual Obligation; with many other Matters of the utmost Consequence in Religion, are fairly considered, and debated, and the Arguments on both Sides impartially represented.",Thomas Morgan,112,0,3,0,1,0,0,0,2,1,0,1,0,0,2,1,9,0,0,0,2,2,0,2,0,0,2,4,1,2,1,0,1,2,1,3,8,5,11,5,3,1,1,1,0,2,0,2,1,4,16,1,3,0,0,2,1,1,1,0,1737,1,1,"London : printed for the author, MDCCXXXVII. [1737].",London,462,male,,1743,FALSE,"Moment, when the Spirit , as it is supposed, might have worked upon them effectually and instantaneously, and at once have brought them out of Darkness into Light , before they had been aware of it. They look upon Ordinances, and Means of Grace, as the Food and Physic sick"
0532601900_000032,"An essay on religion. Demonstrating, that God's being, and existing as a Trinity in unity, and his attributes, are self-evident, by the universal and concurrent Witness of his Works; and that his Attributes are the only infallible Test of Truth. Or, Plain Reasons for believing the Great Misteries of the True Christian Religion; leaving no Room for any Doubt of the Truth, nor any Plea for implicit Faith. Shewing the Fallibility of Human Reason, and the Certainty of Divine Revelation; God's general and particular Providence; Predestination and Free Will; Man's Fall, Redemption, and final Perfection: Asserting, That the Want of trying our Reason by the Test of Truth, is the Cause of misunderstanding the Scriptures, and of all Error in Religion: And proving, That by that Test, we may clearly distinguish Truth from Error; and be certain in all Things, that God requires us to learn, believe, and practice, for our Temporal and Eternal Happiness. Introduc'd by a necessary dissertation on thought, and the wrong notion of free-thinking.",Philoveritas,103,0,2,3,0,0,0,0,0,0,0,2,3,1,1,1,1,6,0,2,1,10,2,1,1,0,2,1,0,4,0,1,5,6,0,0,1,2,2,6,2,0,0,3,1,0,3,0,0,1,2,3,2,5,0,7,3,0,2,2,1737,1,1,"London : printed for J. Roberts, at the Oxford Arms, in Warwick-Lane; and sold at the pamphlet shops in London and Westminster, [1737].",London,154,unknown,,,FALSE,"the TRUE Value of Good. But rational Creatures being capable of knowing God , they could never have been fatisfy'd in and with his Dispensations, had they suffered Evil in their original Nature , and not as a Penalty for the Milthfe of' their Freewill. And though the Offqpring of"
1466600100_000143,"Sermons upon the following subjects, viz. I. Eternal life the reward of patient continuance in well doing. II. Moral perfection the ultimate intention of all the works and ways of God. III. The nature of enthusiasm. IV. Christianity the spirit of power. V. Christianity the spirit of love. VI. Christianity the spirit of wisdom, and of a sound mind. VII. The nature and faculties of the human soul; and particularly the operations of the understanding. VIII. Of the will, of liberty, and particularly of moral liberty. IX. Of the affections. X. Of reason and conscience. XI. The loss of the soul, and the torments it may suffer in a future state. XII. The loss of the soul opposed to temporal acquisitions. XIII. The happiness of the righteous. XIV. The greatness of God, and of his works. XV. The dissolution of the material system, and the final consummation of all things. XVI. Communion with God explained. XVII. Of the reverence a man owes to himself. XVIII. Of friendship. By the late Rev. James Duchal, D.D.",James Duchal,93,1,3,2,1,0,0,2,0,0,2,4,0,2,0,2,1,1,0,3,0,4,2,2,2,6,1,0,1,2,0,0,0,0,1,6,2,1,2,3,0,1,4,3,2,0,5,2,0,2,0,1,1,3,4,0,0,2,1,3,1767,1,1,"Dublin : printed by T. Ewing in Dame-Street, MDCCLXVII. [1767].",Dublin,1507,male,1697,1761,FALSE,"an original intelligent cause , to which we ascribe all of them. But yet, when we confider that the intelligent prin Q. 4 ciple SER m.ciple within us, which is the subject of IX all our perceptions, the agent that thinks , '"" and the cause of all voluntary aations,"
1487600100_000068,"Discourses on the evidence of revealed religion. By Joseph Priestley, LL.D. F.R.S. &c. [Two lines from Acts].","Spotswood, William",102,2,0,0,3,0,0,1,4,0,0,1,0,1,1,3,0,1,1,0,1,13,0,1,0,0,0,3,1,5,1,0,1,6,2,0,1,3,3,8,1,1,3,1,0,5,1,1,1,1,4,1,0,2,0,3,2,0,1,7,1795,1,1,"Boston : Printed and sold by William Spotswood, no. 55 Marlborough-Street, 1795.",Boston,288,male,1753,1805,FALSE,"our ways, our minds would be liable to be disturbed and unhinged by the events of s3 life , and we should more especially find ourselves destitute of power to carry us through severe trials and sufferings in the cause of truth and a good conscience. But an habitual refpe"
0028500100_000041,"The life of John Buncle, Esq; containing various observations and reflections, made in several parts of the world; and many extraordinary relations.","Amory, Thomas",112,0,0,2,1,0,0,0,2,0,2,0,0,1,3,7,0,1,1,0,0,12,3,1,0,0,0,1,6,3,1,3,2,2,2,1,0,3,3,8,0,1,3,0,1,1,2,1,0,6,8,0,3,1,2,3,1,0,3,5,1756,1,1,"London : printed for J. Noon, at the White Hart in Cheapside, near the Poultry, MDCCLVI. [1756].",London,527,unknown,1691,,FALSE,"for they were as guilty as the Gentiles were in transgressing the law of nature . Neither of them had any legal title tojulification.. They were all very great transgressors. The throat of yew and Gentile an open; fepul cre: their tongues, deceit: the poison of asps under their lips:"
0973301002_000004,"Sermons on the following subjects, viz. Of the universal sense of good and evil. ... By James Foster.",James Foster,92,3,1,0,0,2,1,4,0,0,1,1,3,6,4,2,1,3,0,1,5,5,0,2,1,0,0,1,1,0,0,0,0,3,0,0,0,1,5,5,2,0,3,1,1,0,2,2,2,7,1,0,0,1,2,1,1,1,1,2,1737,2,2,"[Dublin] : Printed by R. Reilly, on Cork-Hill, for G. Risk, G. Ewing: W. Smith, and A. Bradley, 1735.",Dublin,271,male,1697,1753,FALSE,"God , but against his wisdom only, in taking the most proper methods to promote the general happiness, are attempts to argue where we have no principles to proceed upon; and muit therefore be extremely rash and arrogant. So that this short view of the cafe is sufficient to convince"
0280800102_000095,"The advantage and necessity of the Christian revelation, shewn from the state of religion in the antient heathen world: ... To which is prefixed, a preliminary discourse on natural and revealed religion. In two volumes. By John Leland, ...",John Leland,80,1,2,1,1,1,0,1,0,1,2,2,0,0,2,4,1,2,0,2,1,0,0,2,1,1,0,1,0,6,1,2,0,1,1,4,0,1,3,6,2,0,0,0,0,0,1,1,1,5,2,1,0,5,2,1,2,0,0,3,1764,2,2,"London : printed by W. Richardson and S. Clark; for R. and J. Dodsley, and T. Longman, 1764.",London,526,male,1691,1766,FALSE,"religion , and to the cause of virtue in the world , whether there be life to come, in which men fiall be rewarded or punifled, according to their behaviour in this present slate; or whether this present life be the whole of our existence, beyond which there is nothing"
1407601100_000005,"Two discourses, delivered in the public assemblies of the people called Quakers. By Thomas Story. Taken in short-hand; and, after being transcribed at length, examined by the said T. Story, and published by his permission.","Carter, John",119,3,1,3,0,2,0,1,6,0,1,0,1,4,0,8,0,2,0,0,0,12,5,2,0,1,2,3,3,6,4,0,2,4,1,0,1,11,1,2,1,0,0,0,0,0,3,0,2,2,0,0,8,0,2,2,2,2,0,3,1769,1,1,"[Providence] : London, printed. Providence, re-printed and sold by John Carter, at Shakespear's Head, M.DCC.LXIX. [1769].",Providence,44,male,1745,1814,FALSE,"by which he might come near unto mankind , in our own nature and likeness, under the character and name of Jesus Christ , who in the holy scripture is called the wisdom of God ; and the power of God ; and by John;, the evangelist, is called the"
0129200600_000008,"A panegyrick on the Newtonian philosophy. Shewing the nature and dignity of the science, and Its absolute Necessity to the Perfection of Human Nature; the Improvement of Arts and Sciences, the Promotion of true Religion, the Increase of Wealth and Honour, and the Completion of Human Felicity. By B. Martin.",Benjamin Martin,100,1,14,1,0,5,0,3,0,0,2,0,0,1,1,2,1,0,0,1,2,2,0,2,1,1,1,3,3,3,0,1,0,2,2,4,2,2,1,12,0,2,0,3,1,0,3,1,1,1,0,1,2,0,1,2,1,0,4,1,1749,1,1,"London : printed for W. Owen, near Temple-Bar, and J. Leake, and J. Frederick, at Bath, MDCCLXIX MDCCLXIX [1749].",London,65,male,1705,1782,TRUE,"the Nature and ofau, Struaure Bcdies. ( 32) stru&ure of animal Bodies , and the Uses of the several Parts. By this Science we are taught the divine Laws of animal Mechanism; not in the low nonsensical Notion of the Cartef ans, who confider Aimals as mere Machines, devoid of"
0451800100_000117,"Memoirs of the Rev. Isaac Watts, D.D. By Thomas Gibbons, D.D.",Thomas Gibbons,83,2,1,2,0,3,0,1,7,2,0,1,1,0,1,5,0,1,0,0,1,6,1,5,2,1,0,4,2,3,1,0,0,1,1,0,0,1,3,5,0,1,0,0,0,0,2,2,1,1,2,0,4,2,0,1,1,0,1,1,1780,1,1,"London : printed for James Buckland in Pater-Noster-Row; and Thomas Gibbons at No. 2, in Norton-Falgate, near Bishopsgate-Street, MDCCLXXX. [1780].",London,511,male,1720,1785,FALSE,"Sentiments. i2. The rational Foundation of a Christian Church, and the Terms of Christian Communion; to which are added Three Discourses, namely, namely, A Pattern for a Dissenting Preacher; the Office of Deacons; and Invitations to church fellowfhip. 22 Useful and important Questions concerning Jesus the Son freely proposed; with"
1752500200_000008,Practical discourses on the following subjects: I. Man's original state. II. The fall of Adam. III. Jesus Christ as a saviour. IV. Justification by faith. V. The spirit and its fruits. By Nicholas Manners. ...,"Manners, Nicholas",111,1,3,0,1,4,0,3,0,0,0,1,0,0,2,1,3,1,0,1,0,19,5,0,0,1,1,3,0,1,1,1,6,0,0,4,1,2,4,7,1,1,0,2,1,0,3,1,1,3,1,4,9,2,0,0,0,0,1,4,1777,1,1,"Leeds : printed for the author, by J. Bowling, and sold by J. Binns; and R. Spence, York, 1777.",Leeds,155,unknown,,,FALSE,"or no quality, a mere rasa tabula, to be impressed by things extrinfical to it, without any underitanding and choice of its own: Both which were foreign to the primitive state of man. For, every fubitance having a quality, and it being highly derogatory to God , to suppose that"
0177600102_000027,"Discourses on various subjects, by the late Reverend John Leland, D.D. With a preface, giving some account of the life, character, and writings of the author. In four volumes. ...",John Leland,100,0,1,1,0,1,1,1,0,0,3,4,0,0,2,2,0,2,0,1,2,8,0,3,0,4,0,1,5,0,0,0,2,3,2,0,0,3,6,12,1,2,0,0,1,2,2,1,3,7,0,2,1,1,1,1,2,2,0,1,1769,2,4,"London : printed for W. Johnston; and J. Dodsley, 1769.",London,513,male,1691,1766,FALSE,"other other Classes of Beings here on Earth are subservient and subordinate? Surely we ilave great Reason to think that the most wise and powerful and benevolent Lord and Parent of the Universe, whose Kingdom ruleth over all, doth in a special Manner exercise his Government and Care towards the"
1147401001_000043,"An estimate of human life. In a series of discourses. By Geo. Marriott, Rector of Alphamstone, in Essex, Lecturer of St. Luke, Middlesex. And Late Chaplain of the Factory in Sweden. Volume the first.","Marriott, George           1793",73,0,0,1,1,0,0,0,3,1,0,0,1,1,2,3,1,1,0,1,1,2,2,1,1,0,0,3,1,4,0,0,1,2,0,1,0,5,5,2,1,4,1,1,1,1,0,1,1,0,2,1,1,1,3,1,3,0,0,3,1774,1,1,"London : printed for the author, and sold by W. Flexney, opposite Gray's-Inn Gate, Holborn, MDCCLXXIV. [1774].",London,425,unknown,,,FALSE,"much delicacy by those who disapprove them and with their abolifllment. Intemperate oppositions bring on unnecefl'hy bloodihed, and frnifh the worst part of mankind , the interested du vourcrs vourers of the Fruit of Imposture, with an opportunity of inspiring the rabble of Devotees with the rage of Persecution. External"
0431400300_000158,"The dignity of human nature. Or, a brief account of the certain and established means for attaining the true end of our existence. In four books. I. Of prudence. II. Of knowledge. III. Of virtue. IV. Of revealed religion. By J.B. Master of an academy at Newington-Green, Middlesex.",James Burgh,77,0,2,2,1,1,1,0,0,0,1,1,1,1,1,2,0,0,1,0,3,1,0,3,1,1,3,6,1,1,2,1,0,5,1,1,0,1,1,1,0,0,0,2,1,2,1,0,0,4,4,1,0,3,2,1,3,1,1,3,1754,1,1,"London : printed by W. B. and sold by J. and P. Knapton, in Ludgate-Street; J. Ward, in Cornhill; J. Whiston and B. White, in Fleet-Street; A. Millar, in the Strand; and R. and J. Dodsley, in Pall-Mall, MDCCLIV. MDCCLIV. [1754].",London,446,male,1714,1775,FALSE,"know the TRUE virtues of the water of life ; that is, he must, to know the religion of the Scriptures, go directly to the Scriptures, and study them more than all the fyfsems or bodies of divinity in the world . There is no greater hindrance to the candid"
0973301001_000071,"Sermons on the following subjects, viz. Of the universal sense of good and evil. ... By James Foster.",James Foster,99,0,1,2,0,0,1,0,0,1,2,1,0,1,3,1,4,1,0,2,4,4,0,1,1,2,1,0,10,1,2,0,1,1,1,4,1,0,4,9,3,2,0,0,2,0,0,5,1,7,2,0,0,3,0,2,1,0,0,4,1735,1,2,"[Dublin] : Printed by R. Reilly, on Cork-Hill, for G. Risk, G. Ewing: W. Smith, and A. Bradley, 1735.",Dublin,287,male,1697,1753,FALSE,"that the principle itfdbf is ivwrg, but may justly incline us to si/pee, it; or, at tq4 least, S E R M. least, bhould make us proceed with deliberation and XV caution, before we venture to determine in a matter of so great consequence, and not susser us to be"
0459000202_000009,"Miscellanies: in two volumes. By the Rev. Richard Shepherd, B. D. Late Fellow of C. C. C. Oxford. ...","Shepherd, Richard",93,3,1,3,0,2,2,0,1,0,0,0,1,1,1,1,0,6,0,2,9,1,0,3,1,1,1,1,3,1,1,0,0,1,0,2,2,5,4,5,0,2,0,2,1,0,0,2,0,2,0,1,0,1,0,3,12,1,0,1,1776,2,2,"Oxford : printed for W. Flexney, in Holborn, London; J. Fletcher and S. Parker, in Oxford, MDCCLXXVI. [1776].",Oxford,278,male,1732,1809,FALSE,"he would find it a very difficult matter to give a tolerable reason . Paradoxical: as this may appear , there are fats in the natural world , such as are the immediate objets of our senses , that operate no less unaccountably. Who, for infrance, has told us what"
0167900100_000049,"An essay on regimen. Together with five discourses, medical, moral, and philosophical: serving to illustrate the principles and theory of philosophical medicin, And point out Some of its Moral Consequences. By Geo. Cheyne, M.D.C.R. Ed. S. and F. R. S.",George Cheyne,109,1,1,1,1,3,0,0,0,0,0,1,1,2,1,2,0,4,1,0,5,3,0,2,1,1,1,11,3,5,1,2,2,0,1,0,8,0,2,15,1,2,1,2,1,2,2,1,1,0,0,1,9,0,0,2,0,1,1,0,1742,1,1,"London : printed for Geo. Strahan, at the Golden Ball in Cornhill, and John and Paul Knapton, at the Crown in Ludgate-Street, M.DCC.XLII. [1742].",London,436,male,1671,1743,FALSE,"the Ideas meant by these K 3 Tcrmsi. Terms; and this is the TRUE and only Mean of natural Knowledge about Bodies and their natural Qualities and Laws . In spiritual Truths, imperceptible and immaterial Beings, (ziz.) about their Nature , Qualities and Ranks, can know nothing naturally and humanly,"
0255800700_000072,"Dæmoniacs. An enquiry into the heathen and the Scripture doctrine of dæmons. In which the hypotheses of the Rev. Mr. Farmer, ... are particularly considered. By John Fell.","Fell, John",106,2,0,1,1,0,6,3,0,2,0,0,7,0,1,4,0,8,0,0,1,4,2,6,3,0,2,1,0,0,1,0,0,4,0,1,0,2,7,8,2,0,0,4,2,2,2,3,1,2,2,0,1,2,0,0,0,0,0,6,1779,1,1,"London : printed for Charles Dilly, 1779.",London,447,male,1735,1797,FALSE,"account of their ideas , concerning the entrance of sin and death into this world , and to let us know , whether they ascribe it to the agency of the devil or not; for till this is done, those arguments that have been advanced against the received opinion, on"
0384600800_000049,"An essay on regimen. Together with five discourses, medical, moral, and philosophical: serving to illustrate the principles and theory of philosophical medicine, And point out Some of its Moral Consequences. By George Cheyne, M. D. Fellow of the Royal Society.",George Cheyne,102,1,1,1,0,3,0,0,0,0,1,1,0,2,3,2,0,1,0,1,6,2,0,2,2,1,1,12,3,1,0,0,2,0,1,0,7,1,2,10,1,6,1,0,1,2,1,2,3,1,0,1,4,3,1,2,0,2,1,0,1753,1,1,"London : printed for Dan. Browne, without Temple-Bar; R. Manby, on Ludgate-Hill; J. Whiston and B. White, in Fleet-Street; and A. Strahan, in Cornhill, MDCCLIII. [1753].",London,438,male,1671,1743,FALSE,"advance that Step; and when we K 2 come come into the proper Disposition of Body and Mind , to benefit by the just and precise Knowledge of thcl mentioned and fuch likc Divine Truths, (though absolute prec/i'on be inconliftcnt withinitude) we hall admire and adore the Wisdom of our"
0763400400_000097,"A review of the principal questions in morals. Particularly those respecting the origin of our ideas of virtue, its Nature, Relation to the deity, Obligation, Subject-Matter, and Sanctions. The third edition corrected, and enlarged by an appendix, containing additional notes, and a dissertation On the Being and Attributes of the Deity. By Richard Price, D.D. F.R.S.",Richard Price,82,1,0,0,0,0,2,1,1,0,2,1,3,1,1,3,1,2,0,0,2,3,0,1,3,1,3,0,0,2,0,0,1,1,3,0,3,2,1,5,1,1,3,0,4,2,3,3,0,3,1,1,0,2,1,1,3,1,1,1,1787,1,1,"London : printed for T. Cadell in the Strand, MDCCLXXXVII. [1787].",London,520,male,1723,1791,TRUE,"to some lower place in God's family, but to all those privileges of a son which he had forfeited, break the whole connexion between sin and punishment, and issue in full favour and everlasting glory through that great MAESSIAH wvho loved us and gave hin; elf for us. To this"
