0061100400_000052,"The holy Bible, containing the Old and New Testaments: Newly Translated out of the Original Tongues: And with the Former Translations Diligently Compared and Revised, By His Majesty's Special Command. Appointed to be Read in Churches.",,104,3,2,2,3,0,10,0,0,0,2,0,0,4,3,0,0,1,0,1,1,5,6,3,1,1,0,0,0,1,9,2,0,2,1,2,7,0,0,6,0,0,0,0,8,9,0,0,0,1,0,0,3,1,0,0,0,0,0,1,3,1766,1,1,"London : printed by Mark Baskett, Printer to the King's most Excellent Majesty; and by the assigns of Robert Baskett, M.DCC.LXVI. [1766].",London,844,unknown,,,FALSE,"God . Ltt ?I 9 t Let tha more w ork be laid upon the men, i that they may labour therein: and let them not LS,, a ts regard vain words . it lo L And the tafk maflers of the people went Before out, and their officers, and"
1236000100_001141,"The Holy Bible, with the Apocrypha at large. Explained and illustrated with notes and annotations, theological, moral, divine, &c. selected from the most eminent commentators ... with practical observations and reflections. ...",,85,2,2,0,0,2,4,0,3,0,0,1,0,0,0,1,2,1,2,0,7,2,0,0,1,1,2,1,3,0,5,3,0,2,0,0,2,3,0,4,1,1,0,1,10,0,0,0,0,0,1,2,0,2,0,4,1,1,0,1,4,1796,1,1,"Berwick : printed for J. Embleton, 1796.",,992,unknown,,,FALSE,"there none like unto him: 20 Who kept the law of the Most High, and was in covenant with him; he established the covenant in his flesh; and when he was proved, he was found faithful . 21 Therefore he alfured him by an oath, that he would bless the"
1508901100_000064,"The Holy Bible, containing the Old and New Testaments: Newly translated out of the original tongues, and with the former translations diligently compared and revised. By His Majesty's special command. Appointed to be read in churches.",,131,0,0,0,2,2,3,0,1,0,4,1,1,1,0,1,0,10,1,1,0,12,7,4,0,0,0,0,1,1,7,1,0,0,2,1,3,11,0,15,1,1,0,2,20,2,0,1,0,2,0,1,0,0,1,0,0,3,0,3,1,1756,1,1,"Oxford : Printed by Thomas Baskett, printer to the University, MDCCLVI. [1756].",Oxford,1090,unknown,,,FALSE,"6 And he said unto Moses , I thy father in law Jethro am come unto thee, and thy wife, and ter two sons with her. 7 qi And Moses went out to meet his father in law , and did obeisance, and kissed him, and they asked each other"
1130801301_000085,"The whole works of the Reverend Robert Millar, A. M. Late Minister of the Gospel in Paisley. In eight volumes. ...","Millar, Robert",98,7,0,0,2,0,2,1,0,0,3,0,0,2,2,0,1,1,1,0,3,17,0,1,1,0,3,0,0,0,6,0,0,4,2,1,1,0,0,4,1,1,0,0,7,9,3,0,0,1,2,0,3,0,0,0,2,1,1,0,2,1789,1,8,"Paisley : printed by John Neilson, for Robert Reid, M.DCC.LXXXIX. [1789].",Paisley,433,male,1672,1752,FALSE,"and done the signs in their sight, the people believed, as God had foretold ; and they bowed their heads and Zw/, hippped; expressing not only their. thankfulness to God , who had sent them a deliverer, but also their cheerful readiness to obey his orders. § 3 Moses and"
1149000100_000053,"The holy Bible containing the Old Testament and the New: Newly Translated out of the Original Tongues, and With the former Translations diligently Compared and Revised. By his Majesties special Command. Appointed to be read in Churches.",,138,11,1,4,4,0,3,0,3,0,0,0,0,11,0,0,0,0,0,3,0,2,5,3,2,0,2,0,0,2,4,0,0,2,2,0,5,0,0,8,0,0,1,0,5,22,0,0,1,0,14,0,3,0,0,0,7,0,8,0,0,1718,1,1,"London : printed by John Baskett, Printer to the Kings most Excellent Majesty, and by the assigns of Thomas Newcomb, and Henry Hills, deceas'd, [1718]-19.",London,914,unknown,,,FALSE,"and moses , to whom the LORD raid, Bring out the children of Ifrade from the land of E yptl according to their armies. 27 These are they which sake to Pharaoh king of Egypr, robring out the rhildren of Israel from Egypt : therfe are tlat Moses and Aaron"
0927900102_000116,"A short and plain exposition of the Old Testament, with devotional and practical reflections, for the use of families. By the late Reverend Job Orton, S.T.P. Published from the author's manuscripts, by Robert Gentleman. ...",Job Orton,83,1,1,0,2,2,2,0,0,1,1,3,0,1,1,0,0,2,0,4,0,11,4,3,2,0,0,1,1,0,4,3,2,1,0,0,3,6,1,5,0,1,0,0,3,0,1,0,0,0,0,0,0,0,0,5,0,1,2,1,1,1791,2,3,"Shrewsbury : printed and sold by J. and W. Eddowes. Sold also by T. Longman, Paternoster Row; C. Dilly, in the Poultry; and J. Johnson, St. Paul's Church Yard, London, MDCCXCI. [1791].",Shrewsbury,540,male,1717,1783,FALSE,"us a law , [even] the inheritance of the congregation of Jacob ; Moses con. manded us to receive this law , which God hath given, and which was the best inheritance to them and their children . 5 And he was king in Jefhurun, when the heads of the"
0060200200_000056,"The holy Bible, containing the Old and New Testaments; Newly Translated out of the Original Tongues, and With the former Translations diligently compared and revised, By His Majesty's special Command. Appointed to be read in Churches.",,142,14,2,1,3,0,3,0,4,0,0,0,0,13,0,0,0,0,0,2,0,3,5,6,1,0,5,0,0,1,5,0,0,2,2,0,7,0,0,13,0,0,1,0,3,17,0,0,1,0,11,0,2,0,1,0,6,0,8,0,0,1768,1,1,"Cambridge : printed by John Archdeacon Printer to the University; and sold by John Beecroft, John Rivington, Benjamin White, and Edward Dilly, in London; and T. & J. Merrill, Cambridge, 1768.",Cambridge,1294,unknown,,,FALSE,"fe bare him Nu. 26 Aaron and Moses : and the years of the 5' life of Arirarm were an hundred d nd thirty and seven yeats. 21 And the sons of Izhar; Koiraih and Num. 16 Nepheg, and Zichri. Co  22 And uthe sons of Uzziel; Mifhael, 37,"
1162300200_000056,"The Holy Bible, containing the Old and New Testaments: ...",,106,3,0,2,1,2,2,2,0,0,0,5,2,8,0,1,0,3,2,2,0,5,1,3,0,0,4,2,0,4,2,0,0,0,3,0,6,0,1,10,1,0,0,0,4,12,0,0,0,0,0,0,9,0,0,0,1,1,0,2,0,1795,1,1,"Oxford : printed at the Clarendon Press, by William Jackson and WIlliam Dawson: and sold at the Oxford Bible Warehouse, London, 1795.",Oxford,1086,unknown,,,FALSE,"17 As yet exaltcft thou thyself against my people , that thou wilt not let them go? r8 Behold , tomorrow about this time I will cause it to raiin a very grievous hail, such as hath not been in Egypt tilce the foundationi thereof even until now. 19 Send"
1604700800_000134,"The book of common prayer, and administration of the sacraments, and other rites and ceremonies of the church, according to the use of the Church of England: Together with the Psalter or Psalms of David, pointed as they are to be sung or said in churches.",Church of England,87,1,1,0,0,4,0,0,0,0,2,1,1,3,0,0,0,2,1,4,4,2,0,2,0,0,1,1,1,1,1,1,0,3,0,0,12,1,1,2,1,0,0,0,8,0,1,0,1,0,1,3,1,0,1,1,4,1,3,6,2,1745,1,1,"Cambridge : Printed by Joseph Bentham printer to the University; and sold by Charles Bathurst in Fleet-street, London, 1745.",Cambridge,360,unknown,,,FALSE,"for an everlatling testament. I I Saying, Unto thee \\ ill I give the land of Canaan : the lot of your inheritance. z z When 12 When there were yet but a few of them: and they itrangers in the land ; 13 What time as they went from"
1162501100_000106,"The book of common prayer, and administration of the sacraments, And Other Rites and Ceremonies of the Church, According to the Use of the Church of England: together with the Psalter or Psalms of David, Pointed as they are to be Sung or Said in Churches.",Church of England,79,2,1,0,0,3,0,0,0,0,2,1,1,4,0,0,0,1,1,4,2,1,0,3,0,0,1,1,1,1,1,1,0,2,0,0,8,1,1,1,1,0,0,0,6,0,1,0,1,0,1,4,2,0,1,1,4,1,3,6,2,1715,1,1,"Oxford : printed by John Baskett, Printer to the King's most Excellent Majesty, and to the University, MDCCXV. [1715].",Oxford,147,unknown,,,FALSE,"my prophets no harm. 16 Moreover, he called for a dearth upon the land : .and.deftbyed all the provifiop of bread; -. But he had' ent a man before them': eveh Joseph, who was sold to be a hond fervant; is Whose feet they hurt in the Rocks: the iron"
0060000200_000865,"The new family Bible: or, divine library. Containing the sacred text at large of the Old and New Testament; with the Apocrypha. With notes selected from the most eminent and approved Commentators. The Whole carefully Revised and Corrected.",,106,0,3,1,1,3,1,1,3,0,2,1,1,2,2,0,0,5,0,0,1,11,1,1,6,0,3,1,1,4,5,0,0,6,2,1,5,1,1,2,1,0,0,0,3,0,1,0,2,0,0,0,3,1,0,0,3,10,0,3,1,1777,1,1,"Shrewsbury : printed by T. Wood; and sold by G. Robinson, Pater-Noster-Row; and T. Vallance, Cheapside, London, MDCCLXXVII. [1777].",Shrewsbury,1320,unknown,,,FALSE,"Moses his i. ra 3; at the time that he brought our fathers out of the. d of Egypt , to give us a land that floweth i: rh miki and honey, like as it is : t see this day. I nerenhrel s wre have not hearkened unto the"
0984500104_000029,"The Holy Bible translated from the Latin Vulgat: ... first published by the English College at Doway, Anno 1609. Newly revised, and corrected, according to the Clementin edition of the Scriptures. With annotations ...",Richard Challoner,98,0,1,5,1,1,8,7,1,0,3,1,0,2,2,1,1,2,2,1,1,9,4,7,0,0,1,1,0,2,5,0,0,3,0,0,6,1,0,0,1,2,1,0,2,0,1,0,1,1,0,0,0,1,2,0,1,1,0,3,2,1750,4,4,"[Dublin?] : Printed in the year, 1750.",Dublin,517,male,1691,1781,FALSE,"for the right of inheritance is thine, and thou art next of kin to poffefi it. And I underiood that this was the word of the Lord. 9 And I bought the field of Hanameel my uncle's son, that is in Anathoth: and I weighed him the money, seven ilaters,"
1305800600_000120,"The book of common prayer, and administration of the sacraments, and other rites and ceremonies of the Church, according to the use of Church of England: Together with the Psalter or Psalms of David, pointed as they are to be sung or said in churches.",Church of England,83,2,1,0,0,4,1,0,0,0,2,1,1,2,0,0,0,2,0,4,3,3,0,2,0,0,1,1,1,1,1,2,0,2,0,0,10,2,1,1,1,0,0,0,7,0,1,0,1,0,1,3,5,0,1,1,3,0,3,4,1,1736,1,1,"Oxford : Printed by John Baskett, printer to the University, MDCCXXXVI. [1736].",Oxford,115,unknown,,,FALSE,"wonders, and the judgments of his mouth, 6 0 ye seed of Abraham his servant : ye children of Jacob his, chosen. 7 He is the Lord our God : his judgments are in all the .world. 8 He hath been always mindful of his covenant and promise .that he"
0077900300_000573,"The holy Bible, containing the Old Testament and the New: Translated out of the Original Tongues, and With the former Translations Diligently Compared and Revised, By His Majesty's special Command. Appointed to be read in Churches.",,93,0,0,4,1,0,0,1,0,1,1,0,0,11,1,0,1,0,2,2,1,5,10,5,0,1,0,0,0,0,2,1,3,11,0,1,4,0,0,0,1,0,1,0,1,3,0,0,3,0,5,1,1,0,0,0,2,1,2,3,0,1773,1,1,"Oxford : printed by T. Wright and W. Gill, Printers to the University: and sold by S. Crowder, in Pater-Noster Row, London; and by W. Jackson, in Oxford, [1773].",Oxford,1201,unknown,,,FALSE,"his life: as 1 gave Zedekiah king of Judah into the hand of Nebuchadrezzar king of Babylon his enemy, and that sought his life. CH A P. XLV X Barucb being didhayed, 4 Jeremiah in firu seth and comforteth him. tphe word that Jeremiah the prophet IL spake unto Baruch"
1159202800_000046,"The whole book of Psalms, collected into English metre, by Thomas Sternhold, John Hopkins, and others. Conferr'd with the Hebrew. Set forth and allowed to be Sung in all Churches, of all the People together, before and after Morning and Evening Prayer; and also before and after Sermons; and moreover in private Houses, for their godly solace and comfort: laying apart all ungodly Songs and Ballads, which tend only to the nourishing of Vice, and corrupting of Youth.",,81,2,0,0,0,2,0,0,1,0,1,1,1,4,0,0,1,1,1,1,3,2,0,2,0,0,3,1,3,1,1,1,0,1,0,0,15,1,1,2,0,0,2,0,7,1,1,0,0,0,1,2,3,0,0,1,3,1,3,2,1,1768,1,1,"Cambridge : printed by John Archdeacon Printer to the University; sold by John Beecroft, John Rivington, Benjamin White, and Edward Dilly, in London; and T. & J. Merrill, in Cambridge, 1768.",Cambridge,97,unknown,,,FALSE,"from prison where he was; The ruler of the people then did freely let him pass : ao And over all his house he made him lord, to bear the sway, And of his substance made him have the rule and all the flay: az That he might to his"
0053300501_000057,"The sacred interpreter: or, a practical introduction towards a beneficial reading, and a thorough understanding of the Holy Bible. Containing, I. A Faithful History of the Four Ancient Monarchies, (the Assyrian, Persian, Grecian, and Roman,) absolutely necessary for the Knowledge of the Condition of the Jewish People. II. A General View of the State of the Jewish Church, to the Destruction of Jerusalem. III. Remarks on the Pentateucb, and the Prophets in the Old Testament; and on the Gospels, the Acts of the Apostles, and the Epistles, in the New; shewing the Design and chief Scope of each Book. IV. An exact Chronology of the Holy Scriptures, taken from Arch-Bishop Usher, and Mr. Archdeacon Echard. V. A Dissertation upon Revealed Religion, and an Account of those Divines who have Defended it. VI. Difficult Texts of Scripture explained; with a Recital of such Sacred Mysteries as ought not to be made the Subject of Human Enquiry. Likewise, The several Parts of the Holy Land are compared with the Accounts given thereof by Modern Travellers: The Whole designed to render the Study of the Holy Scriptures more Easy and Instructive. By David Collyer, late Vicar of Great Coxwell, Berks.","Collyer, David",80,1,1,0,1,4,2,0,0,4,1,1,0,6,0,0,1,3,0,0,0,11,1,0,0,0,0,0,0,2,3,4,1,3,0,0,2,1,0,1,1,0,3,0,6,4,2,0,2,3,0,1,1,0,0,2,0,0,0,1,0,1732,1,2,"London : printed for Thomas Astley, at the Rose, against the North Door of St. Paul's, 1732.",London,434,male,1652,1724,FALSE,"Lord Jesus being the TRUE Messiah or Christ: But the Truth of this Exposition is confirmed by the last Words of the aforementioned Prophecy; And unto him ifall the Gathering of the People be; for this is the same Character by which he was declared to Abra. ham, Gen. XXVI"
0375500500_000009,"A treatise concerning the fear of God, scripturally recommended unto all people, from the example of the patriarchs, prophets, kings, and judges, &c. With an historical account, briefly reciting the many advantages which they received who lived therein.","Field, John",106,2,0,0,2,4,0,0,4,0,4,0,1,4,0,0,0,1,18,2,0,14,0,5,0,0,0,1,0,2,2,1,0,1,1,1,3,2,1,9,0,0,0,0,8,2,0,1,0,1,1,3,2,0,0,0,0,2,1,0,0,1781,1,1,"London : printed and sold by J. Phillips, George-Yard, Lombard-Street, 1781.",London,219,male,1652,1723,FALSE,"unto them on the right. a Exod. III 2 b Exod. XII 43 hand r 27 ] hand and on their left : and the Lord over' threw the Egyptians in the midst of the sea , when Moses , by his command , stretched forth his hand ; andt"
0546900101_000029,"A course of lectures, on the prophecies that remain to be fulfilled. Delivered in the borough of Southwark, as also, at the chapel in Glasshouse-Yard, in the year 1789. By Elhanan Winchester. Repent; For The Kingdom Of Heaven IS At Hand. ...",Elhanan Winchester,88,0,1,2,1,1,4,0,2,0,1,2,0,2,0,1,0,1,0,2,1,13,1,2,1,0,1,1,3,3,5,1,1,0,1,1,1,7,0,5,1,0,0,0,8,0,1,1,1,1,0,0,0,0,1,0,0,2,0,4,0,1789,1,4,"London : printed and sold by I. Garner, No. 57, Wych-Street. Also sold by T. Scollick, City-Road, Moorfields; and J. Parsons, Paternoster-Row, M.DCC.LXXXIX. [1789].",London,379,male,1751,1797,FALSE,"reason, that the gifts gifts and calling of God are without repentance: Rom. XI 28, 29 To close the whole, we may observe, that the covenant between God and Abraham was faithfully performed on Abraham's part, during his time of trial: and God will never susser it to sail on"
0060500100_000321,"The holy Bible, containing the Old and New Testaments, Translated out of the Original Tongues, and with the Former Translations Diligently Compared and Revised. With select notes. Appointed to be Read in Churches.",,118,0,0,1,0,3,7,6,7,2,2,0,0,1,1,0,0,4,11,0,0,13,2,2,1,0,0,1,0,3,11,1,3,7,2,0,5,3,2,0,5,0,2,0,0,0,1,3,2,0,0,0,2,0,1,1,0,0,0,0,0,1796,1,1,"London : printed by M. Ritchie, Middle-Street, Cloth Fair, for J. Wright, 169, Piccadilly, MDCCXCVI. [1796].",London,1736,unknown,,,FALSE,"and keep up to Samaria, and besieged it three my commandments , and my statutes, ac years. cording to all the law which I com 6 In the ninth year of Holhea, the manded your fathers , and which I sent king of Assyria took Samaria, and car to you"
1152400600_000135,"The book of common prayer, and administration of the sacraments, and other Rites and Ceremonies of the Church, According to the Use of the Church of England: together with the Psalter or Psalms of David, Pointed as they are to be sung or said in Churches.",Church of England,86,1,1,0,0,4,1,0,0,0,1,0,1,3,0,1,0,2,0,4,3,0,0,3,0,0,2,1,2,1,2,3,0,3,0,0,11,2,1,1,2,0,0,0,7,0,1,0,1,0,1,1,3,0,1,1,3,1,3,5,2,1779,1,1,"Cambridge : printed by John Archdeacon, Printer to the University; and sold by John, Francis, & Charles Rivington, Benjamin White, and Thomas Beecroft, in London; and T. & J. Merrill, in Cambridge, [1779].",Cambridge,338,unknown,,,FALSE,"works . 3 Rejoice in his holy Name: let the heart of them rejoice that seek the Lord. 4 Seek the Lord and his strength : seek his face evermore. 5 Remember the marvellous works that he hath done: his wonders, and the judgements of his mouth; 6 0 ye"
1687900101_000044,"The Holy Bible, Containing the Old testament and the New: newly translated out of the original tongues, and with the former translations diligently compared and revised, by His Majesty's special command. Appointed to be read in churches.",,90,0,0,4,1,2,3,0,0,0,3,0,1,2,0,2,0,4,1,0,1,13,0,2,0,3,0,0,1,1,3,2,0,1,1,1,3,2,1,8,0,0,0,0,1,7,0,2,0,0,3,0,0,0,3,0,2,0,6,0,0,1767,1,2,"Cambridge : Printed by John Archdeacon printer to the University; and sold by John Beecroft, John Rivington, Benjamin White, and Edward Dilly, in London; and T. & J. Merrill, in Cambridge, 1767.",Cambridge,561,unknown,,,FALSE,"is found, and brought up by Pharaoh's daughter 15 He fleetb into Midian. A ND there went a man of the house of Levi, and took to wife a daughter of Levi. 2 And the woman conceived and bare a son: and when (he saw him that he was a"
1333700100_001033,"The Holy Bible, containing the Old and New Testaments: translated out of the original tongues: and with the former translations diligently compared and revised. And the Apocrypha: with marginal references.","Berriman, Jacob R.",95,1,0,1,1,1,3,0,0,0,3,0,0,12,2,0,0,9,0,1,3,14,0,3,1,2,2,0,1,2,2,5,0,2,0,1,4,0,0,4,1,0,0,0,2,3,0,0,1,0,0,1,0,2,1,0,2,0,0,1,1,1796,1,1,"Philadelphia : Printed for Berriman & Co. by Jacob R. Berriman, MDCCXCVI. [1796]",Philadelphia,820,unknown,,,FALSE,"not so mluch as to set his foot on: yet he promised that he would give it: to him for a poffeilion, and to his seed after him, when as yet he had no child. 6 And God spake on this wise, That his seed thould fojoirrn in a firange"
1687900102_000072,"The Holy Bible, Containing the Old testament and the New: newly translated out of the original tongues, and with the former translations diligently compared and revised, by His Majesty's special command. Appointed to be read in churches.",,87,0,0,3,2,0,0,1,1,0,1,1,1,0,1,1,0,1,2,1,1,4,8,2,2,1,1,0,0,1,5,3,2,4,2,0,2,0,0,0,2,0,0,1,4,0,0,5,5,4,0,0,2,0,0,0,2,1,0,7,0,1767,2,2,"Cambridge : Printed by John Archdeacon printer to the University; and sold by John Beecroft, John Rivington, Benjamin White, and Edward Dilly, in London; and T. & J. Merrill, in Cambridge, 1767.",Cambridge,448,unknown,,,FALSE,"give you an expected end. 12 Then ( hall ye call upon me, and ye shall go and pray unto me, and I will hearken urto you. 13 And ye ( hall seek me, and find me, when ye Shall search for me with all your heart . 14 And"
1172600900_000047,"The whole book of Psalms, collected into English metre, by Thomas Sternhold, John Hopkins, and others: Conferred with the Hebrew. Set forth and allowed to be Sung in all Churches, of all the People together, before and after Morning and Evening Prayer, and also before and after Sermons; and moreover in Private Houses, for their godly Solace and Comfort: Laying apart all ungodly Songs and Ballads, which tend only to the nourishing of Vice, and corrupting of Youth.",,82,1,0,0,0,2,0,0,1,0,2,0,1,3,0,0,1,2,1,1,2,2,0,3,0,0,3,1,2,1,1,1,0,3,0,0,14,1,1,1,0,0,2,0,7,1,1,0,1,0,1,3,3,0,0,1,2,1,3,3,2,1772,1,1,"London : printed by Charles Rivington, for the Company of Stationers, 1772.",London,311,unknown,,,FALSE,"no oppressor's hand he suffered them to take: But even great and mighty kings reproved for their sake. t5 And thus he said, Touch ye not those that mine anointed be; Nor Nor do the prophets any harm that do pertain to me. 16 He called a dearth upon the"
0073800100_000052,"The holy Bible, containing the Old Testament and the New: Newly Translated out of the Original Tongues, and With the former Translations Diligently Compared and Revised. By His Majesty's Special Command. Appointed to be read in Churches.",,113,3,3,0,1,1,2,0,0,0,0,1,3,16,0,2,0,1,0,1,1,4,15,2,0,0,2,2,2,5,5,0,0,0,1,0,14,0,1,5,0,0,2,0,4,8,0,0,0,0,0,1,2,0,1,0,1,0,0,0,1,1750,1,1,"London : printed by Thomas Baskett, Printer to the King's most Excellent Majesty; and by the assigns of Robert Baskett, M.DCC.L. [1750].",London,1207,unknown,,,FALSE,"Mores said, Thou hast spoken coasts of Egypt : very grievous uere they; well, I will see thy face again no more. before them there were no such locusts C H A P. XI as they, neither after them Shall be I Gods mrtfage to the Ifratlitis to borrow. such."
0879900100_001188,"The book of common prayer and administration of the sacraments, and other Rites and Ceremonies of the Church, According to the Use of The Church of England: Together with the Psalter, or Psalms of David, Pointed as they are to be sung or said in Churches.",Church of England,89,1,1,2,0,3,3,0,0,0,2,0,0,6,1,1,0,10,0,0,1,13,0,5,1,1,3,1,2,3,3,2,0,1,0,0,3,2,0,2,0,2,0,0,2,1,0,0,3,0,0,1,0,0,2,0,2,1,0,1,1,1763,1,1,"London : printed by Mark Baskett, Printer to the King's most Excellent Majesty; and by the assigns of Robert Baskett, MDCCLXIII. [1763].",London,1261,unknown,,,FALSE,"Emmor the father of Sychenm. 17 ibut when the time of the promise drew nigh, which God had sworn to Abraham, the people grew and multiplied in Egypt , is Till another king arose, which knew not Joseph. 19 The same dealt fubtilly with our kindred, and evil entreated our"
0073900302_000046,"The holy Bible, containing the Old and New Testaments; Translated out of the Original Tongues, and With the former Translations diligently compared and revised, by his Majesty's Special Command. Appointed to be Read in Churches.",,78,0,0,2,1,1,1,2,3,0,0,2,1,2,3,2,0,1,0,1,0,4,7,0,0,1,2,3,0,1,1,0,3,1,1,0,2,1,0,0,1,2,1,3,4,0,0,2,3,2,0,0,0,1,0,0,2,6,0,2,0,1796,2,2,"Cambridge : printed by John Archdeacon and John Burges, Printers to the University; and sold by C. Dilly, F. & C. Rivington, and B. & J. White, in London; and J. & J. Merrill, in Cambridge, MDCCXCVI. [1796]-98.",Cambridge,1094,unknown,,,FALSE,"han 19 Do they provoke me to did wor anger? saith the lord: do they 27 Th not provoke themselves to the all these confusion of their own faces ? they will 20 Therefore thus saith the thou tha Lord GOD ; Behold , mine anger but they and my"
1257500100_000472,"The compleat works of that eminent minister of God's word, Mr. Isaac Ambrose: Consisting of these Following treatises, viz. Prima, Media, et Ultima; or, the First, Middle, and Last things. Wherein is set forth; I. The Doctrine of Regeneration; or, the New Birth. II. Of sanctification, in the Means, Duties, and Ordinances, both Private and Public, for Continuance and Increase of a Godly Life. III. Certain Meditations on Man's Misery, in his Life, Death, Judgment; and on Heaven and Hell; as also, on God's Mercy, in his Redemption and Salvation. With a sermon added, concerning redeeming the time. Looking unto Jesus, as carrying on the Great Work of Man's Salvation. War with Devils; Ministration of, and Communion with, Angels.",Isaac Ambrose,106,0,3,1,0,2,1,0,7,0,1,1,0,3,0,0,1,1,1,0,1,15,5,2,1,0,0,0,3,1,2,0,0,2,0,0,2,7,0,4,3,4,0,1,12,0,0,1,1,0,0,0,1,0,4,1,1,2,0,6,2,1768,1,1,"Glasgow : printed by Joseph Galbraith, and to be sold at his Printing-Office in Paul's Closs above the Cross, M,DCC,LXVIII. [1768].",Glasgow,658,male,1604,1664,FALSE,"forty days and forty nights, that the Lord gave me the then ye shall be a peculiar treasure unto me above all peo twvo tables of stone, even the tables of the covenant,  pie; for all the earth is mine: and ye ( hall be unto me a ver."
0074800700_000134,"The holy Bible, containing the Old and New Testaments: Newly Translated out of Original Tongues; and with the former Translations Diligently Compared and Revised. By his Majesty's Special Command. Appointed to be Read in Churches.",,99,12,0,1,4,1,4,4,2,1,2,0,0,5,1,1,0,2,0,3,0,1,1,2,1,2,0,0,0,1,10,0,0,2,0,0,4,1,2,8,0,0,3,0,5,0,0,0,0,0,0,1,0,0,1,0,2,2,6,1,0,1751,1,1,"Edinburgh : printed by Adrian Watkins, His Majesty's Printer, MDCCLI. [1751].",Edinburgh,842,unknown,,,FALSE,"con sage through his border: wherefore Irael gregation of the LORD, into this wilderness, turned away from him. that we and our cattle should die there zz ¶ And the children of Israel , evtr 5 And wherefore have ye made us to the whole congregation, journeyed from come up"
0074200100_000047,"The holy Bible, containing the Old Testament and the New: Newly Translated out of the Original Tongues, And with the former Translations diligently Compared and Revised, By His Majesty's special Command. Appointed to be read in Churches.",,110,9,2,2,3,1,1,0,2,0,0,1,0,10,0,0,0,1,0,1,0,2,3,4,1,0,6,0,0,2,1,0,0,1,0,2,10,0,0,6,0,0,0,0,3,10,0,0,1,0,10,0,0,1,2,0,5,0,6,1,0,1756,1,1,"Cambridge : printed by Joseph Bentham Printer to the University, by whom they are sold in Cambridge, and by B. Dod in Ave-Mary Lane, London, [1756]-58.",Cambridge,841,unknown,,,FALSE,"at And the tonnes of Izhar; Korah, and rod before Pharaoh , and before his ser Nepheg, and Zichri. vants, and it became a serpent. an And the fans of .Uzziel; Mifhael, ri Then Pharaoh also called the wife. andelzaphan, and Zitlri. men, and the sorcerers: now the magi. a;"
