1334400101_000862,"The Christian's family Bible. Containing the Old and New Testaments at large; and the Apocrypha. With comments and annotations, theological historical, critical, and moral: by the Reverend W. Rider, A.B. late of Jesus College, Oxford, one of the Masters of St. Paul's School, and Chaplain to the Worshipful Company of Mercers.",William Rider,86,2,5,2,1,3,1,0,4,0,0,0,0,1,1,1,0,2,0,0,2,5,0,1,0,0,0,0,1,1,5,0,4,10,0,1,0,0,0,1,0,8,5,4,2,1,0,6,2,0,0,0,2,0,1,0,0,0,0,1,0,1770,1,3,"London : printed for Robinson and Roberts, in Paternoster-Row, MDCCLXX. [1770].",London,1091,male,1723,1785,FALSE,"of the houle of God , gave unto the priests for the \pa'fs over offerings two thousand and six hundred small cattle, and three hundred oxen. 9 Conomiah also, and Shemaiah, and Nethaneel, his brethren, and Hathabiah, and Jeiel, and Jozabad, chief of the levites, gave unto the Levites for"
1152400800_000099,"The book of common prayer, and administration of the sacraments, and other Rites and Ceremonies of the Church, According to the Use of the Church of England: together with the Psalter or Psalms of David, Pointed as they are to be Sung or Said in Churches.",Church of England,85,0,0,0,0,3,2,0,2,0,1,0,2,3,1,0,1,0,1,1,5,11,0,3,0,2,3,2,1,0,4,2,1,0,0,1,3,1,0,0,0,0,0,0,4,0,2,0,0,0,2,2,2,1,3,3,3,0,5,0,2,1752,1,1,"Oxford : printed by Thomas Baskett, Printer to the University, MDCCLII. [1752].",Oxford,113,unknown,,,FALSE,"from the hand of the enemy; 7 To the intent, that when they came up: they might show 44 How he had wrought his miracles in Egypt : and his won their children the same; ders in the field of Zoan. 8 That they might put their trust in God"
0073800500_000046,"The holy Bible, containing the Old Testament and the New: Newly Translated out of the Original Tongues, And with the former Translations diligently Compared and Revised. By His Majesty's special Command. Appointed to be read in Churches.",,106,5,2,2,4,0,10,0,0,0,1,0,0,7,1,0,0,1,0,2,1,4,5,3,0,1,0,0,0,1,7,2,0,2,2,2,9,0,0,7,0,0,0,0,7,10,0,0,0,0,0,0,1,1,1,0,0,0,0,1,4,1735,1,1,"London : printed by John Baskett, Printer to the King's most Excellent Majesty. MDCCXXXV. Cum Privilegio, [1735].",London,838,unknown,,,FALSE,"will do to Pha 7 Ye nhali no more give the people fraw raoh: for with a strong hand shall he let to make brick, as heretofore: let them go them go, and with a firong ha: d Shall he and gather straw for themselves. drive them out of his"
0714400200_000314,"The christian's comlete [sic] family Bible, containing the sacred text of the Old and New Testament at large. And the Apocrypha. Illustrated with notes and comments; whereby The difficult Passages are explained; the Mistranslations corrected; and the seeming Contradictions, found in the Oracles of Truth, reconciled; A Work of the greatest Use in all Families desirous of understanding the Sacred Writings, the Foundations on which all their Hopes of Happiness in a future Life are grounded. By several eminent divines of the Church of England.",,104,0,1,0,1,2,4,2,5,1,0,8,0,5,2,2,0,4,0,1,0,15,0,1,3,2,1,6,0,1,3,0,0,3,2,0,5,2,0,5,3,0,1,0,2,0,1,0,0,0,1,1,0,1,0,0,1,2,1,2,1,1789,1,1,"Manchester : printed by J. Harrop, opposite the Exchange, MDCCXXXIX [1739, i.e. 1789].",Manchester,888,unknown,,,FALSE,"punishing the contemners of his laws : who, from the recitude of his nature, will be as far from letting moral evils pass with impunity, as fire is from not conluming its pro. per fuel. 26 Icall heaven and earth to witnjefs.] A fixurative and animated expression, whereby he in"
1508901100_000631,"The Holy Bible, containing the Old and New Testaments: Newly translated out of the original tongues, and with the former translations diligently compared and revised. By His Majesty's special command. Appointed to be read in churches.",,78,0,0,3,1,0,0,1,0,1,2,1,0,11,1,0,1,0,2,1,0,2,5,3,0,1,0,0,0,0,1,3,1,7,0,0,5,0,0,0,2,0,1,0,2,3,0,0,2,1,4,1,2,0,0,0,2,1,2,2,0,1756,1,1,"Oxford : Printed by Thomas Baskett, printer to the University, MDCCLVI. [1756].",Oxford,1090,unknown,,,FALSE,"unto him, The LORD saith thus, Behold , that which I have built will I break down, and that which I have planted I will pluck up, even this whole land . 9 And feekeft thou great things for thyself? seek them not: for behold , I will bring evil"
1063300202_000028,"Dissertations, essays, and discourses, &c. in prose and verse. By Dr. Fortescue. ...",James Fortescue,86,0,0,3,0,1,0,0,1,0,0,1,0,7,1,0,3,2,4,0,0,12,0,2,5,1,2,1,1,1,2,0,0,2,0,0,4,0,2,4,0,1,0,1,1,3,1,3,0,3,0,2,1,0,0,1,1,1,2,1,2,1759,2,2,"Oxford : printed by W. Jackson; and sold by Mess. Dodsley, Owen, and Rivington and Fletcher in London; and J. Fletcher in Oxford, MDCCLIX. [1759].",Oxford,283,male,1716,1777,FALSE,"and priests he seems to stand Unmoved, in faith , and claims the promised land . Nor fears to seek, nor yet ashamed to own Himself a pilgrim to a land unknown. See, him of Egypt's every good bereft, His house , his friends, his goods behind him left :"
0073900301_000298,"The holy Bible, containing the Old and New Testaments; Translated out of the Original Tongues, and With the former Translations diligently compared and revised, by his Majesty's Special Command. Appointed to be Read in Churches.",,109,0,1,1,0,2,8,4,6,0,2,0,0,1,1,0,0,2,9,1,0,12,2,2,0,0,0,0,0,3,13,1,4,8,2,0,5,2,1,2,5,0,2,0,0,0,1,3,1,0,0,0,1,0,0,1,0,0,0,0,0,1796,1,2,"Cambridge : printed by John Archdeacon and John Burges, Printers to the University; and sold by C. Dilly, F. & C. Rivington, and B. & J. White, in London; and J. & J. Merrill, in Cambridge, MDCCXCVI. [1796]-98.",Cambridge,988,unknown,,,FALSE,"and their daughters to pass through the fire, and used divination and enchantments, and sold themselves to do evil in the sight of the LORD, to provoke him to anger. 18 Therefore the LORD was very angry with Israel , and removed them out of his fight: there was none"
0984400203_000054,"The Holy Bible translated from the Latin Vulgat: ... first published by the English College at Doway, Anno 1609. Newly revised, and corrected, according to the Clementin edition of the Scriptures. With annotations ...",Richard Challoner,95,1,0,0,0,4,4,0,3,0,0,1,2,2,0,0,2,4,0,1,3,13,0,3,0,2,3,3,1,0,5,2,0,0,1,0,1,3,0,1,0,0,1,0,4,0,2,0,0,1,2,3,0,2,0,0,4,1,7,1,2,1750,3,4,"[Dublin?] : Printed in the year, 1750.",Dublin,485,male,1691,1781,FALSE,"saw thee; and they were afraid, and the depths were troubled. 8 Great was the noise of the waters : the clouds sent out a sound. For thy arrows pass , 19 the voice of thy thunder in a wheel. Thy lightenings enlightened the world: the earth ihook and trembled."
0078500200_000373,"The holy Bible, containing the Old Testament and the New: Newly Translated out of the Original Tongues, and With the former Translations diligently compared and revised, By His Majesty's Special Command. Appointed to be read in Churches.",,118,2,9,1,2,1,1,0,3,1,0,0,0,0,2,0,1,5,0,0,4,9,2,3,0,2,2,0,4,5,5,0,4,11,0,1,1,0,0,1,0,7,5,1,7,0,0,7,0,0,0,0,0,0,1,0,0,0,0,6,2,1760,1,1,"Cambridge : printed by Joseph Bentham, Printer to the University, by whom they are sold in Cambridge, and by Benj. Dod Bookseller in Ave-Mary Lane, London, 1760.",Cambridge,1233,unknown,,,FALSE,"the kings of ludah had destroyed. bring evil upon this place, and upon the z2 And the men did the work faithful inhabitants thereof, even all the curies iy: andtheoverfeersofthemwerejahath, taa: are written in the book which they and Obadiah, the Levites, of the soils of have read before the"
0056800101_000250,"An abstract of the historical part of the Old Testament, With References to other Parts of the Scripture, but especially to the New Testament, which are placed at length in an opposite Column. To which are added, Observations of the Bishop of Sodor and Man thereupon. Also a map of the Travels of the Children of Israel through the Red-Sea, and the Wilderness, into the Holy Land, wherein the Distance in Miles between each Encampment is set down. II. An Essay for composing a harmony between the Psalms and the New Testament; wherein the Supplicatory and Prophetick Parts of this Sacred Book are disposed under proper Heads. III. The Harmony of the Four Gospels, wherein the different Manner of relating the Facts by each Evangelist is exemplified. To which are annexed, References to other Parts of the Scriptures, with the History of the Acts of the Apostles. Inscribed to The Founders, Benefactors, and Trustees of the Charity Schools, in and about the Cities of London and Westminster, and Bills of Mortality. By the Honourable Edward Harley, Esq; their Chairman. ...",Edward Harley,118,1,8,2,2,1,2,0,5,1,1,0,0,0,2,0,0,4,0,0,1,9,0,3,0,3,2,0,4,5,10,0,4,15,0,0,0,2,1,1,0,6,1,1,4,0,0,4,1,0,0,0,0,1,1,0,0,0,0,9,1,1735,1,2,"London : sold by Messieurs Ward and Wicksteed, in the Inner-Temple Lane, M.DCC.XXXV. [1735].",London,749,male,1664,1735,FALSE,"Scribe, I have found the BOOK of the LAW in the House of the LORD. And Hilkiah delivered the Book to Shaphan: 16 And Shaphan carried the Book to the King . 18 And Shaphan read it before the King . 19 And it came to pass when the King"
0074800100_000067,"The holy Bible: that is, the sacred Scriptures contained in the Old and New Testament. Translated According to the Hebrew and Greek; and Conferred with the best Translations in Divers Languages. With Most Profitable Annotations upon all the Hard Places, and Other Things of Great Importance. By the Archbishops, Bishops, Etc. Etc.",,104,0,0,3,3,1,6,0,0,0,3,0,1,5,1,1,1,5,2,1,1,22,0,2,0,3,0,0,1,0,5,2,0,1,1,1,5,2,1,9,0,0,1,0,3,3,0,1,0,0,0,0,0,0,0,0,2,0,5,0,0,1775,1,1,"London : printed by M. Lewis, Paternoster-Row, for Mess. Buckland, Keith, Vallance and Simmons, MDCCLXXV. [1775].",London,1171,unknown,,,FALSE,"to the providencc o. God , sfhoin she :, ick. envy them. could not keep from th'. rr,. of the tyrant. T here feem'ib have been the chief of the ref.  Man's., counsel cannot -, hisder that wlsich God bath bis, disobedizer lleeitsreintwas lsthlsf, but theirc difni. determinflle tal"
0714400201_000401,"The christian's comlete [sic] family Bible, containing the sacred text of the Old and New Testament at large. And the Apocrypha. Illustrated with notes and comments; whereby The difficult Passages are explained; the Mistranslations corrected; and the seeming Contradictions, found in the Oracles of Truth, reconciled; A Work of the greatest Use in all Families desirous of understanding the Sacred Writings, the Foundations on which all their Hopes of Happiness in a future Life are grounded. By several eminent divines of the Church of England.",,99,0,1,1,1,2,1,1,3,0,1,1,0,1,1,0,0,6,0,0,1,9,1,1,7,0,3,0,1,4,7,1,0,5,2,1,7,1,1,1,1,0,0,0,4,0,1,0,2,1,0,0,3,1,0,0,3,8,0,1,1,1789,1,1,"Manchester : printed by J. Harrop, opposite the Exchange, MDCCXXXIX [1739, i.e. 1789].",Manchester,888,unknown,,,FALSE,"-- -- -- -1 -- -- 3 - g -- -· JI, L ispocryplja. Bai 7 For all these plagues are come upon us, which the Lord hath pronounced against us. S Yet have we not prayed before the Lord, that we might turn every man from the imaginations of"
1127200501_000058,"The holy Bible, containing the Old Testament and the New: Newly Translated out of the Original Tongues, And with the former Translations diligently Compared and Revised, By His Majesty's special Command. Appointed to be read in Churches.",,119,1,0,1,0,3,4,0,0,0,5,1,1,2,0,1,0,10,1,1,0,9,0,4,1,0,0,0,1,1,6,1,0,0,2,1,2,11,0,15,1,1,0,0,20,2,0,0,0,1,1,1,0,0,1,0,0,2,0,4,0,1743,1,2,"Cambridge : printed by Joseph Bentham, Printer to the University, MDCCXLIII. [1743].",Cambridge,473,unknown,,,FALSE,"may drink. and Moses said unto them, of the one was Gerhom, (for he said, I Why chide you with me wherefore do have been an alien in. a ftrangeland :) ye tempt the LORD I 4 And the name of the other was Elie Anid the people thirsted there"
1050300300_000185,"The church-of-England-Man's companion: containing the Book of Common Prayer, and administration of the sacraments, and other Rites and Ceremonies of the Church, According to the Use of the Church of England, together with the Psalter or Psalms of David, Pointed as they are to be sung or said in Churches; and the Form or Manner of Making, Ordaining, and Consecrating of Bishops, Priests, and Deacons; with Notes, Practical and Explanatory. Extracted from the Works of several learned and pious Divines, and other ingenious Commentators.",Church of England,82,1,0,0,0,3,1,0,0,0,1,3,1,3,0,2,1,1,0,2,2,4,1,0,0,0,2,1,2,1,3,3,0,3,0,0,11,1,0,1,1,0,0,0,8,0,0,0,1,0,1,0,4,0,1,1,2,0,1,5,3,1780,1,1,"Chester : printed by J. Poole, in Foregate-Street, MDCCLXXX. [1780].",Chester,506,unknown,,,FALSE,"face of the earth . 31 The glorious Majesty .of the Lord hall endure for ever: the Lord Shall re. joice in his works . 32 The earth shall tremble at the look of him: if he do but touch the hills, they shall smoke. 33 1 will sing unto"
0879900100_000488,"The book of common prayer and administration of the sacraments, and other Rites and Ceremonies of the Church, According to the Use of The Church of England: Together with the Psalter, or Psalms of David, Pointed as they are to be sung or said in Churches.",Church of England,101,0,1,1,0,3,4,6,8,0,1,0,0,1,2,0,0,3,6,0,0,10,1,1,1,0,0,1,0,3,10,1,3,6,2,0,5,3,2,0,4,0,1,0,0,0,1,2,3,0,0,0,2,1,0,1,1,0,0,0,0,1763,1,1,"London : printed by Mark Baskett, Printer to the King's most Excellent Majesty; and by the assigns of Robert Baskett, MDCCLXIII. [1763].",London,1261,unknown,,,FALSE,"places in all their cities , from the tower of the watchmen, to the fenced city . o1 And they set them up t images and groves f Heb. in every high hill, and under every green tree: latues. I And there they burnt incense in all the high places,"
0070600600_000047,"The holy Bible, containing the Old Testament and the New: Newly Translated out of the Original Tongues, and With the former Translations Diligently Compared and Revised, By His Majesty's Special Command. Appointed to be read in Churches.",,100,4,0,3,3,0,9,0,1,0,2,0,0,5,2,0,0,1,0,1,1,7,2,1,1,1,0,0,0,1,10,1,0,2,2,1,5,0,0,4,0,0,0,0,10,11,0,0,0,0,0,0,2,1,0,0,0,1,0,1,4,1764,1,1,"London : printed by Mark Baskett, Printer to the King's most Excellent Majesty; and by the assigns of Robert Baskett, M.DCC.LXIV. [1764].",London,1029,unknown,,,FALSE,"the Jfratit s t a. 22 Msel coi.plainetb to God . A ND afterward Moles and Aaron went , in and told Pharaoh , Thus saith the LORD God of Israel , Let my people go, that they may hold a feast unto me in the wilderness. 2 And Pharaoh"
0071500200_000777,"The Holy Bible, containing the Old and New Testament: ...",,69,1,0,1,2,1,4,0,2,0,0,1,0,1,3,2,3,3,1,0,4,2,0,2,2,1,0,1,0,2,2,2,0,1,0,0,1,1,0,1,2,2,0,0,7,1,0,1,2,0,1,1,2,0,0,0,2,0,1,0,0,1728,1,1,"Oxford : printed by John Baskett, 1728.",Oxford,861,unknown,,,FALSE,"thy way, and b fllew my people their more for you? saith the Lord. s 4 s. finul deeds, and their children their wickedness, : i Thus saith the Almighty Lord, When you which they have done against me that they may were in the wilderness, Uj in the river"
0892000201_000111,"The Christian's magazine, or A treasury of divine knowledge.","Coote, J. (John)",89,0,2,0,1,0,2,1,1,0,2,0,1,5,0,0,2,2,1,0,3,18,0,0,0,0,1,2,2,1,1,1,0,4,0,0,5,5,1,1,0,0,0,2,4,2,1,0,1,0,0,1,2,1,0,7,1,0,2,0,0,1760,1,7,"London [England] : printed pursuant to his Majesty's royal licence, for J. Newbery in St. Paul's Church Yard, and J. Coote in Pater-Noster Row, [1760]-M DCC LXVII. [1767].",London,471,unknown,,,FALSE,"to be dead; but God had wonderfully preserved him to be the saviour of his family. Pharaoh , king of Egypt had given him the government of his kingdom. : Jacob , beil; ic his death, particularly blessed each of his children , prophesying things to come. He told j7dah,"
1522900100_000940,"The Holy Bible, Containing the Old and New Testaments: with arguments prefixed to the different books; and moral and theological observations illustrating each chapter: composed by the Reverend Mr. Ostervald, professor of divinity, and one of the ministers of the church at Nenschatel in Swisserland. Translated at the desire of, and recommended by, the Society for Propagating Christian Knowledge.",Jean-Frédéric Osterwald,91,1,0,2,1,2,2,0,0,0,2,0,0,8,2,0,0,12,0,1,4,13,0,2,1,2,1,1,1,1,1,3,0,2,0,1,8,0,0,5,1,1,0,0,2,2,0,0,0,0,0,1,0,1,1,0,1,1,0,0,1,1797,1,1,"Edinburgh : Printed by Mark and Charles Kerr, His Majesty's printers; and sold by James Gillies, bookseller, Glasgow, MDCCXCVII. [1797].",Edinburgh,987,male,1663,1747,FALSE,"the land of Madian, where he bqgat two sons. 3o And, when forty years were expiredi, there apl s uses, peared to him in the wilderness of mount Sina an sa"" angel of the Lord in a flame of fire in a bush. 3z When Moses saw it he wondered"
0077200103_000120,"The holy Bible, containing the Old and New Testament; with notes Explanatory, Critical, and Practical, Selected from the works of Several Eminent Divines. ...",,81,0,0,2,2,1,1,1,4,0,0,2,1,2,3,2,0,4,0,1,0,6,2,0,0,1,2,5,0,3,1,0,3,1,1,0,3,1,0,0,1,3,0,0,5,0,0,1,2,2,0,0,1,1,0,0,2,6,0,2,0,1774,3,5,"London : printed and sold by I. Moore and Co. Letter-Founders and Printers, in Queen-Street, near Upper-Moorfields, M.LCC.LXXV. 1774-76. [1775].",London,1007,unknown,,,FALSE,"and the fathers kindle the fire, and the women knead their dough, to make cakes to the queen of heaven , and to pour out drink offerings unto other gods , that they may provoke me to anger. 19 Do they provoke me to anger? saith the LORD: do they"
1053800100_000017,"Cheap repository tracts for Sunday reading. To which are added, some prayers for individuals and for families.",,70,0,1,2,4,3,1,1,0,1,1,3,0,4,1,1,0,2,0,3,0,3,0,1,0,2,1,1,0,1,1,4,0,2,1,2,4,0,1,1,0,0,2,0,4,3,1,0,0,0,0,1,3,1,0,0,0,0,1,0,1,1800,1,1,"London : sold printed by Bye and Law, St. John's Square, Clerkenwell; and sold by F. and C. Rivington, No. 62. St. Paul's Church-Yard; J. Evans, No. 41, Long Lane, West-Smithfield; J. Hatchard, No. 173, Piccadilly; and S. Hazard, Bath, 1800.",London,405,unknown,,,FALSE,"of the dust, and lifteth the poor out of the mire, that he may set him with the princes, even with the princes of the people ."" It is true, he Sometimes afflics even his most favoured people ; "" He brings down, as it is said, their heart through"
1302700800_000151,"The book of common prayer and administration of the sacraments, and other rites and ceremonies of the church, according to the use of the Church of England: Together with the Psalter or Psalms of David, pointed as they are to be sung or said in churches; and the form or manner of making, ordaining, and consecrating of bishops, priests, and deacons.",Church of England,83,2,1,0,0,4,0,0,0,0,1,1,1,3,0,0,0,2,0,4,3,3,0,1,0,0,1,1,1,1,2,2,0,3,0,0,10,2,1,1,1,0,0,0,8,0,1,0,1,0,1,1,4,0,1,1,3,0,3,5,2,1772,1,1,"Oxford : Printed by T. Wright and W. Gill, printers to the University: and sold by S. Crowder, in Paternoster Row, London; and by W. Jackson, in the High Street, Oxford, MDCCLXXII. [1772].",Oxford,404,unknown,,,FALSE,"7 He is the Lord our God -: his judgements are in all the wrdi"" i He hath been always mindful of his covenant and promise : ""that; he made to a thousand generations; 9 Even the covenant that he made with Abraham : and the oath that he fware"
1666400100_001230,"The complete British family Bible: being a new universal exposition and commentary on the Holy Scriptures. Containing the sacred text of the Old and New Testaments, with the Apocrypha, at large. Illustrated with notes ... By Paul Wright, ... Embellished with ... copper-plates ...","Wright, Paul",90,1,1,2,0,4,1,0,0,0,2,0,0,4,1,1,0,11,0,0,1,14,0,4,1,1,2,2,1,2,1,5,0,1,0,1,4,0,0,7,0,2,0,0,2,1,0,0,3,0,0,0,0,1,1,0,2,1,0,1,1,1781,1,1,"London : printed for Alex. Hogg, 1781.",London,1153,unknown,,,FALSE,"4~ Then seat Joseph, and called his father Jacob to him, and all his kindred, threelcore and fifteen souls. IS So Jacob went down into Egyfpt and died, he, and our Fathers , 16 And were carried over into Sychem, and laid in the sepulchre that Abraham bought for a"
0074800100_000075,"The holy Bible: that is, the sacred Scriptures contained in the Old and New Testament. Translated According to the Hebrew and Greek; and Conferred with the best Translations in Divers Languages. With Most Profitable Annotations upon all the Hard Places, and Other Things of Great Importance. By the Archbishops, Bishops, Etc. Etc.",,94,3,0,1,1,2,3,0,0,0,0,3,1,6,0,1,0,2,1,1,0,7,0,3,0,0,3,3,0,4,2,0,0,0,2,4,5,1,0,9,0,1,0,0,2,9,0,0,0,1,0,1,6,0,1,0,1,0,0,3,1,1775,1,1,"London : printed by M. Lewis, Paternoster-Row, for Mess. Buckland, Keith, Vallance and Simmons, MDCCLXXV. [1775].",London,1171,unknown,,,FALSE,"to rain a might great hail, such as was not in as the Lord had said t by Moses . t nl. it edgpt, since tl.c foundation thereof was laid , im: tscf unto this time. C H A P. X t9 Send therefore now, and  gather thy cat"
0332900200_000203,"Explanatory notes upon the New Testament. By John Wesley, M. A. Late Fellow of Lincoln-College, Oxford.",John Wesley,98,1,1,2,0,3,2,0,0,0,2,1,0,6,1,1,0,8,0,0,1,21,0,4,1,1,2,2,2,0,2,1,0,0,1,0,2,1,0,6,0,6,0,0,2,0,1,0,5,0,0,1,0,0,1,0,3,1,0,1,2,1788,1,1,"London : printed for the author: and sold at the New-Chapel, City-Road, and by all the Booksellers in Town and Country, M,DCC,LXXXVIII. [1788].",London,916,male,1703,1791,TRUE,"the wilderners, in a flame of fire in a bull. And Moses feeing it, wondered at the sight. But as he drew near to behold it, the 0.3 voice of the Lord came to him, I am the God of thy fathers , the God of Abraham, and the God"
0071500200_000054,"The Holy Bible, containing the Old and New Testament: ...",,118,14,4,3,5,0,8,0,2,0,0,0,0,12,0,0,0,2,0,2,1,2,1,3,2,0,2,0,0,0,5,0,0,4,1,1,7,0,0,8,0,0,0,0,1,18,0,0,1,0,2,0,1,0,3,0,2,0,1,0,0,1728,1,1,"Oxford : printed by John Baskett, 1728.",Oxford,861,unknown,,,FALSE,"not unto noses, for neb: t anguish of spirit, and for cruel bondage. P: rm.ft, IO And the LORD fpakeuntomofes, saying, /,  X Go in, speak unto Pharaoh king of Egypt , that he let the children of Israel go out of his land . I: And Moles spake"
0519100400_000031,"An easy introduction to the knowledge of nature, and reading the holy scriptures. Adapted to the capacities of children. By Mrs. Trimmer.",Sarah Trimmer,84,4,0,0,1,0,1,0,4,0,3,0,0,1,1,0,0,0,0,3,1,7,1,1,0,1,2,0,2,1,0,1,0,0,1,1,2,4,1,12,0,0,2,0,3,6,0,0,0,1,1,4,0,2,0,0,1,1,6,0,1,1789,1,1,"London : printed for T. Longman, and G. G. J. and J. Robinson, Paternoster-Row; and J. Johnson, St. Paul's Church-Yard, M.DCC.LXXXIX. [1789].",London,204,female,1741,1810,TRUE,"go; "" and he re. proved Moses and Aaron for hindering the people from their work , and laid severer tafls on them than before. GOD almighxty permitted him to. do so, that the deliverance he was going to bring about might appear the greater.' The people however were extremely"
0070900101_000064,The holy Bible containing the Old and New Testaments Newly translated out of the Original Tongues and with the former translations diligently compared & revised. By His Majesties special Command Appointed to be read in Churches.,,114,1,0,0,2,2,3,0,1,0,3,1,1,1,0,0,0,10,1,1,0,13,1,4,1,0,0,0,1,1,6,1,0,1,2,1,2,12,0,10,1,1,1,1,18,2,0,0,0,1,0,0,0,0,1,0,0,3,0,1,1,1772,1,2,"London : printed by C. Eyre & W. Strahan, His Majesty's Printers, MDCCLXXII. [1772].",London,1754,unknown,,,FALSE,"his wife unto Moses into the wildernefa, where he encamped at d the mount of God . d ch 6 And he said unto Moses , I thy - father in law Jethro am come unto thee, and thy wife, and her two sons with her. 7 ¶ And Moses"
1540800100_000046,"The Holy Bible, containing the Old testament and the New: Translated out of the original tongues, and with the former translations diligently compared and revised, by His Majesty's special command. Appointed to be read in churches.",,132,10,2,3,5,1,4,0,2,0,0,0,0,14,0,0,0,1,0,3,0,1,0,6,0,0,4,0,0,1,4,0,0,1,3,0,10,0,0,9,0,0,1,0,5,11,0,0,1,0,13,0,2,1,0,0,4,0,10,0,0,1792,1,1,"Oxford : Printed at the Clarendon Press, by W. Jackson and A. Hamilton, printers to the University; and sold by W. Dawson, at the Oxford Bible Warehouse, Paternoster Row, London, MDCCXCII. [1792].",Oxford,1198,unknown,,,FALSE,"LORD, IB this titor tha~lt know that I ame the Loan: behold , I will fmnite with the rod that is in mine hand upon the waters which are in the rivers , and they thall be turned to blood. a 3 And the sith that II in the river"
0074300100_000052,"The holy Bible, containing the Old Testament and the New: Newly Translated out of the Original Tongues, and With the former Translations Diligently Compared and Revised. By His Majesty's Special Command. Appointed to be read in Churches.",,105,3,0,1,2,3,2,0,0,0,0,3,3,12,1,5,0,3,0,2,0,6,5,3,0,0,4,2,0,3,1,0,0,0,2,2,8,0,2,9,0,1,0,0,2,11,0,0,0,0,0,0,1,0,1,0,2,0,0,0,0,1747,1,1,"London : printed by Thomas Baskett, Printer to the King's most Excellent Majesty; and by the assigns of Robert Baskett, M.DCC.XLVII. [1747].",London,1027,unknown,,,FALSE,"heart , and the heart of his for vants; that I might Show these my figni before him: 2 And that thou mayefl tell in the ears of thy son, and of thy sons son, wlhat things I have wrought in Egypt , and my signs which I have doneainongft"
