0184200404_000024,Choice of the best poetical pieces of the most eminent English poets. Published by Joseph Retzer. ...,,76,0,0,1,2,2,1,1,1,4,0,0,2,1,0,0,1,0,1,1,0,0,2,2,0,0,3,4,5,2,2,3,0,0,4,1,0,2,4,0,0,0,2,2,1,1,1,0,0,1,2,2,1,2,3,1,3,1,0,1,1783,4,6,"Vienna : printed for Sonnleithner and Hoerling, MDCCLXXXIII. [1783].",Vienna,334,unknown,,,FALSE,"in vain essay; vn, while you write, you take that praise away: Light to the stars the fun does thus restore, nut shines himself, till they are seen no more. Swift. On a Company of bad Dancers to good Music, How ill the motion with the music suits !] So"
0768900100_000055,"The beauties of the poets. Or, a collection of moral and sacred poetry from the most eminent authors.",,71,1,1,0,1,1,1,1,1,3,2,2,4,1,1,1,2,2,0,0,1,1,3,1,2,0,0,1,3,2,1,2,0,0,2,3,1,4,1,0,1,0,3,1,0,2,0,0,2,1,0,1,2,2,1,0,0,1,1,0,1773,1,1,"Bristol : printed by William Pine, M.DCC.LXXIII. [1773].",Bristol,333,unknown,,,FALSE,"solemn form the rituals are prepared, The feal is broken, and a groan is heard,. And :;; i tlhou, my soul, (0 fall to sudden prayer, \: idlct the thought fink deep!) shalt thou be there? Sec on the left (for by the great command Tile throng divided falls on"
0250601100_000024,"Miscellanies in prose and verse intended as a specimen of the types, at the Logographic Printing Office.",John Walter,78,1,3,0,1,3,1,2,3,1,3,0,0,0,0,0,1,0,1,3,0,1,0,2,1,0,2,1,1,0,3,2,0,0,1,3,2,5,3,2,0,1,2,0,0,5,1,0,3,3,1,1,2,0,1,1,1,2,1,1,1785,1,1,"London : printed and sold by J. Walter, Printing-House-Square, Blackfryars And At NO. 45. Lombard-Street, M,DCC,LXXXV. [1785].",London,253,male,1739,1812,FALSE,"happy ground, And with choicer plenty crowned. Here on all the shining boughs Knowledge fair and useful grows; On the same young flowery tree All the seasons you may see Notions in the bloom of light , Just disclosing to the sight; Here are thoughts of larger growth, Ripening into"
0081500122_000031,"The works of the English poets. With prefaces, biographical and critical, by Samuel Johnson. ...",Samuel Johnson,91,6,0,1,1,2,7,1,4,0,2,1,0,1,0,1,2,2,0,1,2,7,3,0,3,0,1,1,2,0,0,2,1,0,0,0,2,9,1,0,0,1,2,0,1,4,2,0,1,3,4,1,0,2,1,1,0,0,2,0,1779,22,58,"London : printed by H. Hughs; for C. Bathurst, J. Buckland, W. Strahan, J. Rivington and Sons, T. Davies, T. Payne, L. Davis, W. Owen, B. White, S. Crowder, T. Caslon, T. Longman, B. Law, E. and C. Dilly, J. Dodsley, H. Baldwin, J. Wilkie, J. Robson, J. Johnson, T. Lowndes, T. Becket, G. Robinson, T. Cadell, W. Davis, J. Nichols, F. Newbery, T. Evans, J. Ridley, R. Baldwin, G. Nicol, Leigh and Sotheby, J. Bew, N. Conant, J. Murray, W. Fox, J. Bowen, MDCCLXXIX. [1779]-80.",London,319,male,1709,1784,TRUE,"thy easy faith betray, Flora ranging, Like the moon and ocean changing, More inconflant proves than they. B E A U T Y, A N 0 D E. I. F AIR rival to the god of day, Beauty , to thy celestial ray A thousand Iprightly fruits we owe; Gay"
1442400100_000056,"Poems on divine subjects, [O]riginal and translated from the Latin of M. Hieron. Vida, Bp. of Alba. With large annotations more particularly concerning the being and attributes of God. The second edition. By Tho. Morell, A.M. fellow of King's College, Cambridge.",Thomas Morell,95,1,0,0,1,3,1,1,4,5,5,1,2,2,0,0,0,1,0,0,1,6,1,3,0,1,0,2,5,1,2,2,3,1,0,0,1,3,2,1,0,1,1,2,0,12,2,0,1,2,1,0,4,0,1,3,1,0,1,1,1736,1,1,"London : Printed by E. Owen in Amen-Corner; and sold by J. Walthoe in Cornhill; W. Bickerton in the Strand; and Olive Paine in Round-Court, 1736.",London,299,male,1703,1784,FALSE,"the Perils of the Sea, To face a Lion in his deathful Way, Or tempt the Horrors of the stormy Skies, When some imperious Damsel claims the Prize. Love's sweet Enchantments strike the Reason blind, And taint with Madness the too thoughtful Mind , To what strange Frenzy are some"
0866300500_000027,"Select pieces of poetry, intended to promote piety and virtue in the minds of young people. Collected by Rachel Barclay.","Barclay, Rachel",96,0,0,1,0,1,0,2,1,3,1,1,0,0,4,0,1,1,0,1,1,1,0,5,2,2,1,6,0,2,6,3,0,1,4,0,0,4,2,3,2,1,3,2,0,8,4,0,1,1,2,1,5,0,2,1,1,2,0,0,1795,1,1,"London : printed and sold by James Phillips, George Yard, Lombard Street, 1795.",London,186,male,1743,1792,FALSE,"this consecrated hour With better hopes be filled. Thy love the powers of thought bcftow'd To thee my thoughts would soar: L Thy mercy over my life has flowed ; That mercy I adore. In each event of life , how clear Thy ruling hand I see Each blessing to"
0332502100_000008,Poems on several occasions.,Thomas Moss,72,1,2,1,0,1,1,1,0,3,1,1,0,1,2,0,1,1,0,0,1,0,1,0,0,1,1,4,4,0,1,2,1,0,1,3,0,4,1,4,2,0,3,2,1,0,2,0,0,1,3,3,0,0,1,1,1,3,1,2,1769,1,1,"Wolverhampton : printed and sold by G. Smart; Mr. Longman, Pater-Noster-Row; and Mr. Dodsley, Pall-Mall, London, M.DCC.LXIX. [1769].",Wolverhampton,64,male,1738,1808,FALSE,"appointed to defend, Is sirs to menace, and is first to wound. Oh Jealousy! -- thou Foe of deadliest Bane! -- - Thou to thyself dof Miseries impart, And, like the Miser, feel a keener Pain , The greater is the Treasure of thy Heart . Tis thine, like Darkness"
0589501700_000015,"Sketches of beauty, natural and moral, sacred to love and virtue ; in six books ; designed for the late Lady Viscountess Valentia ; Dedicated, With Permission, To Her Grace The Duchess Of Devon.",Vicarius,92,0,2,0,0,3,3,0,2,0,1,3,0,1,1,1,1,2,1,2,1,4,2,3,1,0,0,4,4,2,1,2,0,1,4,3,1,9,1,6,0,1,1,0,0,1,3,0,0,0,3,1,2,1,0,0,2,1,4,0,1787,1,1,"London : printed by Sammells and Ritchie, Albion-Buildings, Bartholomew-Close, for the author, and sold at no.12, Brownlow-Street, Holborn; sold also by J. Stockdale, Piccadilly; W. Flexney, Holborn; J. French, Fenchurch-Street; J. Denis, New Bridge-Street; and J. and J. Fletcher, Oxford, MDCCLXXXVII. [1787].",London,240,unknown,,,FALSE,"95) Or shuddering, silent, joins the fentencejuft! Virtue with lifted hand , her eye incensed, Frowns fearfully vindictive; claiming loud, Tu her ftain'd honour, amplest fatisfaaion: Heaven owns the suit; the hand of perfect Love , Strait writes the sentence, "" Bitterness of soul !"" This with a stroke, raised"
0699700700_000027,"Horæ lyricæ. Poems chiefly of the lyric kind, in three books. ... By I. Watts, D.D.",Isaac Watts,95,1,0,1,4,2,2,1,5,2,2,3,1,0,1,0,1,2,0,0,2,1,3,1,0,1,1,4,4,1,0,3,2,0,2,3,1,11,2,3,2,2,2,0,0,3,0,0,1,2,3,0,3,0,1,0,0,1,2,0,1731,1,1,"London : printed for Richard Hett, 1731.",London,368,male,1674,1748,TRUE,"to return again. 1v. I feel my warmest Passions dead To all that Earth can boast; This Soul of mine was never made For Vanity and Duff. V Now I can fix my Thoughts above, Amidf their flattering Charms , Till the dear Lo R D that hath my Love"
1012600300_000062,"The polite instructor; or, youth's museum. Consisting of moral essays, tales, fables, visions, and allegories. Selected from the most approved modern authors. With an introduction, containing rules for reading with elegance and propriety. To the whole is added, a collection of letters. With some rules prefixed, useful for supporting a genteel epistolary correspondence.",,82,1,1,1,0,2,1,2,2,1,0,1,0,0,0,0,1,1,0,0,0,2,2,0,4,1,0,3,1,1,3,3,0,6,5,3,1,2,2,2,2,1,1,4,2,0,1,0,0,3,3,0,2,2,1,0,0,1,3,1,1768,1,1,"Dublin : printed by John Exshaw, in Dame-Street, MDCCLXVIII. [1768].",Dublin,265,unknown,,,FALSE,"fairest light Paints rural profpeats and the charms of sight. These soft amusements bring content along, And fancy, void of sorrow, turns to song . Here beauteous health for all the year remain, wlhec the next comes, I'll charm tlhe thus agaia, A HYMN to CONTENTMENT. Ovely, lalling peace of"
0537100500_000003,"The cave of Morar, the man of sorrows. A legendary tale. In two parts.","Tait, John",91,0,1,0,2,4,0,6,2,1,0,2,2,0,0,0,2,1,0,7,0,0,0,1,0,1,0,3,0,3,2,5,0,0,0,0,2,4,3,2,1,0,1,2,3,2,0,2,2,1,3,4,1,0,5,1,4,1,0,2,1774,1,1,"London : printed for T. Davies, in Russel Street, Covent Garden, Bookseller to the Royal Academy; and sold by J. Bew, Pater-Noster Row; and J. Balfour, at Edinburgh, M,DCC,LXXIV. [1774].",London,32,male,1748,1817,FALSE,"freli from Nature's bounteous Store, The Sage the chryfl'al Beverage poured.; i lis Guells enjoyed the rustic Clheer, Nor were their grateful thl.anks forgot, Till beauteous E Ai M A lcg'd to hc.11, The mournful Tale of MORAR's Ltt. My Friends , he said, though' rude my voice , ""And"
0656701400_000079,"The academic speaker; or, a selection of parliamentary debates, orations, odes, scenes, and speeches, from the best writers, proper to be read and recited by youth at school. To which are prefixed, elements of gesture; ... The third edition. By John Walker, ...",,85,1,1,3,2,1,1,0,2,1,1,1,0,3,1,0,1,3,0,0,1,2,4,0,0,1,3,1,3,1,1,0,0,2,4,3,0,2,5,1,0,2,0,0,1,0,1,0,1,1,1,0,4,0,4,2,2,3,0,7,1797,1,1,"London : printed for the author; and sold by G.G. and J. Robinson; and T. Cadell, Junior, and W. Davies, 1797.",London,316,unknown,,,FALSE,"up in arms , And mans each part about me. Once again That noble eagerness of sight has seized me; That eagerness with which I darted upward To Cassius' camp. In vain the sleepy hill Opposed my way; in vain a war of spears Sung round my head , and"
0577200802_000028,"The bouquet, a selection of poems from the most celebrated authors, with some originals. ...",,76,0,2,0,1,1,0,1,4,0,2,0,1,1,1,0,0,4,1,1,1,2,0,0,1,2,0,2,4,1,3,3,1,1,3,0,1,2,1,0,1,0,1,1,2,1,0,0,1,0,2,3,2,0,4,1,6,1,1,1,1792,2,2,"London : printed by E. Hodson, Bell-Yard, Temple-Bar; for J. Deighton, Holborn; Debrett, Piccadilly; Richardson, Royal Exchange, M.DCC.XCII. [1792].",London,205,unknown,,,FALSE,"spray to spray And with soft music usher in the day: The tuneful lark is now ascending high, With fluttering wings gay warbling in the Iky. Shall man be silent mid the general choir, Nor with concordant voice God's love admire? Shall man profusely spend his precious hours ? No"
0302100300_000035,"The shamrock: or, Hibernian cresses. A collection of poems, songs, epigrams, &c. Latin as well as English, the original production of Ireland. To which are subjoined, thoughts on the prevailing system of school education, respecting Young Ladies as well as Gentlemen: with Practical Proposals for a Reformation. By Samuel Whyte, Principal of the English Grammar School.","Whyte, S. (Samuel)",84,0,0,1,0,3,4,3,2,0,1,0,2,1,2,0,1,3,0,0,0,0,1,1,2,1,1,6,3,2,2,1,0,1,1,1,2,7,2,1,2,1,1,1,0,3,3,0,1,1,2,0,3,0,2,2,0,1,0,3,1772,1,1,"Dublin : printed by R. Marchbank, In Cole's-Alley, Castle-Street, MDCCLXXII. [1772].",Dublin,549,male,1733,1811,FALSE,"floried Urn shall celebrate his Name: Enough for him, that, where his Ashes lie, When kindred Spirits shall at Times repair, The prosperous Youth shall cast a pitying Eye; The flizhted Virgin pour her Sorrows there: Enough for him, that, pointing to his Stone, The old Man his Story shall"
0264901300_000044,"Psalms and hymns, collected by William Bromley Cadogan, M. A. Rector of St. Luke's, Chelsea; St. Giles's, Reading; and Chaplain to the Right Honourable Lord Cadogan.",William Cadogan,89,1,1,2,1,0,0,0,0,1,4,2,4,0,0,0,4,0,0,6,3,4,4,1,1,3,1,3,4,1,1,1,1,3,0,0,1,2,0,0,1,0,1,5,1,4,1,0,1,2,2,3,0,1,2,2,0,2,1,0,1787,1,1,"London : printed by W. Justins, No. 35, Shoemaker-Row, Blackfriars; and sold by J. Mathews, No. 18, Strand; and J. F. and C. Rivington, St. Paul's Church-Yard: also by A. Smart and T. Cowslade, and H. Waugh, Reading; and Mrs. Davenport, Chelsea, MDCCLXXXVII. [1787].",London,274,male,1751,1797,FALSE,"And share in the blessings of this gospel day. The people who know The SAVIOUR below, With burning affetion to worship Him glow. The people are blessed Who lean on his breat, And have a rich foretaste of his promised rest. This blessing be mine Through' savour divine; But, O"
0562100900_000004,Poems. By Mrs. Hughes.,"Hughes, Anne",89,2,0,1,5,2,1,0,4,2,1,0,0,3,1,0,3,1,0,0,0,0,0,1,0,0,1,3,1,1,4,1,0,1,3,1,1,13,2,3,0,0,1,3,2,2,0,0,1,1,3,3,0,2,1,2,1,1,2,2,1784,1,1,"London : printed for J. Dodsley, In Pall-Mall, M.DCC.LXXXIV. [1784].",London,137,female,,,FALSE,"power to prove, Nor tempt too far his much enduring love . Z A R A ( 19) Z A R A. Cursed be the hour that gave these hapless charms To hated SOLYMAN's detested arms ! Oh! had I died before that fatal day Which tore me from my"
0419400600_000013,The poetical works of Mr. Joseph Williams: some of which have been before published under the signature of Clio.,"Williams, Joseph, poet",89,1,3,0,0,1,2,3,4,2,0,1,0,0,0,0,2,1,0,1,1,1,0,0,2,2,1,2,6,0,3,2,0,1,2,4,1,8,0,2,2,2,1,1,0,3,0,0,1,0,6,2,2,1,1,0,3,2,2,1,1786,1,1,"Shrewsbury : printed by T. Wood; And Sold by all Booksellers in Town and Country, M,DCC,LXXXVI. [1786].",Shrewsbury,118,unknown,,,FALSE,"When ca2'an's blushing Ilf'ters turned to Wine: O! may his spotless Virtues fire my Breast, Refine my Thoughts , and on my Numbers re: : So ( 93) So shall the Ear of Innocence approve; And rigid Virtue kifs the Lips of Love . When Time, as yet a Child,"
0188300801_000006,"The laurel-Wreath; being a collection of original miscellaneous poems, on subjects moral, comic, and divine. By W. P. In two volumes. ...",William Perfect,88,0,0,1,0,1,2,5,2,2,1,1,0,1,0,0,1,3,1,3,0,0,2,0,3,0,2,6,2,0,4,3,0,0,1,1,2,11,1,2,0,1,2,3,1,1,1,1,0,0,2,1,0,2,2,1,2,0,1,3,1766,1,2,"London : printed for the author: and sold by Mess. Fletcher and Anderson, in St. Paul's-Church-Yard; Mr. Williams, in Fleet-Steet; Mr. Fisher, at Rochester; Mr. Mercer, at Maidstone; and Mr. Baker, at Tunbridge, MDCCLXVI. [1766].",London,204,male,1737,1809,FALSE,"diltrefs. Soon Soon has the tyrant feiz'dyour breatd, And itruck your youthful heart ; By that sworn foe to human refi, Too soon you've felt the finart, My wounded Friend ! advice receive, While passion's immature, The method I propose to give, Will soon effect the cure. Though' CUPID has"
0789300500_000023,"The hearty fellow: or, joyous soul's companion. Being a chaste, elegant, and humourous collection of songs, for the entertainment of the tender maid, the pining lover, the Choice Spirit, the Droll Dog, the Jovial Sportsman, the Daring Soldier, and the Rough Honest Tar; and for all those who would wish to render themselves agreeable, divert Company, kill Care, and be joyous; where the high seasoned Wit and Humour will be a sufficient Apology for a bad Voice, and by which such at as have a tolerable one will be able to shine, without repressing the Laugh of the merrily disposed, or offending the Ear of the chastest Virgin. To which is added, a complete collection of the various toasts, sentiments, and hob-nobs, that have been drank, are now drinking, and some new Ones offered for Adoption.",,89,3,0,0,1,0,3,1,6,0,1,1,1,1,0,0,0,1,0,0,3,0,3,0,6,2,1,0,1,0,2,5,0,1,4,0,1,10,2,4,1,0,0,1,1,1,2,0,1,4,3,0,1,1,2,2,1,2,1,1,1775,1,1,"Dublin : printed by J. Magee, No. 41, College-Green, [1775?].",Dublin,371,unknown,,,FALSE,"hollow,. Ringwood, Rockwood, Jowler, Bowman; - All the chase do follow. The man in the moon drinks claret, Eats powdered beef, turnip, and carrot; - But a cup of Malaga sack Will fire the bull at his back. SO N G 8o. R E E from confinement and strife, I'll"
1301900500_000017,"The sentiments of experience or The art of saying much in a few words, on the most interesting subjects,with poems moral and entertaining, selected by Bob Short, with memoirs of the editor.",,90,0,0,1,0,2,2,1,1,1,2,1,1,1,2,0,1,1,1,1,1,6,2,1,2,0,2,4,3,1,0,5,2,3,2,1,1,10,0,3,3,1,0,1,2,3,0,0,1,0,3,0,0,1,2,0,3,1,1,0,1787,1,1,"London : Printed for Scatchard & Whitalcer, Ave-maria Lane, 1787.",London,122,unknown,,,FALSE,"want the doleful scene; And joy enough to gild the day i And make life's course serene i Virtue enough to alk the heart , Art thou secure within? Hast thou performed an honest part, Hast thou no private sin? This to perform, these things poffefq Must raise a noble"
1734400400_000058,Poems on several occasions. By Mr. John Gay. Volume the first.,John Gay,76,3,1,1,1,0,1,1,1,0,0,1,1,1,0,1,2,0,0,0,0,1,3,1,1,0,1,2,0,1,2,3,0,3,3,1,1,11,0,1,1,1,2,2,2,0,2,1,2,0,1,3,1,0,1,1,0,1,0,5,1720,1,1,"London : Printed for Jacob Tonson, at Shakespear's-Head in the Strand, and Bernard Lintot, between the Temple-Gates in Fleetstreet, MDCCXX. [1720].",London,557,male,1685,1732,TRUE,"And wolves with pity hear their bleating dams; Sooner shall vultures from their quarry fly, Than FALSE Alexis for Panthea sigh. Thy bosom never a tender thought confert, Sure fiubborn flint has armed thy cruel breaat 5 But hardest flints are worn by frequent rains, And the soft drops dissolve"
0082000500_000032,"Elegant extracts: or useful and entertaining pieces of poetry, selected for the improvement of youth, In Speaking, Reading, Thinking, Composing; and in the Conduct of Life; being similar in design to Elegant extracts in prose.",,83,0,2,0,2,6,0,4,1,0,3,0,0,1,0,2,1,1,0,1,0,3,1,0,2,0,1,4,2,0,3,2,0,0,1,2,3,3,0,1,2,0,2,3,1,1,1,0,0,2,4,0,4,2,2,0,1,3,0,3,1789,1,1,"London : printed for Charles Dilly, Poultry, [1789?].",London,741,unknown,,,FALSE,"mudl win the lofty prize Proposed by heaven ; TRUE bliss, and realgood.' Honour rewards, the brave and bold alone .; Site spurns the timorous, indolent, and base: Danger and toil Iland tern before her throne, And guard (so Jove commands) the sacred place: Who seeks her murf the mighty"
0089202800_000040,A collection of the best modern poems.,,108,0,0,0,4,0,2,1,3,1,4,0,0,0,1,0,2,1,0,0,0,0,2,5,1,2,2,5,5,1,3,2,0,1,3,0,1,14,2,2,1,3,4,2,2,4,0,0,3,0,1,5,1,0,5,0,1,3,0,3,1771,1,1,[London?] : Printed in the year MDCCLXXI. [1771].,London,246,unknown,,,FALSE,"life's summer sea; The gay attendants of my happy state, he Smiles, the Graces round were seen to wait, And all the moments, as they swiftly flew, Showeer'd down soft joys , and pleasures ever new. lio.v changed this fleeting image of a day! i low sets in awful gloom"
0055600700_000032,"Eighty-Nine fugitive fables, in verse; moral, prudential, and allegorical. Original and selected.",,83,0,0,1,0,2,0,8,3,1,3,1,0,1,0,1,0,2,1,1,1,0,1,4,1,1,0,4,1,1,2,5,1,1,2,3,2,3,1,1,0,1,4,1,3,2,0,0,2,1,2,0,1,0,3,1,1,0,0,1,1792,1,1,"London : printed for J. Murray, No 32, Fleet-Street, M.DCC.XCII. [1792].",London,239,unknown,,,FALSE,"from the spicy Saba's flore. Arrived, he sought the splendid dome, Where foft eyed Lux'ry makes her home; Adorned with all the charms of Art , With finiling look, and aching heart , High on a throne, in pageant state, The gaudy, painted Idol fate . Here Riot and Excess"
0581400300_000034,A collection of psalms and hymns for public and private worship; more particularly Designed for the use of the congregation at Woolwich-Chapel.,Woolwich Chapel,87,1,2,1,2,2,0,0,1,0,5,1,2,0,0,0,1,0,0,0,3,3,3,2,1,0,1,5,5,1,0,3,1,1,0,1,2,6,1,4,1,1,1,3,1,4,2,0,1,2,1,1,0,0,2,1,0,3,2,0,1791,1,1,"London : printed at the Minerva Press, Leadenhall-Street, London, MDCCXCI. [1791].",London,462,unknown,,,FALSE,"Would past offences trace; Trembling I make the black review, Yet pleased, behold, admiring too, The power of changing grace ! This tongue with blasphemies defiled, These feet to erring paths beguiled, In heavenly league agree i Wh ( i63) Who could believe such lips could praise , Or think"
0244301000_000059,"The union song-book: or, vocal miscellany. Being a choice collection of the most celebrated Scots and English songs. Likewise a Variety of Favourite Airs And Catches. To which is added, toasts, sentiments, and hob-nobs, &c. &c. &c.",,84,1,0,0,1,0,1,3,2,0,0,0,1,1,1,0,2,0,0,3,0,2,1,1,2,0,2,5,0,2,0,3,1,2,1,2,1,10,6,0,2,1,2,1,2,1,2,0,1,5,3,1,2,0,1,1,0,1,0,1,1781,1,1,"Berwick : printed by and for W. Phorson; B. Law, Ave-Mary Lane, and John Brown, NO. 45. Cheapside, London, 1781.",Berwick-upon-Tweed,358,unknown,,,FALSE,"the cheek, give the glance to the eyes; In the gay round of pleasure let prudence command, Nor think it too low, to be merry and wife. Then smile with the season, c. When spring is too forward, tis nipped in the bloom, The bud and the blossom is blighted,"
0833300100_000010,Hymns and spiritual songs. Selected from various authors.,,91,2,0,1,0,0,4,3,1,0,6,2,1,0,1,0,0,4,0,2,2,4,2,3,0,1,0,1,2,0,2,2,0,0,4,6,2,3,0,2,1,1,1,0,1,7,4,1,1,1,1,1,1,1,1,3,0,0,1,1,1793,1,1,"London : printed for the editors, and sold by D. Taylor, Union-Street, Bishops-Gate-Street; ..., MDCCXCIII [1793].",London,546,unknown,,,FALSE,"view of the CREATION, Gen. i. OOK up, ye saints, direl your eyes To him who dwells above the Skies; With your glad notes his praise rehearse, Who formed the mighty universe. - Hc spoke, and from the womb of night At once sprang up the cheering light , Him"
0118900300_000034,The muse's banquet: consisting of a select collection of pieces in the different species of poetical composition. By the most celebrated authors.,,85,0,0,1,2,1,2,2,1,2,9,0,3,4,2,0,1,1,1,0,2,3,1,1,1,0,1,2,2,0,2,4,0,1,1,1,1,2,1,3,2,2,1,1,0,3,0,0,1,0,1,0,1,1,2,2,0,0,7,0,1779,1,1,"Dublin : printed by Robert Burton, No. 2, Capel-Street, M,DCC,LXXIX. [1779].",Dublin,349,unknown,,,FALSE,"world's a grain; yet myriads grace With golden pomp the throned aethereal space; So bright, with such a wealth of glory store, Twere sin in heathens not to have adored. Ho great, how firm, how sacred all appears ! How worthy an immortal round of years! Yet all must drop,"
0157501700_000004,Poems on several occasions. By Thomas Blacklock.,Thomas Blacklock,80,1,3,0,2,2,0,1,3,2,4,0,0,2,2,0,1,0,1,2,0,6,0,1,1,1,0,3,3,0,1,2,0,1,0,1,1,1,1,2,4,0,3,2,0,2,3,0,1,1,2,2,0,3,0,1,4,1,0,0,1746,1,1,"Glasgow : printed for the author; and sold by the booksellers in town and country, MDCCXLVI. [1746].",Glasgow,95,male,1721,1791,FALSE,"firings. From pole to pole, on ever waving wings, Winds waft thy praise , by rolling planets tuned; Aid then, O Love ! my voice to emulate the sound. VII Ir comes! it comes! I feel internal day; Transfufive warmth through' all my bosom glows; My soul expanding gives the"
0744701402_000045,"A select collection of poems, from the most approved authors. In two volumes. ...",,77,0,2,1,1,2,2,1,5,0,0,1,0,2,1,0,1,3,1,3,1,1,1,1,3,0,1,5,2,0,0,2,0,1,1,0,0,8,1,1,1,1,1,0,1,2,2,0,1,0,1,1,2,0,4,0,1,2,1,1,1768,2,2,"Edinburgh : printed by A. Donaldson, and sold at his shops in London and Edinburgh, 1768.",Edinburgh,272,unknown,,,FALSE,"blooming Eden bear; And distant warblings lessen on my ear,  That lost in long futurity expire. Fond impious Man, think'ft thou yon sanguine cloud, Raised by thy breath, has quenched the orb of day? tomorrow he repairs the golden flood,  And warms the nations with redoubled ray. Enough"
0509301102_000007,A collection of poems in three volumes. By several hands.,Robert Dodsley,89,0,1,0,2,1,1,4,4,0,0,1,1,1,2,0,1,2,0,5,3,0,1,2,2,1,1,2,2,0,1,3,0,1,3,1,1,8,4,1,1,0,1,1,1,3,3,0,1,0,2,0,1,0,1,0,6,1,4,0,1748,2,3,"London : printed by J. Hughs, for R. Dodsley, at Tully's-Head in Pall-Mall, M.DCCXLVIII. [1748].",London,338,male,1703,1764,TRUE,"the Congress of SOISSONS in the Year 1728 Written at Paris. [By tb, Same.] O Thou whiofe frienidthip is my joy and pride, Whose Virtues warm me, and whose Precepts guide; Thou, to whom Greatness, rightly underitood, Is but a larger power of being good; Say, Poyntz, amidst the toils"
1092800500_000059,A selection of psalms and hymns for private and social worship.,,103,0,0,2,0,0,1,4,1,1,0,1,0,0,1,0,1,0,1,0,4,13,5,1,0,0,0,8,5,5,1,3,0,3,3,2,1,3,1,1,1,0,1,3,0,2,5,0,2,3,2,0,3,1,3,1,2,1,1,0,1798,1,1,"London : printed by J. Davis, Chancery-Lane, MDCCXCVIII. [1798].",London,362,unknown,,,FALSE,"gold. * A name given to Christ, John i. 29 36 and bor rewed, probably, from Ifa. LIII 7 4 But 4 But far more fair the pious breast,. In richer robes of goodness dressed, Where heaven's own graces shine; And brighter far the prospects rise That burst on faith's"
0247100300_000032,"Poems by James Fordyce, D.D.",James Fordyce,72,0,1,0,0,1,0,2,1,1,1,1,1,0,0,1,1,3,0,3,1,1,1,1,2,1,0,2,1,3,1,2,0,1,4,2,2,1,4,1,0,1,1,1,2,1,2,0,1,0,0,1,2,1,2,0,4,1,2,2,1786,1,1,"London : printed [by T. Spilsbury] for T. Cadell, in the Strand, M.DCC.LXXXVI. [1786].",London,282,male,1720,1796,FALSE,"-. in ways direct and pleasant, firm and plain ? To you, who have not known the: maze of Guile, Twere vain perhaps to show it; you would fnile, - Did C 25! J Did I this world's dark knaveries disclose. unpraetis'd Youth would tilll conclude, that those who wear"
0439300600_000009,Poems; chiefly composed from recent events. By Mr Nisbet.,"Nisbet, W.",92,0,0,2,1,2,2,3,3,6,1,2,1,2,0,0,2,1,1,1,0,0,4,6,1,0,0,5,2,1,1,0,0,2,4,0,1,3,0,3,0,0,5,4,0,2,2,0,2,0,1,4,2,0,1,0,3,1,0,2,1780,1,1,"Edinburgh : [s.n.], M,DCC,LXXX. [1780].",Edinburgh,130,unknown,,,FALSE,"His feeble voice began at lait to fail; Nature , unable to fu[tain decay, Over every sense let silent death prevail. ELE Ga -70 ELEGT V To Mrs HON the Death of a promfing Child. A H whence the tear , that fills a parent's eye, Why heaves thy boson"
0438802100_000064,"Reliques of Irish poetry: consisting of heroic poems, odes, elegies, and songs, translated into English verse: with notes explanatory and historical; and the originals in the Irish character. To which is subjoined an Irish tale. By Miss Brooke.",Charlotte Brooke,93,2,2,1,3,3,2,4,1,1,0,1,0,3,5,0,2,3,1,0,0,0,1,2,2,0,2,4,0,3,1,0,0,0,3,1,1,6,3,0,0,1,1,0,0,1,0,0,1,0,6,3,2,0,5,5,1,0,0,4,1789,1,1,"[Dublin] : George Bonham, printer, South Great George's-Street, Dublin, M.DCC.LXXXIX. [1789].",Dublin,370,female,1740,1793,FALSE,"foe, Beneath the royal care , I saw my lovely scion grow, And ihoot its branch in air .. Oh, while I viewed his blooming face ,. And watched his opening mind ; While, in a form of matchless grace , I saw each virtue fhrin'd; With more than a"
