0615200800_000036,The lover's manual being a choice collection of poems from the most approv'd modern authors. With several original pieces. In five books. Containing I. Love Epistles in Verse. II. Love Epistles in Prose. III. Epistolary Panegyrics. IV. Acrostics. V. Select Pieces of Poetry.,,86,1,0,1,2,2,9,1,7,0,1,1,0,0,1,0,1,4,0,0,1,1,0,1,1,1,2,3,1,0,1,3,0,5,1,1,0,6,4,2,0,0,0,0,1,1,2,1,1,1,2,0,1,1,2,0,6,1,0,1,1753,1,1,"London : printed for S. Silver, Bookseller in Sandwich; and sold by Charles Hitch, and Lacy Hawes, Booksellers in Pater-Noster-Row, 1753.",London,346,unknown,,,FALSE,"fair, go flaunt it hence, away, shine the fov'reign beauty of a day, H 4 Where Where fools in tinsel glitter round the ring ; 'here ogle, prate, and let the syren sing; Flutter at balls, at plays, or mafqucrades, Or walk a goddess, in the evening shades. Peralps !bme"
0419600400_000039,"The seasons, by James Thomson. A new edition. Adorned with a set of engravings, from original designs. To which is prefixed, An essay on the plan and character of the poem, by J. Aikin, M.D.",James Thomson,69,0,1,0,0,0,3,1,1,1,1,1,1,2,0,0,0,0,0,1,1,1,0,0,2,0,2,3,2,1,3,2,1,1,5,2,1,1,1,3,2,0,1,2,1,1,0,0,2,3,1,0,1,1,1,0,1,1,4,2,1794,1,1,"London : printed for J. Murray, No. 32, Fleet Street, 1794.",London,304,male,1700,1748,TRUE,"dance. Her every charm abroad, the village toaft, Young, buxom, warm, in native beauty rich, Darts not unmeaning looks; and, where her eye Points an approving smile, with double force, The cudgel rattles, and the wrestler twines. Age too shines out; and, garrulous, recounts The seats of youth . Thus"
0134001900_000011,"Poems on several occasions. By Mat. Prior, Esq;",Matthew Prior,80,2,0,2,3,2,2,0,3,1,0,0,1,1,2,1,1,0,0,0,1,3,0,0,2,1,1,5,0,1,0,2,0,0,0,2,1,10,0,0,3,1,1,1,4,2,1,1,0,4,0,0,3,1,3,1,0,1,0,3,1719,1,1,"Dublin : printed for J. Hyde in Dame-Street, R. Gunne in Caple-Street, R. Owen in Skinner-Row, and E. Dobson in Castle-Street, Booksellers, 1719.",Dublin,386,male,1664,1721,TRUE,"FRIENDSHIP. A PAST ORAL jby Mrs. ELIZABETH SINGER, A MAR LLIS. VW VH I L E from the Slies the ruddy Sun decends;, And rising Night the Evening Shade extends: While pearly Dews o'erfpread the fruitful Field; And closing Flowers reviving Odours yield: Let Us, beneath these spreading Trees, recite"
0424802300_000012,"The cupid. A collection of love songs, in twelve parts. Suited to twelve different sorts of lovers. Viz. The Female Lover. The Admiring Lover. The Slighted Lover. The Modest Lover. The Constant Lover. The Jealous Lover. The Tender Lover. The Whining Lover. The Saucy Lover. The Merry Lover. The Pressing Lover. The Happy Lover. The second edition. With an addition of near a hundred songs, and the names of the tunes added to each song.",,88,2,0,3,2,2,5,2,6,1,0,4,1,0,1,1,0,1,0,0,1,1,7,1,2,1,1,2,1,0,0,0,0,0,2,2,1,8,1,1,2,0,1,0,0,2,0,1,2,9,1,2,2,0,0,0,1,1,0,1,1739,1,1,"London : printed for J. Osborn, at the Golden-Ball in Pater-Noster Row, M.DCC.XXXIX. [1739].",London,285,unknown,,,FALSE,"Skies: Adieu to the Opera, adieu to the Ball; My Darling is gone, and a Fig for them all. Oh! the Tears , c. SONG LX Tweed Side. ON D Echo, forbear thy light Strain, And heedfully hear a lost Maid Go, tell the FALSE Ear of the Swain, How"
1300801400_000025,"[A] Collection of poems, essays, and epistles. Containing Essay on man. Universal prayer. Eloisa to Abelard. Messiah: A sacred eclogue. An ode on solitude. An essay on criticism. Poem on the last day. An elegy written in a country Church-Yard. Hymn to adversity. The grave. The Hermit. A night-piece on death. The splendid shilling. The deserted village. The traveller. The genealogy of Christ. The fragment. By Pope, Young, Gray, Blair, Parnell, Philips, Lowthe, Goldsmith and Mallet.",,83,0,0,0,2,1,2,2,1,3,8,0,3,2,3,0,1,1,1,0,1,3,0,1,1,0,1,3,2,2,2,5,0,1,3,1,1,2,0,1,2,2,1,1,0,4,0,0,0,0,1,1,1,1,1,2,0,0,6,0,1770,1,1,"Dublin : Printed for Thomas Armitage, in Crampton-Court, MDCCLXX [1770].",Dublin,248,unknown,,,FALSE,"This hour , for aught all human wisdom knows , Or when ten thousand harvests more have rose; When scenes are changed on this revolving earth , Old empires fall , and give new empires birth. While other Bourbons rule in other lands, And (if man's sin forbids not) other"
0191700305_000026,"The poetical works of Isaac Watts, D.D. In seven volumes. With the life of the author. ...",Isaac Watts,102,1,0,0,2,3,2,1,4,2,1,2,1,0,1,0,1,1,0,0,1,5,3,2,0,0,1,9,2,1,0,3,1,1,2,1,1,17,3,3,2,0,3,0,0,4,0,0,1,1,3,1,4,0,2,0,0,1,2,0,1782,5,7,"Edinburg : at the Apollo Press, by the Martins. Anno, 1782.",Edinburgh,175,male,1674,1748,TRUE,"- 6 Dear Sovereign! break these fetters off, And set our spirits free; God in himself is bliss enough, For we have all in thee. Desiring to love Clrfl. COME, let me love ; or is thy mind Hardened to stone or froze to ice? I see the blessed fair"
0357000400_000008,"The poetical monitor: consisting of pieces select and original, for the improvement of the young in virtue and piety; intended to succeed Dr. Watts' Divine and moral songs. Published for the benefit of the Shakespear's Walk Female Charity School, St. George in the East.",,104,0,0,0,1,0,0,4,0,1,0,1,0,1,3,0,1,2,0,3,0,6,1,3,2,1,4,8,1,4,0,6,2,3,3,1,0,12,3,0,1,0,0,6,0,0,2,0,2,1,1,3,2,0,2,1,1,3,0,2,1798,1,1,"London : sold by T. N. Longman, Paternoster-Row; J. Johnson, St. Paul's Church-Yard; C. Dilly, Poultry; A. Cleugh, Ratcliff-Highway; and the Secretary, by orders sent to the school, [1798].",London,171,unknown,,,FALSE,"ease, Wealth, same, eternal life , and peace . With pity let my breast overflow, When Ilbehold another's woe: And bear a sympathising part,. Whenever I meet a wounded heart . And let my neigliboui's profp'rotis fate ; A mutual joy in me create; His virtuous triumph let me join;"
1034500600_000001,"Elegy, written at Amwell, in Hertfordshire, MDCCLXIX.",John Scott,78,1,2,0,0,2,1,0,0,2,3,1,1,0,0,0,0,1,0,3,1,0,0,1,0,1,1,2,2,2,3,1,0,0,3,2,0,9,1,1,1,1,3,1,1,0,0,0,2,1,1,3,2,0,6,4,2,1,2,0,1769,1,1,"London : printed by Dryden Leach, for the author, MDCCLXIX. [1769].",London,8,male,1730,1783,FALSE,"gi s'. ; E IE  G Y WRITTEN A T A MW E L L .- I N HE RT SO R D S H I R E, M D C C LXIX LO N D ON: PRINTED BY DRYDEN LEACH, FOR THE AUTHOR. M D C C LX"
0296001000_000016,"Poems on several occasions. By the late Rev. Thomas Browne, ...","Browne, Thomas",85,0,1,0,1,1,3,0,0,2,1,0,1,3,2,0,4,1,0,2,0,0,1,2,2,1,0,7,1,3,2,1,0,0,0,1,1,9,2,5,2,3,0,0,1,2,0,0,3,1,1,2,2,1,1,1,2,0,0,3,1800,1,1,"[London] : Printed for Vernor & Hood, London, By R. & W. Dean, Manchester; and sold by Merritt and Wright, Liverpool, and Thomas Browne, Hull, 1800.",London,207,male,1771,1798,FALSE,"on foreign coasts to live ; To a capricious master's stern command, What love refuses fear compels to give, No soft emotion rugged Selim feels, Love's gentle influence never touched his heart ; ; A River of Circassia, From sick reluctance what he rudely steals, What pleasure can it to"
0531400401_000017,"Hermas, or the Acarian shepherds: a poem. In sixteen books. The author, John Spencer. ...","Spencer, John, of Newcastle",97,0,1,1,1,0,4,3,4,1,0,0,0,3,1,0,0,1,0,1,1,0,2,1,1,0,0,2,5,1,1,4,0,2,5,0,0,14,4,3,0,3,0,1,3,1,4,0,0,2,2,0,1,0,1,1,6,1,0,4,1772,1,2,"Newcastle upon Tyne : printed by T. Saint, MDCCLXXII. [1772].",Newcastle upon Tyne,244,unknown,,,FALSE,"When POLYDORE, the youth beloved swain, Courteous and mild, to LEDIA thus began. See LEDIA! see! the tender lambs, With harnlefs innocence and play, Diverted by their simple sport, An emblem to the breast convey. The guileless heart , serene and pure, Uncumbered with life's boding cares , Feels angel"
0444800300_000034,"Psalms and hymns, collected by William Bromley Cadogan, M. A. Rector of St. Luke's, Chelsea, St. Giles's, Reading; and Chaplain to the Right Hon. Lord Cadogan.",William Cadogan,105,0,0,1,0,1,0,0,1,1,3,0,0,0,1,1,2,0,0,0,2,9,4,3,1,1,2,6,4,1,0,7,1,1,3,4,1,9,2,4,2,1,1,3,0,7,4,0,1,2,1,0,1,0,4,0,0,1,1,0,1794,1,1,"Reading : printed and sold by A. M. Smart and T. Cowslade ; sold also by J. Mathews, No. 18, Strand, and J. F. and C. Rivington, St. Paul's Church-Yard, London; by R. Snare, and H. Waugh, Reading ; and Mrs. Davenport, and Lewis and Fienes, Chelsea, MDCCXCIV. [1794].",Reading,290,male,1751,1797,FALSE,"in the cross of CHRIST my GOD ; All the vain things that charm me most, I sacrifice them to his blood. See from his head , his hands , his feet, Sorrow and love flow mingling down! Did ever such love and borrow meet, Or thorns compose so rich"
0560001000_000041,"Poems by Mr. Thomas Blacklock. To which is prefix'd, an account of the life, character, and writings, of the author, by the Reverend Mr. Spence, Late Professor of Poetry, at Oxford.",Thomas Blacklock,95,2,0,0,0,1,1,3,4,0,0,0,0,3,0,0,6,3,0,2,0,3,0,2,1,1,1,7,2,2,4,4,0,1,4,3,1,6,1,2,1,1,1,0,0,0,2,0,2,0,2,0,2,0,2,5,5,1,1,0,1756,1,1,"London : printed for the author, by R. and J. Dodsley, in Pallmall, M.DCC.LVI. [1756].",London,305,male,1721,1791,FALSE,"And loved EDINA's lofty turrets rise, Sing, heavenly mute! to thy loved CLIO sing; Tune thy faint voice , and stretch thy drooping wing. . COI., 0.1 COULD I, like URIEL, on fomr pointed ray, 5 To your fair distant Eden wing my way, Outstrip the moments, scorn the swiftest"
1306900200_000019,"Vida's Art of poetry, translated into English verse, after the manner of Mr. Pope. In three books.",Marco Girolamo Vida,76,0,3,2,1,2,1,2,1,1,1,1,0,2,1,0,0,0,0,1,2,3,1,5,2,2,4,0,2,0,0,0,1,0,2,2,0,0,2,0,0,0,0,1,2,0,2,1,0,6,1,0,1,1,1,2,0,3,2,6,1750,1,1,"[London? : s.n.], Printed in the year M.DCC.L. [1750].",London,92,male,1485,1566,FALSE,"sky. For thus his gelious takes a different face From each refpetive genius of a place. The soul too varies; and the bard may find A thousand different motions in his mind . New gleams of light will every moment rise, While from each part the fcatt'ring darkness flies. And,"
0154201600_000046,"The conquest of Canäan; a poem, in eleven books. By Timothy Dwight. [Two lines from Pope].","Babcock, Elisha",77,0,0,0,5,3,1,0,2,1,1,0,1,2,0,1,0,1,0,1,3,0,2,2,1,0,1,1,2,1,1,0,2,0,4,2,4,1,4,0,3,0,0,1,3,0,0,1,3,0,2,2,0,0,3,1,1,2,0,5,1785,1,1,"Hartford : Printed by Elisha Babcock, M,DCC,LXXXV. [1785].",Hartford|Hartford.,323,male,1753,1821,FALSE,"to hand ; They fell; new squadrons over their corses rise, And louder tumults echo from the skies, 3t Imperious Samlah lists ahaughty cry -- - hlence, on your lives , presuming daflards fly! Who dares transgress shall find a sudden doom: Give Samlah place -- give kings , and"
1287700102_000011,"The seasons, and other poems, by Mr. James Thomson. In two volumes. ...",James Thomson,77,4,1,1,0,6,3,2,1,1,2,0,0,0,0,1,2,3,0,1,2,3,5,2,1,2,0,3,0,0,1,0,1,0,2,1,2,3,1,3,0,0,0,1,2,1,0,0,3,1,1,0,1,1,1,1,1,2,0,1,1777,2,2,"Aberdeen : printed for, and sold by J. Boyle, M.DCC.LXXVII. [1777].",Aberdeen,233,male,1700,1748,TRUE,"power of Eloquence, at large, Breathed the persuasive or pathetic soul; Still'dby degrees the democratic storm, Or bade it threatening rise, and tyrants fhookl Flushed at the head of their victorious troops.. In it the Muse, her fury never quenpch'd, By mean unyielding phrase, or jarring sound, Her unconfined divinity"
0381700500_000042,"The polite preceptor; or, improving moralist. Consisting of a choice collection of relations, visions, allegories, and moral essays. Selected from the most eminent English authors. Compiled at the request of a noble lady, and designed for the use of schools.",,69,0,1,0,1,0,2,1,1,1,1,1,1,0,0,0,1,1,0,1,1,2,0,0,2,0,2,3,2,1,3,2,1,1,4,1,0,1,3,5,2,0,1,2,1,1,0,0,1,3,1,0,1,1,1,0,1,1,4,1,1774,1,1,"London : printed for R. Snagg, at No. 29. Pater-Noster Row, M.DCC.LXXIV. [1774].",London,262,unknown,,,FALSE,"spurned at lux'ry when exprefl In all its pleasing forms to charm . The mind that don't securely arm Itself against those dire events Which flow from banquets forced. contents Or in the bowl capacious lurks, And aims its force at Nature's works, Debating those of high degree From Reason's"
0225800500_000107,"The poetical preceptor; or, a collection of select pieces of poetry; extracted from the works of the most eminent English poets. Particularly Addison, Akenside, Armstrong, D. Buckingham Collins, Congreve, Cowley, Cowper, Denham, Dryden, Dyer, Garth, Gay, Grainger, Gray, Hill, Johnson, Ben. Jonson, Lee, L. Lyttleton, Mallet, Mason, Milton, Otway, Parnell, Philips, Pope, Prior, Rowe, Shakespeare, Shenstone, Spence, Swift, Thomson, Tickell, Waller, Wharton, Whitehead, Wilkie, Young, &c. And calculated for the Use, not only of Schools, but of Private Gentlemen.",,78,0,1,0,2,5,0,1,3,0,5,1,1,2,0,1,1,1,0,1,0,3,1,0,2,0,2,2,1,0,3,1,0,0,2,2,3,1,3,2,1,0,0,1,0,4,2,0,0,2,4,0,3,0,1,0,2,2,0,3,1790,1,1,"London : printed only for S. Crowder, Pater-Noster-Row, MDCCXC. [1790].",London,396,unknown,,,FALSE,"cooled with summer Gfows The dainty board, with choicest viands spread i To thee are tasteless all! sincere repose Flies from thy flowery couch and downy bed. For thou art only tired with indolence N or is thy sleep with toil and labour bought: Th' imperfect sleep, that lulls thy"
0110402800_000010,"Odes and elegies, descriptive & sentimental: with The patriot, a poem; by John Corry.",John Corry,94,1,0,1,1,1,6,0,3,2,2,1,0,0,1,0,1,1,0,0,2,1,1,2,1,1,0,5,0,0,2,4,0,1,0,4,3,14,3,2,1,1,0,0,2,3,2,0,0,0,6,2,0,0,2,3,0,3,1,1,1797,1,1,"Newry : printed by R. Moffet, 1797.",Newry,159,unknown,1667,1726,FALSE,"fanned. When tender feelings filled my youthful breast, Oft through' thy scented walks, dear Ravens dale, I've rambled, with my Anna's converse blessed, When Nature's sylvan music filled the gale. How sweet , to her my love's impassioned voice By Echo gently whispered from the shade To view that form"
0373600200_000035,"The poetical miscellany; consisting of select pieces from the works of the following poets, viz. Milton, Dryden, Pope, Addison, Gay, Parnel, Young, Thomson, Akenside, Philips, Gray, Watts, &c. For the use of schools.",,78,0,1,2,1,1,0,0,0,3,3,0,1,1,2,1,3,3,0,1,0,3,2,0,1,0,1,1,0,0,1,3,1,6,3,4,1,1,0,3,3,2,0,1,1,0,2,0,1,1,2,0,3,0,1,3,0,2,2,0,1762,1,1,"London : printed for T. Becket and P. A. de Hondt, at Tully's Head, in the Strand, MDCCLXII. [1762].",London,348,unknown,,,FALSE,"vales Sees dafies open, rivers run, And seeks (as I have vainly done) Amusing thought ; but learns to know That solitude's the nurse of woe. No real happiness is found In trailing purple over the ground: Or in a soul exalted high, To range the circuit of the Sky,"
1490100300_000009,"Ladies delight: or, The merry songster. Containing a collection of above one hundred songs intirely new; none of which are contain'd in the Syren, Nightingale, Lark, Merry companion, or any other collection.",,89,1,0,1,0,1,2,1,2,1,1,0,1,1,1,1,0,0,0,1,0,1,2,1,1,1,2,5,0,0,1,1,0,1,3,0,1,18,0,2,3,3,2,0,1,0,0,1,1,7,2,1,4,2,4,0,0,0,1,2,1741,1,1,"London : Printed and sold by T. Wright, at the Bible in Exeter-Exchange, in the Strand, MDCCXLI. [1741].",London,109,unknown,,,FALSE,"Heil tis sure must ascend, For nothing or. Earth fb much Filth could ingend, Mouft Muf he born ofa Devil, engenders in Strife, And sent to perplex us all Days of our Life . Let us stand on our Guard, and fight in Defence, Or we shall be worst oftfa"
0191700201_000027,The poetical works of John Hughes. In two volumes. With the life of the author. ...,John Hughes,83,3,0,2,1,2,1,3,1,0,0,0,0,2,2,0,2,2,0,2,0,2,3,2,4,0,2,0,1,1,1,3,0,0,0,1,2,4,3,3,0,1,0,2,2,1,3,0,0,2,0,2,5,2,0,3,1,3,1,0,1779,1,2,"Edinburg : at the Apollo Press, by the Martins. Anno, 1779.",Edinburgh,203,male,1677,1720,FALSE,"fage reformers too: No viciousftrains pollute your moral scene; Chaste are your thoughts , and your expieffion clean Strains such as your's the ftri&r test will bear; Sing boldly then, nor busy cenifure fear ; 40 Your virgin voicco: sends no virgin ear. Proceed in tragic numbers to difelofe Strange"
0365701702_000005,The British album. In two volumes. ...,,88,0,1,0,1,3,5,3,4,2,0,3,1,2,2,0,1,1,0,1,0,0,1,0,0,0,0,5,1,0,4,4,0,1,4,0,0,4,2,2,0,2,1,0,1,2,0,0,0,1,2,4,1,1,4,0,3,0,2,6,1790,2,2,"London : printed by John Bell, 1790.",London,175,unknown,,,FALSE,"esteem, And tribute of regard. What though' no trappings I allow; The Watch thus unadorned; Believe me, when I dare avow, Its worth should not be scorned. Companion of my earliest youth , I've oft its value known; Unswayed its probity and tnrth, By Fortune's smile, or frown. In Infant"
0377001201_000014,Bell's classical arrangement of fugitive poetry. Vol. I.,,75,0,1,1,0,1,1,2,0,0,2,0,1,3,1,0,2,2,0,4,1,0,1,2,1,1,2,1,4,1,2,1,0,1,3,0,3,1,2,1,0,2,0,1,2,1,3,1,0,0,1,1,1,0,3,1,5,0,3,1,1789,1,1,"London : printed by John Bell, British Library, Strand, Bookseller to His Royal Highness the Prince of Wales, MDCCLXXXIX. [1789].",London,178,unknown,,,FALSE,"all other fear rejects. Hence Just Ambition boundless splendours crown, And hence she calls eternity her own. Thus your loved Scipio past his glorious days, Blessed with his kindred's, friend's , and country's praise . Nor ended there the human hero's thought , Nor in the Roman was the man"
0918700103_000042,A collection of poems in six volumes. By several hands.,Robert Dodsley,80,3,1,1,0,0,1,1,1,1,4,0,0,1,1,0,3,2,0,2,0,2,1,0,2,1,0,2,2,1,1,6,0,4,2,0,2,4,0,3,1,1,1,1,1,2,0,0,0,1,5,2,2,0,0,2,2,0,2,2,1775,3,6,"London : printed for J. Dodsley, in Pall-Mall, MDCCLXXV. [1775].",London,351,male,1703,1764,TRUE,"dart, And guilt, that scorpion, flings his heart . Will knowledge give us happiness ? In that, alas! we know there's less, For every pang of mental woe Springs from the faculty, to know w. Hark! at the death betok'ning knell Of yonder doleful paffing bell, Perhaps a friend ,"
1531800400_000001,"Elegy, written at Amwell, in Hertfordshire, MDCCLXVIII.",John Scott,78,1,2,0,0,2,1,0,0,2,3,1,1,0,0,0,0,1,0,3,1,0,0,1,0,1,1,2,2,2,3,1,0,0,3,2,0,9,1,1,1,1,3,1,1,0,0,0,2,1,1,3,2,0,6,4,2,1,2,0,1769,1,1,"London : Printed by Dryden Leach, for the author, MDCCLXIX. [1769].",London,9,male,1730,1783,FALSE,"E L E G Y, WRITTEN AT AMWELL, I N HE R T SO RDS HI R E, M D C C L X V I I I. L O N D O N: PRINTED BY DRYDEN LEACH, FOR THE AUTHOR. MDCCLXIX. ·· · j;; ·-·. ··, ·' ~·: ·~.-;"
0146602500_000005,"A new miscellany of original poems, translations and imitations. By the most eminent hands, viz. Mr. Prior, Mr. Pope, Mr. Hughes, Mr. Harcourt, Lady M. W. M. Mrs. Manley, &c. Now first Published from their Respective Manuscripts. With some Familiar Letters by the late Earl of Rochester, never before Printed.",,84,1,1,2,1,2,3,4,3,2,0,1,1,1,3,0,1,1,0,1,0,0,2,1,3,0,1,5,3,2,0,3,1,1,2,2,3,7,2,2,0,2,0,1,0,1,0,0,0,1,1,1,4,0,1,2,1,0,1,0,1720,1,1,"London : printed for T. Jauncy at the Angel without Temple Bar, [1720].",London,375,unknown,,,FALSE,"the fashion. But 1 will not keep you too long upon this doleful Alteration it is enough to make most Wives in the wtorld very Melancholy. If you write to me, you mull direct to lincoln's nn Fields, the House next to the Duke's Playhouse in Portugal row; there lives"
0452601400_000014,"Hymns, and divine songs, for young persons. To which are added, many hymns on interesting subjects, for private and public use. Originally designed for the use of the Sunday School, at Bolton. By Benjamin Rhodes.","Rhodes, Benjamin",89,1,1,2,0,0,3,2,1,3,1,1,0,0,1,0,0,1,0,2,2,4,3,0,0,1,1,4,3,0,3,3,2,0,3,0,1,6,3,3,3,0,1,2,0,3,6,0,1,3,4,0,0,0,1,1,0,2,1,0,1796,1,1,"Birmingham : printed by J. Belcher, 1796.",Birmingham,102,male,1743,1816,FALSE,"trace behind! 4 In anxious toil we daily rise, Renew the chase to seize the prize; The bliss we seek is absent frill, And like a shade eludes our will. Though fading as the tender flower, We spend in vain the doubtful hour ; e5 [ be ] Like toiling"
0184700302_000043,"The works of the most celebrated minor poets. Namely, Wentworth, Earl of Roscommon; Charles, Earl of Dorset; Charles, Earl of Halifax; Sir Samuel Garth; George Stepney, Esq; William Walsh, Esq; Thomas Tickell, Esq. Never before collected and publish'd together. In two volumes.","Wentworth Dillon, 4th Earl of Roscommon",77,1,1,1,2,5,0,0,2,0,1,0,2,5,1,0,3,1,0,1,0,2,1,0,0,1,2,2,1,1,0,2,2,0,0,1,1,5,1,1,0,0,0,2,0,0,3,1,0,3,4,3,5,0,1,3,1,0,1,1,1749,2,2,"London : printed for F. Cogan, at the Middle Temple Gate, MDCCXLIX. [1749].",London,260,male,1633,1685,FALSE,"stars Shall raise mock heroes, and fantaltie wars; Like Like the young spreading laurels, Pope, thy name Shoots up with strength, and rises into fame; With Philips shall the peaceful valleys ring , And Britain hear a second Spenser sing. That much loved youth , whom Utrecht's walls confine, To"
0499500612_000024,Bell's classical arrangement of fugitive poetry. Vol. XII.,,67,2,1,0,1,2,0,2,1,1,1,0,0,1,0,0,1,1,0,0,1,2,2,5,0,1,3,2,0,1,1,2,0,0,1,0,0,1,1,1,1,2,1,0,2,3,3,0,1,3,2,2,1,0,3,1,1,1,1,1,1790,12,12,"London : printed by John Bell, 1790.",London,180,unknown,,,FALSE,"TWAS the deep groan of death That struck th' affrighted earl The momentary breeze, the vital breath Expiring sunk I let Friendship's holy tear Embalm her dead, as low he lies. To weep another's fate , oft teaches to be wise. Wisdom! set the. portal wide, - Call the young,"
1101901300_000017,"Poems on various subjects. Consisting of meditations, contemplations, soliloquies, Poetical Epistles, Moral Reflections, Hymns, and Taraphrases of Several Parts of Scripture, &c. By T. May.","May, Thomas, of Henley",93,0,1,0,0,2,0,0,3,6,5,1,2,0,1,0,0,1,0,1,1,4,3,0,4,1,0,2,6,1,0,5,1,2,3,1,1,3,5,1,1,0,0,3,0,2,3,0,0,2,0,1,2,0,5,1,2,1,1,2,1791,1,1,"Henley : printed by G. Norton, for the author; and sold by C. Dilly, Poultry; Scatcherd and Co. Ave Maria-Lane; T. Hookham, New Bond-Street; Champante and Whitrow, Jury-Street, Aldgate; Darton and Co. Grace Church-Street; C. Stuart, Princes-Street, Leicester-Fields, London; J. Fletcher, Oxford; S. Hazard, Bath; and W. Brown, Tolzey, Bristol, [1791?].",Henley-on-Thames,163,unknown,,,FALSE,"dart, And deep struck fear corrodes the conscious heart . Launch tle tall veiel, dare the spacious main, Search realrrs unknown, and all our pride is vain . Think not below confumnmate bliss to find; cod gives extension to the labouring mind ; Hence all our bliss is toil; constraint"
0342000700_000019,"Alfred, an historical tragedy, To which is added a collection of miscellaneous poems, by the same author.",Ebenezer Rhodes,68,0,1,1,0,1,3,2,2,1,1,0,0,1,2,1,2,1,0,0,0,1,1,0,2,1,2,2,1,0,1,6,0,0,1,2,1,1,2,0,1,1,0,0,3,3,2,0,2,2,0,1,0,1,1,4,0,1,0,3,1789,1,1,"Sheffield : printed for the author, by J. Gales; and sold by him, and G.G.J. and J. Robinson, in London, M,DCC,LXXXIX. [1789].",Sheffield,185,male,1762,1839,FALSE,"me, rofe lipp'd Temperance, thine, And fliicld me from so dire a throng Till youth , with all its joys are flown, And age has marked me for his own. TALE THE COMPLAINTT. OFT has the splendour of a court, Where wealth and elegance resort, And bliss ideal reigns Midit"
1068500400_000028,"Christian songs. To which is prefixed, The evidence and import of Christ's resurrection versified, for the help of the memory.",John Glas,79,1,0,1,1,1,0,2,0,6,1,1,1,1,1,0,1,2,1,1,0,8,2,0,2,1,2,3,2,1,0,3,1,1,4,2,2,1,2,1,0,0,1,2,0,1,3,0,0,2,0,2,0,1,3,2,1,1,0,0,1784,1,1,"Perth : printed by R. Morison jun. for W. Coke, Bookseller in Leith; R. Morison and Son, Booksellers in Perth; and T. Vernor, Bookseller at No 58 Fore-Street London, M,DCC,LXXXIV. [1784].",Perth,147,male,1695,1773,FALSE,"mind , so finooth the soul, When ruffling passions cease. S Stretched in the grave, our last retreat. You view at distance there The vain pursuits of bury man, And finle at human care . 6 Blessed be the grave whose earth contains What's dear to Jesus breast: let every"
1199300106_000018,Roach's beauties of the modern poets of Great Britain carefully selected and arranged in six volumes ...,,80,0,1,1,0,0,1,0,1,5,2,1,1,3,3,0,0,0,0,1,2,3,2,2,1,1,2,4,2,0,2,1,1,1,3,1,1,5,2,0,0,1,1,0,0,3,2,0,0,1,1,2,1,0,2,0,5,1,4,0,1793,6,6,"London : printed by and for J Roach, 1793.",London,249,unknown,,,FALSE,"man's impurer eyc; I hear the words, that issuing thence proclaim, "" Let God's attendants praise his awful name !"" Then heads unnumbered bend before the Ihrine, Mysterious seat of Majesty divine! And hands unnumbered strike the silver firing, And tongues unnumbered I iallelujaih ing, See, where the fining Scraphims"
0544600126_000033,The British poets.,,75,1,2,2,2,1,2,3,2,2,1,2,0,3,0,0,0,2,1,2,0,4,2,2,1,0,0,1,5,2,0,2,2,0,3,0,1,1,4,1,1,0,2,0,0,2,1,0,0,0,0,1,1,0,2,2,1,1,0,2,1773,26,44,"Edinburgh : printed for A. Kincaid and W. Creech, and J. Balfour, M,DCC,LXXIII. [1773][-76].",Edinburgh,169,unknown,,,FALSE,"all the woes behind. Then murl he susser what the fares ordain; For fate has wove the thread of life with pain , And twins even from the birth, are misery and man! But if descended from th' Olympian bower, Gracious approach us some immortal power ; If in that"
0419800200_000018,Poems on several occasions. By Stephen Duck.,Stephen Duck,74,2,2,1,0,1,2,0,3,0,1,1,0,0,0,1,1,0,0,1,1,1,2,1,4,1,1,1,3,1,0,0,1,1,1,1,0,3,3,3,1,0,1,4,2,2,0,1,2,0,1,0,1,0,2,2,2,0,2,6,1738,1,1,"London : printed for John Osborn, at the Golden Ball in Pater-Noster-Row; Samuel Birt, at the Bible and Ball in Ave-Mary Lane; and James Hodges, at the Looking-Glass on London-Bridge, 1738.",London,285,male,1705,1756,FALSE,"nce rural Solitude more pleasing smiles. O s.litnde! the Sage's chief Delight! Vhirt Niumbers can thy lovely Charms recite! i il, peace full Nymph! thou eldest Thing on Earth ! Na, lile Eterniy, thou hadst no Birth: Iti The Heavens alone can thy Commencement tell, Ete michtael sought, or peccant"
