0590000400_000031,Love tales and elegies: interspersed with pastorals and other curious poems. Selected from the best authors. With several valuable originals.,,90,0,3,0,1,1,1,0,3,3,1,0,1,1,0,0,0,0,0,1,0,1,1,1,2,0,0,5,3,0,2,2,0,1,0,1,1,16,2,0,3,4,2,2,2,3,1,0,1,1,3,2,1,0,2,1,3,0,0,5,1775,1,1,"London : printed for J. Wenman, No 144, Fleet-Street, MDCCLXXV. [1775].",London,193,unknown,,,FALSE,"power To soothe the soul in the disastrous hour , To give Content, and make it still endure, Which heaps of gems and gold cannot procure. Benevolence, thy praises crowned her song , Who bring'ft each Virtue in thy train along; Ad Hail holy Charity! to thee is given, To"
1056000700_000001,Elegies. By Robert Scott.,"Scott, Robert, writer of verse",86,1,0,0,0,4,2,3,3,0,0,0,1,3,0,0,1,1,0,1,0,0,1,2,2,1,1,5,0,2,2,5,0,1,1,1,2,9,2,1,1,0,3,2,1,1,0,0,0,4,2,2,2,0,5,1,1,0,2,1,1764,1,1,"London : printed for G. Burnet, at Bishop Burnet's Head, in the Strand, MDCCLXIV. [1764].",London,24,unknown,,,FALSE,"e"" y,, .r,"" ,"" y .4.._,, """"'°'""-  :  ?'5.  E L Ei; : -. t......  -': ./' * _.,; :  .; BY ko B RT. S C o tt. ..eelegeia flebile Carmen: Non facit ad Lachrymas Barbitos ulla meas. OVID. .'. C L 0 N"
0918700103_000003,A collection of poems in six volumes. By several hands.,Robert Dodsley,77,0,1,0,2,6,0,2,2,0,3,1,0,1,0,1,1,1,0,1,0,1,1,0,2,0,2,2,1,0,3,3,0,0,2,2,3,2,1,2,2,0,0,2,1,0,2,0,0,1,4,0,4,2,3,0,2,2,0,3,1775,3,6,"London : printed for J. Dodsley, in Pall-Mall, MDCCLXXV. [1775].",London,351,male,1703,1764,TRUE,"and mathlefs : strength excel? "" : irftcohiuer thouthyfolf. to eafe, to rell, "" To each soft thought of pleasure, bid farewell. ""The night , alternate due to sweet repose,  In watches waste; in : painfil: tmarch, the day: ""'coatgeii'd, amidst the rigorous wiriter's fndws;  Scorched, hythe fu'nftier'slthirftlinflatning"
1112000701_000028,"The miscellaneous works, in prose and verse, of Mrs. Elizabeth Rowe: Published by her Order, By Mr. Theophilus Rowe. To which are added, Poems on several occasions, by Mr. Thomas Rowe. And to the Whole is prefixed, An Account of the Lives and Writings of the Authors. In two volumes. ... . The fourth edition, corrected. To which is added, The history of Joseph, a Poem in Ten Books.",Elizabeth Rowe,86,0,4,1,1,4,3,0,3,1,3,0,0,0,1,0,2,0,1,1,2,2,5,2,0,1,1,2,5,0,1,3,0,1,2,3,0,1,3,2,1,0,0,0,0,2,6,0,0,3,1,1,1,0,1,0,7,0,1,1,1756,1,2,"London : printed for Henry Lintot, MDCCLVI. [1756].",London,382,female,1674,1737,TRUE,"(Thou midnight moon, and all ye starry throng. Retard your course, and hear th' immortal song i Ye silver floods, your murmuring lapse restrain, Nor roll your cryltal volunmes to the main?) No more let flowers receive their annual birth, Or vernal verdure cloathe the laughing earth ; No more,"
0295400200_000088,"Sequel to The English reader: or, elegant selections in prose and poetry. Designed to improve the highest class of learners in reading; to Establish a Taste for Just and Accurate Composition; and to Promote the Interests of Piety and Virtue. By Lindley Murray, Author of ``english Grammar Adapted to the Different Classes of Learners,'' &c.",Lindley Murray,78,0,0,1,1,1,0,1,1,2,2,0,0,2,3,1,2,1,0,1,0,2,1,1,0,0,2,3,1,3,3,3,1,1,4,1,1,2,0,0,3,1,0,1,0,2,1,0,1,0,2,5,3,1,2,3,3,2,0,0,1800,1,1,"York : printed by T. Wilson and R. Spence, High-Ousegate, for Longman and Rees, No. 39. Pater-Noster-Row; Darton and Harvey, No. 55, Grace-Church-Street, London; and Wilson and Spence, York, 1800.",York,393,male,1745,1826,FALSE,"its power to save O for that sympathetic glow, Which taught the holy tear to flow ! It comes: it fills my labouring breafli I feel my beating heart oppressed. Oh! hear that lonely widow's wail! .See her dim eye; her afpeet pale! To Heaven the turns in deep despair;"
1207901100_000040,A collection of psalms and hymns from various authors: chiefly designed for the use of public worship.,"Robinson, Thomas",110,0,1,0,1,0,0,0,1,3,3,3,0,0,2,0,1,1,0,0,4,6,7,1,3,0,0,13,1,3,2,4,3,1,1,0,1,10,0,1,1,0,1,0,0,8,5,0,2,3,1,0,2,1,4,1,0,2,1,1,1795,1,1,"Leicester : printed and sold by J. Brown, M,DCC,XCV. [1795].",,361,male,1749,1813,FALSE,"souls to thee, With sweet resistless power ; Thy boundless grace let rebels see, And at thy feet adore. u1 Y M N CLXXXV At the Funeral of a Young pe7fon. 1 i t EN blooming youth is finatch IV By death's resistless hand , [awayi Our hearts the mournful"
0096201400_000046,"The poetical works of J. Langhorne, D.D. With the life of the author. Cooke's edition. Embellished with superb engravings.",John Langhorne,94,0,1,0,1,1,0,3,2,2,0,0,5,2,2,0,1,1,1,0,2,1,2,1,0,1,2,6,1,1,5,1,0,0,5,1,5,11,1,0,2,2,0,0,1,2,2,0,0,0,3,5,1,0,0,4,1,1,2,0,1798,1,1,"London : printed for C. Cooke, No. 17, Paternoster-Row; and sold by all the booksellers in Great Britain and Ireland, [1798].",London,217,male,1735,1779,FALSE,"soft i'duaive arts ! The flattering clime of courts explore, Nor fpoil.the convent's simple hearts . 40 ""To me their praise more justly due, Of longer bloom and happier grace ! Whom changing months unaltered view , * And find them in my fond embrace."" ""How well,"" the modest flower"
0535400801_000028,"Poems on subjects chiefly devotional. In two volumes. A new edition. To which is added, a third volume, consisting of miscellaneous pieces. By Theodosia.",Anne Steele,98,1,2,2,1,3,1,9,0,0,3,0,1,0,1,0,1,1,1,2,1,3,0,2,1,0,1,7,4,5,1,1,0,1,2,2,0,1,2,1,3,2,4,1,0,5,0,0,0,0,1,2,4,0,7,1,0,2,2,0,1780,1,3,"Bristol : printed by W. Pine. Sold by T. Cadell, T. Mills, and T. Evans; - and by J. Buckland, Paternoster-Row, and J. Johnson, St. Paul's Church Yard, London, 1780.",Bristol,263,female,1717,1778,FALSE,"AH! why should this immortal mind , Enslave by sense, be thus confined, And never, never rise? Why thus amused with empty toys, And footed with visionary joys , Forget her native skies? II The mind was formed to mount sublime, Beyond the narrow bounds of time, To everlasting things;"
1712500102_000019,Poems on several occasions. By Mr. John Gay. Volume the first.,John Gay,89,0,1,2,1,2,2,0,0,0,0,1,1,1,2,0,1,0,0,0,2,1,0,3,0,1,4,5,3,1,0,1,1,2,2,5,0,6,1,3,8,0,2,0,1,2,0,1,2,3,1,1,3,0,1,1,0,1,5,2,1737,2,2,"London : Printed for H. Lintot, and J. and R. Tonson, MDCCXXXVII. [1737].",London,266,male,1685,1732,TRUE,"scatter round my arrows, Men fall as thick as hail; And maidens love like sparrows. IV Then, itwain, if me you need, Straight lay your theep hook down a Throw by your eaten reed, And haste away to town. So well I'm known at Court, None ask where Culpid dwells"
0386401200_000052,"Loose hints upon education, chiefly concerning the culture of the heart.","Henry Home, Lord Kames",91,1,0,0,1,3,4,6,3,0,0,0,0,2,1,0,2,0,0,1,1,1,2,0,4,0,1,3,4,2,0,3,0,3,4,0,3,3,0,1,1,3,2,1,0,4,1,0,0,0,2,0,1,1,1,1,6,0,3,5,1781,1,1,"Edinburgh : printed for John Bell, Parliament-Square; and John Murray, London, M,DCC,LXXXI. [1781].",Edinburgh,389,male,1696,1782,TRUE,"and of misery. A little farm was my paternal lot, Then like the lark I sprightly hailed the morn; But ah! oppression forced me from my cot, My cattle died and blighted was my corn. My daughter, once the comfort of my age, Lured by a villain from her native"
0276602400_000001,"Poems, by the late Mr. and Mrs. Johns, of Plymouth.","Johns, Mrs.",93,2,1,0,1,1,0,1,0,4,3,0,0,1,1,1,2,2,1,1,0,6,1,4,0,0,3,5,6,0,4,3,0,1,5,3,2,4,2,1,1,0,2,2,0,3,3,0,1,0,0,1,1,0,2,0,0,3,2,0,1797,1,1,"Plymouth : Clarence Press, [1797?].",,93,female,1731,1792,FALSE,"P EM S, c- -- - -- - ~~~~~~~~~~~~~~~~~~~~~~~~~~~~~~ POEMS, I y T' HE LATE Mr. and Mrs. O H NS, OF PLYMOUTH. ec CLARENCE PRE S S, POEMS, c. WRITTEN ON THE BIRTHDAY OF MY SON. -- -- -- *xmggg^oo --. -- A Year is fled again the fun"
0383601200_000024,The bull-Finch. Being a choice collection of the newest and most favourite English songs most of which have been sett to music and sung at the public theatres & gardens.,,101,2,1,2,2,5,2,1,8,0,1,2,1,1,2,0,0,1,0,0,1,3,3,0,6,1,0,7,1,0,0,6,0,4,0,2,6,3,2,3,1,0,0,0,1,4,0,1,0,7,1,0,0,0,3,2,1,0,0,1,1760,1,1,"London : printed & sold by I. Hinton at the Kings Arms in St. Pauls Church Yard London, [1760?].",London,194,unknown,,,FALSE,"( o00) A Fol is fit for neither, no Pleasure can he prove; Tis only Men of Humour can please the Fair iq. Lsve. SONG CXXXVII H I L E Strpbhon on fair c/loe hung; And gently wooed, and fiveetly lung. The i5imph, in a disdainful Air , 1 bus"
0082000500_000184,"Elegant extracts: or useful and entertaining pieces of poetry, selected for the improvement of youth, In Speaking, Reading, Thinking, Composing; and in the Conduct of Life; being similar in design to Elegant extracts in prose.",,82,3,2,0,0,8,4,2,1,1,1,0,1,0,0,1,2,2,0,1,3,3,5,2,1,2,0,2,0,0,1,0,1,0,3,0,3,3,1,3,0,0,0,1,1,1,2,0,3,1,0,0,1,1,1,1,3,2,0,2,1789,1,1,"London : printed for Charles Dilly, Poultry, [1789?].",London,741,unknown,,,FALSE,"and for mle * to die i Ere mercenary murder grew a trade. Mark, as the purple triumph waves along, The highell pomp and lowest fall of life . Her feltive games, tile school of heroes, see; Her Circus, ardent with contending youth ; Her liteets, her temples, palaces, and"
0936800302_000025,"The art of English poetry. Containing, I. Rules for making verses. II. A collection of the most natural, agreeable, and sublime thoughts, viz. allusions, similes, descriptions and characters of persons and things, that are to be found in the best English Poets. III. A dictionary of rhymes. By Edward Bysshe, gent.",Edward Bysshe,74,0,0,0,1,0,1,1,0,0,2,1,1,2,1,1,2,1,0,1,1,5,1,2,3,1,3,0,1,0,0,4,2,0,0,1,0,9,0,1,0,1,2,0,1,1,1,1,2,1,4,2,0,2,1,0,0,0,3,3,1724,2,2,"London : printed for R. Wilkin in St. Paul's Church-Yard; O. Loyd in the Temple; J. Osborn in Lombard-street; W. Mears, and F. Clay without Temple-Bar, and J. Hooke in Fleet-street, M.DCC.XXIV. [1724].",London,338,male,,1712,FALSE,"her Fears in Love , And the fierce Youth languish at her Feet. Begin! Even Age itself is cheered with Music, It wakes a glad Remembrance of our Youth , (Pen. Calls back past Joys , and warmsus into Transport. Row Fair The breathing Flutes soft Notes are heard around,"
0239200700_000004,"Original poems and translations. By James Beattie, A.M.",James Beattie,76,0,0,1,3,1,2,1,0,1,0,0,0,2,2,1,0,1,1,2,1,0,0,3,1,0,2,3,2,2,1,3,0,0,2,1,1,1,2,2,3,1,2,0,1,3,0,0,1,0,2,3,2,2,3,1,3,0,0,4,1760,1,1,"London [i.e. Aberdeen?] : printed [by F. Douglas, Aberdeen?]; and sold by A. Millar in The Strand, MDCCLX. [1760].",London|Aberdeen.,198,male,1735,1803,FALSE,"] And lo, his iron hand prepares To grasp its feeble prey. III 2 Oh who shall guard bewildered Youth Safe from the fierce assaults of hostile rage? Such wars can Virtue wage, Virtue , that bears the sacred shield of Truth? Ah no. On Infamy's victorious spear Fair Virtue's"
0086900500_000001,"The works of Edmund Waller, Esq; in verse and prose. Published by Mr. Fenton.",Edmund Waller,80,3,0,1,0,3,4,2,3,2,1,0,0,4,1,0,1,4,0,1,0,1,4,0,1,0,2,0,2,0,0,1,2,0,2,1,1,8,2,1,0,0,1,1,1,1,5,0,0,1,1,0,1,1,1,1,1,2,0,4,1752,1,1,"Glasgow : printed by Robert and Andrew Foulis, MDCCLII. [1752].",Glasgow,305,male,1606,1687,FALSE,"I THE WORKS W O R K S or EDMUND WALLER, Esq; I N VERSEAND PROSEL PU B L IS H ED By Mr. F E N T O N, GLASGOW, PRINTED BY ROBERT AND ANDREW FOUISS M DCC LTI. TO THE RIGHT HONOURABLE T H E LADY MARGARET CAVENDISHE"
0706001100_000027,"Horae lyricae. Poems, chiefly of the lyric kind, in three books. Sacred I. To devotion and piety. II. To virtue, honour and friendship. III. To the memory of the dead. By I. Watts, D.D.",Isaac Watts,95,1,0,0,3,3,1,1,3,3,1,2,2,0,1,0,1,2,0,1,1,0,3,1,0,0,1,9,4,1,0,2,1,1,2,2,1,13,2,2,2,0,2,0,0,4,0,0,2,2,2,1,3,0,2,0,0,1,3,0,1748,1,1,"Boston : Printed and sold by Rogers and Fowle in Queen-Street and J. Blanchard at the Bible and Crown in Dock-Square, MDCCXLVIII. [1748].",Boston,297,male,1674,1748,TRUE,"dear f'aouand, says he, and fiands And prays to clasp me to his Heart . VII Sure I mull love ; or are my Ears Still deaf, nor will my Pallion move? Then let me melt this Heart to Tears ; This Heart shall yield to Death or Love ."
0381500300_000010,"Horæ lyricæ. Poems, chiefly of the lyric kind. In two books. ... By I. Watts.",Isaac Watts,90,0,1,2,1,0,0,1,3,2,2,3,0,0,1,0,0,1,0,1,2,8,2,1,1,2,0,4,1,1,0,3,2,1,3,4,2,7,4,0,1,3,1,2,1,0,0,0,1,2,3,1,4,0,1,2,1,1,0,0,1706,1,1,"London : printed by S. and D. Bridge, for John Lawrence, 1706.",London,288,male,1674,1748,TRUE,"all the Joys we Mortals know Oj yjefr, thy Love exceeds the rest Love , the belt Bleffig here below, And nearest Image of the Blefti , it II weet are my Thoughts , and soft my Cares henthe dear Heavenly Flame I feel; all my Hopes and all my"
1091901000_000262,"The annual register, or a view of the history, politicks, and literature, for the year 1760.",,84,2,2,1,0,2,2,0,1,4,2,2,0,1,3,0,0,3,0,1,0,0,2,3,1,0,0,2,1,0,3,5,2,2,1,1,1,2,6,4,0,0,3,1,0,1,2,0,0,3,2,1,2,0,0,1,2,3,0,1,1775,1,1,"London : printed for J. Dodsley, in Pall-Mall, 1775.",London,542,unknown,,,FALSE,"and flowly rifing ghost. Tell me, nor count the question too revere, Why need the dismal powdered forms appear ? When chilling horrors Shake th' affrighted king , And Guilt torments him with herfcorpion sling; When keenest feelings at his bosom pull, And fancy tells him that the seat is"
0260200100_000001,"The works of Edmund Waller, Esq; in verse and prose. Published by Mr. Fenton.",Edmund Waller,74,3,0,1,0,2,4,2,3,1,1,0,0,4,1,0,1,4,1,1,0,1,3,0,1,0,2,0,1,0,0,1,1,0,2,1,1,6,2,1,0,0,1,0,1,1,5,0,0,2,1,0,1,1,1,2,0,2,0,4,1730,1,1,"London : printed for J. Tonson in the Strand, MDCCXXX. [1730].",London,472,male,1606,1687,FALSE,"i edmund WAILER E q. RE E 1m1h : : W -- W K S' WORKS sdm d4 a Waler, Esq /< - N VERSE and PROSEL. PUB lished By Mr. FENTON LON ).O; N: Printed for J. To NS on in the Strand. a. MDCCXXX. - ae~_/'~&o~l i. -,"
0587800200_000004,Miscellanies in prose and verse. By Anna Williams.,Anna Williams,78,2,0,1,1,2,3,4,2,3,0,1,2,2,1,0,1,1,0,1,0,0,1,2,0,0,1,4,1,1,2,3,0,0,2,0,1,4,5,2,0,1,1,0,0,2,2,0,2,1,0,1,2,0,1,2,3,1,2,1,1766,1,1,"London : printed for T. Davies, in Great Russel-Street, Covent-Garden, M,DCC,LXVI. [1766].",London,187,female,1706,1783,FALSE,"tcmpcfs blow; Where mountains sudden rise, and where Whole citiet fink below. With fearless heart , and easy rmien, i e views tlh dreaddful fl'lt, Ilis guiltless soul remains fercne, Prepared to take her flight. No danger can disturb his reit, Secure of heaven's defence; For what can shake the"
1735100106_000010,A Collection of poems in six volumes. By several hands.,Robert Dodsley,77,2,0,1,2,2,0,1,2,0,1,3,0,1,2,0,0,4,0,6,0,1,2,2,3,0,0,1,3,1,0,2,0,1,1,1,1,5,2,1,1,1,3,1,1,2,2,1,3,0,3,0,1,1,1,0,1,0,0,1,1766,6,6,"London : Printed by J. Hughs, for J. Dodsley, in Pall-Mall, MDCCLXVI. [1766].",London,338,male,1703,1764,TRUE,"generous warmth descend, - And still new trophies rise, at once , to Arts , and Arms . d3 ELEGY ( 54) E L E G Y V To a F R IE N D Sick. Written at roms, 1756 9 WAS in this isle, o0 Wright indulge my lay,"
0544700201_000026,"The miscellaneous works, in prose and verse, of Mrs. Elizabeth Rowe: Published by her Order, By Mr. Theophilus Rowe. To which are added, poems on several occasions, by Mr. Thomas Rowe. And to the Whole is prefixed, An Account of the Lives and Writings of the Authors. ... . The fifth edition, corrected. To which is added, The history of Joseph, a Poem in Ten Books.",Elizabeth Rowe,80,0,1,0,2,0,4,0,1,3,3,0,2,1,1,1,1,3,0,4,1,1,1,2,2,0,1,3,3,1,3,1,0,0,1,0,1,3,0,0,0,1,2,2,4,1,4,0,0,2,3,3,0,0,1,0,6,0,0,0,1772,1,2,"London : printed for J. Buckland, G. Keith, W. Nicholl, G. Pearch, and H. Gardner, M.DCC.LXXII. [1772].",London,380,female,1674,1737,TRUE,"length of days was thine! Their friend , their parent must the poor resign; Who now Shall tooth the finking heart to hope , And blend with lenient sweets woe's bitter cup? Where Shall the orphan's cry find pitying ears? Into whose breat the widow pour her tears ? Where"
1174900103_000012,"A complete collection of old and new English and Scotch songs, with their respective tunes prefixed. ...",,101,0,1,3,0,0,3,5,4,0,0,2,1,0,0,0,2,2,0,4,2,0,3,1,2,0,0,6,2,1,0,4,0,0,2,0,2,11,3,2,2,0,1,4,1,1,1,0,3,9,3,0,1,1,0,0,0,1,4,1,1736,3,4,"London : printed and sold by T. Boreman; and sold likewise at his shop at the Cock on Ludgate-hill, 1736.",London,189,unknown,,,FALSE,"a TRUE love knot, or name, Engraves a wounded tree. Ah Celia! (fly Sabina cried) Though' neither love , we're both denied: Let either fix the dart. Poor girl! (fays Celia) say no more; That spite which broke his chains before, Would break the other's heart . VOL. III I"
1494001100_000010,"Fables, odes, and miscellanious poems. By Elizabeth Fell, of Saffron-Walden.","Fell, Elizabeth           1780",99,2,0,0,1,3,2,4,4,4,1,0,0,6,1,0,1,4,0,1,0,2,0,2,2,0,3,2,3,0,3,3,0,1,9,3,1,9,1,0,1,0,1,3,0,1,1,0,1,0,2,1,0,0,2,0,5,1,0,2,1771,1,1,"London : Printed for J. Robson, bookseller, at the Feathers in New-Bond-Street, MDCCLXXI. [1771].",London,186,female,,,FALSE,"On my ~lels'dt life rpontaneous slow, Anid brighten every morn. QO OD E. [ zz4 J O D E To a c~raz. SWEET candour, innocence, and truthr, Adorn thy lovely infant youth . Oh may they grow through' riper age, incessant war with pailion wage, Encreading as thy years decline,"
1040300109_000276,"The London magazine, and monthly chronologer.",John Pine,73,2,1,2,0,5,2,1,4,1,0,2,0,1,0,1,1,2,0,2,0,3,3,1,1,0,0,4,1,1,2,2,1,1,1,1,0,5,1,3,1,0,0,0,0,1,1,0,1,1,1,1,0,0,1,1,1,1,2,2,1736,1,1,"London [England] : printed by C[harles]. Ackers, in St. John's-Street; for T[homas]. Cox, at the Lamb under the Royal-Exchange; J[ohn]. Clarke, at the Golden-Ball in Duck-Lane; and T[homas]. Astley, at the Rose over-against the North-Door of St. Paul's, [1736-1746].",London,660,male,1690,1756,FALSE,"And his fierce hunger curb. Place him in those unfruitful lands VW', ere no enlivening ray descends, Trees no gay verdure wear; Malignant clouds obscure the Iky; de th pointed lightnings round hinm y,. And plagues insea the air : Place him beneath the torrid sore, Near the hot chariot"
1577901701_000034,"Apollo: or, The Songster's Universal Library. Being a collection of all the new and old songs on love, mirth, war, hunting, and drinking. Likewise, the pastoral ballads, loyal and sea songs, duetts, cantatas, &c. Contained in the several theatrical pieces and oratorios, or those sung at the gardens in these kingdoms. Interspersed with many original Irish, English, and Scotch songs, of mirth and oddity, that have hitherto been only handed about incorrectly in manuscript. First part of vol. I.",,88,1,2,1,3,1,3,1,5,1,0,0,0,2,2,0,0,1,0,0,0,0,2,0,2,0,0,5,2,2,0,4,0,1,2,1,0,12,0,2,2,2,4,0,1,1,2,0,0,3,3,1,2,1,4,1,1,0,0,2,1775,1,1,"Dublin : Printed by James Hoey, Jun. at the Mercury, [1775?].",Dublin,152,unknown,,,FALSE,"blessed. THOM. For this the sailor on the malr, Endures the cold and cutting blast; All dripping wet, wears out the night , And braves the fury of the sight. SALLY. For this the virgin pines, and sighs, With throbbing heart , and streaming eyes; Till sweet reverse of joy"
0660200600_000084,"The lady's preceptor; or, a series of instructive and pleasing exercises in reading; for the particular use of females; consisting of a selection of moral essays, narratives, letters, Dialogues, and Poetical Compositions, Materially Interesting To The Sex: Intended for the Cultivation of their Minds, and to assist them in varying their Mode of Reading; By Mr. Cresswick, Teacher Of Elocution.","Cresswick, Mr           1792",98,0,0,0,0,1,7,2,2,3,2,4,1,4,0,0,1,4,0,1,1,1,4,0,0,0,0,2,3,0,2,2,0,1,4,1,3,4,5,3,1,4,2,2,0,1,2,0,0,0,0,2,2,0,2,0,6,0,4,2,1792,1,1,"London : printed for G.G.J. and J. Robinson, in Paternoster-Row, and Hookham and Carpenter, Old and New Bond-Street, MDCCXCII. [1792].",London,437,unknown,,,FALSE,"tafle that comfort which the world denies. TO THE MEMORY OF A YOUNG LADY AGED EIGHTEEN. IN vain our tears , lamented maid, are Ihed, In vain with sighs we mourn thine early doom; The pangs of woe can never reach the dead, Or pierce the silent mansions of the"
0381200400_000084,"The speaker: or, miscellaneous pieces, selected from the best English writers, and disposed under proper heads, with a view to facilitate the improvement of youth in reading and speaking. To which is prefixed An essay on elocution. By William Enfield, LL. D. Lecturer on the Belles Lettres in the Academy at Warrington.",William Enfield,81,1,1,0,0,0,4,0,1,1,3,1,0,1,0,0,0,3,0,1,0,1,0,3,1,0,0,3,4,2,2,4,0,0,6,1,2,4,3,3,2,0,1,1,1,2,0,0,2,3,1,1,2,0,1,1,2,1,3,1,1779,1,1,"London : printed for Joseph Johnson, St. Paul's Church-Yard, MDCCLXXIX. [1779].",London,442,male,1741,1797,FALSE,"not those fantastic joys , That still amuse the wanton, still deceive; A face of pleasure, but a heart of pain ; Their hollow moments undelighted all? Sure peace is his; a solid life , estrange To disappointment, and fallacious hope : Rich in content, in Nature's bounty rich, In"
0302600400_000084,"The speaker: or, miscellaneous pieces, selected from the best English writers, and disposed under proper heads, with a view to facilitate the improvement of youth in reading and speaking. To which is prefixed an essay on elocution. By William Enfield, LL. D. lecturer on the belles lettres in the academy at warrington.",William Enfield,85,0,1,0,0,0,3,2,1,1,1,2,0,0,1,0,0,1,0,1,0,1,1,1,3,1,0,5,3,1,3,4,0,1,6,1,2,5,4,4,2,0,1,1,1,1,0,0,3,3,0,1,2,1,1,0,2,1,4,1,1786,1,1,"London : printed for J. Johnson, ST. Paul's Church-Yard, MDCCLXXXVI. [1786].",London,446,male,1741,1797,FALSE,"faith, And equal transport, free as nature live , Disdaining fear . What is the world to them, Its pomp, its pleasure, and its nonsense all Who in each other clasp whatever fair High fancy forms , and lavish hearts can with; Something than beauty dearer, Should they look Or"
0376400700_000016,"The poetical monitor: consisting of pieces select and original, for the improvement of the young in virtue and piety: intended to succeed Dr. Watts' Divine and moral songs. Published for the benefit of the Shakespear's-Walk Female Charity-School, St. George in the East.",,98,0,1,1,0,0,1,1,1,3,4,0,0,2,1,1,0,2,0,1,4,3,0,1,3,0,3,4,4,2,0,5,0,1,7,2,1,9,1,1,1,0,3,2,0,2,1,0,3,0,2,0,3,0,0,0,5,2,2,2,1796,1,1,"London : sold by T. N. Longman, Paternoster-Row; J. Johnson, St. Paul's Churchyard; C. Dilly, Poultry; A. Cleugh, Ratcliffe-Highway; and the Secretary, by orders sent to the school, [1796].",London,167,unknown,,,FALSE,"In endless pain or joy . Important thought ye mortals! hear On what your peace depends; The voice of truth invites your ear, And this the voice the sends; When virtue glows with youthful charmss  How bright the vernal skies!  When virtue , like the summer, warms, What"
1017900500_000018,"The wanderer: a poem. In five canto's. By Richard Savage, Son of the late Earl Rivers.",Richard Savage,87,2,0,0,1,1,1,2,6,0,1,0,2,1,3,0,0,4,0,1,1,1,2,0,0,0,0,3,2,1,2,5,1,4,3,5,0,3,3,1,3,1,2,1,0,0,0,0,2,1,2,0,3,1,0,3,0,3,2,1,1729,1,1,"London : printed for J. Walthoe, over-against the Royal Exchange, in Cornhill, [1729].",London,162,male,1697,1743,TRUE,"of [ Night , Scattering, like Hope through' Fear , a doubtful Light . Lone Philomela tuned the silent Grove, With pensive Pleasure listened wakeful Love . half dreaming Fancy formed an Angel's Tongue, And Pain forgot to groan, so sweet he sung. The Night c; rone, with the Melody"
1133700101_000113,"The lady's poetical magazine; or, beauties of British poetry. ...",,68,0,1,1,1,0,1,1,1,2,1,1,0,3,0,0,2,0,1,0,1,0,1,1,1,1,1,3,2,2,2,4,0,2,0,1,1,3,2,0,2,1,0,1,1,1,0,3,1,1,0,6,0,2,3,1,1,0,0,0,1791,1,2,"London : printed for Harrison and Co. No. 18, Paternoster-Row, 1791.",London,490,unknown,,,FALSE,"so near it's journey's end, · Through' cruel torment to the grave descend?  His fllallow blood all iflte at a wound,  Wafll a slave's feet, and smoke upon the ground · But he to you has ever been severe'  take your vengeance' Suffolk now drew near, Bending"
0751200300_000042,"Miscellaneous poems, viz. Night. In 4 books. Zeuma: or the love of liberty. In 3 books. Clarinda: or the fair libertine. The muses' address, and The tempest. By Mr. Ralph.","Ralph, James",82,0,1,0,3,0,0,3,5,2,0,1,1,2,0,1,2,2,0,0,1,2,1,2,0,4,1,4,3,1,1,3,1,0,3,0,0,4,3,0,0,1,0,3,1,3,2,0,4,2,0,0,0,1,0,1,3,1,1,2,1729,1,1,"London : printed by C. Ackers, for W. Meadows at the Angel in Cornhill; S. Billingsley at the Judge's Head in Chancery-Lane; and J. Gray at the Cross-Keys in the Poultry, MDCCXXIX. [1729].",London,383,male,,,FALSE,"for virtue , and grow fond of fame, Even he, and every younger branch that decks The royal house, Should be the theme of verse, And every joyful Muse run riot to their praise . Thus Greemnich dome, stupendous pile! Well worthy Albion, and her naval sons, Where william's triumphs,"
0889500400_000004,Love elegies. Written in the year 1732.,"Hammond, James",86,0,2,0,1,2,3,5,4,2,0,1,0,1,2,0,0,1,1,1,1,0,1,1,2,0,1,4,0,4,2,1,0,3,3,3,0,8,2,2,1,0,2,0,0,2,0,0,0,0,2,3,2,0,2,1,1,1,4,1,1768,1,1,"London : printed for W. Strahan; and R. Baldwin, Paternoster-Row, MDCCLXVIII. [1768].",London,46,male,1710,1742,FALSE,"not of despair: With mean disguise let others nature hide, Aid mimic virtue with the paint of art , I scorn the cheat of reason's foolish pride, f And boast the graceful weakness of my heart . The more I think, the more I feel my pain , And learn"
0544700144_000016,The British poets.,,73,0,2,1,1,2,0,1,1,0,0,1,1,2,1,1,1,1,0,2,2,0,0,0,1,0,1,5,0,3,2,6,0,2,2,0,0,3,4,1,1,0,0,5,1,1,2,0,1,4,2,0,1,0,1,0,1,2,0,1,1773,44,44,"Edinburgh : printed for A. Kincaid and W. Creech, and J. Balfour, M,DCC,LXXIII. [1773][-76].",Edinburgh,86,unknown,,,FALSE,"doubly swift the shadow flies, "" When gainst the gale the pilgrim plies. "" At leaf be firm, and undismayed "" Maintain your ground; the fleeting (hade. 4"" Erclong spontaneous glide away, "" And gies you back th' enlivening ray. "" Lo, while I pamk, our danger pal! "" No"
