0331900102_000036,"The works of Dr. Jonathan Swift, Dean of St. Patrick's Dublin. Accurately corrected by the best editions. With the author's life and character; notes historical, critical, and explanatory; tables of contents, and indexes. More complete than any preceding edition. In nine volumes. ...",Jonathan Swift,78,0,0,0,1,1,3,1,0,1,2,1,4,0,0,2,1,1,1,1,4,0,3,0,0,0,2,1,3,0,0,0,1,0,0,3,0,0,1,0,0,1,3,2,0,1,1,7,1,2,2,0,0,1,0,0,2,1,3,0,13,1758,2,9,"Dublin : printed for G. and A. Ewing, 1758.",Dublin,403,male,1667,1745,TRUE,"numerous and rich, by a long peace and free trade , not over preffed with many burdensome taxes ; no violent faction ready to dispute his just prerogative, and thereby weaken his authority at home, and lessen his reputation abroad. For, if the contrary of all this happen to be"
0515000109_000082,"A complete history of England, from the descent of Julius Cæsar, to the Treaty of Aix la Chapelle, 1748. Containing the Transactions of One Thousand Eight Hundred and Three Years. By T. Smollett, M.D.Volume the first.",Tobias Smollett,82,2,2,0,0,0,0,2,5,1,0,0,2,3,0,2,1,4,1,1,0,5,0,1,1,0,4,6,0,1,1,0,0,0,0,0,3,0,0,0,3,4,0,3,3,1,3,5,1,2,0,0,0,2,1,1,0,1,1,3,0,1758,9,11,"London : printed for James Rivington and James Fletcher, at the Oxford-Theatre; and R. Baldwin, at the Rose, in Paternoster-Row, MDCCLVIII. [1758]-60.",London,489,male,1721,1771,TRUE,"much admired by the well wilhers to the revolution, that they printed it with decorations, in the English, Dutch, and French languages. It appeared as a piece of furniture in all their houses , and as the king's last legacy to his own and all protestant people . In this"
0301400400_000029,"The history of the four last years of the Queen. By the late Jonathan Swift, D. D. D. S. P. D. Published from the last manuscript copy, corrected and enlarged by the author's own hand.",Jonathan Swift,88,2,1,0,2,0,1,0,1,0,0,2,5,0,0,1,1,1,0,0,0,0,5,0,4,1,2,5,1,1,0,0,0,0,0,9,4,0,0,1,1,2,2,3,2,1,2,3,4,0,1,0,0,0,2,1,6,2,1,0,5,1758,1,1,"London : printed for A. Millar, in the Strand, MDCCLVIII. [1758].",London,405,male,1667,1745,TRUE,"two "" and a half percent. deducted from the ""foreign troops, was public money , and ""ought ""ought to be accounted for : "" which resolutions were laid before the Queen by tile whoil house , and her miajefty pron icd to do her part in redreflfing what was complained"
1212401800_000002,An address to the House of Commons of Ireland: by a freeholder.,"Caldwell, James, Sir",74,0,2,0,0,0,1,1,4,0,0,0,1,1,0,1,1,1,1,1,5,1,1,0,0,1,1,0,2,0,1,0,0,0,2,4,7,0,0,0,0,0,1,2,1,5,0,0,2,2,0,0,2,2,0,2,2,0,5,2,6,1771,1,1,"[Dublin?] : printed in the year, 1771.",Dublin,45,male,,,FALSE,"the neglet of them. IT is notwithstanding true, that it was the interest of Great Britain, rather to keep North America than Martinico and guadal3rpe; because though the jvefti bdia Islands would have poured more money into the Kingdom ; vet the trade to America employs more flhipping, and if"
0605900300_000156,"The political history of Europe. Being a collection of the public treaties and state tracts, Digested into due Order, and historically introduced; commencing with the treaty of Munster, 1648. To which is prefixed, A short Historical and Chronological Account of the State of Affairs, from the Year 800 down to the said Treaty. Interspersed with A Variety of curious Anecdotes, relating to Literature, Philosophy, and Science.","Horsley, William",100,0,0,2,0,1,0,1,0,0,0,0,1,6,0,2,1,6,0,4,8,7,2,2,1,0,0,10,4,2,0,1,1,0,0,0,5,0,0,0,1,0,5,0,1,2,0,0,0,1,1,0,1,3,5,0,0,1,1,9,2,1746,1,1,"London : printed by J. Bettenham, for the author; and sold by R. Manby, and H. S. Cox, on Ludgate-Hill, MDCCXLVI. [1746].",London,520,male,1701,1776,FALSE,"ations not becoming even an enemy ; and yet. he was so far from declaring himself so, that at that very time he was negotiating here in England by his ministers a treaty of neutrality and good correspondence in America. The proceedings of the French King against our fubjets in"
0125800401_000197,"A new geographical, historical, and commercial grammar; and present state of the several Kingdoms of the world. Containing I. The Figures, Motions, and Distances of the Planets, according to the Newtonian System and the latest Observations. II. A general View of the Earth considered as a Planet; with several useful Geographical Definitions and Problems. III. The grand Divisions of the Globe into Land and Water, Continents and Islands. IV. The Situation and Extent of Empires, Kingdoms, States, Provinces, and Colonies. V. Their Climate, Air, Soil, vegetable Productions, Metals, Minerals, natural Curiosities, Seas, Rivers, Bays, Capes, Promontories, and Lakes. VI. The Birds and Beasts peculiar to each Country. Vii. Observations on the Changes that have been any where observed upon the Face of Nature since the most early Periods of History. Viii. The History and Origin of Nations: their Forms of Government, Religion, Laws, Revenues, Taxes, naval and military Strength. IX. The Genius, Manners, Customs, and Habits of the People. X. Their Language, Learning, Arts, Sciences, Manufactures, and Commerce. XI. The chief Cities, Structures, Ruins, and artificial Curiosities. XII. The Longitude, Latitude, Bearings, and Distances of principal Places from London. XIII. A General Index. With a table of the coins of all nations, and their value in English money. By William Guthrie, Esq. Illustrated with a New and Correct Set of Large Maps, Engraved by Mr. Kitchin, Geographer. The second edition. In two volumes. ...","Paraire, John",61,1,0,0,0,1,2,0,3,0,1,0,2,0,1,0,1,4,1,0,2,0,1,0,0,0,3,3,2,1,2,0,1,0,0,1,4,0,0,1,1,4,1,1,2,2,0,1,3,0,2,0,0,1,0,0,2,0,1,1,1,1771,1,2,"London : printed for J. Knox, at No. 148, near Somerset-House, in the Strand, MDCCLXXI. [1771].",London,489,unknown,,,FALSE,"but of late erection, and was owing to a scheme of carrying on an exclusive trade , and making a let tlenent in the South seas, which had been formed in 171i. In 1720 the company obtained an a t increase their capital 4 tck Rock by redeeming the public"
0334600104_000041,"History of Great Britain, from the revolution to the session of parliament ending A.D. 1793. By W. Belsham. In four volumes. ...",William Belsham,85,0,0,0,1,1,0,0,2,1,0,0,0,9,0,1,1,6,1,0,8,6,3,0,1,1,3,6,2,2,1,1,1,0,0,0,1,0,1,0,2,2,1,0,1,2,1,2,1,0,0,1,1,0,2,2,0,0,0,1,6,1798,4,4,"London : printed for G. G. and J. Robinson, Paternoster-Row, MDCCXCVIII. [1798].",London,573,male,1752,1827,FALSE,"of Philipfburg, Manheim, Mentz, Spires, chut he was wholly disappointed in his designs upon Cologne, which, rejecting the neutrality offered by France , admitted a garrison of 6000 men from Prince Clement of Bavaria, recently chosen Elector. The States General having nothing to apprehend therefore on that fide, the Prince"
1761600303_000504,"The history of England, by Mr. Rapin de Thoyras. Continued from the revolution to the accession of King George II. By N. Tindal, ... Illustrated ...","Rapin de Thoyras, M. (Paul)",76,0,0,0,1,0,2,0,1,1,0,0,1,1,0,1,1,1,0,1,3,2,2,1,2,1,5,7,3,1,1,1,1,0,0,0,4,0,1,0,0,8,1,0,1,0,0,3,0,1,0,0,0,4,2,0,0,1,0,5,4,1744,3,4,"London : printed for John and Paul Knapton, 1744-47.",London,821,male,1661,1725,FALSE,"a motion concerning their Colony at Darien, which they conceived was not agreeable to the 40th alz of the I th Parliament of King James VI wherein it is enaled, That nothing Should be done or commanded which might direaly or indirealy prejudice the liberty of free voting, and reasoning"
0162200102_000598,"The civil history of the kingdom of Naples. In two volumes. Vol. I. Wherein is contain'd, The History of that Kingdom (comprizing also the general Affairs of Europe) under the Romans, Goths, Greeks, Dongobakds, Normans, and the Princes of the House of Suevia, 'till the Death of the Emperor Frederick II. in the Year 1250. With the History of the Civil, Canon, and Feodal Laws; the Ecclesiastical Polity; the Succession of the Popes, and by what subtle Arts the pontificate gain'd upon the Regale. Where the Author clearly demonstrates, That the Temporal Dominion and Power exercis'd by the Popes, has been altogether owing to the Ignorance, and Connivance of, or Concessions extorted from Secular Princes during the dark Ages, &c. Written in Italian, by Pietro Giannone, Civilian and Advocate in Naples; and publish'd Anno 1723. publish'd anno 1723. Translated into English, by Captain James Ogilvie.",Pietro Giannone,90,1,1,1,4,0,1,0,0,0,0,2,0,4,1,0,0,3,1,4,4,5,2,0,1,2,1,5,6,1,0,0,0,0,2,2,0,0,0,2,7,0,2,2,1,0,0,3,0,1,1,0,2,0,4,2,1,1,0,0,7,1729,2,2,"London : printed for W. Innys, in St. Paul's Church-Yard; G. Strahan, at the Golden-Ball, and R. Willock, at Sir Isaac Newton's Head, in Cornhill; A. Millar, at Buchanan's Head, in the Strand; T. Green, and J. Pote, near Charing-Cross; J. Penn, in Westminster-Hall; A. Johnston, engraver, in St. Martin's-Lane; and sold by the booksellers of London and Westminster: and at Edinburgh, by A. Symmer, in the Parliament-Close, M.DCC.XXIX. [1729].",London,853,male,1676,1748,FALSE,"Money was ordered to be coined, and severe Punishments inflicted upon those who had the Boldness to clip or counterfeit it, vet the Greediness of Gain overcame the severest Punishment whatsoever. The Number of Clippers and FALSE Coiners was fuchj that even in the Houses of Persons of Quality Clippings"
0606100100_000726,"A new and complete history of England, from the earliest period of authentic intelligence to the present time. Wherein every interesting Transaction, relating to War or Peace, Laws or Government, Policy or Religion, Is Impartially recited; The Noble Super Structure Of The British Constitution Fully Described, And Traced From Its Original Foundation: The Characters Of The Most Eminent Persons Are Impartially Drawn, And Their Genius And Learning, Their Virtues And Their Vices, Properly Displayed. Together With A Circumstantial History Of Literature, And The Progress Of The Arts In This Kingdom, From Their First Introduction To The Present Period Of Elegant Improvement. By Temple Sydney, Esq. Embellished and illustrated with upwards of one hundred copper plates, engraved in the most masterly Manner, from the Drawings of the ingenius Mr. Wale, by those capital English Artists, Grignion, Walker, Rennoldson, and Taylor.","Sydney, Temple",74,0,0,0,2,0,2,0,1,0,1,0,2,1,2,1,0,4,1,2,3,2,1,0,0,1,0,1,2,1,0,0,1,0,1,3,3,0,0,0,3,5,8,2,0,1,2,1,2,0,0,0,0,2,1,2,0,0,0,2,5,1775,1,1,"London : printed for J. Cooke, at Shakespear's-Head, in Pater-Noster Row, MDCCLXXV [1775].",London,819,unknown,,,FALSE,"was therefore issued in July, direcing the justices of the peace to meet fiequently in their refpcdive divisions, in order to consult the most effectual means to relieve and subsist the poor, till a sufficient quantity of money could be ifued to relieve the present scarcity. The attorney- general was"
0726100500_000009,An answer to the latter part of Lord Bolingbroke's Letters on the study of history. By the late Lord Walpole of Woolterton. In a series of letters to a noble lord. Part I. and II.,"Horatio Walpole, 1st Baron Walpole",78,0,1,1,4,0,2,0,0,0,0,1,0,2,2,1,3,3,4,2,4,2,3,0,0,0,2,7,1,2,0,0,1,1,1,0,0,1,0,0,0,0,0,1,1,1,0,5,0,0,0,1,2,8,0,2,0,0,0,3,3,1762,1,1,"London : printed by W. Richardson and S. Clark, 1762.",London,204,male,1678,1757,FALSE,"Albuquerque, Valencia, and Alcantara in Eftramadura, c. Secret Art. i., THE arch duke is likewise to yield up to his Portugal majesty certain dominions adjoining to the river Plata in America. Secret Art. 2 BY that with Savoy, that prince's right of succession to the Spanifl monarchy, preferably to any"
0705300103_000046,"The history of England, written originally in French by Rapin de Thoyras: translated into English, with additional notes; and continued from the Revolution to the accession of King George II. By N. Tindal, M. A. Late Rector of Alverstoke in Hampshire, and Chaplain to the Royal Hospital at Greenwich: with the reign of George the II: by T. Smollett, M.D. And an index to each volume. ... Illustrated and Embellished with Portraits of the Kings, Queens, and illustrious Personages, Monuments, Great-Seals, Coins, naval and military Engagements, &c. and Maps of the different Parts of the World, where the Important Events of this History took Place.",Tobias Smollett,98,0,1,4,1,1,1,0,0,1,1,0,0,1,0,1,3,6,1,1,14,5,1,0,0,0,2,17,0,1,1,1,2,0,0,1,0,0,2,0,1,1,5,0,0,0,0,2,0,2,1,0,1,2,0,0,0,1,0,3,9,1789,3,5,"London : printed by and for John Harrison No. 115, Newgate-Street; and sold by all the book-sellers in Great-Britain and Ireland, MDCCLXXXIX. [1789].",London,678,male,1721,1771,TRUE,"The cffrac of this policy evidently appeared at the very time I am (peaking of. Instead of persuading the king to make peace with Spain , they engaged him by degrees to proclaim war with France , at a time when he knew not how to continue the war he"
1206900102_000036,The works of Jonathan Swift. D.D: D.S.P.D. With notes historical and critical by J. Hawkesworth. L.L.D. And others. Vol. I.,Jonathan Swift,73,1,1,0,1,1,2,1,0,2,2,1,3,0,0,2,1,1,1,1,3,0,3,0,0,0,2,0,3,0,0,0,1,0,0,2,0,0,1,0,0,0,3,2,0,1,1,6,1,1,2,0,0,1,0,0,1,1,3,1,13,1767,2,17,"[Dublin] : Printed for J. Williams Dublin, 1767-68.",Dublin,403,male,1667,1745,TRUE,"new entrails only to be devoured! Orrery. This trat and remarks on the barrier treaty , contain the principal fa., wl,;; h the author of John Bull has thrown .into allegory; and greatly i: lullratl. that piece, of which indeed it is olfblil they wer the lground work. Havkf. A"
0144900110_000044,"The history of England, as well ecclesiastical as civil. By Mr. De Rapin Thoyras. Vol. X. Containing The First Fifteen Years of the Reign of King Charles I. Done into English from the French, with large and useful notes mark'd with an *, by N. Tindal, A. M. Vicar of Great-Waltham in Essex.",Paul de Rapin,86,0,1,2,3,0,1,2,0,1,1,0,0,2,0,1,2,3,5,2,9,3,1,0,0,1,1,17,0,2,0,1,2,0,0,1,0,0,1,0,0,1,4,0,0,0,1,1,0,1,1,0,2,1,0,1,0,1,0,1,6,1730,10,15,"London : printed for James and John Knapton, at the Crown in St. Paul's Church-Yard, MDCCXXX. [1730].",London,600,male,1661,1725,TRUE,"to support in France a Religion for which they had the utmost Contempt? It is much more tbmini probable that the King's Ministers feeing little likeli uj. hood of recovering the Palatinate by Arms , and fear. ing the  King would at length be tired of a fruitless War"
0995900800_000127,"A complete collection of all the protests made in the House of Lords, from their original in the year 1641. to the present year 1745. Wherein are exhibited the sentiments of the independent gentlemen of that House, in many important matters, of the utmost consequence to the Constitution, and liberties of Great-Britain.",Great Britain. Parliament. House of Lords,72,0,0,1,4,0,0,2,0,1,1,0,0,0,0,0,0,2,0,4,3,1,1,1,1,1,2,2,4,4,1,0,1,0,1,0,4,2,1,3,1,1,0,2,0,0,3,2,0,3,1,0,3,1,0,2,1,0,3,1,0,1745,1,1,"[London] : Printed for the information of the people, 1745.",London,491,unknown,,,FALSE,"of this Nation be compared with the Situation of Affairs after the Treaty of Ryfivick or that of Utrecht, these Kingdoms will be found infinitely more secure in that Particular, In the firli Period of Time, the late King ames was living, who had an Iri/ Army in his Pay"
1610600103_000011,"The naval history of Great Britain; from the earliest times to the rising of the Parliament in 1779. Describing the origin and progress of the British power at sea; the extension of its commerce; its foreign conquests; and the establishment and growth of its colonies. Including the naval expeditions and sea-fights in every period of the English history, and particularly recording the glorious atchievements in the last war. Also the lives and actions of those illustrious commanders and navigators, who have contributed to spread the fame, and increase the power of the British Empire. Particularly designed to excite in the breasts of Britons, at this important crisis, a noble ardour, to emulate such bright examples; and, by their firmness and valour, to secure to themselves and posterity, that envied pre-eminence which their enemies have in vain attempted to subvert. In this work many new lights are thrown on transactions and characters, by means of valuable manuscripts, never before consulted by any historian. By Frederic Hervey, Esq; and others. In five volumes.","Hervey, Frederic",77,1,0,0,0,0,0,0,3,1,1,0,0,1,0,0,1,6,1,0,9,4,1,0,3,1,2,5,1,0,1,0,0,0,0,1,1,1,0,2,2,3,2,0,1,2,0,1,0,0,0,0,1,4,2,1,0,0,6,3,2,1779,3,5,"London : printed by William Adlard, Fleet-Street; for J. Bew, No. 28, Pater-noster Row, M DCC LXXIX [1779].",London,494,male,,,FALSE,"X 3 of 36 lso 6 of g8 4e rr of a os 4 of 0.4 26 Total o Total wsx The number of geai on board the French Ships , which ea eid dther taken or burnr, more thanin tb Englib, werte ist; and mnoft of them much fupeiar"
1139100134_000049,"A new history of England, from the descent of the Romans, to the demise of his late Majesty, George II Inscribed To his present Majesty, George III. By William Rider, A. B. Late of Jesus College, Oxford. ...",William Rider,83,1,0,0,0,1,0,0,0,1,0,0,3,3,1,2,0,1,0,1,1,4,1,0,4,0,7,3,0,0,2,4,0,2,0,1,4,2,0,1,2,0,2,0,2,2,2,0,1,1,0,0,6,4,0,2,0,0,0,3,6,1761,34,50,"London : printed for S. Crowder and Co. in Pater-Noster Row; and J. Wilkie, in St. Paul's Church-Yard, [1761-64].",London,243,male,1723,1785,FALSE,"made, to those, who were in the administration, for extraordinary expenses, upon unforeseen emergencies · and that, therefore, if the ministers gave, as they had promised, a satisfactory account , how the debt .in question came to be contracted, there was, in his opinion, no occasion for such an address."
0249300800_000110,"The history of the public revenue of the British empire. By John Sinclair, Esq.","Sir John Sinclair, 1st Baronet",71,0,0,1,1,0,1,3,3,0,1,1,3,0,0,0,2,3,0,3,3,1,2,0,1,0,3,1,1,2,0,0,0,1,0,2,1,1,1,0,0,0,2,1,1,3,0,0,3,0,2,0,0,7,2,0,0,0,1,3,4,1785,1,1,"Dublin : printed by P. Byrne, NO. 108, Grafton-Street, (near The College), M,DCC,LXXXV. [1785].",Dublin,484,male,1754,1835,FALSE,"kingdomdurm ing his own life, had nominated Philip duk of Anjou, second son of the dauphin of France , i.no,. hiv heir; and when Charles died, Lewis wit. 1-7^2. out much hesitation abandoned the treaties o partition, and accepted of a will, which pc his grandson in the peaceable poffeffionof"
0683900800_000004,"The life of King Edward III. of England, with reflections on his political and military conduct, containing An Account of the most memorable Transactions, and Revolutions, in Great Britain, France, and other Countries, during upwards of fifty Years.",Thomas Cooke,100,0,0,1,1,0,2,3,1,0,1,1,1,0,0,1,2,4,2,0,4,3,0,0,0,1,1,26,2,0,1,2,1,0,0,1,1,0,0,0,2,1,1,7,0,1,1,0,0,0,4,0,2,0,0,2,2,0,1,0,13,1734,1,1,"London : printed for J. Huggonson, next to Kent's Coffee-House, near Serjeant's-Inn, in Chancery-Lane, [1734].",London,53,male,1703,1756,FALSE,"after which Saying he was proclaimed a Traitor and he fled to England about the Year 1 336, in the tenth Year of the Reign of King Edward, into whose Council he was admitted and he was created Earl of Richmond. The Methods which he took to obtain the Favour"
0156500101_000084,"The history of Great Britain: from the revolution in 1688, to the accession of George the First. Translated from the Latin manuscript of Alexander Cunningham, ... To which is prefixed, an introduction, ... by William Thomson, ... Published by Thomas Hollingbery, ... In two volumes. ...","Cunningham, Alexander",84,1,0,1,2,0,2,1,3,0,1,1,0,1,2,0,1,4,1,1,3,7,0,0,0,2,2,14,2,0,0,1,0,0,0,1,0,0,0,0,3,7,4,1,0,1,0,3,1,0,0,0,1,3,1,2,0,0,0,2,1,1787,1,2,"London : printed for A. Strahan; and T. Cadell, 1787.",London,551,unknown,,,FALSE,"were to be wifled that like praise were due to all those of our times. It is reported, that on his deathbed he said to Mr. Nedham, one of his domestic chaplains, That though they had gone different ways in life, yet the gates of heaven might be wide enough"
0313600104_000006,"A third collection of scarce and valuable tracts, on the most interesting and entertaining subjects: but chiefly such as relate to the history and constitution of these kingdoms. Selected from an Infinite Number in Print and Manuscript, in the Royal, Cotton, Sion, and other Public, as well as Private Libraries; Particularly that of the late Lord Somers. Revised by eminent hands. ...",,83,0,0,1,2,1,0,0,0,3,0,5,0,0,1,4,0,5,2,3,7,1,1,0,1,2,0,4,0,0,1,0,2,0,0,0,3,0,1,0,0,0,1,5,0,3,5,1,0,1,1,0,1,3,2,2,0,2,1,1,4,1751,4,4,"London : printed for F. Cogan, at the Middle-Temple-Gate, in Fleet-Street, MDCCLI. [1751].",London,500,unknown,,,FALSE,"lb secure of the A fiifclions oif cotlain, d ireland..; were to be wilh'd. So-so that in our present Cafe , I do not take the Question to be, Whether we shall have War or Peace ? but, whether we shall with a. good Grace, begin a just and honourable"
0515000110_000109,"A complete history of England, from the descent of Julius Cæsar, to the Treaty of Aix la Chapelle, 1748. Containing the Transactions of One Thousand Eight Hundred and Three Years. By T. Smollett, M.D.Volume the first.",Tobias Smollett,69,0,0,0,1,0,2,0,4,1,2,2,3,1,0,0,1,3,1,1,1,1,0,0,0,0,4,6,2,1,0,1,1,1,1,0,3,3,0,1,1,2,3,2,0,1,1,5,0,0,0,0,1,1,0,1,0,0,1,2,0,1758,10,11,"London : printed for James Rivington and James Fletcher, at the Oxford-Theatre; and R. Baldwin, at the Rose, in Paternoster-Row, MDCCLVIII. [1758]-60.",London,486,male,1721,1771,TRUE,"gradually difliharging the national debt was now become so certain and considerable, tela nrthing but some unforeicen event could alter or diminish it: a circumstance that affirded the faireit projpe& of tceing the old debts discharged, without any nectflity of incurring new encumbrances. This answer, fraught with miny orher express,,,..,"
0228000903_000170,"Jordan's Parliamentary journal, for the year MDCCXCIII. Being an accurate and impartial history of the debates and proceedings of both Houses of Parliament, from the opening of the session on the thirteenth day of December, 1792. Including All Motions, Resolutions, Protests, &c. And Papers of Every Kind.","Jordan, J. S. (Jeremiah Samuel)",99,0,0,1,1,1,1,3,4,1,2,3,0,0,0,4,6,0,1,2,3,1,1,0,1,0,6,3,0,1,1,0,0,2,1,0,0,0,0,2,0,3,2,1,0,1,7,0,1,1,0,0,1,0,1,3,0,0,0,16,10,1792,3,3,"London : printed for J. S. Jordan, No. 166, Fleet-Street, MDCCXCII. [1792]-93 [1793].",London,391,unknown,,,FALSE,"and the King of Sardinia. He observed that; these treaties ought to be printed, and their contents male as public as polfible. There was one article in the, eaty with the Em press of Rulfia which required explanatior,. * trejarjle, bted, ""That neither of the contracing parties Aouiday .doi arms"
1761600303_000113,"The history of England, by Mr. Rapin de Thoyras. Continued from the revolution to the accession of King George II. By N. Tindal, ... Illustrated ...","Rapin de Thoyras, M. (Paul)",98,0,1,1,0,0,1,1,4,1,0,0,0,4,1,2,1,2,0,1,7,5,1,1,1,0,4,15,5,0,1,1,0,0,1,0,1,0,0,0,2,2,2,1,0,3,3,2,0,1,0,0,0,2,1,1,0,2,2,0,11,1744,3,4,"London : printed for John and Paul Knapton, 1744-47.",London,821,male,1661,1725,FALSE,"many of the chambers into prisons for Protestants. One Moore, a Popish Priest, was nominated Provost, and one Macarty Library keeper, and the whole designed for them and their fraternity; and three of the former Collegians were forbid to meet together on pain of death. One Archbishopric, several Bilhopricks, and"
0678400300_000254,"A general treatise of the dominion of the sea: and a compleat body of the sea-laws: Containing What is most Valuable on that Subject in Antient and Modern Authors; And particularly the Antient Laws of the Rhodians and Romans; those of Oleron, Wisbuy, and other Countries; with Curious Notes and Observations. As also That Excellent Body of Sea Laws lately publish'd in France: With a Collection of Marine Treaties concluded during the last Century. Together with Several Discourses about the Jurisdiction and manner of Proceeding in the Admiralty of England, both in Criminal and Civil Matters, and Adjudg'd Cases in several Courts concerning Trade and Navigation. In all which are explain'd at large, the Laws and Customs of Merchants, and of the Courts in Cases of Bottomry, Insurances, Charter-Parties, Bills of Lading, Pyracy, and of Letters of Marque and Reprizal. To which is subjoin'd, An Appendix concerning the present State and Regulations of the Admiralty and Navy. The third edition, with large additions, and improvements. And a new appendix, containing several eminent lawyers opinions in important marine cases; a Comparison of the English and French Conduct in their Sea Affairs; an Essay concerning the Navy of England, taken from Mr. Pepis's, Mr. Burchet's, and other Authentick Memoirs; an Abstract of all the Acts of Parliament relating to the Marine; particularly, that for Establishing Articles and Orders for the Regulating and better Government of the Fleet, &c.","Justice, Alexander",102,0,1,1,0,5,4,0,0,0,1,2,0,0,0,8,0,2,1,1,0,0,2,0,1,2,0,2,0,0,0,3,1,5,0,0,9,0,0,1,1,2,1,0,0,2,3,5,1,0,0,0,9,1,3,5,0,1,5,2,9,1710,1,1,"London : printed for the executors of J. Nicholson; J. and B. Sprint in Little Britain; and R. Smith, under the Piazza of the Royal Exchange, [1710?].",London,788,unknown,,,FALSE,"of the Captors,. or into some Port where their Fleet is at Anchor, before the Captors be legally vested with a Property in the Prize, and think that any Ship taken and brought into a neutral Porr, before it has been. within. the Jurifdition of the Prince or State whose"
