0736600401_000004,"The political and commercial works of that celebrated writer Charles D'Avenant, LL.D. Relating to the Trade and Revenue of England, The Plantation Trade, The East-India Trade, And African Trade. Collected and revised by Sir Charles Whitworth, Member of Parliament. To which is annexed a copious Index. In five volumes. Volume I.",Charles Davenant,82,0,4,1,1,0,1,0,0,1,1,0,1,0,0,1,0,1,0,0,5,1,2,0,0,0,2,3,5,1,0,0,1,3,1,1,3,1,0,0,2,0,4,4,0,4,3,2,1,0,1,1,0,2,2,0,1,1,0,1,12,1771,1,5,"London : printed for R. Horsfield in Ludgate Street, T. Becket and P. A. Dehondt, and T. Cadell in the Strand, and T. Evans in King Street, Covent Garden, MDCCLXXI. [1771].",London,468,male,1656,1714,FALSE,"the people in general . Raising money by land taxes , funds of interest, polls, doubling the excite, charging tonnage, laying new customs, and anticipating the old ones, may be proper expedients to answer a ingle and a hort necessity, but, perhaps, they will hardly appear to be the proper"
0663300100_000475,"A new, universal, and impartial history of England, from the earliest authentic records, and most genuine historical evidence, to the end of the present year. ... Embellished with upwards of 120 beautiful copper-plate engravings, ... By George Frederick Raymond, Esq. Assisted by Alexander Gordon and Hugh Owen, Esqrs. and others, ...","Owen, Hugh",66,0,0,0,1,1,1,0,3,0,1,0,0,0,0,2,1,5,0,0,2,2,1,0,2,1,1,4,2,1,1,0,0,1,2,0,2,1,0,1,2,5,1,1,2,0,1,1,2,0,0,0,0,3,0,1,1,0,1,4,2,1790,1,1,"London : printed for C. Cooke; and sold by the booksellers of Bath, Bristol, Birmingham, Canterbury, Cambridge, Coventry, Chester, Derby, Exeter, Gloucester, Hereford, Hull, Ipswich, Leeds, Liverpool, Leicester, Manchester, Newcastle, Norwich, Nottingham, Northampton, Oxford, Reading, Salisbury, Sherborn, Sheffield, Shrewsbury, Worcester, Winchester, York; and by all other booksellers in England, Scotland, and Ireland, [1790?].",London,735,male,1761,1827,FALSE,"the sessions The conferences began on the twenty-ninth of parliament . In the course of his Ipeech he ob April, and were nearly being interrupted by the vcd, that proposals had been made for a nego death of Charles XI of Sweden; but as his fuc oin, but that the"
0145700102_000139,"The history of England, from the Revolution to the death of George the Second. (designed as a continuation of Mr. Hume's History.) In five volumes. By T. Smollett, M.D. ...",Tobias Smollett,84,1,0,0,0,1,1,0,1,0,0,2,4,2,0,0,0,1,3,0,2,0,0,1,4,0,10,6,1,0,1,7,0,1,0,0,2,1,1,1,2,1,1,3,4,2,2,0,1,0,1,1,1,3,0,2,0,0,0,2,4,1791,2,5,"London : printed for T. Cadell, in the Strand; and R. Baldwin, No. 47, Pater-Noster-Row, MDCCXCI. [1791].",London,581,male,1721,1771,TRUE,"House was the cafe of John Law , the famous projetor. The resentment of the people on account of his Mississippi scheme had obliged him to leave France . He retired to Italy; and was said to have visited the Pretender at Rome. From thence he repaired to Hanover; and"
0004600103_000079,"A new history of England, from the earliest accounts of Britain, to the ratification of the Peace of Versailles, 1763. Humbly Inscribed to the Queen. By Mr. Mortimer.",Thomas Mortimer,81,0,1,2,5,0,1,0,0,1,2,0,0,0,2,0,0,2,5,1,4,7,2,0,0,0,0,8,2,2,2,0,2,1,2,4,0,0,0,2,2,1,2,2,1,0,0,1,0,0,0,0,3,1,1,1,0,0,2,1,3,1764,3,3,"London : printed for J. Wilson and J. Fell, in Paternoster-Row; and sold by Mr. Fletcher at Oxford, Messrs. Fletcher and Hodson at Cambridge, Mr. Smith at Dublin, and by all the booksellers in Great-Britain and Ireland, MDCCLXIV. [1764]-66.",London,836,male,1730,1810,FALSE,"perfidy, not to'be paralleled in history; for it being one of the articles of his treaty with the court of France , -- that if the allies should refuse to depart the ""duke's dominions, they should be expelled by the joint : arms of France and Savoy; and they refusing"
0709200301_000217,"The history of Great Britain, from the Restoration, to the accession of the house of Hannover. By James Macpherson, in two volumes. ...",James Macpherson,87,0,1,3,0,2,0,0,5,0,0,0,0,3,1,2,1,4,4,4,6,7,0,0,0,0,2,10,1,1,1,0,1,0,1,1,3,0,0,0,2,1,1,0,0,0,1,0,0,0,0,1,3,2,4,1,0,0,0,4,3,1775,1,2,"Dublin : printed for J. Exshaw, D. Chamberlain, J. Potts, W. Sleater, J. Williams, W. Wilson, T. Walker, R. Moncrieffe, C. Jenkin, and M. Mills, M,DCC,LXXV. [1775].",Dublin,665,male,1736,1796,TRUE,"of M. de Louvois, combiing with the va ate of ""tv andt insolence of vewis the Fourteenth, united the Europe. r1., ()t all urope againtf France . The diet of Ratiibon Id declared the French King and the Cardinal de Fur icnmbeg eecilcies of the empire. I he Elctor of"
0156500200_000077,"The history of England, from the Revolution to the present time, in a series of letters to the Reverend Doctor Wilson, ... By Catherine Macaulay. Vol.I.",Catharine Macaulay,70,0,0,0,1,1,3,1,0,1,3,1,1,1,1,0,3,6,1,0,2,0,0,0,1,0,1,4,2,1,1,0,1,0,1,0,2,0,0,0,3,2,2,1,0,1,1,1,0,0,0,0,2,7,2,1,1,0,0,1,5,1778,1,1,"Bath : printed by R. Cruttwell: and sold by E. and C. Dilly, T. Cadell, and J. Walter, London, 1778.",Bath,455,female,1731,1791,TRUE,"all the demanded supplies, the parliament gave their sanction to the keeping on foot the large standing army voted the year before. The protestant cause was still in danger; and a tumult at Glasgow, on the provocation of a new tax on malt, though very inconsiderable in its rise and"
1079500100_000064,"A compleat history of the affairs of Spain, from the first Treaty of Partition, to this present time. Containing A Particular Account of the different Measures taken since the Peace Of Reswyck, to Secure Spain to the House of Austria; by King William of Glorious Memory, and the Great Actions perform'd by Queen Anne, and her Allies, in Spain, the Netherlands, Italy, &c. Represented in a new Method, by all the Authentick Memorials, Letters, Declarations, Manifesto's, Treaties, &c. Relating to that Grand Affair. To which is Prefix'd An Introduction, Giving a short View of the first Rise and Various Revolutions of that Empire, its Grandeur and Designs of attaining to the Universal Monarchy; and the true Cause of its most Surprising Declension since the Reign of King Philip H. By J. C. M.D. Fellow of the Royal Society, and a Member of the College of Physicians, London.","Crull, Jodocus",108,1,0,1,1,0,1,1,0,0,0,4,0,3,2,2,0,1,1,0,12,1,2,3,1,1,1,20,2,1,1,2,0,0,3,0,1,2,1,0,0,1,0,0,0,2,2,1,1,0,0,0,0,15,7,2,0,0,0,3,2,1707,1,1,"London : printed for, and sold by Jos. Barns , at the Crown in Pall Mall ; Will. Taylor , at the Ship in St. Paul's Church-Yard ; Rob. Gosling , at the Mitre in Fleetstreet ; Nath. Cliff , near Mercers Chapel, Cheap side ; J. Phillips , at the Black Bull in Corn-Hill ; and J. Morphew, near Stationers-Hall, 1707.",London,573,male,,,FALSE,"the same as those of the King of France , nay, as all the World may be convinced, by the whole Directions and Management of Affairs, that the King of France , and the Present King of Spain , are one and the same in Effec:, and that the King"
1051100102_000864,"Modern history: or, the present state of all nations. Describing their respective situations, persons, habits, Buildings, Manners, Laws and Customs, Religion and Policy, Arts and Sciences, Trades, Manufactures and Husbandry, Plants, animals and minerals. Being The most complete and correct System of Geography and Modern History extant in any Language. By Mr. Salmon. Illustrated with cuts and maps accurately drawn according to the Geographical Part of this Work, by Herman Moll. ...",Thomas Salmon,80,1,0,1,2,1,3,0,0,0,0,2,0,0,0,1,1,1,1,3,6,2,1,0,0,2,1,7,4,1,0,0,0,0,0,0,1,1,0,0,2,0,2,3,0,4,1,3,1,0,1,0,0,8,1,0,3,0,3,1,4,1739,2,3,"London : printed for Messrs. Bettesworth and Hitch in Pater-Noster-Row ; J. Clarke under the Royal Exchange in Cornhill ; S. Birt in Ave Mary Lane ; Tho. Wotton over against St. Dunstan's Church, and J. Shuckburgh next the Inner Temple Gate, both in Fleetstreet ; and T. Osborne in Gray's-Inn, M.DCC.XXXIX. [1739].",London,999,male,1679,1767,FALSE,"he was Ambassador at the court of France , see the Duke of Mantua otherwise than incognito, because he would not give him the title of Highness. As to the Cardinals and Grandees, they give each other the title of Eminence reciprocally. CHAP. XX T; eats of the frength, forces"
0705400104_000130,"The history of England, written originally in French by Rapin de Thoyras: translated into English, with additional notes; and continued from the Revolution to the accession of King George II. By N. Tindal, M. A. Late Rector of Alverstoke in Hampshire, and Chaplain to the Royal Hospital at Greenwich: with the reign of George the II: by T. Smollett, M.D. And an index to each volume. ... Illustrated and Embellished with Portraits of the Kings, Queens, and illustrious Personages, Monuments, Great-Seals, Coins, naval and military Engagements, &c. and Maps of the different Parts of the World, where the Important Events of this History took Place.",Tobias Smollett,106,0,0,1,0,1,1,1,4,1,0,0,0,6,1,4,1,3,0,1,6,5,1,1,1,0,4,15,5,1,1,1,0,0,0,0,3,0,0,0,3,2,2,1,0,3,4,2,0,1,0,0,0,1,1,1,0,2,2,0,12,1789,4,5,"London : printed by and for John Harrison No. 115, Newgate-Street; and sold by all the book-sellers in Great-Britain and Ireland, MDCCLXXXIX. [1789].",London,801,male,1721,1771,TRUE,"seized upon by the government ; and colonel Lutterel, governor of that city, on the 8th of June 1690, e iflied out an order , commanding all proteftalits, who were, not house keepers, to depart our of the laid city; and all such; as were house keepers, to deliver up"
1607500400_000049,The Senator.,Edward Roome,74,1,2,1,0,0,0,0,0,0,0,3,0,0,1,2,0,2,1,1,7,2,1,1,1,1,0,2,2,1,6,0,2,0,0,1,2,4,0,1,0,0,4,0,1,2,1,0,0,1,2,0,2,3,1,0,1,1,1,1,5,1728,1,1,"London [England] : printed for J. Roberts in Warwick-lane, [1728].",London,65,unknown,,1729,FALSE,"In teretererely' for - th fake' of iiiaking those of S Hollan I Qua Regio in terris, softri nonflena laboris? ·~· I B : LI -8; ·; !5i si ·ir f '"" .r i.: it;! i i : 1 r f i; il, Ir !· ··· ~ j I .I"
0332000109_000049,"The works of Dr. Jonathan Swift, Dean of St. Patrick's Dublin. Accurately corrected by the best editions. With the author's life and character; notes historical, critical, and explanatory; tables of contents, and indexes. More complete than any preceding edition. In nine volumes. ...",Jonathan Swift,82,0,2,0,0,2,1,1,3,0,0,1,0,1,0,0,0,1,0,1,5,3,3,0,0,2,3,1,2,0,2,0,1,1,0,0,2,0,2,0,2,1,3,1,0,1,1,2,1,5,0,0,0,6,6,1,0,2,4,4,2,1758,9,9,"Dublin : printed for G. and A. Ewing, 1758.",Dublin,383,male,1667,1745,TRUE,"such Intrigues: that this was the Cause which made them so litigi6us and slow in all their Steps, in' hopes to break the Congress, and find better Terms for their Trade and Barrier, from the French , than we ever could think fit to allow them. The Dutch Ministers did"
0424600104_000049,"The history of England, from the earliest times to the death of George II. By Dr. Goldsmith. In four volumes. ...",Oliver Goldsmith,71,0,0,2,0,0,1,1,1,0,0,1,3,1,1,0,0,6,2,0,1,1,0,0,4,1,6,3,2,1,0,1,0,1,1,2,3,0,0,0,4,4,2,3,1,2,1,0,0,1,0,0,1,1,0,1,0,0,1,1,2,1796,4,4,"Dublin : printed by William Porter, for W. Gilbert, P. Wogan, J. Exshaw, W. Porter, W. M'Kenzie, J. Moore, W. Jones, and J. Rice, 1796.",Dublin,299,male,1728,1774,TRUE,"Spanifi ministers in all the courts of Europe; and hastened the declaration of war upon the part of the English, which had been hitherto delayed. This This rupture with Spain served once mre to raise the declining expectations of the pretender and its adherents. It was hoped that, by the;"
0875700102_000092,"The naval, Commercial, and General History of Great Britain; including the lives of the admirals, and other Illustrious Commanders and Navigators, from the earliest times to the present. With a great Number of beautiful Copper-Plates and accurate Maps. To each volume is prefixed a political and illustrative preface; And to the whole a copious Index. By Frederick Hervey, Esq. Editor of the New System of Geography in two volumes, folio. In five volumes. ...","Hervey, Frederic",85,0,0,0,2,2,0,0,1,2,3,1,0,1,0,1,2,3,0,2,3,4,1,0,0,0,1,9,2,1,0,1,1,1,0,1,5,0,0,2,1,6,7,1,0,1,0,1,0,0,0,0,1,1,6,0,0,0,2,1,5,1786,2,5,"London : printed for J. Bew, No. 28, Pater-Noster Row, M,DCC,LXXXVI. [1786].",London,508,male,,,FALSE,"enduce the king to peace , they represented the bale behaviour of the French in the lait sea sights, and that an offer had been made them from France of a separate peace , without any respect being had to England . Charles, by this time, perceiveo that it would"
1040100400_000009,"A true and impartial history of the conspiracy against the person and government of King William III. of glorious memory, in the year 1695. By Sir Richard Blackmore, Kt. M.D.",Richard Blackmore,78,1,1,2,3,0,2,0,2,2,0,1,0,0,1,3,1,1,2,1,1,3,1,1,5,2,0,10,3,0,4,0,1,3,2,0,3,0,0,2,0,1,1,3,1,1,1,2,0,0,0,0,1,0,0,0,1,0,1,0,1,1723,1,1,"London : printed for James Knapton, at the Crown in St. Paul's Church-Yard, MDCCXXIII. [1723].",London,221,male,1654,1729,TRUE,"against the Government . This Traitorous Commerce was undertaken by the Lord Preston and his Accomplices; and though he, and some other of the Conspirators, by falling into the Hands ofju Rice, were prevented from carrying it on, yet others of the faaion succeeded to the Employment, and not long"
0554500400_000016,"A sixth letter, by the author of the former letters to the people of England, on the progress of national ruin; in which it is shewn, that the present grandeur of France, and calamities of this nation, are owing to the influence of Hanover on the Councils of England.",John Shebbeare,74,2,0,0,0,0,0,2,2,0,0,0,2,2,1,0,3,2,3,1,1,1,0,0,1,0,3,1,1,1,1,0,0,1,0,4,2,1,1,1,1,0,8,0,0,4,0,1,0,0,0,0,1,9,1,1,0,0,2,4,2,1758,1,1,"London : printed for J. Morgan in Pater-Noster-Row, 1758.",London,79,male,1709,1788,FALSE,"But as the Faith of George's Ministry had been already broken with Spain , this perfidious Ation in Favour of Austria was added to the Former. Thus this unjustifiable Defeat created much ill Blood between this Kingdom and Spain ; your Trade was sacrificed, and your Treasure squandered only to"
0217500301_000003,Political tracts. By the author of Gulliver's travels.,Jonathan Swift,80,0,0,0,1,1,3,1,0,1,2,1,5,0,0,2,1,1,1,1,2,0,3,0,0,0,2,3,3,0,0,0,1,0,0,3,1,0,1,0,0,1,2,3,0,1,1,7,1,2,2,0,0,1,0,0,2,1,3,0,13,1738,1,2,"London : printed for C. Davis in Pater-Noster-Row, MDCCXXXVIII. [1738].",London,372,male,1667,1745,TRUE,"he enters on it; Whether his Coffers be full, his Revenues clear of Debts , his People numerous and rich by a long Peace and free Trade , not over pressed with many burdensome Taxes ; No violent Faction ready to dispute his just Prerogative, and thereby weaken his Authority"
0004500402_000158,"The history of England, from the Revolution to the death of George the Second. (designed as a continuation of Mr. Hume's History.) In five volumes. By T. Smollett, M.D. ...",Tobias Smollett,84,5,1,0,0,0,2,0,5,1,1,1,7,1,0,0,1,3,1,0,1,0,2,0,0,0,6,6,3,0,1,1,0,0,0,3,5,1,1,0,1,2,2,1,0,1,2,4,3,0,1,0,0,1,3,2,0,0,1,1,0,1796,2,5,"London : printed for T. Cadell, in the Strand; and R. Baldwin, No. 47, in Pater-Noster-Row, MDCCXCVI. [1796].",London,581,male,1721,1771,TRUE,"pounds, charged to have been issued for securing the trade and navigation of the kingdom , and preserving and restoring the peace of Europe, he declined granting their request, but signified in general , that part of the money had been issued and ditburfed by his late Majeity, and the"
0432600501_000288,"Memoirs of the life and administration of Sir Robert Walpole, ... With original correspondence and authentic papers, never before published. In three volumes. ... By William Coxe, ...",William Coxe,85,0,0,0,0,0,0,2,0,1,1,3,1,1,0,2,2,1,1,0,5,0,1,0,3,0,1,4,0,0,0,0,0,2,1,1,4,0,0,0,0,0,3,0,0,4,5,0,2,2,0,0,1,4,4,0,1,3,2,6,11,1798,1,3,"London : printed [by James Easton, Salisbury] for T. Cadell, jun. and W. Davies, 1798.",London,830,male,1747,1828,FALSE,"the definitive treaty . "" But the court of Madrid has not only acknowledged the searching of ships on the open seas, and confiscating them for having Spanill money and effects on board, to be a grievance which ought to be remedied, but they have in some measure owned it"
1266000102_000249,"A political survey of Britain: being a series of reflections on the situation, lands, inhabitants, revenues, colonies, and commerce of this island. Intended to Shew That we have not as yet approached near the Summit of Improvement, but that it will afford Employment to many Generations before they push to their utmost Extent the natural Advantages of Great Britain. In two volumes. By John Campbell, L. . D. ...",John Campbell,69,0,1,1,1,0,0,0,3,1,2,1,0,2,0,0,0,2,1,0,4,2,2,0,1,0,0,9,3,0,0,0,1,1,0,1,2,0,1,2,3,2,1,2,2,1,0,3,0,0,1,0,2,1,1,1,2,0,0,2,1,1774,2,2,"London : printed for the author; and sold by Richardson and Urquhart, at the Royal Exchange; J. Wilkie, in St. Paul's Church-Yard; T. Cadell, P. Elmsley, and T. Becket, in the Strand; J. Walter, and T. Durham, at Charing-Cross; J. Dodsley, Pall-Mall; and L. Davis, Holborn, MDCCLXXIV. [1774].",London,791,male,1708,1775,FALSE,"Crowns, which amounted to about Half a Million Sterling Money of those Days, and a great Number of Hostages wvere gjven for the due Performance of these Conditions. At first Sight it hold seem that the English Monarch was a great Gainer by Acquisitions, which taken together were not much"
0104600105_000010,"The works of the Reverend Dr. Jonathan Swift, Dean of St. Patrick's, Dublin. In twenty volumes. Containing, I. His Miscellanies in prose. II. His poetical writings. III. Gulliver's Travels. IV. Papers relating to Ireland, and the Drapier's Letters. V. The conduct of the allies and the examiners. VI. The publick spirit of the whigs, &c. and polite conversation. VII. Letters to and from Dr. Swift. VIII. Directions to servants, sermons, poems, &c. IX. Letters; the history of the last session of Parliament, and the peace of Utrecht, &c. X. Sermons and other Pieces. XI. Letters, &c. the author's life and poems. XII. History of the four last years of Queen Anne's Reign; Letters; and Sermons, &c. Collected by Deane Swift, Esq. XIII. Letters to and from several very eminent persons; poems on various occasions. Collected by Deane Swift, Esq. XIV. XV. and XVI. Letters to and from Dr. Swift. With notes by the Rev. T. Birch, D.D.F.R.S. John Hawkesworth, L.L.D. and others. With many original pieces. XVII. XVIII. and XIX. Letters to & from Dr. Swift. Collected by D. Swift, Esq. with several originals. XX. Tale of a tub.",Jonathan Swift,84,0,1,0,0,0,2,0,0,1,0,6,0,1,1,0,0,4,0,1,3,1,1,0,0,1,0,3,2,2,0,1,0,2,1,1,1,1,1,1,1,2,3,2,0,1,1,1,0,1,0,0,0,3,5,2,0,2,6,9,6,1772,5,20,"Dublin : printed by George Faulkner, MDCCLXXII. [1772].",Dublin,496,male,1667,1745,TRUE,"the Kingdom may require it. As to the other Article, it is a natural Consequence that must attend any Treaty of Peace we can make with France ; being only the Acknowledgment of her Majesty as Queen of her own Dominions, and the Right of Succefflon by our own Laws"
0428900303_000022,"Anecdotes of the life of the Right Honourable William Pitt, Earl of Chatham; and of the principal events of his time: with his speeches in Parliament, ... 1736 to ... 1778. In three volumes.",John Almon,106,0,0,0,4,0,0,1,0,0,1,2,0,10,1,1,1,6,0,3,7,4,1,0,1,0,0,12,0,1,0,4,0,0,0,0,5,0,2,1,0,0,5,1,1,2,2,0,3,0,1,0,2,1,0,3,0,0,2,7,8,1796,3,3,"London : printed for L. B. Seeley, 1796.",London,390,male,1737,1805,FALSE,"offenlivelv against the eri!i'prts Queen or her allies: and in like niannnr. no French forces , under any pretence, hall jo,; n the Imperial army , or serve against isle allies of Great Britain. To ascertain these positions, it stall be farther concluded. that after tlele evacuations, the army of"
0175300201_000009,"Extracts from Colonel Tempelhoffe's History of the seven years war: His remarks on General Lloyd: on the subsistence of armies; and on the march of convoys. Also a treatise on winter posts. To which is added a Narrative of events at St. Lucie and Gibralter, and of John Duke of Marlborough's march to the Danube, with the causes and consequences of that measure. By the Honourable Colin Lindsay, Lieutenant Colonel of the 46th Regiment. In two volumes. ...",,94,0,0,2,2,0,1,1,1,1,0,3,0,0,0,2,1,2,3,5,5,11,3,0,1,0,0,3,1,0,2,0,1,0,5,0,2,0,0,0,2,1,6,0,0,3,0,8,0,2,0,0,2,0,2,2,0,0,1,1,6,1793,1,2,"London : printed for T. Cadell, in the Strand, MDCCXCIII. [1793].",London,375,unknown,,,FALSE,"during this war , they commenced their essay, which they afterwards extended to a dreadful degree, in burning and desolating defenceless towns and villages; intending by an absolute ruin of the country , to cut off the Imperialists from all subsistence, if they should march into Alsace to form a"
0443100202_000050,"An history of England, in a series of letters from a nobleman to his son. ...",Oliver Goldsmith,77,0,1,1,0,1,1,1,3,1,0,1,0,3,0,0,1,2,1,1,2,1,0,0,0,0,8,3,2,2,1,1,0,0,2,1,1,0,0,0,2,1,1,1,0,2,1,1,0,2,0,0,1,10,0,2,0,0,1,5,5,1764,2,2,"London : printed for J. Newbery, at the Bible and Sun, in St. Paul's Church-Yard, MDCCLXIV. [1764].",London,289,male,1728,1774,TRUE,"man to determine, without limitation or appeal, is a privilege unknown to our laws , and inconfilent with our conjiiuiion. The house applauded his wit and eloquence; and the question was carried against him. The diftontents occasioned by such proceedings at home, were still more increased by the depredations of"
1198900102_000050,"The works of Jonathn. Swift, D.D.: D.S.P.D. with notes historical and critical. By J. Hawkesworth, L.L.D. and others. Vol. I.",Jonathan Swift,93,0,0,0,0,0,0,1,1,0,2,2,0,2,1,1,2,0,0,0,4,1,4,1,1,1,4,6,5,1,2,0,2,0,1,0,1,1,0,1,0,1,7,0,2,2,0,2,0,2,0,0,0,12,4,0,0,1,2,5,5,1774,2,15,"[Dublin] : Printed for J. Williams, Dublin, 1774.",Dublin,401,male,1667,1745,TRUE,"the palace in France became maifers of the kingdom ; § and by these steps a General duringplea sure might have grown into a Generalfor life, and a Generalfor fife into a King . So that I fill infit upon it as a wonder, how her Majesty, thus besieged on"
1408300103_000018,"An impartial representation of the conduct of the several powers of Europe, engaged in the late general war: including a particular account of all the military and naval operations; from the commencement of hostilities between the crowns of Great Britain and Spain, in 1739, to the conclusion of the General Treaty of Pacification at Aix La Chapelle, in 1748. To which are added, letters between Monsieur Voltaire and the author, relative to this work, and to the subject of history in general. By Richard Rolt. In four volumes.",Richard Rolt,62,0,0,2,2,0,1,1,2,1,0,1,1,2,2,1,2,0,1,1,3,1,3,1,1,0,1,1,1,0,0,0,0,1,0,1,4,0,0,1,2,3,1,0,0,2,0,2,2,1,0,1,0,1,1,1,0,0,0,1,5,1754,3,4,"Lnodon [sic] : printed for S. Birt in Ave-mary-lane, J. Waugh and W. Fenner in Lombard-street, M.DCC.LIV. [1754].",London,646,male,1724,1770,FALSE,"this situation, it was evident to the British fubjtas, that their liberties were in danger of being subverted i they could not but perceive, if France was to acquire the absolute dominion of the continent, that their own island would soon be reduced, in the same manner as Macedon had"
0902700109_000020,"The works of Jonathan Swift, D.D. Dean of St. Patrick's, Dublin, accurately revised in twelve volumes, adorned with copper-plates; with some account of the author's life, and notes historical and explanatory, by John Hawkesworth.",Jonathan Swift,91,0,1,1,1,1,0,1,1,0,2,2,1,4,0,1,1,5,0,3,4,7,0,0,0,0,1,10,2,2,0,0,1,0,2,0,3,1,1,1,1,0,1,1,1,2,0,3,0,2,0,0,0,5,2,1,0,1,0,1,10,1754,9,12,"London : printed for C. Bathurst, C. Davis, C. Hitch, and L. Hawes, J. Hodges, R. and J. Dodsley and W. Bowyer, MDCCLV. [1755].",London,469,male,1667,1745,TRUE,"name of his grandson, and sent great numbers of troops thither to fright them; that he had seized the city and citadel of Liege; had pojfejfed himself of several places in the archbishopric of Cologne, and maintained troops in the county of Wolfenbuttel, in order to block up the Dutch"
0018400102_000640,"A general history of England. ... . Containing an Account of the first Inhabitants of the Country, and the Transactions in it, from the earliest Times to the Death of King John, A. D. Mccxvi. By Thomas Carte, an Englishman.",Thomas Carte,67,0,0,0,2,1,0,0,2,0,0,3,0,2,1,0,1,1,0,3,1,2,0,0,2,1,1,1,1,3,3,0,0,3,1,1,1,2,1,2,2,3,1,2,4,0,0,2,0,1,0,1,1,0,1,2,2,1,0,1,1,1747,2,4,"London : printed for the author, at his House in Dean's Yard, Westminster. And sold by J. Hodges, at the Looking-Glass facing St. Magnus' Church, London Bridge, MDCCXLVII. [1747]-55.",London,885,male,1686,1754,FALSE,"concluded a league offensive V - and defensive with the duchess,. "" for 3 a mutual assistance in cafe of an invasion of Bretg,, nd, C their respective territories, or of an attempt on France for the recovery of the succours lent., C countries and rights, which had formerly belonged"
0554500500_000016,"A sixth letter, by the author of six former letters to the people of England. Part II. On t [sic] progress of national ruin; in which it is shewn, that the present grandeur of France, and calamities of this nation, are owing to the influence of Hanover on the Councils of England.",John Shebbeare,74,2,0,0,0,0,0,2,1,0,0,0,1,3,1,0,3,3,2,2,1,1,1,0,2,0,2,2,1,1,1,0,0,1,0,2,2,1,0,1,1,0,6,0,0,3,0,1,0,0,0,0,1,9,2,1,0,0,2,7,2,1758,1,1,"London : printed for J. Morgan in Pater-Noster-Row, 1758.",London,82,male,1709,1788,FALSE,"Amongst the Articles ot which it was declared , that the King of Spain should be obliged to renounce his Right to the Reversion of Sicily, and the Duke of Savoy exchange that Island for Sardinia. Thus in the moult arbitrary Manner the above Powers forced themselves upon those two"
