PassageID,Title,Author,Total termFreq,termFreq(account),termFreq(appear),termFreq(arm),termFreq(armi),termFreq(cafe),termFreq(carri),termFreq(caus),termFreq(common),termFreq(confid),termFreq(continu),termFreq(countri),termFreq(debt),termFreq(declar),termFreq(end),termFreq(enemi),termFreq(engag),termFreq(england),termFreq(fleet),termFreq(forc),termFreq(franc),termFreq(french),termFreq(gener),termFreq(god),termFreq(govern),termFreq(hand),termFreq(hous),termFreq(king),termFreq(kingdom),termFreq(land),termFreq(late),termFreq(law),termFreq(littl),termFreq(manner),termFreq(mean),termFreq(monei),termFreq(nation),termFreq(natur),termFreq(noth),termFreq(number),termFreq(order),termFreq(parliament),termFreq(peac),termFreq(peopl),termFreq(person),termFreq(power),termFreq(present),termFreq(princ),termFreq(public),termFreq(reason),termFreq(reign),termFreq(roman),termFreq(ship),termFreq(spain),termFreq(state),termFreq(taken),termFreq(tax),termFreq(think),termFreq(trade),termFreq(treati),termFreq(war),Publication Year,Volume Number,Total Volumes,Imprint,Publication Place,Total Pages,Gender,Birth Year,Death Year,Popular Authors,short_excerpts
0156500200_000004,"The history of England, from the Revolution to the present time, in a series of letters to the Reverend Doctor Wilson, ... By Catherine Macaulay. Vol.I.",Catharine Macaulay,88,1,0,0,3,2,2,0,2,1,0,1,0,1,1,1,3,5,2,1,4,4,2,0,0,0,2,8,5,2,1,1,0,0,1,0,1,0,0,1,0,4,2,0,0,2,2,2,0,2,1,0,0,1,1,2,0,1,2,4,4,1778,1,1,"Bath : printed by R. Cruttwell: and sold by E. and C. Dilly, T. Cadell, and J. Walter, London, 1778.",Bath,455,female,1731,1791,TRUE,"ruling passion was military heroifin, had long and eagerly sought an opportunity to revenge the insults and injuries his country had received from the ambitious Lewis: it was at this period that a confederacy which he had proposed among the princes of the empire began to take effect: the Emperor"
1208900100_000004,"The history of England, from the Revolution to the present time, in a series of letters to the Reverend Doctor Wilson, Rector of St. Stephen's, Walbrook, and Prebendary of Westminster. By Catharine Macaulay. Vol.I.",Catharine Macaulay,84,1,0,0,3,2,2,0,2,1,0,0,0,2,1,1,2,5,2,1,3,4,0,0,1,0,2,8,5,2,1,1,0,0,1,0,1,0,0,2,0,4,3,0,0,1,1,1,0,2,1,0,0,1,1,2,0,1,2,4,4,1779,1,1,"Dublin : printed for John Exshaw, No. 86, and William Hallhead, No. 63, Dame-Street, M.DCC.LXXIX. [1779].",Dublin,463,female,1731,1791,TRUE,"a separate treaty , on any pretence whatever: that no peace should be admitted until the treaties of Westphalia, Ofnaburgh, Munster, and the Pyrenees, should be vindicated; that in cafe of a negotiation for peace , or truce, the tranfac tionson both fides should be communicated bona fide; and that"
0145700101_000009,"The history of England, from the Revolution to the death of George the Second. (designed as a continuation of Mr. Hume's History.) In five volumes. By T. Smollett, M.D. ...",Tobias Smollett,112,1,0,0,0,4,1,1,2,2,0,1,0,7,0,4,2,4,0,2,6,5,3,0,0,0,1,9,3,0,1,2,0,2,1,0,2,0,0,0,0,1,4,0,0,4,2,2,0,1,0,2,0,1,5,2,1,1,2,8,10,1791,1,5,"London : printed for T. Cadell, in the Strand; and R. Baldwin, No. 47, Pater-Noster-Row, MDCCXCI. [1791].",London,523,male,1721,1771,TRUE,"declare war against the French King , who had committed numberless infractions of the treaties of Munster, Ofnabruck, Nimeguen, and the truce; invaded their country without provocation, and evinced himself an inveterate enemy of the holy Roman empire. They, therefore, besought his Imperial Majeity to conclude a treaty of peace"
0004500401_000009,"The history of England, from the Revolution to the death of George the Second. (designed as a continuation of Mr. Hume's History.) In five volumes. By T. Smollett, M.D. ...",Tobias Smollett,113,1,0,0,0,4,1,0,3,3,0,1,0,7,1,4,2,4,0,2,7,5,2,0,0,0,1,9,2,0,1,2,0,1,1,0,2,0,0,0,0,1,4,0,0,4,1,3,0,2,0,2,0,1,5,2,1,1,2,8,10,1796,1,5,"London : printed for T. Cadell, in the Strand; and R. Baldwin, No. 47, in Pater-Noster-Row, MDCCXCVI. [1796].",London,520,male,1721,1771,TRUE,"the affairs of the continent. He retained all his former influence in Holland, as his countrymen had reason to confide in his repeated assurances of inviolable affeaion. The great scheme which he had projeced of a confederacy against France , began at this period to take effet. The Princes of"
0070100104_000008,"A complete history of England, deduced from the descent of Julius Cæsar, to the Treaty of Aix la Chapelle, 1748. Containing the Transactions of One Thousand Eight Hundred and Three Years. By T. Smollett, M.D. ...",Tobias Smollett,109,1,0,0,0,4,1,0,3,3,0,1,0,7,0,4,2,4,0,1,6,5,3,0,0,0,1,8,4,0,1,2,0,1,1,0,2,0,0,0,0,1,4,0,0,4,2,3,0,2,0,1,0,1,2,2,1,1,2,8,10,1757,4,4,"London : printed for James Rivington and James Fletcher, at the Oxford-Theatre, in Pater-Noster Row, MDCCLVII. [1757]-58.",London,703,male,1721,1771,TRUE,"the tears of a popish fucefor. This was the delivery of the princess Anne, v.ho, on the twenry feventh day of July, brought forth a son, christened by the name of William, and afterwards created duke of Gloucester. j XV In the midif of these domefiic disputes, William did not"
1080601300_000020,Miscellanies. The Eighth Volume. By Dr. Swift.,Jonathan Swift,99,0,1,1,2,1,1,0,3,1,1,1,2,2,1,5,5,1,0,3,3,5,0,0,2,1,0,8,1,0,0,1,1,1,2,0,3,2,2,0,0,0,2,2,0,2,0,2,1,3,0,0,0,3,1,1,1,0,1,1,16,1742,1,1,"London : printed for C. Davis against Greys-Inn-Gate, Holborn. and C. Bathurst, MDCCXLII [1742].",London,316,male,1667,1745,TRUE,"King upon us, and the Spaniards would conceive we had as little Reason to force one upon them; that it was true, the Nature and Genius of those two People differed very much, and so would probably continue to do, as well under a King of French Blood, as one"
0803100800_000006,"A letter to a minister of state, Concerning the Pretended Prince of Wales's Being Proclaim'd King of England, &c. in France. With some Thoughts on the Interest of England in this Critical Juncture. And of the Necessity of a Speedy and Vigorous War, in order to preserve the Liberties of Europe, and to restrain the Exorbitant Power of France.",,127,2,0,0,2,1,1,0,1,1,0,1,1,5,0,0,2,5,2,1,4,3,2,0,0,2,1,15,7,3,2,1,1,0,0,2,5,0,0,0,0,3,3,18,0,3,1,1,0,2,0,0,0,1,0,0,0,0,1,4,17,1701,1,1,"London : printed for A. Bell at the Cross-Keys and Bible in Cornhil, and B. Lintot at the Middle-Temple Gate in Fleetstreet, 1701.",London,26,unknown,,,FALSE,"in no danger of an Invasion 5 and if our Fleets do but the Service they ought to do, we at Sea and the Emperor, c. onshore, will in in all probability in a (hort time bring the aspiring Monarch of France to Reason . I am the least inclined"
0008400300_000528,"The ladies history of England; from the descent of Julius Cæsar, to the summer of 1780. Calculated for the use of the ladies of Great-Britain and Ireland; and likewise adapted to general use, entertainment, and instruction. By Charlotte Cowley.","Cowley, Charlotte",90,2,0,0,0,0,1,0,1,0,2,2,10,0,0,0,2,2,1,0,1,1,2,0,1,1,2,8,2,1,1,0,0,0,2,0,5,0,1,1,1,2,1,3,2,1,4,5,4,1,2,0,0,2,2,0,3,0,1,2,2,1780,1,1,"London : printed for the proprietors; and sold by S. Bladon, No. 13, in Pater-Noster-Row, MDCCLXXX. [1780][-81].",London,774,female,,,FALSE,"establishment of the finking fund, and the liberal grants made' by parliament , during the late and the present reign , the national debt was annually increasing, even in a time of profound peace ; so that there was great reason to believe, that the heavy and numerous taxes ,"
0450200101_000009,"The history of England, from the Revolution to the death of George the Second. (designed as a continuation of Mr. Hume's History.) In five volumes. By T. Smollett, M.D. ...",Tobias Smollett,114,1,0,0,0,4,1,0,3,3,0,1,0,7,0,4,2,4,0,2,7,5,3,0,0,0,1,9,3,0,1,2,0,1,1,0,2,0,0,0,0,1,4,0,0,4,2,3,0,2,0,2,0,1,4,2,1,1,2,8,10,1793,1,5,"London : printed for T. Cadell, in the Strand; and R. Baldwin, No. 47, in Pater-Noster-Row, MDCCXCIII. [1793].",London,524,male,1721,1771,TRUE,"C H A P. created Duke of Gloucester. I. § XV In the midst of there domeffick disputes, 6s9' William did not neglect the affairs of the continent. He retained all his former influence in Holland, as his countrymen had reason to confide in his repeated assurances of inviolable affection."
0101800600_000006,"Substance of the speech of Tho. Jones, Esq. F. R. S. F. A. S. & M. P. on his motion for peace, made in the House of Commons, May 8, 1800: With A Copy Of The Address Moved For BY Him To His Majesty.","Sir Thomas Jones, 1st Baronet",101,0,1,1,1,0,2,1,1,1,0,3,0,1,0,0,1,5,2,1,7,4,1,1,3,1,1,6,2,0,3,0,0,0,4,2,4,1,0,1,0,1,0,0,2,11,1,2,1,0,0,0,0,2,3,3,0,1,1,3,8,1800,1,1,"London : printed for J. Debrett, Piccadilly, by Wilson and Co. at the Oriental Press, Wild Court, Lincoln's Inn Fields, 1800.",London,71,male,1765,1811,FALSE,"your principality of Orange, and the utmost insolences committed upon the persons of Your Majesty's subjects there; and how, to facilitate his conquest upon his neighbour Princes , he engaged the Turks in a war against Christendom at the same time. And, as if the violating of Treaties , and"
0550600101_000009,"The history of England, from the Revolution to the death of George the Second. (designed as a continuation of Mr. Hume's History.) In five volumes. By T. Smollett, M.D. ...",Tobias Smollett,113,1,0,0,0,4,1,0,3,2,0,1,0,7,0,4,2,4,0,2,6,5,3,0,0,0,1,9,3,0,1,2,0,2,1,0,2,0,0,0,0,1,4,0,0,4,2,3,0,1,0,2,0,1,5,2,1,1,2,8,10,1800,1,5,"London : printed for T. Cadell, in the Strand; and R. Baldwin [by H. Baldwin and son], No. 47, in Pater-Noster-Row. MDCCC. (H. Baldwin and Son, Printers, New Bridge-Street.), [1800].",London,526,male,1721,1771,TRUE,"The Princes of the empire, assembled in the diet, solemnly exhorted the Emperor to declare war against the French King , who had committed numberless infractions of the treaties of Muntler, Ofnabruck, Nimeguen, and the truce; invaded their country without provocation, and evinced himself an inveterate enemy of the holy"
1206900102_000039,The works of Jonathan Swift. D.D: D.S.P.D. With notes historical and critical by J. Hawkesworth. L.L.D. And others. Vol. I.,Jonathan Swift,92,0,1,1,2,1,1,0,2,1,0,1,2,3,1,5,4,2,0,2,3,5,2,0,3,1,1,6,1,0,0,0,0,1,0,0,1,1,2,0,0,0,2,1,0,2,0,2,1,2,0,0,0,4,2,1,1,0,2,2,14,1767,2,17,"[Dublin] : Printed for J. Williams Dublin, 1767-68.",Dublin,403,male,1667,1745,TRUE,"whole confederate army ; yet we had no reason to boast of our fiiccefs; how then should we be able to oppoli France with those powers against us, which would carry sixty thousand men from us to the enemy ; and so make us upon the balance weaker by one"
0215401700_000004,"Good Queen Anne vindicated, and the ingratitude, insolence, &c. of her Whig ministry and the allies detected and exposed, in the beginning and conducting of the war. The Englishman's memorial: Containing A short History of the Land Wars we have been engaged in, with unanswerable Arguments, proving 'tis not the Interest of England to be concerned, as a Principal, in a Land War, upon any Pretence Whatsoever;-Mind the Sea. With Remarks on the new Ways of raising Money, &c. (unknown to our Ancestors, and which our Posterity will curse us for;) also Many important Matters relative to the British Affairs, worthy of the Attention of the Publick at this Juncture. By the author of The dissertation on parties.","Henry St John, 1st Viscount Bolingbroke",94,0,2,1,2,1,1,0,3,1,1,0,2,2,1,5,5,1,0,3,3,3,0,0,1,2,0,7,1,0,0,0,1,1,2,0,3,2,2,0,0,0,2,2,0,2,0,2,1,3,1,0,0,3,1,1,1,0,1,1,14,1748,1,1,"London : printed for and sold by W. Owen, at Temple-Bar, [1748].",London,73,male,1678,1751,TRUE,"upon, as some would pretend; that We rightly thought it a Piece of Insolence, as well as Injustice, in the French , to offer putting a King upon Us; and the Spaniards would conceive, we had as little Reason to force one upon Them; that it was true, the Nature"
0155501000_000023,"Elements of universal history, for youth: faithfully extracted from the best authors, carefully abridged agreeable to the most exact chronology, and calculated to convey to the tenderest Capacity, in a short Space of Time, an entertaining, useful, and general Knowledge of the History of all ancient and modern Nations, more particularly of that of Great-Britain: With the Boundaries, Capital Towns, Commerce, Population, Government, and Religion of the modern Nations. Also, A Chronological Table Of the learned and ingenious Men, remarkable Events, Inventions, Discoveries, &c. from the Creation of the World to the Year 1786. By J. A. L. Montriou.","Montriou, J. A. L.",100,0,0,3,2,0,0,1,1,0,3,0,1,3,0,1,0,3,4,2,8,11,1,0,1,1,0,5,1,3,2,1,0,0,0,0,3,0,0,3,0,4,5,2,0,2,1,1,1,0,4,0,1,2,0,3,0,1,1,1,7,1787,1,1,"London : printed for the Author by Fry and Couchman; and sold by R. Marsh, No. 49, Fleet-Street; and W. Darton, White-Lion-Alley, Birchin-Lane, Cornhill, [1787?].",London,196,unknown,,,FALSE,"James's fon in law , to seize the crown: accordingly, William landed in England , and the king , instead of opposing him, fled to France . He afterwards endeavoured to retrieve what his imprudence and pugllanimity had forfeited; but being entirely defeated at the battle of the Boyne, and"
0966500101_000145,"The history of England, from the Revolution to the death of George the Second. (designed as a continuation of Mr. Hume's History.) In five volumes. By T. Smollett, M.D. ...",Tobias Smollett,86,2,1,0,0,0,0,2,5,1,0,0,2,3,0,2,1,5,1,1,1,4,0,1,2,0,4,4,0,2,1,0,0,0,0,1,2,0,0,1,3,3,1,2,4,2,2,7,0,2,0,0,0,1,1,1,2,1,2,3,0,1785,1,5,"London : printed for T. Cadell, in the strand; and R. Baldwin, No 47, in Pater-Noster Row, MDCCLXXXV. [1785].",London,481,male,1721,1771,TRUE,"who trust to a parliamentary security. He declared , that he never asked aids from his people without regret: that what he desired was for their own safety and honour, at such a critical time; and that the whole should be appropriated to the purposes for which it was intended."
0918300109_000021,"The works of Dr. Jonathan Swift, Dean of St. Patrick's, Dublin. Accurately revised, in twelve volumes. Adorned with copper-plates; with some account of the author's life, and notes historical and explanatory. By John Hawkesworth.",Jonathan Swift,92,0,1,1,2,1,1,0,3,1,0,1,2,3,1,6,4,2,0,2,2,4,1,0,3,1,1,5,1,0,0,0,0,1,0,0,1,1,2,0,0,0,2,1,0,2,0,3,1,2,0,0,0,4,1,1,1,0,2,2,16,1766,9,12,"London : printed for C. Bathurst, J. Rivington, W. Strahan, B. Collins, J. Hinton, J. Dodsley, L. Davis and C. Reymers, R. Baldwin, and W. Bowyer, M.DCC.LXVI. [1766].",London,351,male,1667,1745,TRUE,"treasures in the spanijh wefj indies; that in the last war , when Spain , Cologne, and Bavaria were in our alliance, and, by a modest computation, brought sixty thousand men into into the field against the common enemy ; when Slanders, the seat of war , was on our"
0904000103_000096,"The works of the Rev. Dr. Jonathan Swift, Dean of St. Patrick's, Dublin. Arranged, revised, and corrected, with notes, by Thomas Sheridan, A.M.",Jonathan Swift,89,0,1,1,1,0,1,0,1,1,0,1,2,3,1,5,4,2,0,2,3,5,1,0,3,1,1,6,1,2,0,0,0,1,0,0,1,1,2,0,0,0,2,1,0,2,0,2,1,1,0,0,0,4,2,1,1,0,2,3,13,1784,3,17,"London : printed for W. Strahan, B. Collins, J. F. & C. Rivington, L. Davis [and 8 others in London], 1784.",London,487,male,1667,1745,TRUE,"be able to oppose France with those powers against us, which would carry sixty thousand men from us to the Enemy ; and so make us upon the balance weaker by one hundred and twenty thousand men at the beginning of this war , than of that in i688? On"
0104600105_000005,"The works of the Reverend Dr. Jonathan Swift, Dean of St. Patrick's, Dublin. In twenty volumes. Containing, I. His Miscellanies in prose. II. His poetical writings. III. Gulliver's Travels. IV. Papers relating to Ireland, and the Drapier's Letters. V. The conduct of the allies and the examiners. VI. The publick spirit of the whigs, &c. and polite conversation. VII. Letters to and from Dr. Swift. VIII. Directions to servants, sermons, poems, &c. IX. Letters; the history of the last session of Parliament, and the peace of Utrecht, &c. X. Sermons and other Pieces. XI. Letters, &c. the author's life and poems. XII. History of the four last years of Queen Anne's Reign; Letters; and Sermons, &c. Collected by Deane Swift, Esq. XIII. Letters to and from several very eminent persons; poems on various occasions. Collected by Deane Swift, Esq. XIV. XV. and XVI. Letters to and from Dr. Swift. With notes by the Rev. T. Birch, D.D.F.R.S. John Hawkesworth, L.L.D. and others. With many original pieces. XVII. XVIII. and XIX. Letters to & from Dr. Swift. Collected by D. Swift, Esq. with several originals. XX. Tale of a tub.",Jonathan Swift,91,0,1,1,2,1,1,0,2,1,0,0,2,3,1,5,4,2,0,2,3,5,1,0,3,1,1,6,1,0,0,0,0,1,0,0,1,1,2,0,0,0,2,1,0,2,0,2,1,2,0,0,0,4,2,1,1,0,2,3,14,1772,5,20,"Dublin : printed by George Faulkner, MDCCLXXII. [1772].",Dublin,496,male,1667,1745,TRUE,"Head of the whole Confederate Army ; yet we had no Reason to boast of our Success: How then flould we be able to oppose France with those Powers against us, which would carry sixty thousand Men from us to the Enemy , and so make us, upon the Balance,"
0475300105_000100,"The works of Jonathan Swift, D.D. Dean of St. Patrick's, Dublin, accurately revised in six volumes, adorned with copper-plates; with some account of the author's life, and notes historical and explanatory, by John Hawkesworth.",Jonathan Swift,94,0,1,1,2,1,1,0,3,1,1,0,2,1,1,5,5,2,0,3,3,4,0,0,1,1,1,7,1,0,0,0,1,1,2,0,3,2,2,0,0,0,2,2,0,2,0,2,1,3,0,0,0,3,1,1,1,0,1,1,15,1755,5,6,"London : printed for C. Bathurst, C. Davis, C. Hitch and L. Hawes, J. Hodges, R. and J. Dodsley, and W. Bowyer, MDCCLV. [1755].",London,493,male,1667,1745,TRUE,"laboured under; that both we and the Dutch had already acknowledged Philip for king of Spain ; that the inclinations 56 tions of the Spaniards to the house of Aujiria, and their aversion from that of Bourbon, were not so surely to be reckoned upon as some would pretend; that"
1133200300_000005,"The conduct of the allies, and of the late ministry, in beginning and carrying on the present war.",Jonathan Swift,90,0,2,1,1,1,0,0,2,1,0,1,2,3,1,4,4,1,0,3,2,5,2,0,3,1,0,6,1,0,0,0,0,1,0,0,2,2,2,0,0,0,3,1,0,1,0,2,1,1,1,0,0,4,2,1,1,0,2,3,13,1711,1,1,"London : printed for John Morphew, near Stationers-Hall, 1711.",London,94,male,1667,1745,TRUE,"King of Spain ; that we could have no Security tor our Trade , while that Kingdom was subject to a Prince of the .k1orbon lfamily; nor any hopes of preserving the Balance of Europe, becaute the Grandfather wouldl, in ee, be King , while his Grandson had but the"
0515000108_000098,"A complete history of England, from the descent of Julius Cæsar, to the Treaty of Aix la Chapelle, 1748. Containing the Transactions of One Thousand Eight Hundred and Three Years. By T. Smollett, M.D.Volume the first.",Tobias Smollett,106,0,0,0,0,4,1,0,3,2,0,1,0,5,0,4,2,3,0,2,8,4,3,0,0,0,3,11,2,0,2,1,0,1,1,0,1,0,0,0,0,1,4,0,1,4,3,3,0,2,0,2,0,1,3,1,1,1,2,6,7,1758,8,11,"London : printed for James Rivington and James Fletcher, at the Oxford-Theatre; and R. Baldwin, at the Rose, in Paternoster-Row, MDCCLVIII. [1758]-60.",London,489,male,1721,1771,TRUE,"now judged expedient to pass an a for Geicf: fettling the succession of the crown, according to the former resolution of the convention. A bill for this purpose was brought into the lower house , with a clause disabling papists from succeeding to the crown: to this the lords added,"
0624401200_000002,"Good Queen Anne vindicated, and the ingratitude, insolence, &c. of her Whig ministry and the allies detected and exposed, in the beginning and conducting of the war. The Englishman's memorial: containing A short History of the Land Wars we have been engaged in, with unanswerable Arguments, proving 'tis not the Interest of England to be concerned, as a Principal, in a Land War, upon any Pretence Whatsoever-Mind the Sea. With Remarks on the new Ways of raising Money, &c. (unknown to our Ancestors, and which out Posterity will curse us for;) also Many important Matters relative to the British Affairs, worthy of the Attention of the Publick at this Juncture. By the author of The dissertation on parties.","Henry St John, 1st Viscount Bolingbroke",98,0,0,0,1,0,3,0,0,0,2,1,5,2,1,0,3,3,1,0,5,2,4,0,1,1,1,10,2,1,3,0,2,0,0,6,1,0,0,0,1,1,2,1,1,0,1,5,1,1,2,0,0,3,0,0,1,1,0,2,14,1748,1,1,"London : printed by M. Cooper, in Pater-Noster-Row, MDCCXLVIII. [1748].",London,48,male,1678,1751,TRUE,"with the most unreasonable Demands, and at every turn threatening to break the Alliance, if he will not comply. From there rfle&tions upon War in general , .descend to cdtfider those Wars , wherein England hath been engaged since, the Conquest. In the Civil wars of the Barons, as well"
0008400300_000420,"The ladies history of England; from the descent of Julius Cæsar, to the summer of 1780. Calculated for the use of the ladies of Great-Britain and Ireland; and likewise adapted to general use, entertainment, and instruction. By Charlotte Cowley.","Cowley, Charlotte",99,0,0,0,4,0,1,0,3,1,0,0,0,4,0,0,4,2,4,1,10,4,2,0,1,0,3,7,3,0,1,1,0,0,1,1,2,2,0,0,1,5,7,0,1,4,0,2,0,0,1,0,2,2,3,1,0,2,0,2,4,1780,1,1,"London : printed for the proprietors; and sold by S. Bladon, No. 13, in Pater-Noster-Row, MDCCLXXX. [1780][-81].",London,774,female,,,FALSE,"unless an army of thirty thousand nmen was maintained, and ninety ships of war were kept in commission, the nation could not be deemed to be in a late of ic curity. After mentioning the marriage of his niece with the prince of Orange, he requested a supply proportioned to"
0475300105_000098,"The works of Jonathan Swift, D.D. Dean of St. Patrick's, Dublin, accurately revised in six volumes, adorned with copper-plates; with some account of the author's life, and notes historical and explanatory, by John Hawkesworth.",Jonathan Swift,94,0,0,0,1,0,3,0,0,0,2,1,5,1,1,1,1,3,1,0,4,2,4,0,1,0,1,9,2,1,3,0,3,0,0,6,1,0,1,0,1,1,2,1,2,0,0,5,1,1,2,0,0,3,0,0,1,2,0,2,12,1755,5,6,"London : printed for C. Bathurst, C. Davis, C. Hitch and L. Hawes, J. Hodges, R. and J. Dodsley, and W. Bowyer, MDCCLV. [1755].",London,493,male,1667,1745,TRUE,"to contribute more than the principal party, and even tnmre in proportion to his abilities, he ought at leait to have his share in what is conquered from the enemy ; or, if his romanitick disposition transport him so far as to expe< little or nothing from this, he might"
0107301108_000020,Miscellanies. The eighth volume. By Dr. Swift.,Jonathan Swift,92,0,1,1,2,1,1,0,3,1,0,1,2,3,1,6,4,2,0,3,3,4,0,0,2,1,0,6,1,0,0,0,0,1,1,0,2,1,3,0,0,0,2,1,0,1,0,3,1,2,1,0,0,3,1,1,1,0,1,1,16,1748,8,8,"London : printed for C. Davis, against Gray's-Inn Gate, Holborn; and C. Bathurst, opposite St. Dunstan's Church, Fleetstreet, MDCCXLVIII. [1748].",London,316,male,1667,1745,TRUE,"Assistance; this would introduce French Counsellors into King Philip's Court,. and this, by Degrees, would habituate and reconcile the two Nations ; that, to assist King Charles by Eng h h and Dutch Forces , would render him odious to his new Subjects, who have nothing in so great Abomination"
