0190000106_000102,"A new history of England, from the time that the Phoenicians first landed in this island, to the end of the reign of King George I. Taken from the best authors and manuscripts. By William Blennerhassett, Esq;","Blennerhassett, William",73,0,0,0,0,0,0,1,1,1,1,1,0,2,0,1,2,2,1,4,2,1,0,0,1,1,3,11,0,2,0,1,0,0,2,0,0,0,0,1,3,1,0,0,0,3,1,1,0,2,1,1,1,6,1,2,0,0,1,6,1,1751,6,6,"Newcastle upon Tyne : printed by John Gooding, on the Side, for the author, MDCCLI. [1751].",Newcastle upon Tyne,441,unknown,,,FALSE,"to the Pragmatick Saniion; z by which the Order of Succession to the Dominions of the House of aufiria is fettled on the Emperor's Heirs and Successors of either Sex; and declared to be a perpetual, indivisible, and inseparable Feoffment to the Primogeniture. This Pragmatick Sanction, or perpetual Law ,"
0004600103_000121,"A new history of England, from the earliest accounts of Britain, to the ratification of the Peace of Versailles, 1763. Humbly Inscribed to the Queen. By Mr. Mortimer.",Thomas Mortimer,75,1,0,2,2,0,0,0,5,0,0,0,1,1,0,2,1,5,0,0,1,1,2,0,1,2,5,5,0,0,1,0,1,0,0,0,2,0,1,2,3,1,3,0,2,3,1,1,1,0,0,0,0,2,5,1,0,2,1,4,1,1764,3,3,"London : printed for J. Wilson and J. Fell, in Paternoster-Row; and sold by Mr. Fletcher at Oxford, Messrs. Fletcher and Hodson at Cambridge, Mr. Smith at Dublin, and by all the booksellers in Great-Britain and Ireland, MDCCLXIV. [1764]-66.",London,836,male,1730,1810,FALSE,"he detained them, the number of prisoners would have been at least five times greater than that of the conquerors. After this, he entered the city of Narva in triumph. The czar was not present at this battle: it seems he had given orders for the march of about thirty"
0652001100_000007,"The natural probability of a lasting peace in Europe; Shewn from the Circumstances of the Great Powers, as they are now situated; compared with the State of Affairs when the Treaties of Ryswick and Utrechi were severally concluded.",,94,0,1,5,1,0,0,1,1,0,0,5,0,0,1,1,0,1,0,0,7,6,2,0,0,1,1,6,3,0,1,1,1,0,0,0,2,1,0,1,0,1,7,3,3,9,1,4,1,2,1,0,0,2,1,1,0,0,0,4,4,1732,1,1,"London : printed for J. Peele, at Locke's-Head in Amen-Corner, near Pater-Noster Row, [1732].",London,39,unknown,,,FALSE,"of great Infuenee Abroad. He had numerous Armies conm opofed of veteran well difciplined'soldiers. He had many great Commanders of mighty Renown in War , the first for Reputation then in the World, and in, those Times almtoft ever successful. He was in his own Person . of a most"
0475300105_000117,"The works of Jonathan Swift, D.D. Dean of St. Patrick's, Dublin, accurately revised in six volumes, adorned with copper-plates; with some account of the author's life, and notes historical and explanatory, by John Hawkesworth.",Jonathan Swift,75,0,0,0,2,0,2,0,0,0,1,4,1,0,3,1,0,3,1,0,2,2,2,1,1,0,0,2,1,2,3,0,1,1,0,1,4,0,1,0,0,0,7,2,0,3,1,1,0,2,0,0,0,3,1,1,0,1,2,1,8,1755,5,6,"London : printed for C. Bathurst, C. Davis, C. Hitch and L. Hawes, J. Hodges, R. and J. Dodsley, and W. Bowyer, MDCCLV. [1755].",London,493,male,1667,1745,TRUE,"We have been fighting to raise the wealth and grandeur of a particular family; to enrich usurers and flock jobbers, and to cultivate the pernicious designs of a faction by destroying the landed interest. The nation begins now to think these bleqjngs are not worth fighting for any longer, and"
0516300801_000170,"The general genteel preceptor: by Francis Fitzgerald, Esq. being a summary introduction to polite learning. Adapted to the service and instruction of youth of both sexes, And of Others, who wish to acquire, or to confirm, useful and pleasing Knowledge in the various Branches of Education. The First Series. Containing Elementary Principles of Geography, History, and Chronology, Natural History, and Botany, &c. Adorned and illustrated by many plates.",Charles Taylor,71,0,0,1,1,0,0,0,3,0,0,4,1,0,3,1,1,4,2,2,1,1,1,0,2,0,3,6,0,2,1,0,0,0,3,0,2,0,0,0,1,2,1,3,1,0,1,1,2,0,0,0,2,3,1,0,0,0,0,2,6,1797,1,3,"London : printed for C. Taylor, No. 105. Hatton-Garden, Holborn, 1797.",London,496,male,1755,1823,FALSE,"emoluments of the state . It invented opprobious names; and charging those who differed from it in opinion, as enemies to their country , it widened the breach between contending portions of the same people . Inconsequence, impeachments and trials both of lords and commons , some furious, and some"
1079500100_000065,"A compleat history of the affairs of Spain, from the first Treaty of Partition, to this present time. Containing A Particular Account of the different Measures taken since the Peace Of Reswyck, to Secure Spain to the House of Austria; by King William of Glorious Memory, and the Great Actions perform'd by Queen Anne, and her Allies, in Spain, the Netherlands, Italy, &c. Represented in a new Method, by all the Authentick Memorials, Letters, Declarations, Manifesto's, Treaties, &c. Relating to that Grand Affair. To which is Prefix'd An Introduction, Giving a short View of the first Rise and Various Revolutions of that Empire, its Grandeur and Designs of attaining to the Universal Monarchy; and the true Cause of its most Surprising Declension since the Reign of King Philip H. By J. C. M.D. Fellow of the Royal Society, and a Member of the College of Physicians, London.","Crull, Jodocus",97,0,0,0,0,0,4,2,4,1,0,0,0,6,0,2,1,5,0,1,9,2,4,2,1,0,0,6,1,2,1,0,0,1,0,0,0,0,1,0,2,3,1,2,1,0,1,3,4,0,1,0,0,9,2,1,0,0,3,0,8,1707,1,1,"London : printed for, and sold by Jos. Barns , at the Crown in Pall Mall ; Will. Taylor , at the Ship in St. Paul's Church-Yard ; Rob. Gosling , at the Mitre in Fleetstreet ; Nath. Cliff , near Mercers Chapel, Cheap side ; J. Phillips , at the Black Bull in Corn-Hill ; and J. Morphew, near Stationers-Hall, 1707.",London,573,male,,,FALSE,"giving the Satisfaction that ought justly to be expected, the French King has not only proceeded to further Violences, in taking upon him to declare the Pretended Prince of Valcs, King of England , Scotland and Ireland, and has also influenced Spain to concur in the same Afifont and Indignity,"
0072200301_000538,"The works of M. de Voltaire. Translated from the French. With notes, historical and critical. By Dr. Smollet, and others. ...",Voltaire,88,0,2,1,0,1,0,2,0,1,1,1,0,2,0,4,1,4,0,2,6,4,0,0,1,0,2,14,1,0,1,3,0,0,0,2,1,1,2,0,1,2,1,0,0,1,0,3,0,3,0,0,0,7,0,1,0,1,0,3,5,1761,1,25,"London : printed for J. Newbery, R. Baldwin, W. Johnston, S. Crowder, T. Davies, J. Coote, G. Kearsley, and B. Collins, at Salisbury, MDCCLXI. [1761].",London,2692,male,1694,1778,TRUE,"council. The chan 7c0 cellor, Pontchartrain, and the duke of Beauvilliers, were of opinion to abide by the treaty , as foreseeing the danger of having a new war to support. Lewis saw nothing like this; but he was accufiomed not to fear war . He therefore accepted the will,"
0900800200_000005,"The state of the nation consider'd, in a letter to a Member of Parliament.",,66,0,2,1,3,0,0,0,0,2,1,2,2,0,4,0,0,0,2,0,3,3,2,0,1,0,0,0,1,3,1,0,1,0,1,1,2,0,3,0,0,1,2,1,0,2,1,0,3,1,2,0,0,0,2,0,1,1,5,0,3,1747,1,1,"London : printed for W. Webb near St. Paul's, [1747].",London,63,unknown,,,FALSE,"a very meritorious Deed: And the obliging our Land Admirals to retire to their Country Seats, and direct the Navigation of their own Fish Ponds, the most becoming Aft in theworldi This, Sir, pushed with Vigour, will make a britijh Parliament revered, give that just Lullre and Dignity to the"
0170300101_000113,"History of Great Britain, from the revolution to the accession of the House of Hanover. By W. Belsham. In two volumes. ...",William Belsham,79,0,1,1,6,0,1,1,2,0,1,3,0,1,0,0,0,3,0,3,4,0,0,0,2,1,1,7,1,1,2,0,1,0,1,0,5,0,0,1,0,2,7,4,0,1,3,2,0,1,2,1,0,1,0,0,0,0,0,3,2,1798,1,2,"London : printed for G.G. and J. Robinson, Paternoster-Row, M.DCC.XCVIII. [1798].",London,496,male,1752,1827,FALSE,"in the places to be restored by France the Roman Catholic religion should continue as it had been established. The Protestant Princes of the Empire, with the Elector of Bran. denburg at their head, demanded that the Lutheran religion should be reinstated in its former rights; but this requisition was"
0988200102_000226,"Lives of the British admirals: containing a new and accurate naval history, from the earliest periods. By Dr. J. Campbell. With a continuation down to the year 1779, ... Written under the inspection of Doctor Berkenhout. The whole illustrated with correct maps ; ... In four volumes. ...",John Campbell,84,1,1,0,0,1,0,1,0,1,0,0,0,1,1,0,1,3,1,2,1,4,1,0,1,0,0,22,0,0,1,0,1,0,3,0,3,0,1,0,1,1,2,2,0,1,0,3,1,1,2,0,0,4,1,1,1,2,0,4,5,1785,2,4,"London : printed for G. G. J. and J. Robinson, 1785.",London,571,male,1708,1775,FALSE,"very calmly, ""i Sir, I was sent hither to serve ""1 your majesty, but not to ruin the king of Denmark."" 4' Why then,""' replied the king , smiling, "" you have certainly  executed your commission, and have made such a war as will <' make a peace ."""
0156500200_000088,"The history of England, from the Revolution to the present time, in a series of letters to the Reverend Doctor Wilson, ... By Catherine Macaulay. Vol.I.",Catharine Macaulay,80,1,2,0,0,3,0,1,2,0,1,0,1,4,0,0,0,4,2,1,0,1,2,0,3,1,5,4,0,2,0,0,1,2,0,1,2,0,0,0,1,2,4,0,0,2,0,1,1,0,0,0,2,9,1,4,0,0,0,5,2,1778,1,1,"Bath : printed by R. Cruttwell: and sold by E. and C. Dilly, T. Cadell, and J. Walter, London, 1778.",Bath,455,female,1731,1791,TRUE,"cnfc LITTER VI cafe the Company should not pay, within a short time, the sum of fixty eight thousand pounds sterling owing to Spain on the duty of negroes, or on the profit of the ship Caroline; that under the validity and force of this protell, the signing of the"
0736600401_000073,"The political and commercial works of that celebrated writer Charles D'Avenant, LL.D. Relating to the Trade and Revenue of England, The Plantation Trade, The East-India Trade, And African Trade. Collected and revised by Sir Charles Whitworth, Member of Parliament. To which is annexed a copious Index. In five volumes. Volume I.",Charles Davenant,93,1,0,0,1,2,0,0,1,1,0,8,1,0,0,0,1,4,1,0,5,1,0,0,8,0,0,0,0,1,0,0,3,1,1,1,4,0,0,1,1,0,6,7,1,1,0,2,6,3,0,0,0,0,2,0,5,1,4,0,7,1771,1,5,"London : printed for R. Horsfield in Ludgate Street, T. Becket and P. A. Dehondt, and T. Cadell in the Strand, and T. Evans in King Street, Covent Garden, MDCCLXXI. [1771].",London,468,male,1656,1714,FALSE,"of a whole people , he that can make a guess founded upon probable grounds, does go a great way in aifting those, whose proper business it is to inquire after, and look into the wealth and strength f their own and their neighbour countries . And in the art"
1139000126_000018,"A new history of England, from the descent of the Romans, to the demise of his late Majesty, George II Inscribed To his present Majesty, George III. By William Rider, A. B. Late of Jesus College, Oxford. ...",William Rider,69,0,2,0,3,0,0,0,0,2,1,5,0,2,0,1,1,3,1,4,4,2,1,0,1,1,0,3,2,0,0,0,1,2,1,0,3,2,0,0,1,0,1,1,0,1,1,4,1,1,0,0,1,1,1,0,0,0,1,2,4,1761,26,50,"London : printed for S. Crowder and Co. in Pater-Noster Row; and J. Wilkie, in St. Paul's Church-Yard, [1761-64].",London,234,male,1723,1785,FALSE,views of Charles were far from being regulated by a regard to national in terell. He immediately proclaimed war against the Dutch; and surely reasons more absurd and ridiculous were never employed to cover a flagrant violation of treaty . Complaints were made of injuries offered to the eaft india
0432100400_000001,"Reform or ruin: abridged. In which every man may learn the true state of things at this time: and what that reform is, which alone can save the country!",John Bowdler,69,0,0,0,0,1,0,0,0,0,0,2,2,1,3,3,0,0,2,1,1,6,0,0,2,1,1,1,1,2,0,1,1,1,1,2,0,0,1,1,1,2,2,1,2,2,0,0,1,0,0,0,3,1,3,5,1,3,1,0,3,1797,1,1,"London : printed for J. Hatchard, No. 173, Opposite Burlington House, Piccadilly, [1797].",London,24,male,1746,1823,FALSE,"REFORM , OR RUIN: I' ABRIDGED. a..;. IN WHICH (I. EVERY MAN MAY LEARN THE TRUE STATE OF THINGS AT THIS TIME: AND WHAT THAT REFORM IS, WHICH LONE CAN SAY THE COUNTRYI THE FOURTH EDITION. [.onlon: PRINTED FOR J. HATCHARD, SO. 173, OPPOSITE BURLINGTON OUSE, PICCADILLY. 1797 [Price 3d."
1267600103_000039,"Memoirs of Great Britain and Ireland. From the dissolution of the last Parliament of Charles II. until the sea-battle off La Hogue. By Sir John Dalrymple, Bart.","Sir John Dalrymple, 4th Baronet",83,2,0,1,2,0,1,4,1,0,0,2,0,1,0,1,0,9,2,3,4,1,0,0,0,3,2,3,1,1,1,2,1,0,0,1,3,2,1,4,0,2,4,2,0,0,1,0,8,0,1,0,1,0,2,0,0,0,0,0,3,1771,2,3,"London : printed for W. Strahan; and T. Cadell, in the Strand: and A. Kincaid and J. Bell, and J. Balfour, Edinburgh, MDCCLXXI. [1771].",London,314,male,1726,1810,FALSE,"simplicity of William's characer, who, loving real grandeur, Use made of defplifed on that account the flew of it, had given him a natural dislike Acation. to public addresses. Of this an instance was reported to have displayed itself on a public court day, when the Mayor of a borough"
0041604100_000012,A view of the political transactions of Great-Britain since the convention was approv'd of by Parliament. In a letter to an absenting Member.,,84,0,0,0,0,3,2,0,1,0,0,2,1,4,0,1,1,1,3,0,0,1,3,0,7,0,1,0,1,0,0,1,0,1,0,1,3,1,0,0,1,0,0,4,1,2,5,0,1,4,0,0,1,10,1,4,0,0,2,1,8,1739,1,1,"London : printed for T. Cooper at the Globe in Pater-Noster Row, MD,CCXXXIX. MD,CCXXXIX [1739].",London,60,unknown,,,FALSE,"should then know the worst; and be no longer betrayed by a Friendship that was never known to be disinterested, nor missed by Profefflons that were never found sincere. The Expediency of attacking the Spaniards without any formal Declaration of War was very much questioned without Doors likewise. Everybody seemed"
0156200100_000193,"A general collection of treatys of peace and commerce, renunciations, manifestos, and other publick papers, from the Year 1642, to the End of the Reign of Queen Anne. Vol.III. Containing, Treaty betwixt King Charles I. and the Irish Roman Catholicks, 1646. English Parliament's Manifesto against the Dutch, 1652. Dutch Manifesto, in Answer to it. Their Placaert, forbidding Commerce with England, 1652. Treatys betwixt Oliver Cromwell and the Dutch, 1654. &c. His Treatys with Sweden, Portugal, Denmark, and France, 1654, &c. Richard Cromwell's Treaty with France. Treaty at Oliva betwixt Poland, Sweden, &c. 1660. Several Treatys betwixt K. Charles II. and Brandenburg, Sweden, and Denmark, 1661. Holland, and Spain, 1674, 1677, 1680. His Treatys with Algiers, Tripoli, and Tunis, 1662. His Treaty with the Duke of Courland relating to the Island of Tobago, 1664. His Treaty of Commerce with the Grand Seignior, 1675. His Treaty with some Indian Princes, 1677. Treaty betwixt King James II. and Holland, 1685. Treaty betwixt King William III. Holland, and Savoy, 1690. Treaty betwixt the Emperor, England, and Portugal, 1703. Treatys at Utrecht, betwixt Great Britain, France, and Spain; with several Renunciations; 1713. The Assiento Treaty for the Importation of Negroes by the South-Sea Company, 1713. With many others, to be seen in the Contents.",,80,1,0,1,0,0,0,1,0,0,0,0,1,2,2,0,2,0,0,2,3,1,1,0,0,0,0,11,5,1,4,5,0,4,0,1,1,0,0,0,2,2,3,0,2,0,2,2,0,1,3,0,1,3,1,1,0,0,0,4,4,1732,1,1,"London : printed for J. J. and P. Knapton, J. Darby, D. Midwinter and A. Ward, A. Bettesworth, and C. Hitch, J. Pemberton, J. Osborn and T. Longman, C. Rivington, F. Clay, J. Batley, R. Hett, and T. Hatchett, M.DCC.XXXII. [1732].",London,533,unknown,,,FALSE,"the same Per. son should never become Kingof both Kingdoms : And to this end , his Catholic Majesty has, for himself, his Heirs and Successors, moult solemnly renounced all manner of Right, Title and Pretension to the Crown of France ) ia the Form and Words following: Here follow"
0481300119_000029,"The Parliamentary or constitutional history of England; from the earliest times, to the restoration of King Charles II. ... By several hands.",Great Britain. Parliament,83,0,0,1,0,0,0,1,1,0,2,0,1,2,1,0,1,1,0,0,0,0,0,4,4,2,1,4,1,3,4,3,0,0,1,0,2,0,0,0,5,3,4,5,3,2,3,3,2,0,0,0,0,0,5,2,1,0,1,2,2,1761,19,24,"London : printed for J. and R. Tonson, and A. Millar; and W. Sandby, 1761-63.",London,514,unknown,,,FALSE,"and Fortunes to those just and long approved Rules of Law , with which they are already so fully acquainted; and not to believe that the Parliament intends the Abrogation of them, but to continue and maintain the Laws and Government of the Nation , with the present Alterations, and"
0015300103_000033,"The history of England, from the Revolution to the death of George the Second. (designed as a continuation of Mr. Hume's History.) In five volumes. By T. Smollett, M.D. ...",Tobias Smollett,62,1,1,0,2,0,0,2,2,1,0,2,1,0,1,0,3,2,0,3,1,0,0,0,0,1,2,4,1,0,0,0,0,0,0,1,3,0,1,1,2,2,1,1,0,1,1,2,1,3,0,0,1,3,1,2,2,0,0,1,2,1790,3,5,"London : printed for T. Cadell, in the Strand; and R. Baldwin, No. 47, in Pater-Noster-Row, MDCCXC. [1790].",London,557,male,1721,1771,TRUE,"the confidence of his Sovereign, and engrossed the whole direction of public affairs. The war with Spain was now become a secondary consideration, and neglected accordingly; while the chief attention of the new rinifter was turned upon the affairs of the Continent. The dispute with Spain concerned Britain only. The"
0292700100_000007,"A political and military rhapsody, on the invasion and defence of Great Britain and Ireland. By the late General Lloyd. Illustrated with three copper-plates. To which is annexed, a short account of the author, and a supplement by the editor.",Henry Lloyd,88,0,1,1,2,2,0,1,0,1,0,3,0,0,1,2,1,5,7,8,2,3,1,1,0,0,4,1,0,3,0,0,0,0,3,0,7,2,2,0,0,0,3,1,0,5,2,0,0,1,0,0,1,0,1,1,0,0,2,2,5,1798,1,1,"London : sold by Egerton, Whitehall; Debrett, Piccadilly; and by the principal booksellers in Great Britain, [1798].",London,323,male,1720,1783,FALSE,"army . Their new raifed fleet being beat and dispersed, our superiority at sea enabled us to overcome every obstacle; we conquered [ 7 quered all we attacked, and reduced the House of Bourbon so low, that we might have prescribed any terms of peace . Unhappily we mistook entirely"
0530101000_000007,"A political and military rhapsody, on the invasion and defence of Great Britain and Ireland. By the late General Lloyd. Illustrated with three copper-plates. To which is annexed, a short account of the author, and a supplement by the editor.",Henry Lloyd,92,0,2,1,2,1,0,0,0,1,1,3,1,0,1,5,0,4,8,17,2,1,1,0,2,0,3,1,1,3,0,0,0,0,2,0,11,1,1,2,1,0,1,0,0,3,0,0,0,1,0,0,1,2,1,0,0,1,1,0,2,1794,1,1,"London : sold by J. Debrett, Piccadilly; J. Egerton, Charing Cross; and J. Mottley, Portsmouth, 1794.",London,261,male,1720,1783,FALSE,"the service of his King and Country , that we may avert the storm which hangs over our heads, and baffle the efforts of our combined enemies . Whoever confiders the position of England , and of its Colonies, will perceive that our very existence depends on this circum itance"
0313600104_000013,"A third collection of scarce and valuable tracts, on the most interesting and entertaining subjects: but chiefly such as relate to the history and constitution of these kingdoms. Selected from an Infinite Number in Print and Manuscript, in the Royal, Cotton, Sion, and other Public, as well as Private Libraries; Particularly that of the late Lord Somers. Revised by eminent hands. ...",,79,0,0,0,1,1,0,0,0,3,0,3,0,0,0,3,2,3,1,8,5,2,0,0,0,0,1,3,0,0,0,0,0,0,3,2,3,1,1,4,0,3,2,1,1,2,1,3,1,2,1,0,0,2,0,0,0,3,0,2,5,1751,4,4,"London : printed for F. Cogan, at the Middle-Temple-Gate, in Fleet-Street, MDCCLI. [1751].",London,500,unknown,,,FALSE,"by them, than our Parliaments shall judge them to be for the Honour and Advantage of the Public . I answer, That no Nation we shall treat with, will for the same Reason , think itself bound by anything stipulated with us, since whenever they shall be pressed to execute"
0004500401_000046,"The history of England, from the Revolution to the death of George the Second. (designed as a continuation of Mr. Hume's History.) In five volumes. By T. Smollett, M.D. ...",Tobias Smollett,79,1,1,2,3,0,1,0,1,0,0,4,1,0,1,2,1,3,1,0,7,3,3,0,3,0,3,7,3,1,0,1,0,0,0,0,2,0,0,2,3,3,0,0,2,1,1,0,0,0,0,2,2,0,0,0,0,0,0,2,6,1796,1,5,"London : printed for T. Cadell, in the Strand; and R. Baldwin, No. 47, in Pater-Noster-Row, MDCCXCVI. [1796].",London,520,male,1721,1771,TRUE,"damage: they undertook, r.', that their Majesties should ratify these articles within 691 - the ipace of eight months, and use their endeavours that they might be ratified and confirmed in Parliament . The subsequent article was calculated to indemnify Colonel John Brown, whose estate and effects had been seized"
0156500200_000070,"The history of England, from the Revolution to the present time, in a series of letters to the Reverend Doctor Wilson, ... By Catherine Macaulay. Vol.I.",Catharine Macaulay,83,1,0,1,0,1,1,1,2,1,0,1,1,0,0,0,2,7,0,2,1,2,2,0,1,0,0,13,2,1,0,0,0,0,0,1,5,0,0,0,0,2,5,0,2,0,0,3,0,0,1,0,0,8,1,3,0,0,1,3,5,1778,1,1,"Bath : printed by R. Cruttwell: and sold by E. and C. Dilly, T. Cadell, and J. Walter, London, 1778.",Bath,455,female,1731,1791,TRUE,"several wise limitations, were the following provisoes: That in cafe the crown and imperial dignity of the realm should hereafter come to any person not being a native of the kingdom of England , the nation hold not be obliged to engage in any war for the defence of any"
1493400111_000149,The Westminster magazine; for ...,Thomas Holcroft,68,1,1,1,5,2,1,0,0,0,2,2,0,1,0,3,1,0,3,1,0,0,2,1,1,0,0,0,0,2,0,0,1,1,0,1,0,0,0,2,0,0,5,3,0,1,2,0,0,2,1,0,1,2,1,1,2,0,4,2,6,1000,11,11,"London [England] : printed for and by T. Wright, Essex-street, Strand: and sold by J. Bew, No. 28, Paternoster-Row; and all other booksellers in Great-Britain and Ireland.",London,759,unknown,,,TRUE,"the present period, was universally d ifcontented on account of they r want of pay. Great numbers had already mutinied; and if the war continued , there was ground to expec, that the greatest part would refuse to submit to the control of military discipline. With such an army ,"
1273000100_000094,"The annual register, or a view of the history, politics, and literature, of the year 1762.",,75,0,0,3,3,0,1,0,1,3,2,2,0,0,2,4,1,0,1,0,3,1,1,0,1,2,2,3,5,1,0,0,0,1,0,0,1,1,1,1,2,3,5,2,1,0,0,1,2,0,2,0,0,4,0,1,0,0,0,0,5,1780,1,1,"London : printed for J. Dodsley, in Pall-Mall, 1780.",London,543,unknown,,,FALSE,"the house commons , When I confider the ample f? plies which you have granted, cannot but lament the heavy b' thens, which the necessities of public service have obliged youl impose upon my people . Fr this consideration, I have end . voured, in every instance, to refll 1"
1188400100_000308,"A new system of modern geography: or, a geographical historical, and commercial grammar; and present state of the several kingdoms of the world. Containing I. The Figures, Motions, and Distances of the Planets, according to the Newtonian System and the latest Observations. II. A general View of the Earth considered as a Planet; with several useful Geographical Definitions and Problems. III. The grand Divisions of the Globe into Land and Water, Continents and Islands. IV. The Situation and Extent of Empires, Kingdoms, States, Provinces, and Colonies. V. Their Climates, Air, Soil, Vegetable Productions, Metals, Minerals, natural Curiosities, Seas, Rivers, Bays, Capes, Promontories, and Lakes. VI. The Birds and Beasts peculiar to each Country. Vii. Observations on the Changes that have been any where observed upon the Face of Nature since the most early Periods of History. Viii. The History and Origin of Nations; their Forms of Government, Religion, Laws, Revenues, Taxes, Naval and Military Strength. IX. The Genius, Manners, Customs, and Habits of the People. X. Their Language, Learning, Arts, Sciences, Manufactures, and Commerce. XI. The chief Cities, Structures, Ruins, and artificial Curiosities. XII. The Longitude, Latitude, Bearings, and Distances of principal Places from London. To which are added, I. A Geographical Index, with the Names and Places alphabetically arranged. II. A. Table of the Coins of all Nations, and their Value in English Money. III. A Chronological Table of remarkable Events from the Creation to the present Time. By William Guthrie, Esq. The astronomical part by James Ferguson, F.R.S. To which have been added, the late discoveries of Dr. Herschell, and other eminent Astronomers.",William Guthrie,83,3,0,0,1,2,1,2,0,0,1,0,0,0,0,0,0,1,1,0,7,3,6,0,4,0,0,3,4,1,2,2,1,1,0,3,4,1,0,3,0,6,2,2,2,5,1,1,2,0,0,0,0,0,1,0,2,0,0,1,1,1792,1,1,"London : printed for C. Dilly, In The Poultry; and G. G. J. and J. Robinson, Pater Noster Row, MDCCXCII. [1792].",London,1102,male,1708,1770,FALSE,"GOVERNMENT .] In speaking upon this article, we must rather confine ourselves to a history of the past conrtitution and government of this kingdom , than presume to give any circumstantial account of them at present . The late changes in these have been so great and remarkable, that, as"
0070100104_000322,"A complete history of England, deduced from the descent of Julius Cæsar, to the Treaty of Aix la Chapelle, 1748. Containing the Transactions of One Thousand Eight Hundred and Three Years. By T. Smollett, M.D. ...",Tobias Smollett,78,5,2,0,0,0,2,0,3,1,0,0,7,1,0,0,2,1,0,1,0,0,1,0,0,0,3,6,2,2,1,1,0,0,0,3,6,0,1,1,1,2,2,1,1,0,3,1,2,0,1,0,0,0,2,2,4,0,3,1,0,1757,4,4,"London : printed for James Rivington and James Fletcher, at the Oxford-Theatre, in Pater-Noster Row, MDCCLVII. [1757]-58.",London,703,male,1721,1771,TRUE,"Frederick malui of namely, Anne, Amelia, Carolina, May, and wa Brandenburgh anfpach, by whom he had two afterwards delivered of Louia, married in the fens, Frederic Lewis prince of Wales, born at sequel to the king of Denmark. Hanover on the thirty frt day of January, one X X X"
