0457600103_000081,"The works of Henry Fielding, Esq; with the life of the author. In eight volumes. ...",Henry Fielding,78,0,1,2,0,0,1,0,2,0,0,2,0,2,1,6,0,0,1,0,1,1,0,5,0,4,3,0,0,1,1,1,1,3,2,2,1,1,0,0,1,3,0,1,1,1,0,0,1,2,2,4,0,0,11,1,1,3,1,1771,3,8,"London : printed for W. Strahan, J. & F. Rivington, L. Hawes & Co. R. Horsfield, W. Johnston, T. Caslon, S. Crowder, T. Longman, E. & C. Dilly, W. & J. Richardson, G. Kearsly, R. Dymott, T. Cadell, W. Woodfall, T. Lowndes, S. Bladon, Robinson and Roberts, R. Baldwin, T. Davies, T. Becket, J. Robson, D. Wilson and G. Nicol. T. Noteman, and T. Evans, MDCCLXXI. [1771].",London,617,male,1707,1754,TRUE,"think on't; if I 8 tfhoull should be seen speaking to him, I fhaltlofe all the fine things I was promised. [Aside. Lord BAW. What are you considering, my dear? WIFE . I muss not stay with you any longer, for I expet an old gentleman every minute, who promised"
1028400109_000094,"The new English theatre vol. IX. Amphitryon, Double dealer, Double gallant, Inconstant, Constant couple.",,74,0,1,1,1,0,1,0,5,3,0,0,0,2,0,1,0,2,0,1,0,1,3,1,0,2,3,0,2,0,4,2,0,14,1,0,1,1,0,1,2,1,1,1,0,1,0,0,3,0,2,2,0,1,0,3,2,0,1,1776,9,12,"London : printed for J Rivington & Sons, J. Dodsley, T. Lowndes, T. Caslon, W. Nicoll, S. Bladon, &c., MDCCLXXVII. [1777].",London,388,unknown,,,FALSE,"you have had abroad by following tirangers; you forget your leap mut of the Courtesan's window at Bologna, to save your fine ring there. Mir. My ring's a trifle, there's nothing we pofeefs comparable to what we desire be Ihy of a lady bare faced in the front box with"
0810900300_000002,"The bankrupt. A comedy, in three acts. By Samuel Foote, Esq.",Samuel Foote,80,1,1,1,1,0,1,0,2,2,1,1,1,1,0,0,0,0,0,1,0,2,0,1,0,3,20,1,0,1,1,2,3,5,1,0,3,1,1,0,1,0,1,2,0,2,0,0,3,0,1,2,2,1,0,0,4,0,2,1776,1,1,"Dublin : printed for S. Price, B. Corcoran, W. Sleater, R. Cross, D. Chamberlaine, W. Watson, J. Potts, H. Burrowes, T. Wilkinson, J. Sheppard, J. Hoey, J. Williams, W. Colles, W. Wilson, R. Moncrieffe, T. Walker, C. Jenkin, P. Highly, T. Armitage, G. Burnet, P. Wilson, E. Cross, R. Stewart, J. Hillary, J. Exshaw, W. Kidd, W. Hallhead, P. Wogan, G. Bonham, S. Colbert, J. Beatty, C. Talbot, MDCCLXXVI. [1776].",Dublin,69,male,1720,1777,TRUE,"me. Kitty. And pray , what may that be, Mr. Robin'? Robin. Not living under the same roof with Miss Kitty. I made no doubt, Madam , but your fortunes would follbw your mistress's, and, in that cafe, I thought to soften the rigours of my captivity, in your agreeable"
0398100104_000082,"The works of Henry Fielding, Esq; with the life of the author. In twelve volumes.",Henry Fielding,73,0,1,1,2,0,1,0,4,0,0,1,0,1,1,5,0,0,1,0,0,2,0,2,0,3,3,0,0,1,1,1,1,2,2,2,1,1,0,0,1,2,0,0,1,1,4,0,1,0,2,2,0,1,9,3,1,3,2,1783,4,12,"London : printed for W. Strahan, J. Rivington and Sons, S. Crowder, T. Longman, J. Robson, C. Dilly, G. Kearsley, G. Robinson, T. Cadell, T. Lowndes, R. Baldwin, W. Cater, G. Nicoll, S. Bladon, J. Murray, W. Flexney, T. Evans. W. Ofridge, J. Sewell, W. Lane, J. Bowen, & W. Fox, MDCCLXXXIII. [1783].",London,435,male,1707,1754,TRUE,"is not half so fine. LORD BAW. 0, my dear, gentlemen of no hundred pound a year scorn sich an houle as this: Nobody lives now in anything but a palace. WIFE . Nay, the finer the better , by goles, if you will pay for it. lord BAW. Pugh,"
1778500205_000026,The English theatre. In eight volumes. Containing the most valuable plays which have been acted on the London stage. ...,,72,0,1,2,0,0,1,0,2,1,2,1,0,4,1,2,0,1,1,2,2,0,1,0,0,1,2,2,0,0,4,0,2,6,2,1,2,1,0,0,1,11,3,1,1,1,0,1,0,1,1,1,0,0,0,0,1,0,2,1769,5,8,"London : printed for T. Lowndes, 1769.",London,378,unknown,,,FALSE,"Klr dg~ori. Yes. £1/ In ipight of all his ill Usage. ori. I can't help it. Bii What's the Matter wi'ye? Ori. Pnhaw! Bi Um! -- before that any young , lying, swear ing, flattering, rakehelly Fellow thou'd play fu h'tricks with me, I would wear my Teeth to the"
1255200301_000081,"Plays, Written by Sir John Vanbrugh. In Two Volumes. ... Containing The Relapse, or Virtue in Danger. The Provoked Wife. Esop, in Two Parts. ... Containing The Confederacy. The False Friend. The Mistake.",John Vanbrugh,69,2,0,2,1,0,0,0,3,0,2,1,0,3,1,1,0,1,2,2,1,3,1,0,1,2,5,2,1,0,1,0,3,1,0,1,1,0,1,0,2,1,0,3,1,0,3,1,5,1,0,3,0,1,0,0,0,1,2,1719,1,2,"London : printed for J. Tonson and M. Wellington, and sold by William Taylor at the Ship in Pater-Noster-Row, M.DCC.XIX. [1719].",London,325,male,1664,1726,TRUE,"is to make one another pa's their time as pleasantly as they can. Now, Sir, here's a young Lord, who has a great deal of Land, a great deal of Title, a great deal of Meat, a great deal of Noise, a great many Servants , and a great many"
0901600500_000023,"The busy body. A comedy. By Susannah Centlivre. Adapted for theatrical representation as performed at the Theatres-Royal Drury-Lane and Covent-Garden. Regulated from the prompt-books, by permission of the managers.",Susanna Centlivre,86,2,1,0,0,0,1,1,5,1,1,4,1,0,4,6,0,1,0,3,3,0,0,5,0,3,1,0,0,5,1,0,2,4,1,0,2,0,0,0,3,0,0,2,0,4,4,0,2,6,3,1,1,0,0,0,1,0,1,1791,1,1,"London : printed for the proprietors, under the direction of John Bell, British Library, Strand, bookseller to His Royal Highness the Prince of Wales, MDCCXCI. [1791].",London,95,female,1667,1723,TRUE,"""Cha. A sudden joy runs through my heart like a pro'  omen."" [Aside. Sir Geo. Come, madam , do not blindly cast your life away just in the moment you would wish to save it. Isab. Pray cease your trouble, sir; I have no wish but sudden death to"
1270200100_000020,"The inconstant; or, the way to win him. A comedy. As it is acted at the Theatre-Royal in Drury-Lane: by Her Majesty's servants. Written by Mr. George Farquhar.",George Farquhar,73,1,2,1,0,0,0,0,2,1,0,0,0,1,1,1,0,1,0,3,0,1,2,1,0,2,1,0,0,0,4,2,0,14,1,0,1,0,1,4,1,2,1,3,0,2,1,0,2,0,3,2,1,1,0,3,1,1,1,1736,1,1,"London : printed for J. Knapton, G. Strahan, and B. Lintot; and sold by W. Feales, at Rowe's-Head, the Corner of Essex-Street in the Strand, M,DCC,XXXVI. [1736].",London,82,male,1677,1707,TRUE,"our Live what shall I do? Mir. By all my Hopes Fortune pimps for me; now, Duretete, for a piece of Gallantry. Dur. Why, you won't sure ? Mir. Won't, Brute! Let not your Servants .Northeast gle&, Madam , put your Ladyship to any Inconvenience, for you can't be difappoinedef"
1600901300_000006,The recruiting officer. A comedy. Written by Mr. Farquhar.,George Farquhar,72,1,0,1,1,4,1,2,3,1,0,4,1,3,2,1,0,3,0,1,0,0,3,0,0,2,0,1,2,4,3,1,1,5,0,1,0,0,1,0,1,1,0,3,4,0,0,0,4,1,0,1,1,0,1,0,0,0,2,1768,1,1,"Dublin : Printed by A. M'Culloh, for William Smith, bookseller in Dame-street, MDCCLXVIII. [1768].",Dublin,84,male,1677,1707,TRUE,"made beforehand. Plume. My Will, Madam , ismade already, and there it is; and if you please to open that Parchment, which was drawn the Evening before the Battle of Blenheim, you will find whom I have left my Heir. Sil Sil. Mrs. silvia Balance, (Opens the Will and Reads)"
0100100500_000008,"The double gallant: or, the sick lady's cure. A comedy. As it is acted at the Queen's Theatre in the Hay-Market. Written by Mr. Cibber.",Colley Cibber,76,0,0,1,0,0,0,1,3,1,1,2,3,1,1,2,0,1,0,6,0,1,3,1,0,11,2,1,0,1,3,0,0,6,1,0,2,4,1,0,1,0,0,1,0,1,0,1,2,1,2,2,1,0,0,0,2,0,2,1707,1,1,"London : printed for Bernard Lintott , between the two Temple Gates in Fleetstreet ; and sold by John Phillips, next the Fleece Tavern against the Royal Exchange in Cornhil, [1707].",London,88,male,1671,1757,TRUE,"had been himself my Husband. Clara melancholy Disappointment indeed 1 L Sad. Oh! tis a Husband's Nature to give em. A Servant whijfer's Sjlvia. Syl. Desire him to walk in Cousin you'll be at hand . Clar. In the next Room Come, Madam , silvia has a little 1finess, I'll"
0345600700_000005,The recruiting officer. A comedy. Written by Mr. Farquhar.,George Farquhar,78,0,2,2,1,0,0,0,4,2,1,1,0,3,3,3,0,1,0,0,1,1,5,0,0,3,0,0,4,0,2,0,1,13,0,2,0,1,0,0,4,1,1,3,1,2,0,0,2,1,0,1,2,0,0,1,1,0,2,1732,1,1,"Dublin : printed by S. Powell, for Richard Norris, at the Corner of Crane-Lane in Essex-Street, MDCCXXXII. [1732].",Dublin,83,male,1677,1707,TRUE,"have my Visit returned. Mel. The sooner, theretore, you make an end of this, the better . Sil. I am easily persuaded to follow my Inclinations; So, Madam , your humble servant . ( Exit . Mel. Saucy Thing. Enter Lucy. Luc. What's the matter , Madam Mel. Did not"
1195900200_000002,"Miss in her teens: or, the medley of lovers. A farce, in two acts. As it is performed at the Theatre Royal, Drury-Lane.",David Garrick,67,1,2,1,0,0,0,0,4,2,2,0,0,2,2,1,0,1,2,1,1,3,2,1,0,4,3,0,0,0,1,3,1,0,0,1,0,0,0,0,1,4,1,1,1,2,2,0,0,0,3,2,0,0,2,4,2,0,1,1787,1,1,"London : printed for T. Becket, In Pall-Mall, MDCCLXXXVII. [1787].",London,45,male,1717,1779,TRUE,"say, Piss? pijf. If your hlnourpleafes to confider that I had a wife in town, whom I left somewhat aburptly half a year ago, you'll think it, I believe , but decent to make some inquiry after her first to be sure it would be some finall consolation to me,"
0047602700_000014,The artifice. A comedy. As it is acted at the Theatre-Royal in Drury-Lane. By His Majesty's company of comedians. By Mrs. Cent-Livre.,Susanna Centlivre,83,0,1,1,0,7,1,0,5,2,0,1,1,3,0,0,0,0,0,1,2,0,6,0,1,6,2,3,0,1,0,1,1,12,3,1,1,0,2,0,3,0,0,2,0,1,0,0,3,1,2,2,0,0,1,2,1,0,0,1723,1,1,"London : printed for T. Payne, near Stationers-Hall, M.DCC.XXIII. [1723].",London,115,female,1667,1723,TRUE,"Mlay allftitfe hearted Men my Fortune have, And whbo sights Woman , be a Woman's Slave! I've romewhat to say to you, my lori, when Time flhall serve. [As bhe goes out. Taliy. I'll meet you in Covent-garden piaszza, in Half an Hour. [Afidec to Farewell. ; Reenter Fainwell. ein."
0154201902_000065,"The dramatic works of Colley Cibber, Esq; In Four Volumes. ... . Containing Love's last Shift, a Comedy. Woman's Wit, a Comedy. Love makes a Man, a Comedy. She would and she would not, a Comedy.",Colley Cibber,80,0,0,2,0,0,2,1,2,2,0,0,0,1,2,1,0,0,0,1,2,3,2,0,0,4,8,1,0,2,1,1,1,12,0,0,0,0,2,0,0,3,0,2,3,2,0,1,2,2,1,3,0,0,0,2,2,0,4,1760,2,4,"London : printed for J. Clarke, C. Hitch and L. Hawes, D. Browne, J. and R. Tonson, J. Rivington, R. Baldwin, T. Caslon, C. Bathurst, S. Crowder and Co. T. Longman, H. Woodgate, and S. Brooks, C. Corbet, G. Kearsly, J. and T. King, and T. Lownds, MDCCLX. [1760].",London,366,male,1671,1757,TRUE,"he paid sort?? Troth, I can't say Ido .They came awavy an't like your Honour , but I did not see them pay for any thing and so after that Enter Hartihorn. Harts Young Mrs. Notable is come to wait upon your Ladyship. La. Wrong. Here, come into the next"
0291900105_000046,"Bell's British Theatre. Consisting of the most esteemed English plays. .. . Containing Comus,..,[sic]....... By Milton. Alchymist, ....... - Ben Jonson. Love for Love, ..... - Congreve. Rival Queens, ..... - Lee.",,61,1,1,0,0,0,1,0,1,2,1,1,0,1,0,3,0,1,0,1,1,0,2,0,0,2,0,2,3,1,2,0,1,4,1,2,1,1,0,0,1,1,1,4,0,1,0,1,0,1,2,2,0,0,2,1,4,0,3,1797,5,34,"London : printed for, and under the direction of, George Cawthorn, British Library, Strand, 1797.",London,366,unknown,,,FALSE,"or else the scale cann'r turn. D. Mas. Say it be so, would that turn thee into my interest? Vi. The very minute you turn into mine, sir; judge your self here sands Osavio with a letter , and two pieces to give it to my mistress there stand you"
1108900800_000004,"Lionel and Clarissa; or, the school for fathers. A comic opera. Written by Isaac Bickerstaff. Taken from the manager's book, at the Theatre Royal, Drury-Lane.",Isaac Bickerstaffe,75,0,2,2,0,0,1,1,1,0,1,2,0,0,1,2,0,1,1,2,1,1,2,1,0,1,4,1,0,0,3,0,0,9,2,1,1,1,0,0,3,0,0,0,2,1,1,1,1,0,7,3,2,2,0,0,2,2,3,1790,1,1,"London : printed for R. Butters, No. 79, Fleet-Street; and sold by all Booksellers in Town and Country, [1790?].",London,53,male,1733,1812,TRUE,"Jenmny. Clarp' Immortal powers, protect me, Alift, support, di es me; Relieve a heart opprcft Ah! who this palpitation! Cease, busy purturbation, And let me, let me rest. ?a. My dear lady , what ails you? Clar. Nothing , Jenny? nothing . en. Pardon me, madam , there is romething"
0048404100_000003,"Second thought is best. An opera of two acts, performed at the Theatre Royal in Drury-Lane. Addressed to R. B. Sheridan, Esq; by J. Hough, ...","Hough, J. (John)           1778",62,0,0,2,1,0,1,2,3,3,1,1,1,0,1,0,0,1,0,3,0,2,2,0,0,2,1,2,2,0,0,1,2,5,2,1,1,3,1,0,2,1,0,2,1,0,0,0,1,1,0,1,0,2,1,2,0,0,1,1788,1,1,"[London] : Published by Mr. Murray, bookseller, No.32, Fleet-Street; and of Mr. Greenlaw, 1788 [1778].",London,40,unknown,,,FALSE,"milk ofmildnefs. Had Frankly tempered moderation with argument, I had melted like tenderhearted charity at the tears of afflitli n. Somi, Song, by Woudbe. Passion is allv'd to madners, And the firstborn son of rage; Tis the lire of grief and ladiels, Known to all of every age. II Reason"
0394100700_000002,"The bankrupt. A comedy, in three acts. By Samuel Foote, Esq.",Samuel Foote,85,1,1,1,1,0,1,0,2,2,1,2,2,1,0,0,0,1,0,1,0,2,0,1,0,3,25,1,0,0,1,1,3,5,1,0,3,1,1,0,1,0,1,2,0,1,0,0,3,0,1,2,1,2,0,0,4,0,2,1776,1,1,"London : printed for G. Kearsly, No. 46, near Serjeants-Inn, Fleet-Street; and T. Evans, near the New Exchange Buildings, in the Strand. MDCCLXXVI. Entered at Stationers Hall, [1776].",London,100,male,1720,1777,TRUE,"and the servants of this fide the bar Really, Mr. Robin, you talk nearly as well as your master. ROB 1 N. And no wonder, Madam , since love , the same deity, inspires us both. KITTY. How quick you are in your rippartees, Mr, Robin? are you good at"
0050400110_000005,"Jones's British theatre. Vol. II. Containing, I. The fair Penitent. II. The Mourning Bride. III. Zara. IV. Venice Preserved.",,89,0,1,1,0,4,1,0,4,3,0,0,0,0,2,0,0,1,1,0,1,0,2,1,0,5,19,2,0,1,1,0,0,3,0,1,0,1,0,0,3,0,1,0,1,2,0,0,2,3,2,4,3,2,2,3,3,3,0,1795,10,10,"Dublin : printed by John Chambers, for William Jones, No. 86, Dame-Street, 1795.",Dublin,511,unknown,,,FALSE,"How long in reason then, do you think that sum ought to last you? Lady 7 Oh, my dear, dear lord! now you have spoiled all again: how is it possible I hold answer for an event that so utterly depends upon fortune? But to hew you that I am"
1570901100_000008,"The bank note, or, Lessons for ladies, a comedy, in five acts. As performed at the Theatre-Royal, Covent-Garden. Partly an alteration, by William M'Cready.","Macready, William",92,0,2,1,0,0,2,1,2,4,0,0,0,3,1,2,0,3,0,1,2,0,0,1,0,10,12,3,0,0,3,1,4,4,0,1,1,0,0,0,0,3,0,1,2,3,4,0,0,0,4,5,0,0,0,3,1,2,0,1796,1,1,"Dublin : Printed by P. Wogan, No. 23, Old-Bridge, 1796.",Dublin,80,unknown,,,FALSE,"-- Kill. Oh, the damn, if I know what to call him a beaft fure that's a human creature mutt love and regard a pretty woman . Come, Madam , with your leave , I'll be after handing you from this agreeable villain, to the care of Sir Charles Leslie."
0664400200_000007,"Love the leveller: or, the pretty purchase. Acted at the Theatre Royal, in Bridges-Street, Covent-Garden. Written by G. B. Gent.",G. B.,74,0,2,1,0,0,0,0,2,4,0,0,1,0,2,1,0,0,1,3,0,4,2,1,1,3,7,3,0,2,0,0,1,4,0,1,3,2,1,1,1,2,0,1,2,3,0,0,1,0,1,2,1,1,3,0,2,1,0,1704,1,1,"London : printed for E. Rumbal, at the Post-House in Russel-Street, Covent-Garden; and are to be sold by J. Nutt, near Stationers-Hall, 1704.",London,76,unknown,,,FALSE,"and am unwillingly forced to . leave you. -. Algr. Youre not sick, I hope , tofee. your Niece present that Jewel to landrsmont;?. . -. i sala. You stall know that at. home, Sir: His Title and Birth turns everything into Ridicule; he resembles mightily the Beggar in the"
0339400400_000024,"The provok'd wife. A comedy. By Sir John Vanbrugh. Adapted for theatrical representation, as performed at the Theatre-Royal, Covent-Garden. Regulated from the prompt-book, By Permission of the Manager.",John Vanbrugh,78,0,1,4,1,1,1,1,2,1,0,0,0,1,4,0,0,1,1,12,0,0,2,0,0,2,2,0,1,2,1,3,1,3,2,0,2,0,1,0,1,2,0,2,1,1,0,0,2,0,4,3,0,0,4,0,1,1,3,1794,1,1,"London : printed for, and under the direction of John Bell, British Library, Strand, Bookseller to His Royal Highness the Prince of Wales, MDCCXCIV. [1794].",London,96,male,1664,1726,TRUE,"whose more than common virtue, I am sure , were she my wife , should meet a better usage. Sir Jobn. Sir, if her conduat has put a trick upon her virtue, her virtue's the bubble, but her husband's the loser. Con. Sir, you have received a sufficient answer already,"
1105701200_000013,"The amorous widow; or, wanton wife. A comedy. As it is acted at the Theatre Royal in Smock-Alley. Taken from Molier and Dancourt. By Mr. Betterton.",Thomas Betterton,78,0,1,1,1,0,1,1,7,2,1,0,2,0,2,0,0,1,0,2,0,1,2,1,0,1,8,2,1,1,2,0,8,7,2,0,1,0,1,0,0,0,0,0,0,2,0,0,3,2,1,0,0,1,2,2,2,1,2,1751,1,1,"Dublin : printed by and for James Esdall, at the Corner of Copper-Alley, on Cork-Hill; and Matthew Williamson, at the Golden Ball, opposite Sycamore-Alley, in Dame-Street, 1751.",Dublin,79,male,1635,1710,FALSE,"I told him that he did: He cried I am the most unfortunate of lien : I love her, Friend , more than I love my Life ; and if thou doll not find some Means to fultain my dying Hopes , henceforth cxpet to see thy Friend no more:"
0478901402_000056,"The works of the late ingenious Mr. George Farquhar: containing all his poems, letters, essays and comedies, publish'd in his life-time. In two volumes.",George Farquhar,72,0,2,2,1,0,0,0,3,2,1,0,0,3,2,2,0,1,0,0,1,2,5,0,0,2,0,0,4,1,1,0,1,10,0,3,3,1,0,0,3,1,1,2,0,2,0,0,1,0,1,2,2,0,0,1,1,0,2,1742,2,2,"London : printed for J. and P. Knapton, G. Strahan, J. Clark, and H. Lintot, 1742.",London,368,male,1677,1707,TRUE,"But to be plain with you, I like Worthy the worse for being so intimate with your Captain, for I take him to be a loose, idle, unmannerly Coxcomb. syi. 0, Madam ! you never saw him, perhaps, since you were Mistress of twenty thousand Pound; you only knew him"
0964300200_000007,"Rosina, a comic opera, in two acts. Performed at the Theatre-Royal, in Covent-Garden. By Mrs. Brooke, Author of Julia Mandeville, &c.",Frances Brooke,76,0,1,1,0,7,1,0,4,1,1,3,0,1,2,2,0,0,0,5,0,4,0,1,0,1,1,2,0,2,4,0,6,2,4,0,2,1,0,0,1,1,0,0,1,1,0,0,0,2,3,1,1,1,0,2,0,0,3,1783,1,1,"London : printed for T. Cadell, in the Strand, MDCCLXXXIII. [1783].",London,46,female,1724,1789,TRUE,"her birth, which I have long sus peed to be above her present situation. Dorcas. To be sure , your honour , since the dear child gives me leave to speak , she's of as good a family as any in England. Her mother, sweet lady , was my bountiful"
0341900300_000007,"The twin rivals. A comedy, by Mr. George Farquhar. Adapted for theatrical representation, as performed at the Theatre-Royal, Covent-Garden. Regulated from the prompt-book, By Permission of the Manager.",George Farquhar,73,0,1,1,0,1,1,3,2,2,0,1,0,2,0,0,0,0,0,2,0,2,2,1,0,4,2,1,2,0,2,1,0,5,0,1,0,1,4,3,3,1,0,1,2,3,0,0,1,0,2,2,0,6,0,0,1,1,3,1795,1,1,"London : printed for the proprietor, under the direction of John Bell, British Library, Strand, Bookseller to His Royal Highness the Prince of Wales, MDCCXCV. [1795].",London,101,male,1677,1707,TRUE,"consequence. You can have no hopes of success there, I'm sure . Mid. Truly, I have no great hopes : but an industrious body, you know , would do anything rather than be idle. The aunt is very near her time, and I have access to the family when I"
0047603100_000007,"The lying lover: or, the ladies friendship. A comedy. Written by Sir Richard Steele.",Richard Steele,71,1,1,0,1,1,1,0,1,1,0,2,1,3,0,4,0,2,1,1,0,0,2,0,0,3,0,2,0,0,0,0,6,7,1,0,0,1,3,1,3,4,0,0,1,1,0,1,2,2,2,4,1,0,0,1,0,0,2,1747,1,1,"London : printed for Henry Lintot, 1747.",London,84,male,1672,1729,TRUE,"dwell upon his knees whom they languiih to receive into their Arms they're no fair Enemy Therefore tis but just, that We use all Arts the Fair to undermine, A., d learn with Gallantry te hide Design. [Exeunt. ACT II SCENE I. Entkr Old Bookwit, Penelope, and Lettice.. B. Iftrefs"
1013100102_000073,"Plays written by Sir John Vanbrugh. In Two Volumes. ... Containing The Relapse; or Virtue in Danger. The Provok'd Wife. Esop, in Two Parts. ... Containing The Confederacy. The False Friend. The Mistake. A Journey to London. The Provok'd Husband.",John Vanbrugh,87,0,3,1,0,1,1,0,2,0,0,1,1,0,0,1,0,0,14,1,3,1,2,4,0,1,4,2,0,1,2,0,5,7,2,0,0,2,0,2,0,0,8,1,0,0,0,0,2,1,0,4,1,1,0,2,0,1,2,1734,2,2,"London : printed for J. Tonson, and J. Watts; W. Feales; R. and J. Wellington; A. Bettesworth, and F. Clay, both in trust for B. Wellington, M.DCC.XXXIV. [1734].",London,387,male,1664,1726,TRUE,"Play tonight, and tomorrow we go to the Opera, and next Night we go to the aftembly, and then the next Night after, we La. Head . Softly, Miss .....Do you.go to the Play tonight... Cot. I did not design it, Madam . but now I find there is to"
0128700700_000024,"The funeral: or, grief a-la-mode. A comedy. Written by Sir Richard Steele.",Richard Steele,68,1,1,1,2,2,0,0,3,1,0,1,1,4,3,3,0,1,2,0,0,0,0,2,0,1,6,4,0,0,0,0,0,8,0,1,1,0,1,0,0,0,1,0,1,2,1,0,3,3,1,3,1,0,0,1,0,0,1,1758,1,1,"London : printed for J. and R. Tonson in the Strand, MDCCLVIII. [1758].",London,86,male,1672,1729,TRUE,"twould never become me I'm sure - -- they can be as merry: Well, I'll tell my new Acquaintance -- What's her Name? -- She that reads so much, and writes Verses- -- Husband was deaf the first Quarter of a Year -- I forget her Name -- That Expretison"
0778900500_000007,"Rosina, a comic opera, in two acts, performed at the Theatre-Royal, in Covent-Garden. By Mrs. Brooke, Author of Julia Mandeville, &c.",Frances Brooke,74,0,1,1,0,6,1,0,4,1,1,3,0,1,2,2,0,0,0,5,0,3,0,1,0,1,1,2,0,2,4,0,6,3,4,0,2,1,0,0,1,1,0,0,1,1,0,0,0,2,2,1,1,1,0,2,0,0,3,1786,1,1,"London : printed for T. Cadell, in the Strand, M.DCC.LXXXVI. [1786].",London,44,female,1724,1789,TRUE,"me leave to speak , she's of as good a family as any in England. Her mother, sweet lady , was my bountiful old mailer's daughter, Squire Welford of Lincolnthire. Bel. What happiness! But go on. Dorcas. He was a noble gentleman , asnd nobody's enemy but his own. His"
0883400200_000006,"Love's last shift: or, the fool in fashion. A comedy: as it is acted at the Theatre Royal in Drury-Lane, by His Majesty's servants. Written by C. Cibber.",Colley Cibber,91,0,3,1,0,1,1,1,1,0,2,0,0,1,0,1,0,0,1,1,0,0,5,1,0,3,3,1,0,1,1,0,10,15,4,0,0,3,1,0,2,1,0,0,2,7,0,0,1,1,2,4,2,1,0,1,2,0,3,1733,1,1,"London : printed by B. Lintot, W. Feales, R. J. and B. Wellington, J. Clark, J. Motte, T. Astley, and T. Saunders, M.DCC.XXXIII. [1733].",London,81,male,1671,1757,TRUE,"me of my Occasions; but, Lord Lord bless me, Madam , how can you be unhappy with zoo 1 a year in your own Possession? Hil.' For my part, the greatest Reason I think you have to grieve, is, that you are not sure your Husband's dead; for were that"
0807300104_000125,The works of Shakespear. In six volumes. Carefully revised and corrected by the former editions.,William Shakespeare,81,1,1,1,1,0,2,0,3,0,1,0,3,0,3,1,2,0,1,2,0,4,1,1,4,5,3,2,0,2,2,3,3,5,0,0,0,1,1,0,2,0,1,2,2,3,0,0,0,5,0,2,1,0,1,3,0,0,0,1745,4,6,"London : printed for J. and P. Knapton, S. Birt, T. Longman, H. Lintot, C. Hitch, J. Brindley, J. and R. Tonson and S. Draper, R. and B. Wellington, E. New, and B. Dod, MDCCXLV. [1745].",London,502,male,1564,1616,TRUE,""". g This A C AC T III S C E NORTHEAST L The., geen's Apartmenzt. Enter ueen and her wyomen, as at work. QUE E N. AK E thy lute, wench, my soul grows with. troubles: Sing, and disperse em if thou canst: leave working. S 0 N G."
0664001600_000004,The wit of a woman. As it is now acted at the New Theatre in Little Lincolns-Inn-Fields. By Her Majesty's sworn servants.,"Walker, T.           1705           fl. 1705",66,0,2,3,0,2,1,0,2,2,1,2,0,1,0,2,0,2,3,2,1,3,2,2,2,0,1,0,3,1,1,0,2,0,1,1,0,1,0,0,0,3,0,2,1,1,0,0,6,0,1,1,1,1,0,1,0,0,2,1705,1,1,"London : printed for Richard Bassett, at the Mitre in Fleet-Street, and J. Chantry, at the Pestle and Mortar without Temple-Bar, 1705.",London,44,unknown,,,FALSE,"that th' French King dissolves t' turn Christian at last, and break Truce with th' Grand tark; and that some great Projecror i' London, (f c9) I conno hit on's Name) has found out a waay t carry on the War bout Taxes. Shep. Ay, marry , that were well"
0878200900_000016,"The maid of the mill. A comic opera. Written by Mr. Bickerstaff. Marked with the variations of the manager's book, at the Theatre-Royal in Covent-Garden.",Isaac Bickerstaffe,67,0,2,0,3,0,0,0,1,2,0,4,1,0,1,0,0,1,2,1,0,1,2,2,0,3,2,0,1,2,1,2,0,1,2,2,2,3,1,1,3,1,0,0,3,0,1,0,0,1,2,2,0,1,0,1,2,1,3,1782,1,1,"London : printed for T. Lowndes, T. Caslon, T. Carnan, R, Baldwin, and S, Bladon, M,DCC,LXXXII. [1782].",London,75,male,1733,1812,TRUE,"lord, I am so much ashamed, I don't know what to answer; the fault of my daughter L dim. Don't mention it, madam ; the fault has been mine, who have been innocently the occasion of a young lady's tranfgretfing a point of duty and decorum, which, otherwise, the would"
1406600106_000073,"The British theatre, in ten volumes. Consisting of the best tragedies and comedies. Collected from the most celebrated authors. Volume I. Containing, Hamlet. Orphan. Oroonoko. Jane Shore.",,69,1,2,1,1,1,0,0,3,5,0,0,1,5,0,7,0,1,0,1,0,3,0,0,0,2,2,0,2,3,0,1,2,7,1,0,0,1,0,1,1,1,2,1,2,1,0,0,3,0,0,0,0,1,0,0,0,1,2,1736,6,10,"London : Printed for W. Feales, at Rowe's-Head, over-against St. Clement's Church in the Strand, M.DCC.XXXVI. [1736].",London,424,unknown,,,FALSE,"thee. Cr. No, if he does, I'm a dead Man. Leo. Hast thou no Dirguire, for fear he thould? Cr. Only this great Pair of spe~tacles. Entrer Lord Bellguard. Bell. What Fellow's this? Lee. A Taylor. Bell. Not your Taylor? Au. No, he's sick, and sent this Fellow in his"
