0048301100_000022,"The coquet: or, the English chevalier. A comedy. As it is acted by His Majesty's servants. Written by Mr. Molloy.","Molloy, Mr. (Charles)           1767",84,0,1,0,0,0,1,0,2,2,0,0,1,3,1,3,0,0,0,0,4,6,1,0,0,0,1,1,2,0,5,0,6,4,3,0,0,0,2,0,3,0,0,2,0,3,1,0,3,0,1,10,1,3,0,1,1,2,4,1718,1,1,"London : printed for E. Curll at the Dial and Bible, and R. Francklin at the Sun, both against St. Dunstan's Church in Fleetstreet, MDCCXVIII. [1718].",London,99,unknown,,,FALSE,"em. A fine Woman , .: by chance, may marry a Man of Merit; but wien he gives up: her Virtue, tis certainly to a worthless Fellow . Val. I hcpe you had rather be the sift than: the last of rhefe you ve named.. Eel. I think the last"
0072801400_000001,"The amorous widow; or, wanton wife. A comedy. As it is acted at the Theatre-Royal in Drury-Lane, by Her Majesty's servants. Written by Mr. Betterton.",Thomas Betterton,84,0,4,1,0,0,1,0,2,1,1,0,0,1,2,1,0,0,0,1,0,1,0,1,0,2,7,0,5,0,1,1,14,6,2,3,0,0,1,1,1,5,1,1,0,1,0,0,1,1,1,3,0,0,1,2,1,0,5,1714,1,1,"London : printed by S. Keimer for E. Curll, R. Gosling, K. Sanger, and A. Bettesworth, 1714.",London,82,male,1635,1710,FALSE,"DRAMATIS PERSONA. S I R Peter Pride. A great Boaster of his Honour , his Valour; his Noble Family, and their mighty couragem r. femr. eeman. c¢mnningham. A Gentleman in love with Philadelphia, and much courted by the Widow. Mr. vferbrigmen. Lovemore. His Friend , in love with Mr. Brittle's"
0094300102_000006,The dramatick works of Mr. George Farquhar. In Two Volumes. ...,George Farquhar,79,0,1,2,1,0,0,0,4,1,1,1,0,3,2,2,0,1,0,0,1,2,6,0,0,3,0,0,4,2,2,0,1,13,0,3,0,1,0,0,3,1,1,4,1,2,0,0,2,0,0,1,2,0,1,1,1,0,2,1736,2,2,"London : printed for B. Lintot, J.J. and P. Knapton, G. Strahan and J. Clarke; and sold by W. Feales, at Rowe's-Head, the Corner of Essex-Street, in the Strand, M.DCC.XXXVI. [1736].",London,351,male,1677,1707,TRUE,"- Mel. The sooner therefore you make an endiof this the better . -.. .' Sl.. I am easily persuaded to follow my Inclinations; so Madam , your humble Servant . [ Exit . Mel. Saucy Thing! - Enter Lucy. Lue. What's the matter , Madam ? Mel. Did you"
0744900700_000005,"Lionel and Clarissa: or, the school for fathers. A comic opera. Written by Mr. Bickerstaff. Marked with the variations in the manager's book, at the Theatre-Royal in Drury-Lane.",Isaac Bickerstaffe,67,0,1,1,0,0,1,1,2,1,1,1,0,0,2,1,0,1,1,0,1,2,0,0,0,1,3,1,1,1,3,0,0,7,0,2,0,2,0,0,1,1,0,1,1,1,1,1,1,0,3,5,3,2,0,1,4,1,2,1786,1,1,"London : printed for W. Lowndes, No. 77, Fleet-Street, M.DCC.LXXXVI. [1786].",London,73,male,1733,1812,TRUE,"nicest put up in a queue' and your - great pudding fleeves! Lord! they'll quite spoil hisfhape, and the fall of his Shoulders. Well! madam , if I was a lady of large fortune, I'll be hanged if Mr. Lionel · should be a parson, if I could help it.'"
0058302500_000005,Friendship a-la-mode. A comedy of two acts. Altered from Sir John Vanbrugh. As it is performed at the theatre in Smock-Alley.,John Vanbrugh,80,1,3,1,3,0,0,0,2,2,1,4,2,2,7,1,0,5,0,1,0,2,1,0,0,6,1,4,1,1,0,0,1,4,2,1,0,0,1,1,0,3,0,1,1,4,0,0,0,0,2,0,3,2,0,1,1,0,1,1766,1,1,"Dublin : printed by and for Messrs. Adams and Ryder, in Cope-Street; and sold by P. Wilson, Bookseller, in Dame-Street; and H. Saunders, Bookseller, in Castle-Street, MDCCLXVI. [1766].",Dublin,45,male,1664,1726,TRUE,"addmittance, L OVEWELL. Wha; do I hear - S pp; rr me. Bring in Sir john. LEONORA. (Faints in Maria's arms) Sir POSITIVE. LU CY. Look up, madam , for heaven's sake; since you mul marry the fellow , make the bell on't. LEONORA. (R: cser.: irg) What shall I"
1779800106_000146,"The works of Mr. William Shakespear; in six volumes. Adorn'd with cuts. Revis'd and corrected, with an account of the life and writings of the author. By N. Rowe, Esq;",William Shakespeare,67,1,0,0,1,1,1,2,2,2,2,4,0,3,2,2,3,0,1,2,0,0,1,1,0,4,4,1,0,0,1,1,3,2,3,1,2,1,0,1,2,1,0,0,0,1,1,0,0,0,0,2,0,1,0,1,1,0,2,1709,6,6,"London : printed for Jacob Tonson, 1709.",London,579,male,1564,1616,FALSE,"be thy will. Pie. Here's the fifteenth Day, - hot and fair. Capt. Puh, would tad been, hot and soul. Pie. The sixteenth Day, that's tomorrow; the Morning for the most part, fair and pleasant. Capt. No luck. Pie. But about high noon, Lightning and Thunder. Capt. Lightning and Thunder?"
0169100700_000002,"The frenchify'd lady never in Paris. A comedy. In two acts, as it is acted at the Theatre-Royal in Crow-Street, by His Majesty's servants. Altered from Dryden by Colley Cibber, Esq;","Dell, Henry",86,5,0,4,1,0,1,1,2,1,0,3,0,0,0,3,0,1,0,2,0,1,0,0,0,3,5,0,3,1,3,2,7,6,7,0,1,0,0,1,2,2,0,0,1,0,0,0,3,0,1,3,1,0,2,1,4,0,2,1761,1,1,"Dublin : printed for Sarah Cotter, in Skinner-Row, MDCCLXI. [1761].",Dublin,26,male,1756,1766,FALSE,"well call myself so, after five year's absence from the court; but you have freed me from one error. A 3 Dcr. What's Dor. What's that, I beseech you; Pal. I thought good voices and ill faces had been inseparable; and that to be fair, and to ting well, had"
0152500802_000054,A collection of the most esteemed farces and entertainments performed on the British stage. ...,,81,1,0,1,0,0,2,0,1,3,0,4,0,0,2,0,3,1,0,0,2,3,4,0,0,7,1,0,1,0,1,1,2,9,1,1,1,1,1,2,1,4,0,0,1,3,0,0,5,1,2,2,1,1,0,1,0,1,2,1786,2,4,"Edinburgh : printed for C. Elliot, Parliament Square, M,DCC,LXXXVI. [1786].",Edinburgh,370,unknown,,,FALSE,"way of amusement he may prove no. disagreeable acquaintance; but you can't surely have any serious designs upon him? mgr. Indeed but I have. mgod. And poor Sir James Elliot is to be discarded at once? mgr, Oh, no! Ml God . What is your intention in regard to him?"
0055301900_000007,"Love in the city; a comic opera. As it is performed at the Theatre-Royal in Covent-Garden. The words written, and the music compiled by the author of Love in a village.",Isaac Bickerstaffe,80,0,1,1,2,1,2,1,1,0,1,1,1,0,4,2,0,3,0,1,2,0,0,3,0,3,4,1,5,2,2,0,1,0,5,0,1,1,1,0,2,1,1,2,0,4,0,0,1,3,1,1,0,0,2,0,4,0,5,1767,1,1,"Dublin : printed for W. and W. Smith, P. Wilson, J. Exshaw, J. Murphy, W. Sleater, J. Potts, D. Chamberlaine, L. Flin, J. Hoey jun. R. Bell, S. Watson J. Williams, J. Mitchell, W. Colles and T. Ryder, 1767.",Dublin,69,male,1733,1812,TRUE,"been understood by your betters ; but I suppose you are disbanded, and want to raise money upon your half pay well, I won't deal i have loll money enough by the army already i have a note of hand by nr: from one of your captains for four pounds"
0691900400_000010,"Isabella; or the fatal marriage: a tragedy of five acts, altered from Southern, by D. Garrick, Esq. Marked with the variations in the manager's books, at the Theatres Royal Drury Lane and Covent Garden.",Thomas Southerne,93,0,1,2,3,0,0,0,4,6,1,1,2,0,4,2,0,0,0,1,0,1,6,1,0,5,6,0,1,1,2,2,8,1,0,0,0,0,2,2,2,2,0,8,0,2,0,0,2,5,1,2,0,0,0,1,2,1,0,1792,1,1,"London : printed for W. Lowndes, No. 76, Felet-Street, M.DCC.XCII. [1792].",London,61,male,1660,1746,TRUE,"find your own. I have a father here, who, perhaps, after seven years absence, and costing him nothing in my travels, may be glad to see me. You know my ftory how does my disguise become me? Bel. Just as you would have it; tis natural , and will conceal"
0341400501_000021,"Plays, written by Sir John Vanbrugh. In two volumes. ... . Containing, The Relapse; Or, Virtue in Danger. The Provok'd Wife, with a new Scene. Aesop, in two Parts. The False Friend.",John Vanbrugh,72,1,0,0,0,0,1,0,3,3,0,3,1,1,0,0,0,1,1,0,0,2,2,0,1,4,1,1,0,0,1,2,4,2,2,1,0,0,1,4,0,4,0,2,3,2,1,0,1,3,0,3,2,0,2,2,1,0,3,1765,1,2,"Dublin : printed for J. Exshaw, in Dame-Street, and H. Saunders, in Castle street, Booksellers, MDCCLXV. [1765].",Dublin,326,male,1664,1726,TRUE,"on the Back, and a great Pinch by the Cheek. Nuife. Ah the poor thing, see how it melts it's as full of Good nature , as an Egg's full of Meat. M/ii. But, my dear Nuri., don't LI now; is he come, by your troth? Nurse. Yes, by my"
0761301100_000002,"The capricious lady: a comedy, (altered from Beaumont and Fletcher) as it is now performing at the New Theatre-Royal, in Covent-Garden.","Cook, William",87,0,1,1,0,4,0,0,4,0,1,1,1,1,1,2,1,0,0,1,2,0,4,1,0,3,19,4,0,1,0,1,3,5,2,0,0,0,1,1,1,1,1,1,0,0,0,0,4,2,0,2,1,1,0,3,0,2,2,1783,1,1,"London : C. Dilly, in the Poultry, M.DCC.LXXXIII. [1783].",London,62,unknown,,1824,FALSE,"great a bore, Your Hdnwble Servant should attempt Jane Shore. Yet though' this foible taints the general race, Our Author hopes tis banished from this place; For though' noforc'd conceits support his cause, No plendid scenes or dresss court applause, Of Bards your Sires have pleased , judge not in"
1114202000_000012,"The intriguing widow: or, the honest wife. A comedy.",,66,0,0,3,1,1,0,1,2,4,3,1,1,1,0,0,0,1,0,0,3,0,2,1,0,3,1,0,2,0,1,1,4,3,1,0,1,1,0,0,1,2,1,4,2,1,0,0,1,0,0,2,1,0,2,1,0,2,3,1711,1,1,"London : printed for J. Isted, at the Golden-Ball, over-against St. Dunstan's Church, Fleetstreet, 1711.",London,73,unknown,,,FALSE,"eased of all his Pain, M !lay be never more Complain, But in Love for ever Live , And when he asks may he flillgive. Let not Enjoyment makeyou Cool, Nor jealouies affli _ your Soul: If once it gets in tis hard to remove, thebane to ourpleafure, anddefirojer of"
0292300132_000020,"Bell's British Theatre. Consisting of the most esteemed English plays. .. . Containing Comus,..,[sic]....... By Milton. Alchymist, ....... - Ben Jonson. Love for Love, ..... - Congreve. Rival Queens, ..... - Lee.",,79,1,1,0,0,0,0,0,3,3,1,0,0,1,2,3,0,0,0,6,0,0,0,0,0,2,1,0,0,2,1,1,1,13,1,1,2,0,1,5,1,2,1,5,0,3,1,0,3,0,2,2,2,0,0,2,1,1,1,1797,32,34,"London : printed for, and under the direction of, George Cawthorn, British Library, Strand, 1797.",London,347,unknown,,,FALSE,"that he goes to a bawdyhouse. Ori. Heavens forbid! [ Exit . Dur. Now would I sooner take a cart in company of the hangman, than a coach with that woman . What a strange antipathy have I taken against these creatures! a woman to me is aversion upon aversion;"
0691900400_000003,"Isabella; or the fatal marriage: a tragedy of five acts, altered from Southern, by D. Garrick, Esq. Marked with the variations in the manager's books, at the Theatres Royal Drury Lane and Covent Garden.",Thomas Southerne,81,0,1,3,1,1,0,0,2,0,0,3,1,0,2,2,1,1,1,0,0,0,2,0,3,7,4,0,0,1,2,3,3,1,6,1,0,0,1,0,1,3,0,1,3,2,2,0,1,1,0,2,1,1,0,2,2,1,5,1792,1,1,"London : printed for W. Lowndes, No. 76, Felet-Street, M.DCC.XCII. [1792].",London,61,male,1660,1746,TRUE,"I hope I bring my welcome along with me: Is your lord at home? Samp. My lord at home! Jfa. Count Baldwin lives here still? Samp. Ay, ay, Count Baldwin does live here: and I am his porter: but what's that to the purpose, good woman , of my lord's"
0113100802_000022,"English miscellanies consisting of various pieces of divinity, morals, politicks, philosophy and history; as likewise of some choice poems; All collected Out of the most approved Authors in the English Tongue, Viz. Tillotson Nichols Lock Milton Cowley Waller Denham Dryden Buckingham Prior Addison Pope &c. And chiefly intended for the advantage of such, as are willing to apply themselves to the learning of this usefull language by John Tompson. ...",,71,0,1,1,1,4,1,0,1,0,0,3,0,1,1,0,0,0,1,0,1,0,1,1,0,7,0,0,0,0,3,1,0,4,1,1,2,1,1,0,1,1,1,2,2,4,1,1,2,0,2,6,1,0,1,4,2,1,0,1746,2,2,"Gottingen : by Abram. Vandenhoeck Printer and Bookseller to the University, 1746.",Göttingen,523,unknown,,,FALSE,"to confine my airs to the directions of a Sollicltor; to look kind, or cruel, only as the Jointure proposed, is, or is not, equal to the fortune, my Father designs me: What! do you think I'll have my features put into the Gazette, to be dispose of, like a"
1182800600_000014,"The choleric man. A comedy. As it is performed at the Theatre-Royal in Drury-Lane. By Richard Cumberland, Esq.",Richard Cumberland,66,2,0,2,1,3,1,0,0,0,0,3,1,1,0,1,0,1,0,1,1,3,1,0,0,2,2,1,2,1,0,0,2,4,1,1,1,0,1,1,1,5,0,1,0,0,1,0,2,2,2,0,0,0,1,1,3,2,4,1775,1,1,"London : printed for T. Becket, the Corner of the Adelphi in the Strand, [1775].",London,115,male,1732,1811,TRUE,"young man's particular than I can; in the mean time I venture to add, that Mr. Manlove will cn/ifider every favour you bestow, in this infiance, as con? serr'd upon himself. I have the honour to be, Madam , Your mos obedient, and mos humble Servant , CHARLES MANLOVE, Sen."
1780200200_000006,"The recruiting officer. A comedy, by George Farquhar, Esq. Adapted for theatrical representation, as performed at the Theatres-Royal, Drury-Lane and Covent-Garden. Regulated from the prompt-books, by permission of the managers. ...",George Farquhar,79,0,2,3,1,0,0,0,3,2,1,0,0,4,2,4,0,1,0,0,1,1,4,1,0,2,0,0,4,1,1,0,1,15,0,3,3,1,0,0,3,1,1,2,0,2,0,0,1,0,1,2,1,0,0,1,1,0,2,1792,1,1,"London : printed for the proprietors, under the direction of John Bell, 1792.",London,128,male,1677,1707,TRUE,"What do you say, Madam ? Syl. I say that you should not use that honest fellow so inhumanly: he's a gentleman of parts and fortune, and besides that he's my Plume's friend ; and by all that's sacred, if you don't use him better , I shall ex pet"
0054700800_000002,"Miss in her teens: or, the medley of lovers. A farce, in two acts. As it is perform'd at the Theatre-Royal in Drury-Lane.",David Garrick,75,0,2,1,0,0,0,0,3,2,2,0,0,2,2,1,0,1,3,1,1,4,2,2,0,6,4,0,0,0,1,3,1,0,0,1,0,0,0,0,1,4,1,2,1,2,2,0,2,0,3,2,0,0,2,4,2,0,2,1758,1,1,"London : printed for J. and R. Tonson, in the Strand, MDCCLVIII. [1758].",London,46,male,1717,1779,TRUE,"Sir Capt. What do you say, Puss? Puff. If your Honour pleases to confider that I had a Wife in Town whom I left somewhat abruptly half a Year ago, you'll think it, I believe , but decent to make some Inquiry after her first; to be sure it would"
0681501300_000017,"The biter. A comedy. Written by N. Rowe, Esq;",Nicholas Rowe,71,0,2,3,1,0,0,0,1,2,1,0,0,5,4,0,0,0,1,0,0,0,1,0,0,6,1,1,0,0,0,0,3,6,0,1,1,1,0,2,0,0,2,1,1,1,3,1,3,1,1,4,1,1,0,2,1,2,3,1736,1,1,"London : printed for J. Tonson in the Strand, MDCCXXXVI. [1736].",London,68,male,1674,1718,TRUE,"Well, but dear Madam , we are of yourparty, und I hope you take us to be so much your Friends as to deserve your Confidence -- You know we hove no ciuer Design upon Sir Timothy, but in order to bring this ltufinefs, between Mr. Friends and you, to"
0152803300_000003,"Isabella; or, the fatal marriage. A tragedy, altered from Southern, by D. Garrick, Esq. Marked with the variations in the manager's book, at the Theatre-Royal, in Drury-Lane.",Thomas Southerne,73,0,2,1,0,1,1,0,1,0,1,4,1,0,2,2,1,1,1,1,0,0,2,0,2,1,2,1,0,3,2,1,3,0,3,1,1,1,1,0,1,2,0,2,2,2,2,0,0,2,0,4,4,0,0,1,1,2,4,1777,1,1,"London : printed for C. Bathurst; T. Lowndes; T. Longman; T. Caslon; W. Nicoll; S. Bladon, and Wheildon & Co., M.DCC.LXXVII. [1777].",London,61,male,1660,1746,TRUE,"that is a grievance indeed in great  families, where the gifts, at good times, ate better · than the a es. It would do well to be reforn'd.' Sa P. But s\hat is the business, nurse You hare been in the family before I came into the world :"
1105700900_000019,Esop; a comedy: as it is acted at the Theatre-Royal in Drury-Lane. In two parts. Written by Sir John Vanbrugh.,John Vanbrugh,81,1,1,0,1,1,3,2,3,1,0,4,0,3,1,0,0,3,0,2,0,2,1,0,0,3,0,1,0,1,1,0,2,1,5,0,0,1,0,1,2,3,0,7,1,2,2,0,4,1,0,7,0,0,2,0,3,1,1,1720,1,1,"London : printed by John Darby, for M. Wellington, and sold by Arthur Bettesworth in Pater-Noster-Row, and Francis Clay without Temple-Bar, M.DCC.XX. [1720].",London,83,male,1664,1726,TRUE,she has kept her word to a little . Euph. Medlinks the Subject we're upon houd be of weight enough to make you serious. Efop.. Right: tomorrow Morning pray be ready; You'll find me o : I'm serious. Now I hope you are pleased . [Turning away from her. Eupb.
0237700102_000045,"The works of Mr. Thomas Southerne. ... . Containing, The Loyal Brother: Or, The Persian Prince. The Disappointment: Or, The Mother in Fashion. Sir Anthony Love Or, The Rambling Lady. The Wives Excuse: Or, Cuckolds make Themselves.",Thomas Southerne,99,0,2,2,4,0,0,0,3,1,1,0,2,0,3,2,0,1,0,2,1,1,6,0,0,7,7,0,1,5,1,3,10,1,0,0,0,1,1,1,1,2,0,4,0,2,0,0,3,6,0,3,2,1,0,1,4,1,0,1721,2,2,"London : printed for J. Tonson, B. Tooke, M. Wellington, and W. Chetwood, MDCCXXI. [1721].",London,410,male,1660,1746,TRUE,"Is your Lady at home, Friend ? Sam. Why, truly Friend , it is my Employment to an. fwcr impertinent quertions. But for spy Lady's being at home, or no, that's just as my Lady pleases . Bir. But bow (hall I know , whetheritpleafesher or no? Sam. Why, if"
1112000300_000023,"The relapse; or, virtue in danger. A comedy, by Sir John Vanbrugh. Adapted for theatrical representation, as performed at the Theatre-Royal, Covent-Garden. Regulated from the prompt-book, By Permission of the Manager.",John Vanbrugh,81,0,1,1,0,1,0,1,5,1,1,0,0,1,1,0,0,1,0,2,0,1,1,2,0,4,1,0,1,1,1,1,19,2,1,2,2,1,1,0,1,0,4,1,0,1,2,0,0,0,1,4,1,1,2,1,1,3,1,1795,1,1,"London : printed for the proprietors, under the direction of John Bell British Library, Strand, Bookseller to His Royal Highness the Prince of Wales, MDCCXCV. [1795].",London,127,male,1664,1726,TRUE,"to her prayers; that's "" the most like to prove her critical minute, for then the "" devil will be there to assist me."" [He ofens the Closet, goes in, and shuts the door after him. Enter B. RI NT HI 5 A,, with a Candle in her hand ."
0568300300_000006,"Love betray'd; or, the Agreable Disapointment. A comedy. As it was Acted at the Theatre in Lincolns-Inn-Fields. By the Author of The Ladies Visiting-Day.",William Burnaby,74,1,0,0,1,0,1,0,4,2,1,0,0,1,0,2,0,1,0,1,1,0,2,2,0,6,6,1,1,1,2,3,2,9,1,1,0,0,0,0,1,0,0,1,1,4,0,1,3,4,0,1,0,0,0,4,0,0,1,1703,1,1,"London : printed for D. Brown at the Black-Swan without Temple-Bar, F. Coggan in the Inner-Temple-Lane, Fleet-Street, W. Davis at the Black-Bull, and G. Strahan at the Golden-Ball against the Exchange in Cornhill, 1703.",London,71,male,1673,1706,FALSE,"me to the Lady .  ( hewing a Letter ) Mor. Right! my dear Boy, go bear it to her now, And plead thy seif the Cause of Love and Me; Thou hast a soft insinuating Way, May sooth her Anger, and delude her Scorn. But if her People"
1112400900_000006,"The sharpers. A ballad opera, as it is acted at the theatre in Smock-Alley. By Mr. Mat. Gardiner.","Gardiner, Mat. (Matthew)",71,1,0,1,1,0,1,1,2,2,0,0,0,0,4,4,0,1,0,2,0,1,2,1,0,1,1,0,4,0,1,2,1,2,4,6,0,1,0,0,0,1,0,0,2,5,0,0,3,1,2,0,0,2,3,3,2,0,0,1740,1,1,"Dublin : printed by E. Jones, for the author, M,DCC,XL. [1740].",Dublin,27,unknown,,,FALSE,"drink at. We. Yeur Lady is all Innocence for me, Sir Jons, I can fwcar with a safe and sincere Conrcience. Sir Jghn. Then I can fwcar it is not your Fault, II thc Ihe is. Conscience! 0 lord, 0 lord, why, what is Conscience now a Days? A I"
0154201902_000089,"The dramatic works of Colley Cibber, Esq; In Four Volumes. ... . Containing Love's last Shift, a Comedy. Woman's Wit, a Comedy. Love makes a Man, a Comedy. She would and she would not, a Comedy.",Colley Cibber,66,1,2,1,1,1,1,2,5,6,1,0,2,2,1,3,0,1,0,1,2,1,2,0,0,1,1,1,1,1,1,2,2,3,0,0,1,0,0,1,0,0,1,0,1,1,2,0,3,0,0,4,2,0,0,0,1,0,0,1760,2,4,"London : printed for J. Clarke, C. Hitch and L. Hawes, D. Browne, J. and R. Tonson, J. Rivington, R. Baldwin, T. Caslon, C. Bathurst, S. Crowder and Co. T. Longman, H. Woodgate, and S. Brooks, C. Corbet, G. Kearsly, J. and T. King, and T. Lownds, MDCCLX. [1760].",London,366,male,1671,1757,TRUE,"Madam , I'll use my best Endeavour to prevent it! In the mean time, take heed your Disorder don't alarm the Company within Which Way went they? La. Gent. That Door, Sir, [ Exit Sir Friendly.] Who's there? [ Enter a servant .] Run quick, and see if the garden"
0047400702_000045,"The dramatic works of Mr. Philip Massinger, compleat. In four volumes. Revised, corrected, and all the various editions collated, by Mr. Coxeter. With notes critical and explanatory, by the editor, and by various authors.",Philip Massinger,60,1,0,1,0,0,1,0,3,2,0,0,2,0,1,0,0,2,1,0,1,1,2,2,2,2,4,1,0,0,1,1,1,2,0,0,2,1,1,1,1,2,1,0,2,1,0,1,3,2,2,1,0,0,2,2,0,0,1,1759,2,4,"London : printed for Henry Dell, the Corner of St. Dunstan's-Hill, in Great Tower-Street, M.DCC.LIX. [1759].",London,451,male,1583,1640,FALSE,"swarm with Cuckolds, for so many Tradefien break. Corif. Pray you appear now, And mark the Alteration. Hii. To your Work, My Lady is in Presence; show your Duties Exceeding well. Soph. How do your Scholars profit? Hil, Hold up your Heads demurely. Prettily For young Beginners. Corif. And will"
0459801700_000057,"The life of Mr. Thomas Betterton, the late eminent tragedian. Wherein the action and utterance of the stage, bar, and pulpit, are distinctly consider'd. With The Judgment of the late Ingenious Monsieur de St. Evremond, upon the Italian and French Music and Opera's; in a Letter to the Duke of Buckingham. To which is added, The amorous widow, or the Wanton Wife. A Comedy. written by Mr. Betterton. Now first printed from the Original Copy.",Charles Gildon,88,0,3,0,1,0,0,1,4,2,0,2,3,1,2,4,0,4,0,1,3,2,0,0,0,3,3,2,0,2,2,0,15,6,1,1,0,0,0,0,2,0,0,1,0,3,2,0,0,1,1,1,3,0,2,1,3,0,0,1710,1,1,"London : printed for Robert Gosling, at the Mitre, near the Inner-Temple Gate in Fleetstreet, 1710.",London,277,male,1665,1724,FALSE,"Hold your Tongue, you Jade, or I'll make you feel my double Sift. You are nor a Gentlewoman -- I may do what I please with you. Mrs. Britt. Oh, my dear Father ! (Cries. I am not able to endure this any longer. Never was any Woman abused as"
0311500100_000006,"The midnight hour. A comedy, in three acts. From the French of M. Damaniant. Called Guerre ouverte; ou, ruse contre ruse. As it is now performing at the Theatre Royal, Covent Garden. Translated by Mrs. Inchbald.","Dumaniant, M. (Antoine-Jean)",75,0,0,1,0,0,0,0,4,3,0,0,0,0,1,1,0,3,0,1,3,2,0,2,0,5,1,1,1,0,4,1,6,4,0,2,1,1,0,1,1,1,0,1,1,3,2,0,2,1,1,4,0,0,0,2,2,1,4,1788,1,1,"London : printed for G. G. J. and J. Robinson, Paternoster Row, M.DCC.LXXXVIII. [1788].",London,49,male,1752,1828,FALSE,"firll give you this sentence, "" Love and hlno.r, "" which shall be the watchword, for all who have the liberty to enter . An'lb. I obey, Sir. [ Exit lame. Gen. And now Nicolas, while I step to my niece to inform her of what has happened; do you"
0244000604_000015,"The works of Henry Fielding, Esq; with the life of the author. Vol. I.",Henry Fielding,84,0,2,1,0,4,0,0,1,1,0,8,1,0,2,2,0,0,1,2,0,0,1,1,1,5,2,1,1,0,2,0,0,2,2,0,1,0,3,0,1,1,2,2,1,0,1,0,0,1,0,0,1,4,2,1,3,2,15,1784,4,10,"London : printed for W. Strahan, J. Rivington and Sons, T. Payne, S. Crowder, T. Longman, J. Robson, C. Dilly, G. Kearsly, G. Robinson, J. Johnson, T. Cadell, T. Lowndes, R. Baldwin, W. Cater, G. Nicol, S. Bladon, J. Murray, W. Otridge, J. Sewell, W. Lane, J. Bowen, and W. Fox, MDCCLXXXIV. [1784].",London,461,male,1707,1754,TRUE,"the advice of her, your befit friend , your belt counsellor?? bonc. TRUE , dear brother . -- - SIR GEO. And then, when you have done so and suffered a fine gentleman here to engage his precious affeelions, to fix his constant heart , which always dotes with the"
1449002800_000007,"Rosina, a comic opera, in two acts. Performed at the Theatre-Royal, in Covent-Garden. By Mrs. Brooke, author of Julia Mandeville, &c.",Frances Brooke,73,0,1,1,0,7,1,0,3,2,0,3,0,1,2,2,0,0,0,5,0,4,0,1,0,1,1,2,0,0,3,0,6,3,4,0,2,1,0,0,0,1,0,1,1,1,2,0,1,3,1,1,1,1,0,0,0,0,3,1783,1,1,"London : Printed for T. Cadell, in the Strand, MDCCLXXXIII. [1783].",London,49,female,1724,1789,TRUE,"put the rest of the thread in, and"" run with it to the weavers. [ Exit . [Capt. Belville at the top of the fjage speaking to a servant . Capt. Bel. Rofina has taken that bye road : run instantly, and execute my orders, but be prudent, and watch"
0357001400_000024,"The twin-Rivals: a comedy. As it is acted at the Theatre-Royal in Drury-Lane, by Her Majesty's servants.",George Farquhar,74,0,1,0,2,0,2,1,3,1,0,0,2,3,2,1,0,1,0,0,0,0,1,3,0,4,2,1,3,0,1,1,0,2,3,1,2,0,1,1,0,2,1,0,1,1,1,0,0,1,0,3,1,14,0,3,0,0,1,1760,1,1,"London : printed for S. Crowder and Co. T. Caslon, T. Lownds, H. Woodgate and S. Brookes, MDCCLX. [1760].",London,93,male,1677,1707,TRUE,"a poor Gentlewoman in Labour; - twill be over presently. - Here, Mr. Cohfjable, there's something for you to drink. [Throwvs down a puij/e, Teague takes it up. tea. Come, Maifhter, we have no more to shay, be me Ihoule, [Going.' Arab, if you will play the Con Pable right"
0478901402_000057,"The works of the late ingenious Mr. George Farquhar: containing all his poems, letters, essays and comedies, publish'd in his life-time. In two volumes.",George Farquhar,77,1,0,1,1,4,1,2,4,1,0,4,1,3,2,2,0,4,0,1,0,0,3,0,0,3,0,1,2,4,3,1,1,5,0,1,0,0,1,0,1,1,0,3,4,0,0,0,5,1,0,1,1,0,1,0,0,0,2,1742,2,2,"London : printed for J. and P. Knapton, G. Strahan, J. Clark, and H. Lintot, 1742.",London,368,male,1677,1707,TRUE,"will; but you know , Sir, there is a certain Will and Testament to be made beforehand. Plume. My Will, Madam , is made already, and there it is; and if you please to open the Parchment, which was drawn the Evening before the Battle of Blenhein, you will find"
0459801102_000056,"The works of the late ingenious. Mr. George Farquhar: containing all his poems, letters, essays and comedies. In two volumes. ...",George Farquhar,79,1,0,1,1,4,1,2,4,1,0,4,1,3,2,2,0,3,0,1,0,1,4,0,0,3,0,1,1,5,3,1,1,6,0,0,0,0,1,0,1,1,0,3,4,0,0,0,5,1,0,1,2,0,1,0,0,0,2,1772,2,2,"London : printed for John Rivington, W. Johnston, S. Crowder, T. Caslon, T. Lowndes, W. Nicoll, S. Bladon, C. Corbet, and R. Baldwin. MDCCLXXII. [1772].",London,330,male,1677,1707,TRUE,"private Inlfu rangce rance; for I swear,. Madam , by the Honour of my Pro feion, that whatever Dangers F went upon, it was with the Hope of making myself more worthy of your Elleem;, and if ever I had Thoughts of preserving my Life , twas for the Pleafire"
