0016600500_000019,"Tales of the arbor; or, evening rewards for morning studies. Comprising a collection of tales, interesting, familiar and moral.",,69,0,0,1,0,0,1,2,1,0,1,2,0,2,1,2,0,1,0,1,3,5,0,2,1,1,0,1,2,0,0,1,2,2,12,1,0,1,1,0,0,0,0,1,1,0,0,2,2,0,0,2,4,2,1,1,3,1800,1,1,"London : printed for Vernor and Hood, in the Poultry, by J. Cundee, By-Lane, Newgate Street, 1800.",London,180,unknown,,,FALSE,"imprudence in man aring again, against my consent; nor can I discover, as you know , notwithstanding my inquiries, where she is to be found; which renders it peculiarly necessary, I keep myself ready to discharge so serious an obligation, whenever I may be called iupon."" Ads As little Patty"
0699301102_000013,"The vicar of Lansdowne; or country quarters. In two volumes. By Regina Maria Roche. Author of The Children of the Abbey, Maid of the Hamlet, Clermont, &c ...",Regina Maria Roche,76,0,0,0,0,0,1,1,3,1,4,0,2,1,0,4,0,0,0,1,2,13,1,0,3,0,0,0,3,0,0,0,1,0,1,2,6,0,0,1,0,0,2,4,2,1,6,1,0,2,2,0,1,0,2,1,1,1800,2,2,"London : printed at the Minerva-Press, for William Lane, Leadenhall-Street, 1800.",London,268,female,1764,1845,FALSE,"of those his goodness has relieved. His memory is immortal. He receives from recording angels his belt applause, and rers for ever in the glorious - slate prepared above for benign charity and exalted virtue."" CHAP, CHAP. V THE MYSTERY UNRAVELLED. 1 HE Vicar having poured forth the joy of"
0393600203_000064,The miscellaneous works of Oliver Goldsmith; now first uniformly collected. ... . Containing The Author's Life And His Essays. Embellished with copperplates.,Oliver Goldsmith,82,0,1,0,0,0,0,0,0,0,8,0,0,3,4,1,0,1,1,2,3,11,0,0,0,0,0,0,1,2,0,0,0,2,0,2,2,1,0,5,0,0,0,2,1,2,9,1,1,2,5,2,1,1,2,0,3,1792,3,7,"Perth : printed by R. Morison Junior, for R. Morison and Son , Booksellers, Perth ; and A. Guthrie, Edinburgh, M,DCC,XCII. [1792].",Perth,303,male,1728,1774,TRUE,"To my shame I confess it, my only defiga design was to keep the licence, and let the Squire know that I could prove it upon him whenever I thought proper, and fo.make him come down whenever I wanted money."" A burit of pleasure now seemed to fill the whole"
1711101701_000042,Honoria Sommerville: a novel. In two volumes.,,65,0,0,1,0,2,2,0,1,0,0,0,0,1,0,0,0,2,3,1,4,2,1,0,1,1,1,0,4,6,3,0,1,1,3,2,7,1,0,0,0,2,1,2,0,1,1,1,0,0,1,1,2,0,0,1,1,1789,1,2,"Dublin : printed for Messrs. P. Byrne, P. Wogan, J. Moore, and J. Halpen, M,DCC,LXXXIX. [1789].",Dublin,292,unknown,,,FALSE,"from it,; but should ever regard the hours passed in their company, as the Itappieft (he had ever known since -- -- - here fthe paused, not knowing how to go on. -- - Are you going to london, Mif& Wentworth ?"" (said Mrs. Irs. Markham). "" Yes, I believe"
0006300202_000002,The auction: a modern novel. In two volumes. ...,,83,1,0,1,0,0,0,0,0,0,0,2,0,7,0,4,0,1,2,2,1,7,3,6,0,2,5,0,0,8,4,0,1,1,0,2,1,2,0,3,0,1,0,0,0,1,4,1,0,0,1,2,3,0,1,0,3,1770,2,2,"London : printed for T. Lowndes, 1770.",London,205,unknown,,,FALSE,"cautious Behaviour; he feigned a Passion for her, and managed it io well, that he extracted from her all that fih knew concerning Fanny, which was, that B 3 fle she had escaped from a Gentleman's House , here ihe had been kept as a Mistress, and fled for Protetion"
1042800101_000027,"The parental monitor In two volumes. By Mrs. Bonhote, Of Bungay, Soffolk. ...",Elizabeth Bonhte,69,1,2,1,0,1,0,0,0,2,0,4,1,0,2,2,0,0,2,2,4,8,0,1,3,0,0,0,3,2,2,2,0,2,1,2,0,0,1,1,0,0,0,1,0,0,0,2,1,2,1,1,4,0,2,2,1,1788,1,2,"London : printed for William Lane, Leadenhall-Street, MDCCLXXXVIII. [1788].",London,265,female,1744,1818,FALSE,"have taken the liberty to introduce them: read them with attention , and you cannot fail to be struck with the lefton they meant to convey. A few cursory Thoughts on the modern Situation of the Fair Sex. ""The great improvement (as they are pleased to call it) they have"
0128700202_000020,Helen Sinclair: a novel. By a lady. In Two Volumes: ...,Elizabeth Spence,72,0,1,0,0,1,0,0,0,3,2,1,0,2,0,0,1,0,1,1,3,12,0,0,2,0,1,1,2,7,1,3,0,2,0,1,4,5,1,0,0,1,0,0,2,1,2,2,1,1,1,0,2,0,1,0,0,1799,2,2,"London : printed for T. Cadell, jun. and W. Davies, in the Strand, 1799.",London,231,female,1768,1832,FALSE,"lady of rank and fallion. They reached London without further incident. Helen took a coach from the inn, which she bade drive to Mrs. Clayton's. C H A P. XXV IN the mean time Lady Olivia, exe tremely anxious concerning Helen, sent her woman at an early hour to her"
0019200501_000028,"Belleville lodge, a novel, in two volumes. ...",,57,1,1,0,0,2,0,2,0,1,1,0,0,1,1,0,1,1,2,0,5,6,0,1,0,1,1,0,0,2,0,3,1,1,1,1,2,0,0,1,0,0,1,2,2,1,0,2,0,1,1,2,2,2,0,1,0,1793,1,2,"Dublin : printed by Thomas Burnside, for Messrs. P. Wogan, P. Byrne, J. Moore, W. Jones, and J. Rice, 1793.",Dublin,182,unknown,,,FALSE,"the device I see is an arm drawing an immense large bow. What What a bow! (fays Fra, .res, as she gave it) it mult be an arm as trong as Hercules to draw it. Lord Henry started, wha; can be more plain, reverse it call it Armstrong. Tis evident,"
0017100108_000023,"The history of Sir Charles Grandison. In a series of letters. By Mr Samuel Richardson, Author of Pamela and Clarissa. In eight volumes. ...",Samuel Richardson,83,0,1,0,0,1,1,1,0,1,0,3,0,1,0,2,0,0,1,3,2,12,0,0,0,3,1,0,3,7,2,1,1,9,0,1,1,1,0,1,1,0,0,0,0,1,4,1,1,2,5,2,0,0,3,1,2,1776,8,8,"London : printed for John Donaldson, corner of Arundel-Street, No. 195. in the Strand. Sold by T. Wilson, at York: A. Smith, Halifax; D. Akenhead, Newcastle: W. Darling, Edinburgh: W. Boyd, Dumfries: W. Anderson, Stirling: Angus and Son, Aberdeen: and L. Flin, Dublin, M,DCC,LXXVI. [1776].",London,346,male,1689,1761,TRUE,"encourage the addresses of a man, who you think loves you not bet. ter than any other woman : Who is not a good man upon principle: Who is not a man of fenie; and that has seen something oi the world . And where, madam, can such a man"
1045800601_000009,"Castle of Wolfenbach; a German story. In two volumes. By Mrs. Parsons, author of errors of education, Miss Meredith, woman as she should be, and intrigues of a morning. ...",Eliza Parsons,74,0,4,0,0,2,0,1,1,1,1,1,0,0,1,1,0,0,3,0,1,11,1,2,1,0,1,0,2,10,1,3,1,0,1,0,1,1,1,1,0,0,0,1,3,0,0,3,0,1,2,0,2,1,2,1,3,1793,1,2,"London : printed for William Lane, at the Minerva Press, Leadenhall-Street, and sold by E. Harlow, Pall-Mall, M.DCC.XCIII. [1793].",London,273,female,1738,1811,TRUE,"is such a good creature, but women's tongues will blab sometimes, to be sure , and as I have sworn to your ladyship, God forbid I should break my oath, though often often and often I have longed to tell my wile."" "" However, Joseph (said the lady , gravely)"
0646700302_000023,"Women as they are. A novel, in four volumes, by Mrs. Parsons. ...",Eliza Parsons,66,1,0,0,0,1,0,0,0,0,0,2,1,2,0,4,2,0,0,0,1,5,1,1,1,2,1,2,0,4,2,1,3,2,0,0,0,1,0,0,0,1,2,3,0,0,2,3,0,0,3,2,3,2,2,3,0,1796,2,4,"London : printed for William Lane, at the Minerva-Press, 1796.",London,265,female,1738,1811,TRUE,"country or not, that I threw him into raptures. He declared I was all the world to him, and that the country would be his preferable choice,  if his Caroline and Almeria were reconciled to stay a few months at Stanton Place, without injury to their health and spirits."
0192500301_000027,"Raynsford Park, a novel. In four volumes. ...","Purbeck, Elizabeth",69,0,2,0,0,0,2,0,2,2,0,4,0,0,0,3,1,0,2,4,2,5,1,0,0,1,2,0,4,4,1,3,2,0,2,1,0,1,0,3,1,1,0,1,1,2,0,2,0,0,0,1,4,1,0,0,1,1790,1,4,"London : printed for G. Kearsley, No. 46, Fleet-Street, [1790].",London,238,female,,,FALSE,"to be broken in upon by domestic employment: this exemption was a continual. source of diffatisfadion: Mary was continually representing to. him I was an encumbrance instead of an assistance to the family , and I plainly saw their complaints were not disregarded. I endeavoured, by every means in my"
0290600402_000062,"The history of Sir Charles Grandison. In a series of letters published from the originals, by the editor of Pamela and Clarissa. In seven volumes. Vol. II.",Samuel Richardson,75,0,2,0,0,1,1,1,0,0,0,0,0,2,0,3,0,1,1,2,1,9,0,2,0,2,0,1,2,8,1,1,0,2,0,2,5,1,0,0,0,0,0,1,0,1,8,4,0,3,1,2,1,0,0,1,2,1754,2,7,"London : printed for S. Richardson; and sold by C. Hitch and L. Hawes, in Pater-Noster Row; by J. and J. Rivington, in St. Paul's Church-Yard; by Andrew Millar, in the Strand; by R. and J. Dodsley, in Pall-Mall; and by J. Leake, at Bath, M.DCC.LIV. [1754].",London,359,male,1689,1761,TRUE,"you, and for our Nancy, now her recovered health will allow her to look abroad more than ihe had of late been used to do. I am sure , my Grandmamma, and my Aunt Selby, will be pleased with it; because it will be a good supplement to the lessons"
0709800601_000016,"The errors of education. In three volumes. By Mrs. Parsons, ...",Eliza Parsons,78,1,0,0,0,2,0,0,0,0,1,0,0,2,4,0,1,0,3,5,0,3,0,1,1,0,1,0,0,11,1,0,0,0,0,1,4,5,0,1,1,0,1,1,1,0,10,0,1,1,2,2,2,1,3,2,2,1791,1,3,"London : printed for William Lane, at the Minerva Press, 1791.",London,249,female,1738,1811,TRUE,"lady and the behaviour of the mother convinced him of what he before fulpeted, that a deep laid plan was formed to engage the affections of Sir William Beaumont, and was in fa the only business which kept them in Town; as he observed the Ba roniet appeared really fond"
0029200103_000023,"Constantia Neville; or, the West Indian. A novel. In three volumes. By Helena Wells, Author of ``the Step-Mother,'' &c. ...",Helena Wells,59,0,1,0,0,1,0,0,0,1,0,3,0,1,0,1,2,3,2,0,1,9,0,1,2,1,1,1,1,4,0,1,0,1,1,0,2,0,0,1,0,1,0,2,0,1,1,4,0,1,2,1,0,1,1,0,2,1800,3,3,"London : printed by C. Whittingham, Dean-Street, Fetter-Lane, for T. Cadell, jun. and W. Davies, Strand ; and W. Creech, Edinburgh, 1800.",London,389,female,,,FALSE,"he dreads coming to Chesterfield, though he sometimes does, when after passing the day .with me, at night he visits the tombs of those so much loved while on earth, on which he drops the tear of calm resignation, looking forward to a reunion in those blissful regions, for the"
0468700601_000064,The adventurer. ...,John Hawkesworth,71,3,1,0,0,0,0,0,1,2,1,1,0,1,1,3,0,1,2,2,1,11,1,0,3,0,0,1,2,4,1,0,0,2,1,3,7,0,0,0,0,2,0,0,1,0,0,5,0,0,0,0,1,0,0,0,6,1794,1,3,"London : printed for J. Dodsley, T. Longman, B. Law and son, J. Robson, G.G. and J. Robinson, T. Cadell, R. Baldwin, S. Hayes, W. Goldsmith, W. Lowndes, G. and T. Wilkie, R. Faulder, J. Deighton, W. Fox, E. Newbery, and H. Murray, MDCCXCIV. [1794].",London,476,male,1715,1773,FALSE,"People confider not, that by family repartees and oblique refletions on each fide, the very inmost secrets of their lives are disclosed to their common acquaintance; and that they oftentimes inconsiderately lay open to their worst enemies, faults and imperfections in themselves and their relations, which they would take pains"
0017300400_000029,The sylph; a novel.,"Georgiana Cavendish, Duchess of Devonshire",77,0,2,2,0,1,0,0,0,1,0,2,0,0,0,1,0,0,1,2,3,12,0,0,0,1,0,1,4,8,1,0,2,0,1,1,1,0,0,1,1,2,0,1,3,2,4,2,0,0,4,1,1,2,1,2,3,1779,1,1,"Dublin : printed for S. Price, J. Williams, W. Colles, W. Wilson, T. Walker, C. Jenkin, R. Moncrieffe, W. Gilbert, E. Cross, W. Spotswood, G. Burnet, J. Exshaw, Beatty, R. Burton, M.DCC.LXXIX. [1779].",Dublin,263,female,1757,1806,FALSE,"of the many different things you put on and pull'off whei you are, what Ihe calls, higli dreffed. If she is'os no use to you, I wish you would send her back before her 1no rals are corrupted. Confider, Ihe has not had the advantage of education, as you have"
0028900103_000021,"The old manor house. A novel, in four volumes. By Charlotte Smith. ...",Charlotte Turner Smith,61,0,0,0,0,2,1,0,0,3,1,0,0,3,0,1,0,3,0,2,0,6,0,1,2,0,0,1,0,3,0,4,1,1,3,1,2,2,2,0,0,1,0,0,0,1,1,2,0,0,0,1,1,1,1,1,6,1793,3,4,"London : printed for J. Bell, No. 148, Oxford-Street, MDCCXCIII. [1793].",London,355,female,1749,1806,TRUE,"A young fellow may wait till he is grey on one of those hags, and the devil a bit find himself the forwarder at laft. they never die; for o' my conscience I believe they have each of them as many lives as a cat: and when at last they"
0241700202_000014,"Anecdotes of two well-known families. Written by a descendant; and dedicated to the first female pen in England. Prepared for the press by Mrs. Parsons, ... In three volumes. ...",Eliza Parsons,85,1,0,0,0,1,1,0,1,1,1,1,0,3,0,1,3,1,0,3,0,12,0,0,0,0,0,2,4,12,0,1,0,0,0,3,5,1,1,0,1,2,1,2,0,0,5,0,3,1,5,1,2,1,0,1,1,1798,2,3,"London : printed for T.N. Longman, 1798.",London,300,female,1738,1811,TRUE,"very differently; lady B *  is extremely wrong to make such a girl her companion, much more to introduce her into company so very superior that the creature is quite out of her sphere, and very likely to have her head turned by such fulsome ridiculous praises.""  Yes"
0016300302_000019,The history of Miss Sally Sable. By the author of Memoirs of a Scotch family. In two volumes. ...,"Woodfin, Mrs.",81,2,1,0,0,0,0,0,0,0,1,0,0,2,1,3,0,3,3,1,2,2,0,0,0,0,2,0,0,12,2,1,1,9,0,1,1,0,0,2,0,0,0,1,1,5,6,1,0,0,3,3,4,1,3,0,1,1757,2,2,"London : printed for F. Noble, at his Circulating-Library in King-Street Covent-Garden. and J. Noble, at his Circulating-Library in St. Martin's-Court, near Leicester-Square, [1757?].",London,223,female,,,FALSE,"Affairs into the Hands of a Friend to finish, made a proper Settlement on the poor Woman , and put her under the Care of good Mr. Graham, to be inftruated in licligion, for she was totally ignorant: He gave Poll the thousand Pounds which he had promised her, .nd"
1377400203_000031,"Miss Melmoth; or, The new Clarissa. In three volumes.",Sophia Briscoe,67,0,0,0,0,0,0,1,0,0,2,0,0,3,0,0,0,0,2,3,2,7,0,0,3,3,2,2,1,5,0,0,1,4,2,0,2,5,0,0,0,0,0,1,1,0,2,1,0,3,1,2,2,1,2,0,1,1771,3,3,"London : printed for T. Lowndes, No. 77, in Fleet-Street, M D CC LXXI. [1771].",London,289,female,1740,1820,FALSE,"6 noble nobl'man in power, in behalf of a very unfortunate person, He went on horseback, and was, as the firvant thinks , very deep in thought , .and regardless of his way; the reins laying loose, the horse fell with. him, throwing him over his head; he was thunned"
0440300104_000014,"Woman as she should be; or, memoirs of Mrs. Menville. A novel. In four volumes. By Mrs. Parsons, ...",Eliza Parsons,71,2,0,2,0,1,0,2,2,1,0,1,0,3,0,1,0,2,3,1,2,5,0,1,0,1,6,0,0,8,1,2,2,2,0,1,3,0,0,0,0,0,1,0,2,2,1,0,0,0,2,0,2,0,2,1,3,1793,4,4,"London : printed for William Lane, at the Minerva, and sold by E. Harlow, 1793.",London,226,female,1738,1811,TRUE,"joy of your kind offer."" We embraced several times . I took leave of the Abbess and community with respect, and had their prayers for my future happiness in the world , and eternal felicity in the life to come. We had a short and pleasant passage, and, without resting"
0387400300_000043,"The visit for a week; or, hints on the improvement of time. Containing original tables, Anecdotes from natural And Moral history, &c. designed for the amusement of youth. The Second edition, revised and corrected. By the author of the Six princesses of Babylon, Juvenile Magazine, And Knight Of The Rose.","Peacock, Lucy",81,1,1,2,2,1,0,0,1,1,0,2,2,0,1,0,0,1,4,1,2,5,0,2,0,0,0,0,1,6,0,4,1,1,0,1,8,1,1,2,0,0,1,5,1,0,1,0,0,1,7,0,2,0,0,0,8,1795,1,1,"London : printed for Hookham and Carpenter, Bond-Street; and for the author, at the Juvenile Library, NO. 259, Oxford-Street, 1795.",London,337,female,,,FALSE,"envy and de tracion were not the least conspicuous: her heart sickened at perfection in another, and her tongue was ever ready to depreciate the excellence she could not attain, Maria, f 249 3 Maria, in the meanwhile, wvas rapidly improving in every amiable virtue and elegant accomplishment. She, too,"
0016500501_000009,"The unhappy wife, a series of letters, by a lady. In two volumes. ...",Lady,71,0,0,0,0,0,1,2,0,0,0,2,1,4,1,2,0,0,0,1,3,7,0,1,0,1,0,1,0,8,1,2,0,5,1,0,6,2,0,1,0,1,0,0,1,2,0,1,0,0,3,1,2,1,2,1,3,1770,1,2,"London : printed for F. Newberry, the corner of Ludgatestreet, St. Paul's Church yard, and J. Smith, No. 15. Paternoster-Row, M.DCC.LXX. [1770].",London,174,female,,,FALSE,I hall always be guided by your better judgement. You You brought Miss Morley from France; I think he is very amiable: Pray give me an account of her mif fortunes. i was greatly chagrined that I could not have the happiness of attending you at Ranelagh; but company of
0277301202_000005,The fair Cambrians. A novel. In three volumes. ...,,69,0,3,0,0,1,1,2,0,1,3,2,1,0,0,1,1,1,1,0,1,7,0,0,2,3,1,2,2,0,0,2,1,1,3,1,3,0,1,1,0,1,1,2,0,0,0,2,1,0,4,1,4,1,0,1,2,1790,2,3,"London : printed for William Lane, Leadenhall-Street, 1790.",London,242,unknown,,,FALSE,"Your sister will, perhaps, be mortified to lose one whom fie supposes entirely devoted to herself ; but if, as you suppose, her heart is good, ihe will endeavour to make the best of what is irretrievable, and forward your return to the utmost of her power,"" ""As to my"
0797000117_000293,The novelist's magazine. ...,,73,0,3,1,0,2,0,0,0,0,2,0,0,1,1,0,0,0,1,0,2,7,2,0,1,2,2,0,1,13,0,2,2,1,2,1,2,2,0,1,0,2,1,3,1,1,7,1,0,0,1,1,0,0,0,0,1,1785,17,23,"London : printed for Harrison and Co., 1780-88.",London,538,unknown,,,FALSE,"to be discussed. Nothing worthy of obtaining a place in this history happening at present, I flallonly say, they allcame to Maidenhead perfectly well pleased with the change of their quarters; and that Mr. Lovegrove, to whole direcion everything was left, took care they should he made full amends that"
0819100201_000027,"The parental monitor In two volumes. By Mrs. Bonhote, author of Olivia, etc. etc. ...",Elizabeth Bonhte,69,1,1,1,0,1,0,0,0,1,0,4,1,0,1,2,0,0,3,1,3,6,0,1,1,0,0,0,2,2,2,2,0,3,1,4,0,0,1,1,1,0,0,0,0,0,0,3,1,2,0,1,5,1,2,3,4,1796,1,2,"London : printed for William Lane, at the Minerva-Press, Leadenhall-Street, M.DCC.XCVI. [1796].",London,239,female,1744,1818,FALSE,"useful alteration in the world . Do not mistake me, my young friends ; for I do not mean , by what I have said on this subject, that young women should neglct, or become totally totally indifferent to the decoration of their persons: by no means ; but they"
0201000203_000024,"Georgina: or, memoirs of the Bellmour family. By a young lady. In four volumes. ...","Bouverie, Georgina",69,0,1,1,0,0,0,0,0,0,0,5,0,1,0,5,1,1,1,1,3,7,2,1,2,2,0,0,1,9,3,4,0,0,1,1,2,2,1,0,0,0,0,1,1,0,0,2,0,0,1,1,0,1,0,1,3,1787,3,4,"London : printed for the author; and sold by R. Baldwin, Pater-Noster Row ; J. Robson New Bond-Street ; P. Elmsly, Strand ; and J. Walter, Charing-Cross, MDCCLXXXVII. [1787].",London,263,female,,,FALSE,"to reflec; that the ruin of my family was occasioned, by ensuring happiness to the truly amiable Miss Bellmour: yet still I could not be I 6 rendered rendered completely miserable, whilst conscious of having used every effort in my power to prevent injustice."" Observing the surprise which this address"
0012400201_000048,"The history of James Lovegrove, Esq; In four books. ...",James Ridley,73,0,1,0,0,1,0,4,0,0,0,1,0,4,0,0,0,0,2,0,0,6,0,3,3,0,3,0,0,3,1,2,1,3,0,0,3,1,2,3,1,0,1,3,0,0,4,5,0,1,3,3,2,0,1,0,2,1761,1,2,"London : printed for John Wilkie, at the Bible in St. Paul's Church-Yard, MDCCLXI. [1761].",London,305,male,1736,1765,FALSE,"requefing the Favour of her Daughter Kitly's Hand.'  Why,, Sir , said the prudent Lady , you would not 4'ifappoint poor Harriet; I am sure he, has always thought , from your Beha  viour, that your Addresses were paid to. her.' Indeed, Madam, replied I, you must be"
0013300401_000013,"Plexippus: or, the aspiring plebeian. ...",Richard Graves,88,0,1,1,2,0,0,0,0,0,1,0,6,2,2,0,0,0,1,1,3,9,2,1,0,1,0,0,0,14,0,1,0,4,0,1,10,0,1,0,0,0,2,2,3,2,5,0,1,0,0,1,2,0,1,0,5,1790,1,2,"London : printed for J. Dodsley, Pall-Mall, M.DCC.XC. [1790].",London,235,male,1715,1804,FALSE,"our escape as soon. as possible from thq. labyrinth in which we are likely to be involved. We are now both exposed to danger,. and. courage will avail nothing agaihft the enchantment of love ; There is no safety but in flight."" ""Ah!"" cries Plexippus, ""I am now thoroughly sensible"
0022000102_000098,"The history of Sir Charles Grandison. In a series of letters. By Mr. Samuel Richardson, Author of Pamela and Clarissa. In seven volumes. ...",Samuel Richardson,91,2,1,0,0,2,2,9,2,2,0,0,0,0,2,0,0,0,0,0,1,5,1,0,0,1,0,0,3,10,1,1,1,4,1,2,9,0,0,0,0,1,0,2,0,2,4,1,2,1,3,1,5,3,3,0,1,1766,2,7,"London : printed (by assignment from Mr. Richardson's executors) for J. Rivington, in St. Paul's Church-Yard; R. Baldwin, S. Crowder, J. Coote, and M. Richardson, in Pater-Noster-Row, MDCCLXVI. [1766].",London,362,male,1689,1761,TRUE,"susser a great deal in the apprehension, at one time , .of disgusting the objec of our passion by too forward a Love ; and, at another, of disobliging him by too great a reserve. Don't you think so? The Ladies said, They were extremely solicitous to see their Brother"
0393300102_000122,"Pamela: or, virtue rewarded. In a series of familiar letters from a beautiful young damsel, to her parents. Now first Published, In order to cultivate the Principles of Virtue and Religion in the Minds of the Youth of Both Sexes. A Narrative which has its Foundation in truth and nature; and at the same time that it agreeably entertains, by a Variety of curious and affecting Incidents, is intirely divested of all those Images, which, in too many Pieces calculated for Amusement only, tend to inflame the Minds they should instruct. In four volumes. The sixth edition. To which are prefix'd, Extracts from several curious Letters written to the Editor on the Subject. Vol. I.",Samuel Richardson,89,0,3,0,0,0,0,1,0,0,0,1,0,2,0,4,0,0,4,0,4,6,0,0,4,1,1,0,4,10,4,7,0,1,0,2,4,6,0,0,2,1,0,2,0,0,7,1,0,2,1,1,0,0,0,1,2,1746,2,4,"London : printed for J. Osborn, in Pater-Noster Row; and J. and J. Rivington, in St. Paul's Church-Yard, MDCCXLVI. [1746].",London,415,male,1689,1761,TRUE,"who then happened to be at home; and, by her Management and Spirit, their Intentions of that sort were frufirated; and, feeing no Hopes , they agreed to Lady Davers's Proposals, and sent poor Miss down to Maarlborough, where, at her Expense, which he answered to her again, she was"
0006300201_000004,The auction: a modern novel. In two volumes. ...,,74,1,0,0,1,0,0,3,0,1,0,1,0,4,3,3,1,0,0,1,0,3,0,1,1,0,2,2,0,12,0,0,1,1,2,1,0,2,0,1,0,1,0,0,0,2,5,6,0,0,1,3,4,0,1,1,2,1770,1,2,"London : printed for T. Lowndes, 1770.",London,213,unknown,,,FALSE,"was forced to yield, where the Disparity was so visible. To aggravate her Chagrin, every Stranger that came to the House gave Fanny the Praise due to Beauty, and the sweet Sen libility of her Mind, which was apparent in her Countenance, while Charlotte was either slightly spoke of, or"
0024200503_000024,"Lucy: a novel, in three volumes. By Mrs. Parsons. ...",Eliza Parsons,62,1,2,0,0,0,1,0,0,1,1,2,1,0,1,1,0,1,2,1,1,4,0,0,3,3,1,0,1,7,2,2,3,0,1,2,0,1,0,1,1,0,0,1,1,1,0,1,0,1,1,1,2,2,0,0,3,1794,3,3,"London : printed for William Lane, at the Minerva Press, Leadenhall-Street, M.DCCXCIV. [1794].",London,265,female,1738,1811,TRUE,"the present her withes should not be be opposed: time , that meliorates every grief, will have its usual effets upon her; if, however, she perseveres in her intention of retirement, I claim you as a resident with me; and from this hour you are my ifter, the dear adopted"
0687400802_000069,Celestina. A novel. In three volumes. By Charlotte Smith. ...,Charlotte Turner Smith,73,0,2,0,0,0,0,0,1,1,0,2,0,2,0,3,4,1,1,0,4,8,1,0,0,0,0,2,2,3,3,4,0,1,0,1,1,0,1,0,1,0,2,2,3,1,5,0,0,1,0,0,1,1,1,5,2,1791,2,3,"Dublin : printed for R. Cross, P. Wogan, P. Byrne, J. Moore, J. Halpen, H. Colbert, W. Sleater, B. Dornin, W. Porter. A. Grueber, J. Jones, J. Rice, W. Jones, R. White, R. M'alister, and A. Porter, 1791.",Dublin,265,female,1749,1806,TRUE,"have all returned together as soon as my complaints subside a little . As to business, you ought to remember that all your money matters might be easily fettled if you pleased."" ""1 thank you, Sir ,"" replied Willoughby, who saw whither the discourse would tend; ""but those matters are"
0012600600_000005,"Village memoirs: in a series of letters between a clergyman and his family in the country, and his son in town.",Joseph Cradock,69,1,0,0,1,2,1,1,1,0,0,3,2,2,1,2,0,0,0,0,1,7,2,1,0,1,0,1,2,4,0,4,0,3,0,1,3,0,1,0,0,1,0,0,1,0,4,3,0,4,1,0,5,0,0,2,0,1775,1,1,"London : printed for T. Davies, in Russel-Street, Covent-Garden, MDCCLXXV. [1775].",London,190,male,1742,1826,TRUE,"in a village, I reason upwards and look with horror on an infected kingdom if time and reflection can work any improvement, I shall gradually inculcate better notions; at present, it is in vain to attempt to sow good principles in a soil not formed for their reception. your sister"
0709800603_000016,"The errors of education. In three volumes. By Mrs. Parsons, ...",Eliza Parsons,88,0,3,2,0,0,2,0,0,0,0,5,0,2,3,5,0,0,2,0,0,5,1,1,0,1,2,3,3,12,0,1,0,1,2,0,3,1,2,1,0,3,1,5,0,1,3,0,1,1,2,0,1,4,2,0,1,1791,3,3,"London : printed for William Lane, at the Minerva Press, 1791.",London,282,female,1738,1811,TRUE,"complied with, and have lived here many years equally refpeced and esteemed; they pay particular attention to Englishmen of character, and by their generosity often relieve the pecuniary diftrefes of their countrymen. To this respectable family I was introduced, which consists of Mr. Worthy, his lady and two daughters ,"
