0110800101_000006,Louisa Mathews. By an eminent lady. in Three Volumes. ...,Eminent lady,73,0,3,0,0,0,0,0,0,0,0,1,0,5,0,0,0,2,5,2,1,2,0,2,2,1,1,2,1,13,2,1,0,0,1,1,4,0,0,1,3,2,0,1,3,0,0,0,0,0,1,2,2,1,2,1,2,1793,1,3,"London : printed for J. Lackington, No. 46 & 47, Chiswell-Street, Finsbury-Square, Moorfields, 1793.",London,234,female,,,FALSE,"Goodricke with what he could very ill spare, a banknote of twenty guineas, and took leave of her for the last time . To To Louisa this gift was a balm indescribable; she embraced her kind friend , and entered the chaise with her father, who carried her to spend"
0290600604_000014,"The history of Sir Charles Grandison. In a series of letters published from the originals, by the editor of Pamela and Clarissa. In seven volumes. Vol. IV.",Samuel Richardson,78,0,4,0,0,1,0,0,0,1,0,0,0,1,1,0,0,1,0,3,1,8,1,1,0,4,0,0,2,3,3,0,0,7,0,1,5,3,0,1,0,1,1,0,1,0,9,2,0,0,0,2,2,1,3,0,4,1754,4,7,"London : printed for S. Richardson; and sold by C. Hitch and L. Hawes, in Pater-Noster-Row; by J. and J. Rivington, in St. Paul's Church-Yard; by Andrew Millar, in the Strand; by R. and J. Dodsley, in Pall-Mall; and by J. Leake, at Bath, M.DCC.LIV. [1754].",London,303,male,1689,1761,TRUE,"a girl whose heart was acknowledged not not to be her own. My Lord's honour would not allow of sich an intention. Nor ought it. - His impatience, however, hastened the rieflage to me. The Countess met me halfway, and embraced me: My lovely girl , how do you Mylord,"
0380400204_000008,"Female stability: or, the history of Miss Belville. In a series of letters by the late Miss Palmer. ...","Palmer, Miss",76,0,7,2,0,0,1,2,0,0,0,1,0,1,0,1,0,0,3,0,1,4,1,3,0,0,2,1,6,1,2,1,0,3,0,1,6,0,0,0,0,1,0,3,1,2,5,1,1,0,2,2,1,1,3,2,1,1780,4,5,"London : printed for F. Newbery, the Corner of St. Paul's Church-Yard, M.DCC.LXXX. [1780].",London,273,female,,,FALSE,"my brother , in being guardian to so lovely a woman ! I think I never saw her equal for beauty in my life."" "" I agree with your Lordship, replied Mr.. Evelin, Miss Belville is indeed the finest woman 1 ever beheld; "" -- "" or the world ever"
0322000200_000002,"Midsummer holidays: or, a long story. Written for the improvement and entertainment of young folk.",,83,2,1,1,0,0,0,5,1,1,0,0,0,3,0,2,0,0,3,0,0,5,1,0,3,0,2,1,1,3,2,3,0,1,0,0,21,1,0,2,0,1,0,0,4,0,0,2,0,0,0,2,5,2,0,0,2,1795,1,1,"London : printed and sold by John Marshall, at No. 4, Aldermary Church-Yard, Bow-Lane; and No. 17, Queen-Street, Cheapside, 1795.",London,82,unknown,,,FALSE,"presents out of his pocket money; and his politeness he shows by a number of little attentions ; which, though they are often negle&ted among brothers and sisters , yet are extreime ly engaging, and tend very much to pre. serve good nature and love in a family : he"
0277301202_000004,The fair Cambrians. A novel. In three volumes. ...,,69,0,2,0,0,1,0,2,0,0,3,1,0,2,1,1,3,0,3,0,1,12,1,0,1,3,2,0,1,2,2,0,0,2,0,0,2,2,0,0,0,1,1,1,0,0,2,1,1,0,2,1,3,2,0,3,1,1790,2,3,"London : printed for William Lane, Leadenhall-Street, 1790.",London,242,unknown,,,FALSE,"entered, , O, GLOOMY, melancholy to excess,"" cried the Widow.. I swear it is enough to moap any living soul to sit here alone, as Miss Dorville does, reading, contemplating, and listening to the monotonous roar of that tremendous torrent. Commend me to the light of the fun, and the"
0699700101_000016,"The exemplary mother: or, letters between Mrs. Villars and her family. New edition. In two volumes. ...",Maria Susanna Cooper,74,0,1,1,0,1,0,5,1,1,1,2,0,0,1,0,0,0,2,2,3,5,2,1,0,1,1,1,1,9,0,0,0,0,1,2,12,2,0,2,0,0,1,0,0,0,0,1,0,1,0,0,2,1,2,2,3,1784,1,2,"London : printed for T. Becket, in Pall-Mall, Bookseller to His Royal Highness the Prince of Wales, and Their Royal Highnesses the Princes, M,DCC,LXXXIV. [1784].",London,251,female,1737,1807,FALSE,"can tell: you, their raillery passes through' my ears "" like:  ""water through' a sieve "" My mother is surely angelic. If the time . of her birth is not well attested, I must be lieve she descended from the celerial regions,. and for the good of erring mortals,"
0012900501_000015,The history of Miss Maria Barlowe. In a series of letters. In two volumes. ...,,74,0,0,0,0,2,1,2,0,0,0,1,0,3,0,1,0,0,3,2,2,12,0,2,1,3,0,0,4,2,3,1,1,0,0,1,6,1,0,2,0,1,0,1,1,1,0,1,0,2,4,4,0,0,0,0,3,1777,1,2,"London : printed for Fielding and Walker No. 20, Pater-Noster-Row, MDCCLXXVII. [1777].",London,263,unknown,,,FALSE,"my inner room , I besought Mr. Brightley not to see him, and he went away. the young gentleman was full of grief an vexation, and I thought a lits 5 tle ( ia) tie fiuftered, which I was not furpifed at; for when the mind is ruffled by any"
0036800502_000027,"Juvenile indiscretions. A novel. In five volumes. By the author of Anna, or the Welch heiress. ...",Anna Maria Bennett,66,0,2,0,0,0,0,3,1,0,3,0,0,1,0,3,1,1,1,0,1,9,0,1,0,1,0,0,2,3,1,1,0,4,1,1,5,0,0,1,0,0,0,1,0,1,1,3,1,0,0,2,4,1,3,1,1,1786,2,5,"London : printed for W. Lane, Leadenhall Street, MDCCLXXXVI. [1786].",London,215,female,1760,1808,FALSE,"restore peace to his family ; but the kindness and generosity of his intentions towards him were not, on that account, likely to susser a diminution. When, therefore, the young man's elopement came to his knowledge, accompanied with the avowal of the motives for taking that sep; when proof of"
0149302402_000027,The unfashionable wife. A novel. In two volumes. ...,,80,0,1,0,0,1,0,1,0,1,1,0,0,1,3,0,0,4,5,4,1,15,2,1,3,2,1,0,3,1,2,1,0,2,2,1,2,4,0,0,0,1,1,1,0,1,0,0,1,1,4,3,0,1,0,0,1,1772,2,2,"London : printed for T. Lowndes, at his Circulating Library, in Fleet-Street, MDCCLXXII. [1772].",London,253,unknown,,,FALSE,"her head -- No; they do not even . know where I am. How! How! cried I, with an astonished air; has Miss Farnby been so far capable of forgetting herself , as to leave her valuable Father and Mother ; and to fly fi-om them, clandestinely too, without their"
1347800500_000060,"How she lost him; or, The history of Miss Wyndham. In two volumes.",,73,3,1,0,0,2,2,1,1,0,0,0,1,1,2,2,1,0,3,0,1,7,0,0,1,1,1,0,2,5,1,1,1,2,1,1,4,3,0,1,0,0,0,0,0,0,11,2,0,0,2,1,2,0,0,0,2,1780,1,1,"Dublin : Printed and sold by S. Colbert, at his Circulating Library, No. 69, Stephen-Street, six doors from George's-Street, MDCCLXXX. [1780].",Dublin,216,unknown,,,FALSE,"at every house and window, and asking if any Ladies , with the names of Lewis, had been there; but to no purpose: no fitch people were to be found. Here hmy tale ends -- take the continuation of it: from Mrs. Hume. : S"" My sister ,. Sir Edward,"
0100500902_000020,"Madeline; or, the castle of Montgomery, a novel. In three volumes. ...",Isabella Kelly,64,1,3,0,0,0,1,0,0,0,1,2,0,1,0,1,1,1,2,0,1,4,1,1,1,0,0,0,3,10,3,1,0,1,1,3,1,5,0,0,0,1,0,1,1,0,0,3,0,0,1,2,0,0,2,1,2,1794,2,3,"London : printed for William Lane, at the Minerva-Press, Leadenhall-Street, MDCCXCIV [1794].",London,288,female,1759,1857,FALSE,"ffill then halt thou cheer this gloomy chamber. Answer my Ellen's letter, convey my blessing, and leave to attend my fiter."" Ellen's Ellen's letter further desired Jarvis would recommend a proper person as Major Domo, as Mr. Fortescue's gentleman declined going abroad. A thought ftruck'the Major it would advantage Jarvis"
0851700104_000002,"Albert; or, the wilds of Strathnavern. In four volumes. ... By Elizabeth Helme, ...",Elizabeth Helme,74,0,3,0,1,0,0,0,0,0,0,1,1,2,0,2,1,1,3,0,4,15,0,0,1,1,0,0,0,1,0,1,2,0,0,3,5,1,0,1,1,0,1,2,0,0,10,2,1,0,1,0,1,2,0,0,3,1799,4,4,"London : printed by and for Sampson Low, 1799.",London,266,female,,1812,FALSE,"*' I have seen you dance far longer without complaint."" Gertrude excused herself , and they chatted until supper; after which Mrs. Stanhope, with her niece and Marian, returned home. The ball , and the meeting it had been productive of, furnished discourse for the etifuing morning both at black"
0128401600_000005,"The life of Miss Catlane; or, the ill effects of a hasty marriage. In a series of letters. Being a complete narrative of real characters. To which is added, an essay on false friendship; or Satan's eye tooth.",,71,1,0,0,1,0,0,0,0,0,0,0,0,1,1,3,0,0,4,0,5,8,1,1,2,2,1,1,5,2,0,1,1,0,0,0,2,4,0,1,2,4,0,0,0,0,3,1,0,1,5,2,1,1,1,1,1,1788,1,1,"London : printed for the author, 1788.",London,239,unknown,,,FALSE,"be called the peace maker, and my dear sister and I be bound to pray for you as long as we live. Did you go to Mr. r ball ? for my 6wn part I find myself so happy here that I did not wifll to be at it, and"
0684700301_000041,"The lounger. A periodical paper, published at Edinburgh in the years 1785 and 1786. In three volumes. ...",,62,1,0,2,0,0,0,0,2,0,0,1,0,2,2,3,0,3,0,2,1,6,0,0,1,0,1,0,3,1,2,1,1,1,0,1,0,1,2,2,0,0,0,0,0,0,1,4,0,1,3,1,4,3,0,2,1,1787,1,3,"Dublin : printed for Messrs. Colles, Burnet, Moncrieffe, Gilbert, Exshaw, Burton, White, Byrne, H. Whitestone, W. Porter, Heery, M`Kenzie, Moore, And Dornin, MDCCLXXXVII. [1787].",Dublin,335,unknown,,,FALSE,"of parliament happened to come on; but as the chiefs of neither party , though their hostilities had ceased, inclined to pay the other the com. pliment of electing a perfon'who was keenly attached to it, my father was fixed upon as a person who was generally beloved, and disagreeable"
0100300502_000002,Augusta Denbeigh; a novel. In three volumes.,,74,1,1,2,0,0,0,1,0,1,3,0,0,0,1,1,0,0,0,0,1,6,0,1,2,2,1,1,1,8,0,3,2,0,2,0,5,0,2,1,0,1,0,4,1,0,2,1,0,1,3,1,4,1,0,0,6,1795,2,3,"London : printed for William Lane, at the Minerva Press, Leadenhall-Street, MDCCXCV. [1795].",London,182,unknown,,,FALSE,"most refined nation on earth. There cannot perhaps be a more severe satire on the frivolity, and indecisive characer of the Parisians, than what is exhibited in their public prints; for the very same paper which announces to us the murder of thousands of their fellow citizens, conveys also an"
1219800300_000035,"Memoirs of a Magdalen; or, the history of Louisa Mildmay. By Hugh Kelly, Esq. In two volumes.",Hugh Kelly,68,0,0,1,0,1,1,0,0,0,0,0,0,1,2,2,1,0,0,1,1,5,1,0,1,0,0,0,3,6,2,6,1,1,1,0,3,0,0,1,1,0,3,0,0,1,1,2,0,1,4,1,3,0,3,2,4,1782,1,1,"London : printed for Harrison and Co. No. 18, Paternoster-Row, MDCCLXXXII. [1782].",London,87,male,1739,1777,TRUE,"And  this,  said the old gentleman,  I am  no way uneasy about, as the weather  is very cold, and his pulse so very tern perate: but,  added he,  ifppofe  you go and see him; there is nobody 5 with him but Milfs"
0720100103_000086,"The history of Sir Charles Grandison. In a series of letters published from the originals, by the editor of Pamela and Clarissa. In six volumes. To the Last of which is added, An Historical and Characteristical Index. As also, A Brief History, authenticated by Original Letters, of the Treatment which the Editor has met with from certain Booksellers and Printers in Dublin. Including Observations on Mr. Faulkner's Defence of Himself, published in his Irish News-Paper of Nov. 3. 1753. Vol. I.",Samuel Richardson,80,0,4,0,0,1,0,0,0,1,0,0,0,1,1,0,0,1,0,1,1,9,1,1,0,4,0,0,1,3,3,0,0,7,0,1,5,3,0,1,0,1,1,0,1,0,9,2,1,0,0,2,3,1,5,0,4,1753,3,6,"London : printed for S. Richardson; and sold by C. Hitch and L. Hawes, in Pater-Noster Row; by J. and J. Rivington, in St. Paul's Church-Yard; by Andrew Millar, in the Strand; by R. and J. Dodsley, in Pall-Mall; and by J. Leake, at Bath; And By R. Main, in Dublin, [1753]- M.DCC.LIV. [1754].",London,391,male,1689,1761,TRUE,"turning to the Earl, - I need not say, This is Miss Byron. He bowed low, and made me a very high compliment; but it had sense in it, though' high, and above my merits. Girls , writing of themselves on there occasions, must be disclaimers, you know : But,"
1185400102_000028,"The history of Sir Charles Grandison. In a series of letters published from the originals, by the editor of Pamela and Clarissa. In seven volumes. ...",Samuel Richardson,76,1,1,1,0,2,0,3,0,0,0,0,0,2,0,1,0,0,1,1,2,3,1,1,0,1,0,0,8,9,2,2,3,4,1,1,4,1,0,0,0,1,0,0,0,0,2,1,2,0,4,0,4,0,3,1,2,1753,2,7,"[Dublin] : London, printed by S. Richardson, and Dublin, re-printed and sold by the booksellers, 1753.",Dublin,359,male,1689,1761,TRUE,"(as I yet never did it) to write separately to you. And what have I in my heart, were it to be laid open to all the world , that I should be afraid i was going to write, that I should be a/hamed of? But I think I am"
1045800601_000037,"Castle of Wolfenbach; a German story. In two volumes. By Mrs. Parsons, author of errors of education, Miss Meredith, woman as she should be, and intrigues of a morning. ...",Eliza Parsons,62,0,2,1,0,0,1,0,0,2,3,1,0,1,0,0,1,0,4,2,1,2,1,0,3,0,3,0,0,2,1,4,0,1,3,0,0,0,0,0,0,2,0,1,2,2,1,0,1,3,3,1,0,2,2,1,2,1793,1,2,"London : printed for William Lane, at the Minerva Press, Leadenhall-Street, and sold by E. Harlow, Pall-Mall, M.DCC.XCIII. [1793].",London,273,female,1738,1811,TRUE,"between them, which might be productive of misery to both; tis for that reason I should wish her to leave Paris whilst the liking which I think mutual is in its infancy."" During the conversation of her generous friends , the unhappy Matilda gave herfelfup to extreme sorrow. If Mr."
0013500302_000030,The history of Captain and Miss Rivers. In two volumes. ...,,62,2,1,0,0,0,0,2,0,1,1,1,0,1,1,2,0,2,4,0,1,4,0,0,4,1,1,0,1,4,0,1,1,0,0,4,2,0,1,0,0,3,0,1,0,1,0,3,1,2,0,1,3,0,0,0,4,1787,2,2,"Dublin : printed by John Rea, for Messrs. Colles, Burton, H. Whitestone, Byrne, W. Porter, Lewis, Moore, and Halpen, M.DCC.LXXXVII. [1787].",Dublin,334,unknown,,,FALSE,"of friendship for her, which Ihe would endeavour to deserve, by an implicit compliance to all they would request of her, as far as her power permitted her. After little more agreeable conversation H z with L i72 1 wvith each other, they all retired to their respective apartments. Louia"
0020100302_000010,The history of Sir Henry Clarendon. ...,,72,0,1,1,0,1,0,3,1,0,0,0,0,0,1,0,2,0,3,3,4,6,2,0,2,4,0,1,2,1,0,3,1,2,0,0,8,0,0,1,0,2,0,1,1,0,4,1,1,1,3,1,1,1,1,0,1,1785,2,2,"London : printed for R. Baldwin, in Pater-Noster Row ; and W. Richardson, at the Royal-Exchange, 1785.",London,329,unknown,,,FALSE,"ggled with such sweetness, that it quite unmanned me; however, the forbore farther inquiry. Miss Weldon's servant coming into the room , she retired to the chamber of her friend . It was certainly prudent to prevent Miss Melville's knowing what Mr. Ryley had written. Sir Henry has answered his"
0424701402_000019,The history of Jemmy and Jenny Jessamy. In three volumes. ... . By the author of The history of Betsy Thoughtless.,Eliza Haywood,67,0,0,0,0,2,0,0,0,1,1,0,0,0,1,0,0,1,2,0,1,4,1,0,3,0,0,0,0,8,2,0,1,1,0,1,3,2,0,2,0,1,0,1,1,1,4,3,0,0,3,3,6,2,1,2,2,1753,2,3,"London : printed for T. Gardner, at Cowley's Head, facing St. Clement's Church, in the Strand; and sold by all booksellers in town and country, M,D,CC,LIII. [1753].",London,295,female,1693,1756,TRUE,"with mr. Lovegrove, and took the part of the accused. They were engaged in this dispute when sir Robert Manley came in, - that gentleman, though expecting to be back ina flcort time , was too polite to think of going without taking his leave of the ladies ; hearing"
0023600302_000029,"The perplexed lovers: or, the history of Sir Edward Balchen, Bart. In three volumes. ...",,90,1,0,0,0,0,0,0,1,0,2,1,0,6,0,0,1,0,0,3,1,8,5,3,2,0,2,0,1,4,2,0,0,4,1,0,2,11,1,0,0,1,0,1,0,1,12,0,3,0,0,2,2,0,1,1,4,1768,2,3,"London : printed by W. Hoggard, for Francis Noble, at his Circulating Library, near Middle-Row, Holborn; and John Noble, at his Circulating Library, in St. Martin's Court, near Leicester-Square, MDCCLXVIII. [1768].",London,258,unknown,,,FALSE,"exposed to view was very alluring: for, in striving t get loose, her cloak hlai had fallen off, together with her hat, so that her lovely hair hung over her face and increased the brightness of her complexion. Her gloves were also torn from the handsomest arms in the world"
0073200104_000014,"The history of Sir Charles Grandison; in a series of letters. By Mr. Samuel Richardson, author of Pamela and Clarissa. In seven volumes. ...",Samuel Richardson,81,0,4,0,0,1,0,0,0,1,0,0,0,1,1,0,0,1,0,3,1,8,1,1,0,4,0,0,2,3,3,0,0,8,0,1,5,4,0,1,0,1,1,0,1,0,8,2,1,0,0,3,2,0,4,0,4,1781,4,7,"London : printed for W. Strahan, J. Rivington and Sons, T. Caslon, S. Crowder, T. Longman, B. Law, T. Cadell, G. Robinson, T. Lowndes, W. Domville, J. Bew, W. Goldsmith, S. Bladon, T. Evans, W. Fox, J. Johnson, and M. Davenhill, 1781.",London,304,male,1689,1761,TRUE,"by his Mother . But there were no thoughts of making any application to a girl whose heart was acknowledged not not to be her own. My Lord's honour would not allow of such an intention. Nor ought it. His impatience, however, hastened the message to me. The Countess met"
0022000102_000062,"The history of Sir Charles Grandison. In a series of letters. By Mr. Samuel Richardson, Author of Pamela and Clarissa. In seven volumes. ...",Samuel Richardson,76,0,2,0,0,1,1,1,0,0,0,0,0,2,0,2,0,1,1,1,1,9,0,2,0,2,0,1,2,8,1,1,0,2,0,3,6,1,0,0,0,0,0,1,0,1,9,3,0,4,1,2,1,0,0,1,2,1766,2,7,"London : printed (by assignment from Mr. Richardson's executors) for J. Rivington, in St. Paul's Church-Yard; R. Baldwin, S. Crowder, J. Coote, and M. Richardson, in Pater-Noster-Row, MDCCLXVI. [1766].",London,362,male,1689,1761,TRUE,"procuring it for you, and for ournancy, now her recovered health will allow her to look abroad more than she had of late been used to do. I am sure , my Grandmamma, and my Aunt Selby, will be pleased with it; because it will be a good supplement to"
0128300301_000030,Adeline; or the orphan. A novel. In three volumes. ...,,80,1,0,3,0,1,2,1,1,0,0,4,0,1,0,7,3,0,2,0,0,8,1,1,1,0,0,0,0,14,1,0,1,0,1,0,0,0,1,0,1,2,0,4,2,1,2,2,0,0,4,0,2,1,0,2,2,1790,1,3,"London : printed for W. Lane, Leadenhall-Street, MDCCXC. [1790].",London,266,unknown,,,FALSE,"Sir . It must be confessed, said he, looking somewhat foolish, that I was not prepared for that manual wit your friend boasted.. The company soon after withdrew, and left a family party , with whom Adeline could divert ierfelf X the behaviour of Woodford, though !ale h: d not"
0022600301_000040,The errors of education. In two volumes. By Mrs. Parsons. Dedicated (by Permission) to the Right Hon. the Countess of Hillsborough. ...,Eliza Parsons,83,1,3,3,1,1,0,0,1,2,2,0,0,1,0,0,0,0,0,1,1,3,1,0,0,3,0,0,1,8,0,1,1,0,1,0,10,4,0,0,0,1,3,2,1,0,16,0,0,1,1,1,3,0,1,0,3,1792,1,2,"Dublin : printed for T. Jackson, No. 23, Parliament-Street, MDCCXCII. [1792].",Dublin,249,female,1738,1811,TRUE,"his .eves,. were sufficiently erprefive to this sprightly young lady , and put her in. high good, humour. sir William, to his inexpreltible vexation:, found himself a mere cypher; he was scarcely permitted to Join in the.converfation,, and: arifiver -- ed Lady Snmmners, who paid him much, attention , in"
0100201501_000043,Cleanthes and Semanthe. A dramatic history. By the author of Leonora. In two volumes. ...,Author of Leonora,69,1,3,0,0,3,0,1,0,1,2,1,0,0,0,1,0,0,0,0,0,4,2,0,0,2,1,3,3,2,0,0,0,0,1,0,4,1,0,1,0,3,0,3,2,3,2,2,2,1,1,1,5,1,1,1,4,1764,1,2,"London : printed for T. Davies , in Russel-Street, Covent-Garden ; and J. Fletcher, in St. Paul's Church-Yard, MDCCLXIV. [1764].",London,334,unknown,,,FALSE,"dangerous affair. However, he hoped bi, great care, and a few gentle remedies, he thould restore her to a perse fitate of health. I told him, as I relied upon his judgement, I should trust her to his care. Company put an end to our conversation : and I must"
0238200401_000019,"Eleonora, a novel, in a series of letters ; written by a female inhabitant of Leeds in Yorkshire. ...","Gomersall, A.",65,2,1,2,3,0,1,0,0,3,3,0,2,0,3,0,0,1,1,0,0,2,1,0,1,0,0,0,2,3,0,1,1,3,1,1,2,0,1,0,1,1,1,1,5,1,2,0,1,0,5,1,3,2,0,0,0,1789,1,2,"London : printed for the authoress, by the Literary Society at the Logographic Press, and sold by J. Walter, No. 169, Piccadilly; and W. Richardson, Royal-Exchange, [1789].",London,269,unknown,,,FALSE,"in her room to avoid you; for hindfome *"" as yqu may think her, and amiable as "" we know her to be, yet I'll answer for ""her ihe'l be as ingenious in the art of tor tormenting as the firft rate coquet of "" them all, from the moment"
0013300401_000012,"Plexippus: or, the aspiring plebeian. ...",Richard Graves,86,0,1,1,2,3,0,5,0,2,0,0,2,1,1,0,1,0,3,0,0,8,0,0,0,2,0,1,3,10,0,4,0,2,1,0,9,1,0,0,0,0,0,3,2,2,6,1,0,0,0,0,1,1,0,0,7,1790,1,2,"London : printed for J. Dodsley, Pall-Mall, M.DCC.XC. [1790].",London,235,male,1715,1804,FALSE,"by maternal authority, of which my dear Camilla, I observe, entertains exalted ideas; which I would not wih her to violate or disregard."" VOL. I. F SEC. [ 98 3 E. C T I O N XV F T E R deliberating and analysing this affair for near an hour,"
0021000201_000003,The history of Mr. Byron and Miss Greville. In two volumes. ...,,67,1,1,0,0,1,0,5,0,2,0,1,0,1,0,0,1,3,5,1,3,4,0,0,1,2,0,1,0,0,1,2,0,2,2,2,5,0,0,1,0,0,0,0,1,0,1,3,1,1,3,3,1,0,1,0,4,1767,1,2,"London : printed for Francis Noble, at his Circulating Library, near Middle-Row, Holborn ; and John Noble, at his Circulating Library, in St. Martin's Court, near Leicester-Square, MDCCLXVII. [1767].",London,240,unknown,,,FALSE,"of his ""'nephew, and has never shown any "" propensity to a married life, there is; not much room to imagine that he.will "" now enter into it."" B 6 When When Miss Moftyn and Miss Greville were by themfelvesi the former, who had been strangely prepofeffed by her brother"
0335900904_000023,Honoria Somerville: a novel. In four volumes. ...,"Purbeck, Jane",67,0,2,0,0,1,0,0,2,2,1,0,0,1,2,0,0,0,6,1,3,2,0,2,1,0,2,1,3,6,0,0,1,0,0,2,5,1,0,0,1,0,2,3,2,2,5,0,1,1,1,0,1,1,0,0,0,1789,4,4,"London : printed for G. G. J. and J. Robinson, Pater-Noster-Row, M,DCC,LXXXIX. [1789].",London,252,female,,,FALSE,"which added to her aftonilhment, as Ihe had not before heard of Miss Clarendon's marriage. She then told him of her visit, and lamented she had not detained Aer, or sent her home in the carriage, At this part of the conversation , Capt tain Fairfax entered the room ."
0443200105_000018,"Cecilia, or memoirs of an heiress. By the author of Evelina. The fourth edition. In five volumes. ...",Frances Burney,66,0,0,0,0,0,1,1,0,2,2,2,0,0,3,1,1,1,0,1,1,5,3,1,4,1,4,1,1,2,3,2,0,2,1,2,2,2,0,1,1,2,0,0,1,0,0,0,1,0,0,2,2,1,2,0,1,1784,5,5,"London : printed for T. Payne and Son at the Mews-Gate, and T. Cadell in the Strand, MDCCLXXXIV. [1784].",London,320,female,1752,1840,TRUE,"an implicit s; ith in that which regarded her having run out her fortune. His determination not to hear her hcewed the inflexibility of his character raiter; and it was evident, notwitlhfanding his parading pretenfionsi of wifling her welfare, that his inordinate pride was inflamed, at the very supposition lie"
0615500102_000003,"The children of the abbey, a tale. In four volumes. By Regina Maria Roche. ...",Regina Maria Roche,74,0,0,0,1,2,0,0,1,0,4,0,0,1,0,1,1,1,1,0,0,7,2,1,2,1,1,1,2,13,0,3,0,0,0,0,5,1,0,2,1,2,3,2,3,0,0,0,0,0,2,2,1,0,1,0,3,1796,2,4,"London : printed for William Lane, at the Minerva-Press, 1796.",London,345,female,1764,1845,FALSE,"ladies f\van into the room , with what they imagined a moult bewitching elc anicr' nd making a sliding courtesy, flung themfl ves upon a fifa, exactly opposite a glass, and alternately viewed themselves, and purflld their remarks on Lady eiiphl raiia's dretl;;  Well, certainly , Alicia,"" said Mif,;"
0646700304_000028,"Women as they are. A novel, in four volumes, by Mrs. Parsons. ...",Eliza Parsons,62,1,0,0,0,0,1,1,0,0,0,3,0,1,1,2,8,1,2,0,1,6,0,0,0,2,2,2,1,3,0,1,2,0,0,1,1,0,1,0,1,0,0,2,1,2,0,3,2,0,1,1,1,1,2,0,1,1796,4,4,"London : printed for William Lane, at the Minerva-Press, 1796.",London,289,female,1738,1811,TRUE,"the bed of sickness, - when sorrow, remorse, and slime, forced themselves before her, how contrite was her heart, how humble her sus ferings !- She discovered a hundred amiable traits that had laid dormant in her mind, shadowed over by the delusions of pride and a too eager solicitude"
0073200104_000031,"The history of Sir Charles Grandison; in a series of letters. By Mr. Samuel Richardson, author of Pamela and Clarissa. In seven volumes. ...",Samuel Richardson,67,0,0,1,1,1,0,4,0,0,0,4,2,1,2,0,0,0,1,2,1,3,1,1,2,0,0,0,1,4,2,1,1,1,0,0,5,0,0,0,0,1,0,0,0,0,9,3,0,2,2,1,4,0,1,0,2,1781,4,7,"London : printed for W. Strahan, J. Rivington and Sons, T. Caslon, S. Crowder, T. Longman, B. Law, T. Cadell, G. Robinson, T. Lowndes, W. Domville, J. Bew, W. Goldsmith, S. Bladon, T. Evans, W. Fox, J. Johnson, and M. Davenhill, 1781.",London,304,male,1689,1761,TRUE,"so long as it will bring no discredit to yourself. Your servant, Good Gravity !But what nmuf be, must. The man is bound to see it. It will be all his own seeking. He will sin with his eyes open. I think he has seen enough of me to take"
0029100702_000025,"Constantia Neville; or, the West Indian. A novel. In three volumes. By Helena Wells, Author of ``the Step-Mother,'' &c. ...",Helena Wells,71,1,1,5,0,0,0,6,0,2,0,2,2,5,0,3,2,0,2,0,0,3,0,0,1,1,4,0,0,7,0,2,0,0,4,1,6,2,2,0,0,1,0,0,0,0,0,1,0,0,0,1,2,1,0,0,1,1800,2,3,"London : printed by C. Whittingham, Dean-Street, Fetter-Lane, for T. Cadell, jun. and W. Davies, Strand ; and W. Creech, Edinburgh, 1800.",London,440,female,,,FALSE,"at what might lead to their advancement, though she could not help feeling most poignantly the slight manner in which her brother spoke of the services of his late clerk, and how much occupied he appeared if 6 to  i : )t ""* be ith the quialifications of the"
