0881900702_000016,Lord Fitzhenry: A novel. By Miss Gunning. In three volumes. ...,Elizabeth Gunning,64,0,1,0,3,0,3,1,0,1,0,2,1,1,1,3,0,1,0,0,1,8,0,0,3,1,4,0,0,4,1,1,1,1,0,0,4,1,1,1,0,1,1,1,0,1,0,1,0,0,0,4,2,1,1,0,1,1794,2,3,"London : printed for J. Bell, No. 148, Oxford-Street, MDCCXCIV. [1794].",London,261,female,1769,1823,FALSE,"to entertain, who at every step was drawing nearer to the presence of a beloved objeet, and his perplexities very much increased, to perceive, as he came within view of Mrs. Melmoth's house , all the windows of it were shut; and that Northangle hung out the same signals of"
0831700104_000008,"A simple story, in four volumes, by Mrs. Inchbald. ...",Elizabeth Inchbald,78,0,2,1,0,1,1,0,0,2,3,0,0,2,1,0,1,3,2,0,2,6,0,0,0,3,2,1,1,8,1,1,1,2,0,2,5,1,0,4,0,1,0,7,2,1,0,0,1,0,2,0,1,0,1,1,2,1799,4,4,"London : printed for G. G. and J. Robinson, Paternoster Row, 1799.",London,161,female,1753,1821,TRUE,"nephew's, when Rufhbrook called for wine, and drinking at the time he did. CHAPTER V THE repulse Lord Margrave received, did not diminiflh the ardour of his pursuit; for as he was no longer afraid of resentment from the Earls whatever treatment his daughter might receive, he was determined the"
0363400102_000026,"Caroline; or, the diversities of fortune : a novel. In two volumes. ...","Hughes, Anne",84,1,4,1,0,0,2,0,1,1,5,2,0,2,0,1,1,0,1,1,1,4,0,0,1,2,2,0,2,7,3,0,2,0,0,0,10,0,1,1,0,4,2,1,2,0,7,0,0,1,5,0,2,0,0,0,1,1787,2,2,"Dublin : printed by M. Graisberry, for Messrs. Gilbert, White, Byrne and H. Whitestone, 1787.",Dublin,295,female,,,FALSE,"as if restrained by her pretence, entirely ceased their conversation . She strove to renew it by introducing several new sub je&s but in vain, a cold yes, Mame, or no, Mame, was all she could obtain, and she had just relinquished further attempts when .^ mdr. Mr. Sanders coming"
0629100403_000045,"Evelina, or, the history of a young lady's entrance into the world.",Frances Burney,68,0,1,1,0,1,3,2,1,1,4,0,0,1,1,2,2,0,0,1,5,8,1,0,0,3,1,0,1,3,1,1,2,0,0,0,2,0,1,3,2,0,0,0,1,0,3,1,0,2,0,0,3,1,0,0,2,1783,3,3,"London : printed for T. and W. Lowndes, No 77, in Fleet-Street, M.DCC.LXXXIII. [1783].",London,266,female,1752,1840,TRUE,"their attention , to feel either pride or pleasure from receiving it. Lord Orville was not long absent; he joined us in the garden with a look of gaiety and good-humour that revived us all. "" You are just the party ,"" said he, "" I wished to see together."
0200900102_000021,The banished man. A novel. By Charlotte Smith. In four volumes. ...,Charlotte Turner Smith,64,0,0,0,2,0,0,1,0,1,0,1,2,4,1,4,0,0,3,0,1,4,0,3,0,0,1,0,0,5,1,1,0,0,0,0,5,3,1,1,0,1,0,0,1,1,2,2,0,0,2,1,1,0,1,2,5,1794,2,4,"London : printed for T. Cadell, jun. and W. Davies, (successors to Mr. Cadell) in the Strand, 1794.",London,249,female,1749,1806,TRUE,"things about which half the world was running mad. But however indifferent file might be to what passed at a distance, in the scene immediately near her fie took the livdieft interenf. She bore the most perfect good will to the generality of her neighbours, except except always the rich"
0440300101_000041,"Woman as she should be; or, memoirs of Mrs. Menville. A novel. In four volumes. By Mrs. Parsons, ...",Eliza Parsons,74,1,2,2,0,2,0,4,0,1,2,0,0,1,1,0,1,0,2,1,1,4,1,0,0,1,1,0,3,4,0,3,1,0,0,0,11,0,4,0,0,0,0,2,4,2,0,1,0,0,2,0,2,3,1,0,3,1793,1,4,"London : printed for William Lane, at the Minerva, and sold by E. Harlow, 1793.",London,282,female,1738,1811,TRUE,"Miss Else, at my request, accompanied them. They had scarcely left the house , when I was most agreeably surprised by a visit from my dear brother Harry: but my satisfaction was of short duration, when he informed me, that my uncle had in De vonfihire formed a connexion with"
0203200202_000055,"The mirror. A periodical paper, published at Edinburgh in the years 1779 and 1780. In three volumes. ...",,67,1,0,2,1,0,0,0,0,4,0,1,0,5,1,1,0,1,0,2,2,4,0,1,3,2,2,0,1,3,1,3,0,0,3,0,2,7,1,2,0,0,0,0,0,0,3,1,0,0,0,0,3,2,0,2,0,1787,2,3,"London : printed for A. Strahan, and T. Cadell; and W. Creech, at Edinburgh, 1787.",London,325,unknown,,,FALSE,"the refinements that produce them. In the course of my researches I became acquainted with Nerina, an only daughter , who had had been educated under the eye of a mother famed for her prudence and cecononly. She was at this time about twenty; though not a perfelt beauty, she"
0027900201_000015,"Simple facts; or, the history of an orphan. In two volumes. By Mrs. Mathews. ...","Mathews, Charles, Mrs",73,1,2,3,0,0,0,5,0,0,0,1,0,0,0,1,0,1,0,0,5,7,1,1,1,2,2,1,2,5,1,2,1,1,1,0,6,1,1,1,0,0,0,0,1,2,1,1,0,2,1,0,4,3,2,0,0,1793,1,2,"London : printed by S. Low, Great Portland Street for the author: and sold by Mr. Richardson, Royal-Exchange; Messrs. Hookham & Carpenter, Old and New Bond Street; and Messrs. Scatcherd & Whitaker, Ave-Maria Lane, 1793.",London,216,female,,,FALSE,"resolution."" "" I ""' hold, Maria,"" said he, ""be glad to ( hear what your objecions to the Doctor are. He is in my opinion, such as no woman , of the nicest delicacy can "" object to; unless her affeceions were ""previously engaged, which is not the "" cafe"
0207100500_000011,"Helena, a novel. By a lady of distinction.",Lady of distinction,74,0,0,2,0,0,2,2,1,1,0,3,0,0,4,1,1,2,2,0,1,3,0,0,5,1,2,0,0,10,2,2,1,0,2,0,1,0,4,1,0,0,0,2,2,2,2,2,0,0,3,0,3,1,0,0,1,1788,1,1,"London : printed for W. Richardson, Royal Exchange, M,DCC,LXXXVIII. [1788].",London,283,female,,,FALSE,"that might afford him many opportunities of feeing and converting: with. the fair Helena. This very circumfiance, which Helena saw must be the consequence of her friendfiip, or even frequent visits to lady Frances, prevented. both: and file preserved a degree of reserve not! natural to her, wherever the met"
0336001203_000030,"Robert and Adela: or, the rights of women best maintained by the sentiments of nature. In three volumes. ...",,77,3,0,0,1,1,2,4,0,0,0,5,0,1,0,2,0,0,3,0,2,12,2,3,1,0,0,1,2,4,2,0,0,1,0,1,3,2,0,0,0,2,2,0,0,0,0,2,0,0,2,2,2,1,3,1,2,1795,3,3,"London : printed for G. G. and J. Robinson, Pater-Noster-Row, MDCCXCV. [1795].",London,282,unknown,,,FALSE,"WE L L I have w: ited until I am qui: e out of pa ience for a line from you. This is ftrar.g A Frcnchman to be accused of a want of gallantry. I have heard at Tregony. Hall of all your firange adventures; and, I beg to congratulate"
0696101401_000033,The modern miniature. A novel. In two volumes. ...,,79,0,2,1,0,0,0,0,0,0,3,0,0,2,0,2,1,0,1,2,0,6,1,3,5,0,3,0,2,4,1,3,0,1,2,0,16,0,0,0,0,1,0,1,1,0,0,2,0,2,2,1,3,0,2,1,2,1792,1,2,"London : printed for T. Hookham and J. Carpenter, Old and New Bond-Street, 1792.",London,298,unknown,,,FALSE,"they are so good-natured to "" tell, I will produce that as the letter ""we were reading."" It [ 18s ] It will now be requisite to let the reader know how the Miss Greenfords came into the alcove unperceived -- As soon as they returned from church, ( little"
0021000201_000026,The history of Mr. Byron and Miss Greville. In two volumes. ...,,87,1,0,0,0,3,2,0,0,0,4,2,2,2,2,2,0,0,0,4,1,12,3,1,0,1,1,0,4,5,0,3,1,0,0,1,8,0,0,0,0,2,1,3,0,1,0,0,2,1,5,0,1,0,1,1,4,1767,1,2,"London : printed for Francis Noble, at his Circulating Library, near Middle-Row, Holborn ; and John Noble, at his Circulating Library, in St. Martin's Court, near Leicester-Square, MDCCLXVII. [1767].",London,240,unknown,,,FALSE,"of buying honour, not "" I: dry ground is worth a hundred titles. ""Besides, Bess, 1 continued he, ""in my ""mind, ""mind, now, when I have done no. ""thing to deferve this same title, it will ""be but a mere empty sound, child; and "" even lords are become so"
0033500200_000002,"The history of Ltitia Atkins, vulgarly called Moll. Flanders. Published by Mr. Daniel Defoe. And from papers found since his decease, it appears greatly altered by himself; and from the said papers, the present work is produced.",Daniel Defoe,82,2,0,0,0,0,3,8,0,0,0,1,1,1,1,2,0,0,0,1,0,11,4,2,0,0,2,0,2,6,2,0,0,1,2,1,0,0,0,1,0,1,1,2,1,0,0,5,2,5,1,1,2,0,4,0,3,1776,1,1,"London : printed for the editor; and sold by F. Noble, and T. Lowndes, 1776.",London,288,male,1660,1731,TRUE,"until I arrived to the age of eighteen; ihe dying and leaving me her effecs, application was made to me by an elderly lady .of the place, an acquaintance of my late .aunt, to wait on : two of her eldest daughters . Here Ilhad all the advantages.for improving my"
1070800202_000028,Eloise de Montblanc. A novel. In four volumes. ...,,74,1,0,2,1,1,0,0,0,2,0,0,0,1,1,1,1,0,2,0,3,7,1,0,0,3,1,0,3,11,1,1,1,3,0,2,0,0,0,3,0,0,2,0,2,0,4,1,1,0,2,2,0,3,1,2,1,1796,2,4,"London : printed for William Lane, at the Minerva Press, 1796.",London,266,unknown,,,FALSE,"well for their purposes, which were to captivate his heart, and sail down the fiream of matrimony. The nobles and gentry only waited for the family at Befborough, to make their appearance at church before they paid the congratulatory visit on their return to the Caille, and this preliminary of"
0335900904_000004,Honoria Somerville: a novel. In four volumes. ...,"Purbeck, Jane",76,1,2,1,0,1,0,1,0,0,0,5,0,3,2,1,0,0,1,1,3,0,1,2,3,0,0,0,3,12,2,2,2,0,0,2,3,1,0,3,0,1,0,4,0,0,2,0,0,1,1,1,2,1,1,1,3,1789,4,4,"London : printed for G. G. J. and J. Robinson, Pater-Noster-Row, M,DCC,LXXXIX. [1789].",London,252,female,,,FALSE,"when the ceremony was performed, they took lodgings ea Carmarthen, till they could resolve on what measures to pursue. -- - And here for a while let us leave them, and return to the more refpe& able personages of our history. CHAP. C H A P. XXXIII HONORIA rose early"
0147103801_000027,"Robert and Adela: or, the rights of women best maintained by the sentiments of nature. In Two Volumes, ...",,71,0,0,0,0,0,0,2,0,2,0,1,0,0,0,2,1,0,2,1,2,5,1,0,2,1,2,0,2,4,4,0,0,0,0,1,0,4,0,2,1,1,1,2,2,3,1,3,1,1,7,5,0,0,2,0,0,1795,1,2,"Dublin : printed for P. Byrne, P. Wogan, W. Jones, and G. Folingsby, 1795.",Dublin,312,unknown,,,FALSE,"ever saw her but in the presence of my mother . I conducted Adela to Salens. I never saw a more interesting object than the Countess de Mont morin. She was handfomne, you remember when we law her in the convent: but three years have transformed the unfinihied girl into"
0509300802_000019,"Louisa. A novel, in two volumes. By the author of Melissa and Marcia ; or, the sisters. ...","Hervey, Elizabeth",71,1,1,1,1,2,1,0,1,1,2,1,0,3,0,4,0,1,2,1,1,7,0,0,1,0,0,0,3,3,2,2,1,1,0,0,1,4,0,0,0,1,0,1,0,1,6,0,1,1,2,2,3,2,1,0,1,1790,2,2,"Dublin : printed for P. Wogan, P. Byrne, J. Moore, J. Jones, Grueber and McAllister, and W. Jones, 1790.",Dublin,322,female,1748,1820,FALSE,"who thought that Mrs. Dinley, so far from seeming alhamned of the part ihe had acted, appeared rather in her narration, to value herielf upon her cleverness, interrupted her. I flould imagine,"" said she, "" that amidst .these torments, the voice of conscience, must be the most troublesome of all;"
0423900303_000010,"Agitation: or, memoirs of George Woodford and Lady Emma Melvill. In three volumes. Dedicated (by permission) to the Honourable Mrs. Lionel Damer. By the author of The ring, and The false friends. ...",Author of The ring,106,1,2,2,0,0,0,3,2,1,1,3,0,1,1,2,0,1,4,0,0,2,0,1,1,0,2,1,5,28,2,0,0,1,1,2,4,0,2,0,1,0,0,2,2,0,11,0,2,0,5,1,3,2,0,0,1,1788,3,3,"London : printed for J. Barker, Russell-Court Drury-Lane, [1788?].",London,219,unknown,,,FALSE,"room . The Boltons were equally affected, but all attributed his sudden departure to the right cause, namely, that he was known to some of the E 3 party party that entered the ballroom. Lady Bolton, laving left her daughter alone for an hour, then went up to her with"
0022600302_000020,The errors of education. In two volumes. By Mrs. Parsons. Dedicated (by Permission) to the Right Hon. the Countess of Hillsborough. ...,Eliza Parsons,67,1,0,0,0,0,1,1,0,1,1,5,0,1,2,0,3,1,1,2,1,5,0,0,1,2,0,0,1,6,0,3,0,0,2,1,4,1,0,1,0,0,1,3,0,2,2,1,0,1,3,2,1,0,1,2,0,1792,2,2,"Dublin : printed for T. Jackson, No. 23, Parliament-Street, MDCCXCII. [1792].",Dublin,226,female,1738,1811,TRUE,"his lordship appeared more pleated that his niece had obtained her freedom by the unhappy man's death, than concerned for his untimely fate he made but a short visit that he might return and write his mother what he called such desirable intelligence. Mils Mayhank felt a little difguffed at"
0049502100_000002,"Stella; translated from the German of M. Goethe, Author of the Sorrows of Werter, &c. &c.",Johann Wolfgang von Goethe,78,1,0,0,0,0,1,0,1,0,2,3,0,3,0,1,0,1,0,3,1,6,1,2,1,0,2,0,3,4,2,2,0,6,1,0,0,2,0,1,0,2,1,0,2,1,0,0,1,2,1,0,6,1,5,2,4,1798,1,1,"London : printed for Hookham and Carpenter, No. 14, Old Bond Street, 1798.",London,118,male,1749,1832,TRUE,"his love made every place amusing, and every trifle interesting! LUCY. Certainly nothing is so pleasant as travelling. MRS. SUMMERS. And after a hot day in summer, or bad roads in winter, when we came into many B 4 much much worse inns than this, and felt the simple pleasure"
0016000301_000017,"He deceives himself. A domestic tale, in three volumes. By Marianne Chambers, Daughter of the late Mr. Charles Chambers, Many Years in the Service of the Hon. East-India Company, and unfortunately lost in the Winterton. ...","Chambers, Miss (Marianne)",75,0,0,0,0,2,0,1,0,1,1,3,0,2,1,5,2,0,3,0,2,6,1,4,1,1,0,0,2,3,1,0,1,1,0,2,2,9,1,1,0,2,0,1,1,1,1,0,1,1,0,1,4,1,1,0,1,1799,1,3,"London : printed for C. Dilly, in the Poultry, 1799.",London,313,female,,,FALSE,"truth of what I have said; do you hear ?"" he cried , "" do not forget it,"" as he went out at the gate. CHAP. VII CHAP. VII ANGELINA remained a few days longer at the rectory; and, one morning while they were at work, the conversation turned on"
0310901103_000023,"The abbey of Saint Asaph. A novel. In three volumes. By the author of Madeline, of [sic] the castle of Montgomery. ...",Isabella Kelly,74,0,0,0,0,2,1,9,2,2,3,0,0,0,1,1,3,0,5,2,1,5,0,0,1,6,1,0,0,2,1,1,0,2,0,0,2,0,0,2,0,0,0,6,0,1,2,3,1,1,0,0,1,1,1,0,2,1795,3,3,"London : printed for William Lane, at the Minerva-Press, 1795.",London,198,female,1759,1857,FALSE,"his arms, with all the tenderness of a parent, requested the might ever confider him as a father, and a friend , anxious to promote her happiness , and desiring lhe might draw upon his affecetion and fortune, for every wish his power could accomplish, he presented her a note"
0017100101_000010,"The history of Sir Charles Grandison. In a series of letters. By Mr Samuel Richardson, Author of Pamela and Clarissa. In eight volumes. ...",Samuel Richardson,67,3,0,0,1,2,2,0,0,0,0,0,1,4,1,0,0,0,2,2,0,4,3,0,2,1,0,0,1,9,0,2,1,1,0,1,2,3,2,3,1,0,0,0,0,1,0,1,0,2,2,0,2,0,1,0,4,1776,1,8,"London : printed for John Donaldson, corner of Arundel-Street, No. 195. in the Strand. Sold by T. Wilson, at York: A. Smith, Halifax; D. Akenhead, Newcastle: W. Darling, Edinburgh: W. Boyd, Dumfries: W. Anderson, Stirling: Angus and Son, Aberdeen: and L. Flin, Dublin, M,DCC,LXXVI. [1776].",London,359,male,1689,1761,TRUE,"reasons, since ihe gave any; and then you had not been troubled with the impertinent remarks of your saucy kinswoman. Lady Betty was so kind as to take great notice of me. She desired to be one in every party of pleasure that I am to be engaged in. Persons"
0032700103_000036,"Exhibitions of the heart; a novel, in four volumes. Dedicated (by Permission) to The Queen. by Miss Hutchinson. ...","Hutchinson, Miss (A. A)",70,0,1,3,1,0,1,3,0,1,1,0,0,3,2,0,1,1,0,1,1,1,0,0,0,2,0,0,1,1,1,3,1,3,0,0,1,7,1,1,0,1,0,4,4,0,3,0,1,0,0,1,3,3,2,0,5,1799,3,4,"London : printed for the author, and sold by G. Kearsley, Fleet-Street. 1799. T. Davison, printer, Lombard-Street, Fleet-Street, [1799].",London,314,female,,,FALSE,"invented a thousand innocent stratagems, which her mother premeditately or ( 232) or by accident frustrated. The dinner hour she knew was approaching; though, comparatively speaking , the minutes lengthened into. hours until her ardent wishes were gratified -- -"" Confess, my dear Jessy,"" said Lady Beaufort, as Mrs. Montgomery"
0881900703_000032,Lord Fitzhenry: A novel. By Miss Gunning. In three volumes. ...,Elizabeth Gunning,60,0,0,2,0,1,1,1,0,1,2,1,0,4,0,2,1,2,0,0,2,3,0,1,0,1,0,0,3,6,0,1,1,2,0,1,0,4,1,0,0,1,0,3,1,2,0,1,2,1,1,1,0,1,0,1,1,1794,3,3,"London : printed for J. Bell, No. 148, Oxford-Street, MDCCXCIV. [1794].",London,277,female,1769,1823,FALSE,"the Countess by Fitzhenry, who whispered his mother ""as ihe affetionately embraced her She J She is now only your niece, I shall he wretched until you receive her as a daughter . He did not speak so low but that his lovely cousin heard what he said; her fair"
0238200401_000036,"Eleonora, a novel, in a series of letters ; written by a female inhabitant of Leeds in Yorkshire. ...","Gomersall, A.",61,0,1,2,0,0,0,0,0,1,1,4,0,2,1,2,1,0,0,1,2,4,3,1,2,0,1,0,0,7,0,0,2,0,1,1,3,0,0,2,1,1,0,0,2,1,3,1,1,0,1,2,0,1,1,1,0,1789,1,2,"London : printed for the authoress, by the Literary Society at the Logographic Press, and sold by J. Walter, No. 169, Piccadilly; and W. Richardson, Royal-Exchange, [1789].",London,269,unknown,,,FALSE,""" with dheir avarice and arrogance. "" But I beg your pardon, Sir , I am keep"" "" you from your company, and you < have been detained from them too long C already: as my spirits are too much disc, composed to allow me to return to the """
0552300400_000006,The juvenile tatler. By a society of young ladies. Under the tuition of Mrs. Teachwell.,Ellenor Fenn,98,2,0,3,3,0,0,0,0,2,0,0,0,1,0,0,1,0,3,0,2,2,3,1,1,2,0,0,3,7,0,1,0,2,1,1,25,1,0,0,0,0,0,0,2,1,16,2,1,0,4,1,0,0,3,0,1,1790,1,1,"London : printed by and for John Marshall No. 4, Aldermary Church-Yard, Bow-Lane; And NO. 17, Queen-Street, Cheapside, 1790.",London,95,female,1743,1813,FALSE,"similar to that of his friend , embellished with such personal accompliihments and vivacity, as recommended him to immediate notice from the young , the gay, and the thoughtless, i.ldependant of his good qualities. There two gentlemen were engaged in conversation in the corner of a public room at Bath,"
0022600302_000006,The errors of education. In two volumes. By Mrs. Parsons. Dedicated (by Permission) to the Right Hon. the Countess of Hillsborough. ...,Eliza Parsons,87,0,2,1,0,3,1,1,0,0,1,1,1,0,2,0,1,1,1,1,0,4,0,1,2,1,0,0,2,19,2,5,2,0,1,0,8,1,0,2,0,1,1,5,2,1,4,0,0,0,0,1,0,1,1,1,2,1792,2,2,"Dublin : printed for T. Jackson, No. 23, Parliament-Street, MDCCXCII. [1792].",Dublin,226,female,1738,1811,TRUE,"address were elegant and pleasing; 1f I wonder, said she, from what part of the world this gentleman is emerged, for he is totally unlike the pretty fellows that crowd public places; he is.polite and well-bred without being. a coxcomb."" "" I believe , answered Sir Edward,, he is but"
0013300401_000009,"Plexippus: or, the aspiring plebeian. ...",Richard Graves,85,0,0,1,0,3,1,0,2,0,2,1,1,2,1,2,1,0,1,2,2,10,1,0,1,1,0,0,3,5,0,2,0,0,1,2,6,3,0,0,0,0,0,1,0,2,2,0,0,0,0,0,1,2,6,5,9,1790,1,2,"London : printed for J. Dodsley, Pall-Mall, M.DCC.XC. [1790].",London,235,male,1715,1804,FALSE,"good characer of you for sobriety and good behaviour, has' made proposals, and offered you his only daughter , to whom he will give, first and last, ten or twelve thousand pounds. She is a very pretty, discreet, and a very religious young woman , and, I don't doubt, will"
0192500702_000027,"Clara Lennox; or, the distressed widow. A novel. Founded on facts. Interspersed with an historical description of The Isle of Man. By Mrs. Lee. Dedicated, by Permission, to H. R. H. The Duchess of York. In two volumes. ...","Lee, Margaret",72,4,1,1,1,2,0,0,0,0,1,1,1,1,1,0,3,0,2,2,3,8,1,0,1,4,0,0,2,3,1,5,0,3,1,0,4,1,0,2,0,0,0,0,3,0,1,0,0,0,2,1,1,1,1,1,1,1797,2,2,"London : printed for the authoress, by J. Adlard, No. 39, Duke-Street, West Smithfield ; and sold by J. Parsons, No. 21, Paternoster-Row, 1797.",London,232,female,,,FALSE,"another message was brought me, from the charming Lady Angelina, to attend her. 1 immediately waited on her ladyship, and, on sending up my name, was admitted to her dreffing room but never did I see beauty in so graceful an attitude as I entered the the room , she"
0947200603_000012,"The history of Sir William Harrington. Written some years since, and revised and corrected by the late Mr Richardson, ... In four volumes. ...",,73,0,2,0,0,2,0,2,2,0,0,0,0,2,2,4,0,0,3,1,3,12,1,0,0,1,0,1,0,4,1,1,0,3,1,0,5,0,0,1,1,1,2,1,0,0,5,4,0,0,1,2,0,1,1,0,0,1772,3,4,"London : printed for John Bell, and C. Etherington at York, 1772.",London,261,unknown,,,FALSE,"deserve, by my troth, replied the Earl, for really your great beauties are a malicious fct of creatures. Not such as you, daughter , daughter , and Miss Hairington, you arc handsome but you are good too. A charming man this old Earl, he lets slip no occasion which offers,"
0036400102_000025,"The way to lose him; or, the history of Miss Wyndham. By the author of The way to please him.",Author of The way to please him,73,0,1,0,0,0,0,0,0,0,1,0,1,5,0,3,0,1,1,2,2,8,1,1,0,3,1,1,2,3,1,2,1,2,2,0,1,5,0,0,0,2,0,3,3,0,8,1,0,0,1,1,1,0,1,1,0,1773,2,2,"London : printed for F. and J. Noble, at their respective circulating libraries, near Middle Row, Holborn, and Saint Mary's Court, near Leicester Square, MDCCLXXIII. [1773].",London,233,unknown,,,FALSE,"the most painful suspense. I am sometimes, however, firmly resolved not to return that favour which you and I have , both, received from Lady Wyndhanm, by accepting of the unmerited honour which her son is desirous of conferring upon me. i am inexpressibly transported to know that I am"
0021600301_000021,"The wreath of friendship; or, a return from India. A novel, in a series of letters. In two volumes. ...",,78,1,1,1,2,1,1,0,0,1,0,1,9,0,4,0,0,0,2,1,1,8,1,0,1,1,0,0,1,7,1,2,1,2,0,1,4,0,1,1,0,2,0,0,2,1,2,0,1,2,1,3,2,2,0,1,1,1790,1,2,"Dublin : printed by P. Wogan, P. Byrne, J. Parker, W. M'Kenzie, J. Moore, J. Halpen, W. Jones, Gruber and M'allister, and D. Servant, M.DCC.XC. [1790].",Dublin,285,unknown,,,FALSE,"it; my profession has done much for me, and I was never aihamed of it in my life. Wherever I am known, I am known for an honeit man, and that is a great character as the world goes, more than all your men of quality can say. I beg"
0024200502_000045,"Lucy: a novel, in three volumes. By Mrs. Parsons. ...",Eliza Parsons,80,3,2,0,0,1,2,0,1,1,0,1,0,0,3,3,5,1,5,0,3,3,0,1,0,1,0,0,1,10,2,1,1,0,2,1,6,0,0,3,0,0,0,1,0,1,1,1,0,2,0,2,2,1,1,1,4,1794,2,3,"London : printed for William Lane, at the Minerva Press, Leadenhall-Street, M.DCCXCIV. [1794].",London,291,female,1738,1811,TRUE,"sure , would soon follow but the situation of Lady Campley and her filter, who saw the darling and only object of their cares hourly finking to the grave, interested every feeling of his heart. To leave them was impossible, to intrust the conveyance of Lucy to strangers was equally"
0024100101_000028,A welsh story. In three volumes. ...,"Barker, Mary           1798",76,1,0,2,0,2,1,0,1,1,1,0,0,0,0,0,1,1,0,1,2,6,5,0,2,0,0,0,1,5,1,4,2,2,0,2,6,0,0,1,0,2,4,4,2,2,2,0,0,1,3,1,1,0,1,2,0,1798,1,3,"London : printed for Hookham and Carpenter, Old Bond Street, 1798.",London,293,female,,,FALSE,"would be delightful to have a concert in. the mufic room in the woods, ( 211) woods, they immediately walked: thither. Lord Oakley petered Charlotte Llewellyn all the way with his gallantries, and what he called his love ; but ihe was disposed to be cruel as he told her,"
0849600301_000035,Ellen and Julia. A novel in two volumes. By Mrs. Parsons. ...,Eliza Parsons,64,0,2,1,1,1,0,0,0,2,1,2,0,1,0,2,1,1,2,0,1,3,0,0,3,1,0,0,0,3,0,2,0,0,1,0,5,7,0,0,0,0,1,5,3,0,0,2,0,0,1,3,0,2,0,1,3,1793,1,2,"London : printed for William Lane, at the Minerva-Press; and sold by E. Harlow, 1793.",London,299,female,1738,1811,TRUE,"I hope you will be perfectly satisfied with our mother's proceedings. Miss Woodville left the room without a reply , and strolled into the garden, where, in a few moments, see was joined by Lord A, as little pleased as herself . After the common salutations, his Lordship afled her,"
0249903102_000012,"Family pictures, a novel. Containing curious and interesting memoirs of several persons of fashion in W-----re. By a lady. In two volumes. ...",Susannah Gunning,73,0,0,1,0,0,1,1,1,0,0,2,0,3,2,2,1,0,2,4,1,6,1,1,1,1,3,0,1,3,0,4,1,1,1,2,9,1,0,0,1,2,1,0,0,0,1,0,0,1,0,1,3,0,3,0,3,1764,2,2,"Dublin : printed for P. Wilson, J. Exshaw, S. Price, and J. Potts, 1764.",Dublin,130,female,1740,1800,TRUE,"plain worker's being brought over las night in the chariot with her. She added, that she must confess, Mhe was not aware of the consequence of her presumption, vwich had really been so fatal as to offend her young friends , and expose her to the resentment of the little"
0199200201_000065,"The adventurer. ... . On vent'rous wing in quest of praise I go, And leave the gazing multitude below.",John Hawkesworth,76,3,1,0,0,0,0,0,0,2,1,1,0,1,1,3,0,1,2,2,1,11,1,0,3,0,0,1,3,4,1,0,1,2,1,3,8,0,0,0,0,2,0,0,1,0,0,5,0,0,0,0,1,2,0,0,7,1788,1,4,"London : printed by H. Goldney, for J. Rivington and Sons, L. Davis, J. Dodsley, T. Longman, B. Law, J. Robson and Co. G. G. J. and J. Robinson, T. Cadell, J. Murray, R. Baldwin, W. Flexney, S. Hayes, W. Goldsmith, W. Nicoll, W. Fox, W. Lowndes, E. Newbery, and G. and T. Wilkie, MDCCLXXXVIII. [1788].",London,312,male,1715,1773,FALSE,"to subdue their passions, an inveterate rancour oftenf lies corroding il the breast, and generally produces all the effects of inexorable malice. PEOPLE confider not, that by family repartees and oblique reflections on each fide, the very inmost secrets of their lives are disclosed. to their commion acquaintance; and that"
