PassageID,Title,Author,Total termFreq,termFreq(ag),termFreq(author),termFreq(believ),termFreq(bitter),termFreq(bodi),termFreq(charact),termFreq(common),termFreq(curl),termFreq(envi),termFreq(fame),termFreq(gener),termFreq(hand),termFreq(hate),termFreq(heart),termFreq(idea),termFreq(judgement),termFreq(ladi),termFreq(libel),termFreq(liberti),termFreq(low),termFreq(malic),termFreq(manner),termFreq(merit),termFreq(opinion),termFreq(piqu),termFreq(poem),termFreq(point),termFreq(power),termFreq(print),termFreq(privat),termFreq(public),termFreq(publish),termFreq(read),termFreq(satir),termFreq(satyr),termFreq(scandal),termFreq(scribbler),termFreq(spirit),termFreq(vain),termFreq(vers),termFreq(vice),termFreq(wit),termFreq(work),termFreq(write),termFreq(wrong),Publication Year,Volume Number,Total Volumes,Imprint,Publication Place,Total Pages,Gender,Birth Year,Death Year,Popular Authors,short_excerpts
0740100201_000101,"The spectator. A new edition in eight volumes; with Illustrative Notes. To which are prefixed the lives of the authors, by Robert Bisset, A. M. ...",,44,0,7,1,0,0,0,0,7,1,0,0,1,0,2,0,0,0,2,0,0,0,1,3,0,0,4,0,0,0,0,2,3,0,3,0,0,0,0,0,0,1,4,1,1,0,1793,1,8,"London : printed for G. Robertson No 221, Piccadilly, J. Cuthell. No 24, Middle Row, Holborn, J. Lackington No 47 and 48 Chiswell Street Moorfields, and Messrs. Bell & Bradfute, Edinburgh, [1793-94].",London,503,unknown,,,FALSE,"not its only merit , though that be a great excellence in any introducion. There is conformity of sentiment as well as of subject. It breathes the sublimest morality, conveyed in most expressive language, and adorned with al the beauties of elegance and harmony. When the impotent malignity of DENNIS"
0535400100_000003,The satirists: a satire.,,43,1,0,0,0,0,1,2,0,0,0,2,0,0,0,1,0,0,0,0,1,1,0,1,0,0,0,1,0,3,0,0,0,1,9,0,7,0,1,0,2,2,7,0,0,0,1739,1,1,"London : printed for C. Corbett, at Addison's Head over-against St. Dunstan's-Church, Fleetstreet, and Sold by the Pamphlet-Sellers of London and Westminster, [1739].",London,16,unknown,,,FALSE,"the Verse well hit? A Page of Scandal is a Page of Wit . There are your Fops in Wit politely place Satire in well dressed Numbers verfe in Lace. Numbers .make Satire , as fine Clothes a Beau; Brilliant alike, and less for Use than Show. Yet Scandal's Scandal"
0081500132_000002,"The works of the English poets. With prefaces, biographical and critical, by Samuel Johnson. ...",Samuel Johnson,34,0,2,0,0,0,1,0,0,1,1,0,0,0,0,0,0,0,1,0,0,0,0,0,0,0,4,1,0,2,0,3,0,0,1,0,0,1,0,0,4,1,1,6,4,0,1779,32,58,"London : printed by H. Hughs; for C. Bathurst, J. Buckland, W. Strahan, J. Rivington and Sons, T. Davies, T. Payne, L. Davis, W. Owen, B. White, S. Crowder, T. Caslon, T. Longman, B. Law, E. and C. Dilly, J. Dodsley, H. Baldwin, J. Wilkie, J. Robson, J. Johnson, T. Lowndes, T. Becket, G. Robinson, T. Cadell, W. Davis, J. Nichols, F. Newbery, T. Evans, J. Ridley, R. Baldwin, G. Nicol, Leigh and Sotheby, J. Bew, N. Conant, J. Murray, W. Fox, J. Bowen, MDCCLXXIX. [1779]-80.",London,383,male,1709,1784,TRUE,"not miilaken, For though the terror of his pen kept them for tome time in respect, yet on his death they role with unrestrained fury, in numerous coffeehouse tales, and gm rbftreet libels . The plan of this admirable Satire v. as artfully contrived to show, that the follies and"
0391300300_000020,A collection of original poems. By Samuel Derrick.,Samuel Derrick,32,0,0,0,0,0,0,0,0,1,1,1,0,1,3,1,0,0,0,0,0,1,1,1,0,0,0,1,2,0,0,0,0,2,2,1,1,1,1,1,2,1,4,0,2,0,1755,1,1,"London : printed for the author; and sold by A. Millar, in the Strand, M.DCC.LV. [1755].",London,257,male,1724,1769,FALSE,"her votary to the skies, Her shield is probity difplay'd, And peaceful happiness her prize. To ASHLEY COWPER, Esq; Occasioned by reading some Poetry of his writing . C owper, in some illustrious roll, shall fame , C To future times deliver down thy name, Loved as a nan and"
0089100205_000095,"The works of Alexander Pope Esq. In nine volumes, complete. With his last corrections, additions, and improvements: together with the commentary and notes of his editor.",Alexander Pope,33,0,6,0,0,0,1,0,1,0,0,1,1,0,0,0,0,2,1,0,0,0,2,0,0,0,2,0,0,5,0,0,4,1,1,0,1,0,0,0,3,0,0,1,0,0,1770,5,9,"London : printed for C. Bathurst, W. Strahan, J. and F. Rivington, R. Baldwin, W. Johnston, T. Caslon, T. Longman, B. Law, Johnson and Davenport, T. Davies, T. Cadell, and W. and J. Richardson, MDCCLXX. [1770].",London,357,male,1688,1744,TRUE,"caco M ift's 335 Mist's Weekly Journal, June 8 A long Letter, fiend W. A. Writ by some or other of the Club of Theobald, Dennis, Moore, Concanen, Cooke, who for some time held constant weekly meetings for these kind of perf; rmances. Daily Journal, June i1. A Letterfigned Philofcriblerus,"
1650500300_000056,"An essay upon the life, writings, and character, of Dr. Jonathan Swift. Interspersed with some occasional animadversions upon the remarks of a late critical author, and upon the observations of an anonymous writer on those remarks. By Deane Swift, Esq; To which is added, that sketch of Dr. Swift's life, written by the doctor himself, which was lately presented by the author of this essay to the University of Dublin.",Deane Swift,34,3,1,0,0,0,1,1,0,0,0,2,1,0,0,0,1,3,0,0,0,1,2,0,1,0,3,0,1,0,0,0,1,1,0,1,1,0,1,0,2,0,1,1,4,0,1755,1,1,"London : Printed for Charles Bathurst, at the Cross-Keys, opposite St. Dunstan's Church in Fleetstreet, MDCCLV. [1755].",London,440,male,1707,1783,FALSE,"the real beauties of an author , as well as to accompany his flights into the most difiant regions of poetry, without guide or monitor; we shall be very sparing in references and quotations of that sort. It may not, however, be amiss to ob. Q 4 serve serve in"
0852900106_000072,The Spectator. In eight volumes.,,29,1,5,1,0,0,0,0,0,0,0,2,0,0,0,0,0,0,1,0,0,1,0,1,0,0,0,1,0,2,1,1,1,0,1,0,3,1,0,0,0,1,1,2,2,0,1793,6,8,"London : printed for Harrison and Co. No 18, Paternoster Row, MDCCXCIII. [1793].",London,145,unknown,,,FALSE,"the eqtiialenti of his loss; and upon his good advice, wherein he clearly demonstrated the folly of such artifices, which can never end but in shame, and the ruin of all correspondence, I never after transgressed. Can your courtiers,  who take bribes, or your lawyers or physicians in their"
0647000201_000001,"The minstrel: in two books. With some other poems. By James Beattie, LL.D. To which are now added, miscellanies. By James Hay Beattie, A.M. With an account of his life and character. In two volumes. ...",James Hay Beattie,33,1,2,0,0,0,1,0,0,1,2,1,0,1,1,0,1,2,0,0,1,0,0,0,1,0,5,0,1,2,1,1,1,0,0,0,0,0,1,1,3,0,0,0,2,0,1799,1,2,"London : printed by T. Gillet, for C. Dilly; and sold by A. Brown, Aberdeen, 1799.",London,127,male,1768,1790,FALSE,"THE' MINSTREL; OR, THE PROGRESS OF GENIUS: WITH soime OTHER POEMS . BY JAMES BEATTIE, LL. D. a ]Jebo Ctition. ~ c~l'dlurwvz~.mst ewyuw. _ *~ ~~~( I 3jmtirel.£b krvr.£verl'2 ^!u^odó^9., yc. ^y^w/yna. THE MINSTREL: IN TWO BOOKS. WITH SOME OTHIER poelms. BY JAMES BEATTIE LL. D. / TO WHICH ARE"
0133700800_000009,"The life of Alexander Pope, Esq; with a view of his writings. And many curious anecdotes of his noble patrons. As well as of his cotemporary wits, friends, and foes. By W.H. Dilworth.","Dilworth, W. H.",40,0,7,0,0,2,2,0,0,2,2,1,0,0,0,0,0,0,1,0,0,1,2,1,1,0,0,0,1,2,0,5,3,1,0,0,1,0,1,0,1,0,1,2,0,0,1759,1,1,"London : printed for G. Wright, 1759.",London,149,unknown,,,FALSE,"see what - to pull the lion's skin from "" this little ass, which popular error has  thrown round him; and to show that "" this author , who has bean lately so "" much in vogue, has neither sense in his "" thoughts, nor English in his express"""
1651903100_000087,"The dunciad, in four books. Printed according to the complete copy found in the year 1742. With the prolegomena of scriblerus, and notes variorum. To which are added, several notes now first publish'd, the hypercritics of aristarchus, and his dissertation on the hero of the poem.",Mary Cooper,31,1,6,0,0,0,0,0,1,0,0,1,1,0,0,0,0,2,1,0,0,0,1,0,0,0,3,0,0,4,0,0,3,1,0,1,1,0,0,0,3,0,0,1,0,0,1743,1,1,"London : Printed for M. Cooper at the Globe in Pater-noster-row, MDCCXLIII. [1743].",London,436,female,,1761,FALSE,"Roberts, oaavo. The Arts of Logic and Rhetoric, partly taken from Bouhours, with new Reflections, c. By John Oldmixon, ocavo. Remarks on the Dunciad. By Mr. Dennis, dedicated to Theobald, otavo. A Supplement to the Profund. Anon. by Matthew Concanen, oclavo. Miff's Weekly Journal, June 8 A long Letter, signed"
0861600104_000017,"The works of Alexander Pope, Esq. In nine volumes, complete. With notes and illustrations by Joseph Warton, D.D. and others. ...",Alexander Pope,25,0,1,0,0,0,1,0,1,0,0,0,0,0,0,0,0,2,5,0,1,0,0,0,0,0,1,0,0,3,0,0,1,0,0,0,1,1,1,0,1,1,2,0,2,0,1797,4,9,"London : printed for B. Law, J. Johnson, C. Dilly, G. G. and J. Robinson, J. Nichols [and 13 others in London], 1797.",London,451,male,1688,1744,TRUE,"vritanda prorsus: : northeast tentes quod eficl non po/it; alterum, northeast ab eo, quod quis optine facit, in aliid, cui minus ejt idoneus, transferas. It was in this knowledge and cultivation of his genius that he had principally the advantage of his great master, Dryden; who, by his Mac flecno,"
0861800109_000034,"The works of Alexander Pope, Esq. In nine volumes, complete. With notes and illustrations by Joseph Warton, D.D. and others. ...",Alexander Pope,28,0,0,1,0,0,0,1,0,1,0,1,0,0,0,0,0,3,1,0,0,0,0,3,0,0,2,0,0,1,0,1,0,1,0,0,1,1,2,0,3,0,2,0,2,1,1797,9,9,"London : printed for B. Law, J. Johnson, C. Dilly, G. G. and J. Robinson, J. Nichols [and 13 others in London], 1797.",London,478,male,1688,1744,TRUE,"of no Lampoons upon her, either made by yourself, or by others, because you esteem her. I think it a vast pleasure that whenever two people of merit regard one another, so many scoundrels envy and are angry at them; tis bearing testimony to a merit they cannot reach; and."
0259500103_000091,"The works of Alexander Pope, Esq; In six volumes, complete. With his last corrections, additions, and improvements; together with all his notes.",Alexander Pope,31,1,6,0,0,0,1,3,0,0,0,0,0,0,0,0,0,0,0,1,1,0,1,0,1,0,4,0,1,2,1,1,0,1,0,0,1,1,0,0,0,0,1,1,1,1,1772,3,6,"London : [s.n.], Printed in the Year MDCCLXXII. [1772].",London,284,male,1688,1744,TRUE,"their power ; the frlt fktch of this poem was snatched from the fire by Dr. Swift, who persuaded his friend to proceed in it, and to him it was therefore inscribed. But the occasion. of printing it was as frllows : There was publflied in those Miscellanies, atreatife of"
0089100402_000041,The works of Mr. Alexander Pope. Volume II.,Alexander Pope,36,0,6,1,0,0,2,1,0,0,0,1,2,0,0,0,1,0,0,0,0,3,2,0,0,0,1,0,0,1,2,3,2,1,0,2,0,1,0,1,0,0,0,1,2,0,1735,2,2,"London : printed by J. Wright, for Lawton Gilliver at Homer's Head in Fleetstreet, MDCCXXXV. [1735].",London,473,male,1688,1744,TRUE,"con cern'd, or surprise, if this or that Scribbler was proved a Dunce; but every one was curious to read what could be said to prove Mr. Pope one, and was ready to pay something for such a discovery: A firatagem which would they fairly own, might not only reconcile"
0239500103_000048,"The lucubrations of Isaac Bickerstaff, Esq.",Joseph Addison,33,1,3,2,0,1,1,2,0,0,0,1,1,0,0,0,1,0,4,0,1,1,2,1,0,0,0,0,0,1,0,0,1,2,1,0,1,0,0,0,1,1,3,0,0,0,1786,3,6,"London : printed for C. Bathurst, J. Buckland, J. Rivington and Sons, W. Owen, R. Horsfield , B. White and son, T. Longman, B. Law, C. Rivington, J. Dodsley, H. Baldwinm G.G.J. and J. Robinson, C. Dilly, T. Cadell, J. Nichols, R. Baldwin, W. Goldsmith, J. Johnson, W. Flexney, W. Nicoll, G. Burnett, C.D. Piguenitt, G. and T. Wilxie, W. Fox, M. Say, and E. Newbery., M DCC LXXVI. [1786].",London,418,male,1672,1719,TRUE,"the actors. The friend consented, and to reading they went. They had not gone over three similes, before Roscius the.player made the acting author stop, and desired to know, ( what he meant by such a rapture? ""and CC and how it came to pass, that in this condi C"
1669500600_000001,"An essay on man. By Alex. Pope, Esq.",Alexander Pope,40,1,3,0,0,0,0,0,0,2,1,0,1,0,1,0,0,1,0,0,0,0,0,0,0,0,2,1,1,0,0,0,0,2,3,0,0,1,0,2,2,6,2,2,5,1,1797,1,1,"Edinburgh : Printed by T. Maccliesh & Co. and sold by the Society of booksellers, 1797.",Edinburgh,60,male,1688,1744,TRUE,"AN ESSAY ON MAN. BY ALEX. POPE, esc As when some student first with curious eye, Through' Nature's wondrous frame attempts to pry; His doubtful reason seeming faults surprise -- - He asks if this be just, if that be wise? Storms, tempests, earthquakes, Virtue in distress, And Vice unpunished,"
0388201300_000002,"An epistle from Mr. Pope, to Dr. Arbuthnot.",Alexander Pope,28,0,1,0,0,0,0,0,0,0,3,0,0,1,0,0,0,0,1,0,0,0,0,1,0,0,1,1,0,3,0,0,1,3,1,1,1,0,1,0,0,0,2,0,5,1,1734,1,1,"London [i.e. Edinburgh] : printed by J. Wright, for Lawton Gilliver, 1734 [1735].",Edinburgh,24,male,1688,1744,TRUE,"Grubflreet will my fame defend, And, more abusive, calls himfelfmy friend. This prints my Letters, that expeets a Bribe, And others roar aloud, "" Subscribe, subscribe. There are, who to my Person pay their court, 15 I cough like Horace, and though' lean, am short, Aminmo's great Son one shoulder"
0433400600_000021,"Remarks on the life and writings of Dr. Jonathan Swift, Dean of St. Patrick's, Dublin, in a series of letters from John Earl of Orrery to his son, the Honourable Hamilton Boyle.","John Boyle, 5th Earl of Cork",35,0,1,1,0,1,1,0,0,0,0,1,0,0,1,0,2,1,0,0,1,0,0,0,0,0,3,1,2,4,1,1,0,2,0,2,0,0,0,0,0,2,2,3,2,0,1752,1,1,"London : printed for A. Millar, opposite to Catharine-Street in the Strand, MDCCLII. [1752].",London,350,male,1707,1762,FALSE,"not even to the Grand Signor himself. To these Ladies , SWIFT owed the publication of many pieces, which ought never to have been delivered to the press. He communicated every composition as soon soon as finished, to his female senate, who, not only passed their judgement on the performance,"
0112600201_000002,"The works of Alexander Pope, Esq. In ten volumes complete. With his last corrections, additions, and improvements; together with all his notes, as they were delivered to the editor a little before his death: printed verbatim from the octavo edition of Mr. Warburton.",Alexander Pope,42,0,4,0,0,0,0,0,0,1,0,0,0,0,0,0,0,0,1,0,0,0,0,0,1,0,6,2,0,3,0,2,3,0,4,0,0,0,0,0,5,1,1,4,4,0,1757,1,10,"London : printed for A. Millar; J. and R. Tonson; H. Lintot; and C. Bathurst, MDCCLVII. [1757].",London,230,male,1688,1744,TRUE,"The rest, together with others of the like sort from his manufcript copy of the other Ethic Epilles, are here inserted at the bottom of the page, under the title of Yariations. The FOURTH Volume contains the Satires ; with their Prologue, the epif/le to Dr. Arbuthnot; and Epilogue, the"
1773100100_000020,"The Dunciad. With notes variorum, and the prolegomena of Scriblerus. Written in the year, 1727.",Alexander Pope,28,0,2,0,1,1,3,0,1,0,0,0,1,0,1,0,0,0,0,1,0,0,0,1,2,2,2,0,1,2,0,1,0,0,0,1,0,0,0,0,3,0,0,0,2,0,1735,1,1,"[London, 1735].",London,217,male,1688,1744,TRUE,"not tyre the reader. Let us rather recreate thee by turning to the other fide, and ihewing his character drawn by those with whom he never con versed , and whose countenances he .could not know, though' turned against him: Firif again commencing with the high voiced, and never enough"
0499400900_000006,"The examiner. A satire. By Arthur Murphy, Esq;",Arthur Murphy,28,1,0,0,0,0,0,0,0,2,0,1,1,0,3,1,1,0,0,0,0,0,1,1,0,0,1,0,0,1,0,0,0,1,1,1,3,1,0,3,0,0,3,1,0,0,1761,1,1,"London : printed for J. Coote, at the King's Arms in Pater-Noster-Row, MDCCLXI. [1761].",London,31,male,1727,1805,TRUE,"request! Then at his patron railed with ranc'rous heart , And from accomplice played th' informer's part. A figure, which the loves and joys forsake, Which would each prostitute a vestal make; But that all virtue still to put to flight, He panders schoolboys to the soul delight. Despise by"
0096102403_000089,"The works of Alexander Pope, Esq. In six volumes complete. With his last corrections, additions, and improvements; Together with all his notes, as they were delivered to the editor a little before his death: printed verbatim from the octavo edition of Mr. Warburton.",Alexander Pope,33,1,4,0,0,0,0,2,0,0,0,1,2,0,0,0,0,0,0,1,0,0,1,0,1,0,2,2,1,2,0,1,2,2,0,0,1,1,1,0,2,0,1,1,1,0,1787,3,6,"London : printed for C. Bathurst, J. Rivington & Sons, B. White, T. Longman, B. Law, S. Crowder, J. Robson, J. Johnson, J. Knox, G. Robinson & Co. T. Cadell, J. Nichols, R. Baldwin, and J. Bew, MDCCLXXXVIII. [1787-1788].",London,298,male,1688,1744,TRUE,"great Anarch! lets the curtain fall; 65 And universal Darkness buries All. THE EKD OF THE FO1 rtr b0oi, By the AUTHOR A DECLARATION. Ell. i E, RT tertain Haberdashers of Points and Particles, being itlligatet LI the spirit of Pride, anl atunling to tljtemelite£ tlje lnane of Critics sant"
0384000505_000041,"The works of Alexander Pope, Esq. In ten volumes complete. With his last corrections, additions, and improvements. Together with all his notes, as they were delivered to the Editor a little before his Death: printed verbatim from the octavo edition of Mr. Warburton.",Alexander Pope,30,0,4,0,0,1,0,0,3,0,1,0,0,0,0,0,0,2,2,0,0,1,3,0,0,0,0,0,0,2,1,1,0,0,1,0,2,1,0,0,2,0,0,3,0,0,1764,5,10,"Dublin : printed by J. Potts, at Swift's-Head, in Dame-Street; and J. Williams, in Skinner-Row, MDCCLXIV. [1764].",Dublin,240,male,1688,1744,TRUE,"thy page "" Its own celestial fire; a While Critics, and.while Bards in rage. .' Admiring, won't admire: "" While wayward pens thy worth affsil, "" And envious tongues decrv; ós These times though' many a Friend beewail, "" These times bewail not I"" "" when the World's'loud praise is"
0226900201_000002,"The works of Alexander Pope Esq. In nine volumes, complete. With his last corrections, additions, and improvements; As they were delivered to the Editor, a little before his Death. Together with the commentary and notes of Mr. Warburton.",Alexander Pope,40,0,4,0,0,0,0,0,0,1,0,0,1,0,0,0,0,0,1,0,0,0,0,0,1,0,5,2,0,3,0,3,3,0,3,0,0,0,0,0,3,1,1,4,4,0,1757,1,9,"London : printed for A. Millar, J. and R. Tonson, H. Lintot, and C. Bathurst, MDCCLVII. [1757].",London,258,male,1688,1744,TRUE,"Variations, or additional verses from the Author's Manuscripts. The epilgr!ze to the Satires is likewise enriched with many and large notes, now first printed from the Author's own Manuscript. The FIFTH Volume contains a corre&er and completer Edition of the Dunciad than hath been hitherto published ; of which, at"
0069500202_000257,"The law-dictionary: explaining the rise, progress, and present state, of the English law, in theory and practice; ... Originally compiled by Giles Jacob; and continued by him, and other editors, through ten editions: now greatly enlarged and improved, ... by T. E. Tomlins, ... In two volumes. ...",Giles Jacob,55,0,1,0,0,0,1,1,1,0,1,1,0,0,0,0,1,1,23,0,0,0,1,0,1,0,0,1,0,2,4,2,2,1,0,0,2,0,0,0,0,0,0,0,8,0,1797,2,2,"London : printed by Andrew Strahan; for T. Longman, B. Law, C. Dilly, G. G. & J. Robinson, [and 22 others in London], 1797.",London,877,male,1686,1744,FALSE,"nwhatever renders a man ridiculous, or lowers him in the ciceem and opiniloi of the world, amounts to a Libel ; though the f.me ex B b z prciiions, LIBEL I. LIBEL I. preions, if spoken, would not have been defamation: tends to a breach of the peace. Hob. ar:"
0992100500_000003,The works of Mr. Alexander Pope.,Alexander Pope,38,4,1,1,0,0,0,0,0,1,0,1,1,0,1,0,0,0,0,0,0,0,0,3,1,0,2,0,0,1,1,4,0,1,0,1,0,1,0,1,5,0,3,2,2,0,1717,1,1,"London : printed by W. Bowyer, for Bernard Lintot between the Temple-Gates, 1717.",London,422,male,1688,1744,TRUE,"never made his talents subservient to the mean and unworthy ends of Party or felf intereft; the gratification of public prejudices, or private passions; the flattery of the undeserving, or the insult of the unfortunate. If I have written well, let it be considered that tis what no man can"
0458100202_000027,The works of Mr. Alexander Pope. Volume II.,Alexander Pope,29,0,1,1,0,0,0,0,0,1,2,0,1,0,1,0,0,1,1,0,1,0,0,1,0,0,1,0,0,0,0,0,0,1,2,0,1,1,0,1,3,0,5,0,3,0,1735,2,2,"London : printed by J. Wright, for Lawton Gilliver at Homer's Head in Fleetstreet, MDCCXXXV. [1735].",London,481,male,1688,1744,TRUE,"wonder?) came not nigh, Dryden alone escape this judging eye: But frill the Great have kindness in'referve, He helped to bury him he helped to itarve. May some choice Patron bless each grey goose quill May every Bavius have his Bufo still! So, when a Statesman wants a Day's defence,"
0534800106_000060,"The works of Alexander Pope, Esq. In six volumes complete. With his last corrections, additions, and improvements; together with All his notes, as they were delivered to the Editor a little before his Death: printed verbatim from the octavo edition of Mr. Warburton.",Alexander Pope,27,0,0,1,0,0,0,1,0,1,0,1,1,1,0,0,0,4,1,0,0,0,0,3,0,0,2,0,0,1,0,0,0,1,0,0,1,1,0,0,2,0,2,0,2,1,1776,6,6,"London : printed for C. Bathurst, W. Strahan, J. & F. Rivington, R. Baldwin, T. Caslon, T. Longman, B. Law, J. Johnson, T. Davies, T. Cadell, W. & J. Richardson, and E. Johnston, MDCCLXXVI. [1776].",London,374,male,1688,1744,TRUE,"her, and abuse her every day, if she is so. I wonder I hear of no Lampoons upon her, either made by yourself, or by others because you ereem her. I think it a vail pleasure that whenever tvo people of merit re. guard one another, so many fcoundrcls envy"
1130000203_000011,"The works of Alexander Pope Esq; Vol. III. Part II. Containing the Dunciad, and notes of Scriblerus.",Alexander Pope,42,0,11,1,0,2,0,0,1,0,1,0,2,0,0,0,0,0,3,0,0,0,1,0,1,0,1,0,1,4,1,3,2,0,0,0,1,0,0,0,1,0,3,2,0,0,1741,3,3,"London : printed for Henry Lintot, 1741.",London,255,male,1688,1744,TRUE,"British freeholder, I am in a particular manner pleased with the la. "" hours of those who have improved our language,,  with the translation of old Greek and Latin authors : We have already most of their Historians in our own tongue, and what is more for the ho"""
0869800801_000002,"The works of Alexander Pope, Esq. complete. With his last corrections, additions, and improvements: together with the commentary and notes of his editor. A new edition, in five volumes. To which is annexed the life of the author, compiled from Original Manuscripts, with a Critical Essay on his Writings and Genius. By Owen Ruffhead, Esq.",Alexander Pope,48,0,8,0,0,0,1,0,0,0,0,1,1,0,0,0,0,0,1,0,0,0,1,0,1,0,7,3,1,4,0,2,4,0,4,0,0,0,0,0,4,0,0,3,2,0,1769,1,5,"London : printed for C. Bathurst, H. Woodfall, W. Strahan, J. and F. Rivington, W. Johnston, B. White, T. Caslon, T. Longman, B. Law, Johnson and Payne, S. Bladon, T. Cadell, and the Executors of A. Millar, MDCCLXIX. [1769].",London,579,male,1688,1744,TRUE,"FUTUR: E ALTERATIONS."" His la 1 Jill and 7etlament. VOL. I. B which which the beit Artists in Paper, Printing , and Sculpture could bestow upon it. If the Public hath waited longer than the deference due to it's; generous impatience for the Author's writings should have suffered, it was"
0534800200_000007,An historical rhapsody on Mr. Pope. By the editor of The political conferences.,Thomas Tyers,36,0,2,1,0,0,2,0,0,0,0,0,0,0,0,0,0,0,3,0,0,1,0,0,1,0,1,2,1,1,0,2,2,1,5,0,0,0,1,0,1,5,0,1,3,0,1782,1,1,"London : printed for T. Cadell, in the Strand, MDCCLXXXII. [1782].",London,101,male,1726,1787,FALSE,"his enemies, it was grateful to his friends. It was having his story from his own mouth. He does not value himself so much upon his faults and his failings, as the Gascon, and perhaps had not so many of which he would have boasted. But fjt he publishes ,"
1144200101_000005,"Hudibras redivivus: or a burlesque poem on the times. In two volumes. The third edition. To which is added an apology, and some other improvements throughout the whole, by the author, Edward Ward, gent.",Ned Ward,29,0,3,1,0,1,0,0,0,1,0,0,0,2,0,0,0,1,0,0,5,2,1,1,0,0,1,0,2,0,0,0,0,0,0,2,2,1,0,0,0,0,2,0,1,0,1715,1,2,"London : printed for George Sawbridge, at the Three Flower-de-Luces in Little Britain. MDCCXV. The two Volumes are twelve Parts each Volume, 12 s. compleat, or single Parts at 6 d each Part. Likewise the London Spy, 4 Volumes compleat, by the same Author, and his other Works, may be had as above, [1715] [1714].",London,340,male,1667,1731,FALSE,"very selves elect; We muss be Blockheads first to choose em, Or very Rascals to abuse em: For he that thinks with Scandal's Dart, To wound a Magiisrate a part From his Authority , declares By th' gross Affront, he little cares Per tlh Power or Dignity lie bears nto"
0381200200_000060,"The pursuits of literature, a satirical poem in four dialogues. With notes.",Thomas James Mathias,36,1,2,1,0,0,0,2,2,0,0,4,0,0,0,1,0,0,0,0,0,0,1,0,0,0,4,1,0,4,0,7,1,1,1,0,1,0,0,0,0,0,0,1,1,0,1799,1,1,"Dublin : printed for J. Milliken, 32, Grafton-Street, 1799.",Dublin,447,male,1754,1835,FALSE,"Commentators of Shakespeare, (See Dial. the First of the P. of L and the translators (not quite The Setpua. gint) of Grey's Elegy into Greek, See Dial. 3 of the P. of L V I. to V 60 [ 234 1 None shall HER column's stately pride deface: The snake"
0237600500_000009,"The dunciad. With notes variorum, and the prolegomena of Scriblerus.",Alexander Pope,25,0,2,0,1,1,0,0,1,1,0,0,0,0,0,0,0,0,0,1,0,1,0,1,2,2,1,0,1,3,0,1,1,0,0,1,0,0,0,0,2,0,0,1,1,0,1729,1,1,"London : printed for Lawton Gilliver at Homer's Head, against St. Dunstan's Church, Fleetstreet, 1729.",London,240,male,1688,1744,TRUE,"WALTER HART, in this Apoitrophe. e. O! ever worthy, ever crowned with praise Blessed in thy life, and blessed in all thy lays. Add, that the Silfers every thought refine And even the lisse befaultlefs as thy line. Vet envy Atin with fiercer rage pursues, Obscures the virtue, and defames"
