1112900400_000028,"A comparative view of the state and faculties of man with those of the animal world. By John Gregory, M. D. F. R. S. Professor of Medicine in the University of Edinburgh, and First Physician to His Majesty in Scotland.",John Gregory,77,0,2,3,0,1,1,2,0,2,2,0,1,3,1,0,0,1,3,0,0,0,0,0,0,0,0,1,2,6,1,15,0,0,0,2,0,3,2,1,2,2,1,0,0,2,0,0,0,2,0,0,0,1,5,0,0,0,3,1,0,1,1,1,0,1785,1,1,"London : printed for J. Dodsley in Pall-Mall, M.DCC.LXXXV. [1785].",London,317,male,1724,1773,FALSE,"yet an object that has once been conneted with them, will often awake the emotion, though it cannot recall M 3 t[ [ ] to. remembrance the original cause of it. * Similar associations are formed , by the appropriations, in a great measure accidental, which different nations have given"
1694000500_000055,"An essay on practical musical composition, according to the nature of that science and the principles of the greatest musical authors. By Augustus Frederic Christopher Kollmann, organist of His Majesty's German Chapel at St. James.",Augustus Frederic Christopher Kollmann,78,4,0,0,0,0,0,2,0,0,0,0,0,1,0,0,0,0,0,0,2,0,5,0,0,0,1,0,1,3,0,5,1,1,0,1,0,7,0,0,0,0,0,3,0,1,0,4,1,1,0,0,0,0,0,3,4,0,0,1,5,4,0,17,0,1799,1,1,"London : Printed for the author, (Friary, St. James's palace,) and to be had of him; at Mr. Dale's, No. 19, Cornhill, and No. 132, Oxford Street;-at Messrs. Longman, Clementi, and Co. No. 26, Cheapside;-at Mr. Smart's, the corner of Argyll Street, Oxford Street; and at the other principal music shops; also at Mr. Low's, No. 7, Berwick Street, Soho, M,DCC,XCIX. [1799].",London,197,male,1756,1829,FALSE,"of his verse , if he cannot have every foot of the metre fitridly accented without giving up an important word or sentiment ; but every principal word of the text must be placed in such a part of the measure and expressed with such a harmony and melody ,"
0013905400_000044,"Malcolm's Treatise of music, speculative, practical, and historical. Corrected and abridged, by an eminent musician.",Alexander Malcolm,90,0,9,2,1,0,0,1,0,1,0,0,1,0,0,0,0,0,0,0,0,2,3,0,0,0,0,1,0,1,4,9,10,0,4,0,0,1,0,0,3,1,0,0,0,0,2,1,1,1,2,0,0,1,0,4,5,0,0,0,5,2,2,10,0,1776,1,1,"London : printed for J. French, No. 47, Holborn, M,DCC,LXXVI. [1776].",London,112,male,1685,1763,FALSE,"notices, that after the change of the ancient pronunciation, and the corruption of their language , the nufic decayed till it became a poor and infigniicanr art . Their odes had a regular return of the fanie kind of very; and: the same quantity of syllables in the same place"
0891200500_000172,"A general history of music, from the earliest ages to the present period. By Charles Burney, Mus.D. F.R.S. Volume the first.",Charles Burney,60,4,1,3,0,0,0,0,0,0,0,0,3,0,0,0,0,0,0,1,0,0,5,1,0,4,1,0,3,2,1,6,2,0,0,0,0,0,0,0,0,3,1,0,0,1,1,0,0,2,1,0,0,0,0,1,2,0,4,1,2,1,2,0,1,1789,1,1,"London : printed for the author: and sold by Payne and Son, at the Mews-Gate; Robson and Clark, Bond-Street; and G. G. J. and J. Robinson, Paternoster-Row, MDCCLXXXIX. [1789].",London,546,male,1726,1814,TRUE,"were now lublifling of the excellence of the oetry, Eloquence, Sculpture, and Architecture of ancient Greece, than of its Mule, we lhollld, probably, be as incurious and incredulous about them, as we are, at prefcllt, concerning the Muliec (f the Sphercs. bcl re I concldtle this chapter, perhaps a short"
0169200500_000019,"An essay on the power of numbers, and the principles of harmony in poetical compositions.",John Mason,63,0,1,2,0,1,0,0,0,0,0,0,3,0,0,3,1,0,0,0,0,1,5,0,0,0,0,0,0,1,4,11,1,2,7,0,1,1,0,0,0,0,0,1,0,0,1,0,1,0,0,0,1,0,1,0,7,0,1,1,1,1,0,2,0,1749,1,1,"London : printed by James Waugh, for M. Cooper, at the Globe in Pater-Noster Row, MDCCXLIX. [1749].",London,118,male,1706,1763,FALSE,"to divide Music , as Nature seems to have intended, into the Male and the Fe M a male. [12] male. The first hath strength, the second hath softness; and sweetness belongs to them both. 3 0 UR Minor Tone is improved by borrowing from its Major Tone a major"
1172300300_000126,A complete dictionary of music. Consisting of a copious explanation of all words necessary to a true knowledge and understanding of music. Translated from the original French of J. J. Rousseau. By William Waring.,Jean-Jacques Rousseau,74,1,1,5,1,0,0,0,0,0,0,3,1,3,2,0,0,0,0,3,0,1,5,6,0,0,4,1,1,2,0,7,2,1,0,0,1,0,1,3,1,3,0,0,0,0,0,2,0,2,1,0,0,0,0,0,1,0,1,0,1,0,1,6,0,1779,1,1,"London : printed for J. Murray , No. 32, Fleet-Street ; and Luke White, Dublin, MDCCLXXIX. [1779].",London,471,male,1712,1778,TRUE,"agreement with the regularity of measure . Syllables mute without sound , articulations which are rough, sounds little harmonious and less varied, are with difficulty conneced to melody ; and a poetry cadenc'd by the number of yllablles only, receives a harmony little felt in musical rhyme, and is incefhantly"
0092400701_000018,"Biographia classica: the lives and characters of all the classic authors, The Grecian and Roman Poets, Historians, Orators, and Biographers. With An Historical and Critical Account of Them and Their Writings: Illustrating their several Excellencies, and shewing their Defects, from the Judgment and Remarks of the most Celebrated Critics, both Ancient and Modern.",,58,0,3,2,0,2,0,1,0,0,1,2,2,0,1,1,1,1,0,2,0,1,0,2,0,2,1,2,0,0,1,1,4,0,4,0,0,0,0,0,2,4,1,0,0,0,0,1,2,0,1,0,0,1,0,1,0,0,3,0,4,0,0,0,1,1750,1,2,"London : printed for Daniel Browne, at the Black Swan, without Temple-Bar, MDCCL. [1750].",London,345,unknown,,,FALSE,"the Death of Cyrus the Teians had been flffered to rein habit their Country unmolested;) here he remained till the Revolt of hijliaeus, on which account, as Suidas tells us, he was obliged once more to fly to dldera, where he died. As his own Verses confess his great Age"
1016700601_000141,"A general history of music, from the earliest ages to the present period. To which is prefixed, A dissertation on the music of the ancients. By Charles Burney, Mus.D. F.R.S. ...",Charles Burney,55,0,2,0,2,0,1,1,0,1,0,1,0,0,0,2,0,0,0,1,1,2,0,0,0,0,1,2,1,3,1,10,0,0,1,0,0,0,0,0,2,2,0,0,0,0,0,2,2,2,1,0,0,1,0,3,0,0,5,0,1,0,1,0,0,1776,1,4,"London : printed for the author: and sold by T. Becket, Strand; J. Robson, New Bond-Street; and G. Robinson, Paternoster-Row, MDCCLXXVI. [1776]-89.",London,594,male,1726,1814,TRUE,"of Phrygia, and cotemporary with Erichthonius, who instituted the Panathenaean games at Athens, 500o B. C was the inventor of the Flute, and Phrygian mode; as well as of the Nomes, or airs, that were sung to the mother of the Gods , to Bacchus, to Pan, and to some"
1172300300_000024,A complete dictionary of music. Consisting of a copious explanation of all words necessary to a true knowledge and understanding of music. Translated from the original French of J. J. Rousseau. By William Waring.,Jean-Jacques Rousseau,65,0,2,2,1,0,2,1,1,2,2,0,1,1,0,1,0,0,0,1,2,3,1,1,0,0,1,0,3,0,0,3,3,0,0,0,4,4,0,1,1,0,0,0,0,0,1,3,0,3,1,0,0,0,0,6,0,0,1,0,1,0,3,2,0,1779,1,1,"London : printed for J. Murray , No. 32, Fleet-Street ; and Luke White, Dublin, MDCCLXXIX. [1779].",London,471,male,1712,1778,TRUE,"pauif, there is no time for making ievcral concords pass, and the canon cannot fail of being monotonous. But it is a nmtliod of nmaking without much trouble, a canon at whatever part we please, for a canon of four measures only will be instantly of eight, if they follow"
1016700601_000042,"A general history of music, from the earliest ages to the present period. To which is prefixed, A dissertation on the music of the ancients. By Charles Burney, Mus.D. F.R.S. ...",Charles Burney,87,0,12,0,5,0,1,1,0,0,0,0,2,0,0,17,0,0,0,0,0,0,1,0,0,1,2,1,1,6,2,12,0,1,0,0,0,1,0,0,0,1,0,0,0,0,0,0,0,8,1,0,0,1,0,2,0,0,3,0,3,2,0,0,0,1776,1,4,"London : printed for the author: and sold by T. Becket, Strand; J. Robson, New Bond-Street; and G. Robinson, Paternoster-Row, MDCCLXXVI. [1776]-89.",London,594,male,1726,1814,TRUE,"mentioned by ancient authors , the determining to which of them there hymns appertain, would be difficult. Besides, the hymn to Ncmefis is by some attributed to a poet named Mefo'mes, who flourifled under the emperor Justinian; but M. Burette thinks the name Mefodmes, corrupted from mejbmedes; and Capitolinus in"
0797500102_001490,"An universal history of arts and sciences: ... The whole extracted from the best authors in all languages, ... By ... Dennis De Coetlogon, ...","De Coetlogon, Dennis",68,0,2,0,2,2,0,0,0,0,0,1,1,0,0,0,0,1,0,3,0,5,0,1,0,0,2,2,1,0,2,2,3,4,8,0,0,0,0,1,1,2,0,1,0,0,0,0,3,0,0,0,2,0,0,1,1,1,0,3,6,1,0,2,1,1745,2,2,"London : printed and sold by John Hart, 1745.",London,1346,unknown,,,FALSE,"Accordingly, he wrote Difcoulrfls under pears from Scripture to have been in Use about a line Title ol Snatrs, in which he took the Liberty of mix thousand Years before that Poet. The Charaferiftick i: : g several Sorts of Verses together, as Hexametcrs with of lyric Poetry , which"
0496000700_000045,"The critical spelling-book an introduction to reading and writing readily and correctly. In a manner more commodious than any, and more comprehensive than all the spelling-books that ever were publisht. Designd-For a standard of the language: and contrivd by a proper gradation of instructions, disposd in a picturesque manner, for the easy and expeditious attaining-to a rational knowledge of it.","Lowe, Solomon",89,3,1,1,0,2,0,3,0,1,1,0,1,2,0,0,1,0,0,0,0,5,1,0,0,0,1,1,3,0,0,0,1,1,3,1,1,0,0,0,6,4,0,1,0,0,6,1,1,1,0,0,0,0,0,0,16,0,2,1,15,0,0,1,0,1755,1,1,"London : printed for D. Henry and R. Cave, at St John's Gate, M.DCC.LV [1755].",London,209,male,,,FALSE,"of fools offends at any time ; But most of all the zeal of fools in rhyme. pop.. XII POEMS , OR Compositions in Metre of various Kinds , according to the Rules of engl7if Poetry . Oetry may be defined the art of casting words into harmonious metre, or"
0106900602_000048,"Essays on the nature and immutability of truth, in opposition to sophistry and scepticism; on poetry and music, as they affect the mind; on laughter, and ludicrous composition; and, on the utility of classical learning. By James Beattie, ... In two volumes. ...",James Beattie,85,0,2,11,3,0,0,2,0,0,5,0,1,2,0,0,0,0,0,2,8,1,3,0,0,0,0,1,0,1,3,9,1,1,0,0,0,2,2,1,1,5,0,0,0,0,0,0,1,4,1,0,0,0,0,0,0,0,5,1,2,2,0,2,0,1778,2,2,"Dublin : printed for C. Jenkin, 1778.",Dublin,499,male,1735,1803,FALSE,"finest pictures, the finest musical compositions , and some of the finest poems in the world. Tlhe iixteenth century does indeed great honour to Italian genius . The ambition of Alexander the Sixth, and Julius the Second, had railed the Papal power to higher eminence, and fettled it on a"
1543300102_000028,"The works of the late John Gregory, M.D.",John Gregory,75,0,0,2,0,1,1,4,1,1,3,0,0,3,1,0,0,1,1,0,0,0,0,0,0,0,0,2,1,4,0,10,1,1,0,2,0,4,1,2,2,2,1,0,0,4,0,0,0,1,0,0,0,3,5,1,0,0,4,1,0,1,1,2,0,1788,2,4,"[Edinburgh : printed for A. Strahan, and T. Cadell, London; and W. Creech, Edinburgh, 1788].",Edinburgh,324,male,1724,1773,FALSE,"men's t feelings and passions are firong, because they are never disguised nor restrained; their imaginations are warm and luxuriant, from never having suffered any check. This disposes them to that enthusiasm so favourable to poetry and music . The es: : * De Legibus... This subject is treated with"
0208800401_000020,"Lectures on the sacred poetry of the Hebrews; translated from the Latin of the Right Rev. Robert Lowth, D. D. Late Praelector of Poetry in the University of Oxford, and Now Lord Bishop of London, by G. Gregory, F. A. S. Author of Essays Historical and Moral. To which are Added, The Principal Notes of Professor Michaelis, and Notes by the Translator and Others. ...",Robert Lowth,92,0,0,0,2,4,0,3,2,6,2,0,6,1,0,0,0,0,0,0,0,1,9,0,0,0,0,2,2,1,0,1,2,3,0,0,0,1,0,1,5,7,0,2,3,0,1,2,0,0,0,0,0,0,0,1,2,0,0,3,9,2,2,4,0,1787,1,2,"London : printed for J. Johnson, No. 72, St. Paul's Church-Yard, M.DCC.LXXXVII. [1787].",London,421,male,1710,1787,TRUE,"So that as the poems divide themselves in a manner spontaneously into periods, for the most part equal; so the periods themselves are divided into verses , most commonly couplets, though frequently of greater length. This is chiefly observable in those passages, which frequently occur in the Hebrew poetry ,"
0912200900_000063,"Historical memoirs of the Irish bards. Interspersed with anecdotes of, and occasional observations on the music of Ireland. Also, an historical and descriptive account of the musical instruments of the ancient Irish. And an appendix, containing several biographical and other papers, with select irish melodies. By Joseph C. Walker, Member of the Royal Irish Academy.","Walker, Joseph Cooper",65,1,1,0,0,1,4,2,0,2,0,0,4,3,0,10,0,0,0,2,0,2,0,0,0,0,0,0,1,2,0,6,0,1,3,1,0,0,2,0,1,1,1,0,0,0,0,2,3,0,2,2,0,2,0,0,0,0,1,0,1,0,0,1,0,1786,1,1,"London : printed for T. Payne and son at the Mews-Gate, and G. G. J. and J. Robinson, Pater-Noster-Row, MDCCLXXXVI. [1786].",London,299,unknown,,,FALSE,between the Roman and Gallican ritual to confit in their Church Music . St. Paul (f) desires the Ephesians to speak to each other in psalms and hymns and spiritual songs . He here seems to make use of a harsh expression to avoid introducing a heathen term (g). With
0053000107_000001,"The works of the Rev. Isaac Watts, D.D. In seven volumes. Vol. I. Containing Sermons,",Isaac Watts,92,0,0,2,1,1,2,0,0,0,0,9,0,0,2,7,0,0,1,1,0,1,2,1,6,0,4,1,0,2,0,0,0,0,0,1,0,3,2,0,3,0,0,1,0,0,3,6,12,0,2,4,0,1,0,2,0,1,2,0,1,0,2,3,0,1800,7,7,"Leeds : printed by Edward Baines; for the editor; for Conder, Bucklersbury; Chapman, Fleet-Street; Button, Paternoster-Row; Williams, Stationers'-Court; Ogle, Great-Turn-Stile, and Baynes, Paternoster-Row, London; and for Edward Baines, Leeds, [1800?].",Leeds,544,male,1674,1748,TRUE,".w REV. ISAAC WATTS, D. D. IN SEVEN VOLUMES. VOL. VII CONTAINING AN ESSAY ON PSALMODY; TIE PSALMS OP DAVID; HYMNS AND SPIRITUAL SONGS ; DIVINE SONGS FOR CHILDIREN; LYRIC POEMS ; RELIQUIE JUVENILES; AND REMNANTS OF TIME . LEEDS: PRINTED ebr DWARD BAINES; FOR THE EDITOR; CONDER, bucklersbulry; CHAPMAN,"
0374200400_000003,"The odes, epodes, and carmen seculare of Horace, translated into English prose, as near the original as the different idioms of the Latin and English languages will allow: with the Latin text and order of construction in the opposite page, and Critical, Historical, Geographical, and Classical notes, in English; from the best commentators, both antient and modern. And A Preface to each Ode, illustrating its Difficulties, and shewing its several Ornaments and Design. Also The Method of Scanning the several Sorts of Verse made use of by Horace; and a Table, shewing at one View of what Sort of Verse each Ode consists. For the Use of Schools as well as of Private Gentlemen.",Horace,99,0,1,0,2,0,0,0,0,1,4,3,6,1,0,0,6,0,0,3,0,5,1,1,0,1,20,0,0,0,0,0,3,1,4,0,0,0,2,0,2,14,1,0,0,0,0,1,3,0,0,0,0,0,1,0,0,0,4,1,4,0,1,0,2,1760,1,1,"London : printed for C. Hitch & L. Hawes, R. Baldwin, W. Johnston, J. Ward, G. Keith, J. Wren, P. Stevens, S. Crowder and Co. P. Davey and B. Law, J. Marshall, and T. Field, M.DCC.LX. [1760].",London,548,male,,,FALSE,"them to give each kind of Poetry the Verse moult proper to it, Lyric Poetry changed its Tone, and assumed a greater Freedom than any other, by admitting all Kinds of Verse , the Pentameter'alone excepted.. What: Poets were the Authors of these Changes we know not, but Lyric Poetry"
1172300300_000150,A complete dictionary of music. Consisting of a copious explanation of all words necessary to a true knowledge and understanding of music. Translated from the original French of J. J. Rousseau. By William Waring.,Jean-Jacques Rousseau,83,1,5,2,0,0,0,1,1,1,0,0,0,0,0,0,0,2,0,2,3,2,4,2,0,0,0,1,2,4,1,10,2,2,0,0,1,6,0,0,0,4,0,1,0,1,0,1,0,0,0,0,0,0,0,1,1,0,4,0,4,2,3,6,0,1779,1,1,"London : printed for J. Murray , No. 32, Fleet-Street ; and Luke White, Dublin, MDCCLXXIX. [1779].",London,471,male,1712,1778,TRUE,"the points, unless the instruments formed something similar in accompanying the voice , of which we have no Indice, Voffius, in his book De Poematum Cantis & Veribus, raises the ancient rhyme greatly, and attributes to it all the force of the ancient music . He says, that a rhyme"
0552900106_000014,The spectator. ...,,68,0,1,2,0,4,1,1,1,3,0,1,1,0,2,3,0,0,1,0,1,2,4,1,0,0,1,2,0,0,0,5,2,0,1,0,2,2,2,1,0,2,0,0,1,0,1,0,3,0,2,0,0,4,0,0,0,1,2,1,0,0,0,4,0,1775,6,8,"London : printed for C. Bathurst; W. Strahan; J. Rivington; T. Davies; J. Hinton: L. Davis; T. Lowndes; Hawes, Clarke, and Collins; J. Dodsley; B. White; T. Longman; B. Law; S. Crowder; E. & C. Dilly; T. Caslon; J. Robson; W. Flexney; T. Becket; J. Johnson; W. Grissin; H. Baldwin; W. Nicoll; J. and T. Bowles; J. Knox; J. Ridley; R. Horsfield; G. Robinson; F. Newbery; T. Cadell; W. Otridge, and E. Johnston, MDCCLXXV. [1775].",London,448,unknown,,,FALSE,"the oracle: of Delphos pronounced to Cicero, when he consulted what course of studies he : hould.purfue, we hiould see .almft every, man as eminent in his .proper phere as Tally was in his, and should in a very short time find inmpertinence and affetation banished from among the women,"
0391400600_000086,"Lectures on the art of reading. In two parts. Containing Part I. The art of reading prose. Part II. The art of reading verse. By Thomas Sheridan, A. M. Author of Lectures on Elocution, British Education, &c.",Thomas Sheridan,76,3,0,1,1,1,0,2,0,0,0,0,1,1,0,0,0,0,1,0,0,2,0,0,0,0,0,0,1,3,0,4,5,3,0,1,0,2,0,1,0,1,0,3,0,4,0,1,1,4,5,0,0,0,0,0,4,0,1,3,6,0,5,5,0,1781,1,1,"London : printed for C. Dilly, in the Poultry; J. Dodsley, Pall-Mall; and T. Evans, in the Strand, MDCCLXXXI. [1781].",London,413,male,1719,1788,TRUE,"the fair. In this the word , hear, with a superior emphasis, obtains also a superior elevation. It is evident, in all these instances, that the change of emphasis, not only produces a change of quantity, but of note alib, in the different syllables on which it is placed. And"
0891200500_000040,"A general history of music, from the earliest ages to the present period. By Charles Burney, Mus.D. F.R.S. Volume the first.",Charles Burney,72,0,10,0,5,0,1,1,0,0,0,1,3,0,0,15,0,0,0,0,0,0,0,0,0,1,2,1,1,4,0,6,0,1,0,0,0,1,0,1,0,1,0,1,1,0,0,1,0,4,1,0,0,1,0,1,0,0,3,0,2,2,0,0,0,1789,1,1,"London : printed for the author: and sold by Payne and Son, at the Mews-Gate; Robson and Clark, Bond-Street; and G. G. J. and J. Robinson, Paternoster-Row, MDCCLXXXIX. [1789].",London,546,male,1726,1814,TRUE,"the pleasure of thy restless wheel, Whose track the Fates from human eyes conceal, Our fortune turns; and in life's toilsome race Tis thine, invisible, our steps to trace; To firew with flowers, or thorns, the doubtful maze, And by thy rule to circumscribe our days. Insulting tyrants, at thy"
1059101600_000009,"The history of the belles lettres, and of arts and sciences, from their origin, down to this present time. Being an introduction to the study of the belles lettres. Translated from the French of M. Juvenal de Carlencas. With a compleat alphabetical index.",Félix de Juvenel de Carlencas,67,0,4,0,1,1,0,0,2,0,0,4,2,0,1,1,0,1,1,1,0,1,0,3,1,0,5,2,0,0,0,1,0,1,4,0,0,0,1,1,0,2,0,1,0,0,0,0,4,0,1,0,0,2,1,3,0,2,4,2,2,0,1,2,1,1741,1,1,"London : printed for James Hodges, at the Looking-Glass, over-against St. Magnus Church, London-Bridge, 1741.",London,341,male,1679,1760,FALSE,"Poesy. God . Guided by the Holy Spirit, it was per('; (';) loc. CLI, set in its Origin: And it was inseparable from Music , because it was to serve for the Initrutioii of Posterity; and because Words put in a Song are better remembered. We have nothing in this"
1016700602_000059,"A general history of music, from the earliest ages to the present period. To which is prefixed, A dissertation on the music of the ancients. By Charles Burney, Mus.D. F.R.S. ...",Charles Burney,88,8,3,0,0,1,2,1,2,1,0,0,0,1,0,0,0,0,0,0,0,3,1,0,0,0,0,2,4,6,0,9,1,2,0,0,0,2,0,0,0,0,0,2,0,0,3,0,1,8,1,0,0,0,0,2,5,0,9,1,2,2,0,3,0,1776,2,4,"London : printed for the author: and sold by T. Becket, Strand; J. Robson, New Bond-Street; and G. Robinson, Paternoster-Row, MDCCLXXVI. [1776]-89.",London,612,male,1726,1814,TRUE,"to imply different Portions of Time , was invented. The ancients have left us no rules for Rhythm, Time , or Accent , in Music , but what concerned the words or verses that were to be sung ; and we are not certain that in high antiquity they had"
0212400501_000401,"Elegant extracts: or, useful and entertaining passages in prose, selected for the improvement of young persons: being similar in design to Elegant extracts in poetry.",,84,0,1,2,1,5,0,5,1,2,2,1,0,1,0,0,0,1,1,3,0,5,3,0,0,0,7,1,0,1,1,0,0,0,12,0,0,1,1,1,2,7,0,0,1,2,0,0,1,0,0,1,0,1,4,0,0,2,2,0,0,0,0,1,1,1794,1,2,"London : printed for C. Dilly, T. Longman B. Law & Son, J. Johnson, G. G. & J. Robinson, T. Cadell, & the rest of the proprietors, 1794.",London,646,unknown,,,FALSE,"our pleasure in reading him is much diminished. One would imagine , that many of his modern imitators thought the belt way to catch his spirit, was to imitate his disorder and obscurity. Infeveral of the choruses of Euripides and Sophocles, we have the same kind of lyric poetry as"
1172300300_000161,A complete dictionary of music. Consisting of a copious explanation of all words necessary to a true knowledge and understanding of music. Translated from the original French of J. J. Rousseau. By William Waring.,Jean-Jacques Rousseau,69,0,1,3,1,2,0,0,0,0,0,2,3,0,1,0,0,3,0,2,0,2,0,0,0,4,2,1,0,0,0,2,1,0,1,0,0,0,0,1,1,2,0,0,1,2,1,4,7,2,2,0,0,0,0,8,0,0,2,0,0,0,2,3,0,1779,1,1,"London : printed for J. Murray , No. 32, Fleet-Street ; and Luke White, Dublin, MDCCLXXIX. [1779].",London,471,male,1712,1778,TRUE,"1 dare to foretell, that so unnatural a taste cannot continue. Miufic, purely harmonic, is trifling: to please corftantly,. and prevent languor, it ought to be. raised to the rank. of imitative . arts ;, but its imitation is not always imamediate, as those of poetry :. and painting; the"
0625400300_000164,"A treatise of musick, speculative, practical, and historical. By Alexander Malcolm.",Alexander Malcolm,83,0,7,1,1,0,0,2,0,0,0,0,1,0,0,0,0,0,0,0,0,2,2,0,0,0,0,3,1,1,3,3,10,0,3,0,0,0,0,0,1,1,0,0,0,0,3,2,2,1,2,0,0,1,0,3,5,0,0,1,9,2,0,10,0,1721,1,1,"Edinburgh : printed for the author, MDCCXXI. [1721].",Edinburgh,639,male,1685,1763,FALSE,"as to the Rthinus, in the mefame Manner as to the I. we scan them, every pes being a distinct Bar Measure , separate by a diftine Paue; but id ebare Reading, that Diftinriiori was not ac irately observed, the Verse being read in a ore continuous Manner . Again"
0901900400_000047,"The critical spelling-book an introduction to reading and writing readily and correctly. In a manner more commodious than any, and more comprehensive than all the spelling-books that ever were publisht. Designd-For a standard of the language: and Contrivd by a proper gradation of instructions, disposd in a picturesque manner, for the easy and expeditious attaining-to a rational knowledge of it. By Mr Lowe, Tutor to his late Royal Highness the Duke of Cumberland, and to the Princess Amelia.","Lowe, Solomon",79,2,1,0,0,4,0,1,0,0,0,1,1,1,0,0,1,0,0,0,0,4,1,0,0,1,2,1,3,0,0,0,1,0,10,1,1,0,0,0,5,2,0,0,0,0,0,1,3,1,0,0,0,0,0,2,13,0,1,1,12,0,0,1,0,1770,1,1,"London : printed for F. Newbery, at the Corner of St. Paul's Church Yard, 1770.",London,211,male,,,FALSE,"to iambics . (a) There * Homage to thee, and peace to all fne brings. .Waller. * I sing the man, read it who lists. Cotton. (a) Two syllables our Finjlih feet compose, But i5artities distinguish them frcm Prof. There is also in frequent use what is called : galloping"
0757600900_000001,Rimes.,John Pinkerton,60,0,2,1,3,1,0,1,0,0,0,0,0,4,0,0,0,0,0,0,1,1,0,1,0,1,3,0,2,5,2,2,0,1,10,0,1,2,0,2,1,3,2,0,0,0,0,0,0,2,0,0,2,0,0,0,0,1,1,2,0,0,0,0,0,1781,1,1,"London : printed for Charles Dilly, MDCCLXXXI. [1781].",London,138,male,1758,1826,FALSE,"RI ME s. *P1NG0 MIHI ET IRPTX. L 0 N D 0 Ns 4PI1RNTED FOR CHARLES DILLY. m DCC.LXXYZ4 ADVERTISEMENT. W HEN such of the ODES in this publication as extend to greater length were composed, it was observed, that whatever art might be used to diversify the cadence, there"
1116300115_000246,"Encyclopaedia; or, A dictionary of arts, sciences, and miscellaneous literature ... Compiled from the writings of the best authors, in several languages ... Illustrated with five hundred and forty-two copperplates. ...",,72,0,0,2,1,2,0,0,0,0,0,0,1,5,0,0,3,0,0,3,0,1,4,0,0,0,0,1,3,0,0,2,5,2,1,0,0,1,0,0,1,5,0,0,0,2,0,0,1,3,2,0,0,2,0,0,0,0,0,6,6,2,4,1,0,1798,15,18,"Philadelphia : Printed by Thomas Dobson, at the stone house, no 41, South Second Street, M.DCC.XCVIII. [1798] (Copy-right secured according to law).",Philadelphia,801,unknown,,,FALSE,"of astonishing (fays Johafon) may write blank verse ; but those that hope only to plafe, rmuft condescend to rhime."" Rhime, however, is of less importance by far than rhythm, which in poetry as well as in music is the source of much pleasing variety ; cf variety tempered with"
0013904300_000034,A dictionary of music. Translated from the French of Mons. J. J. Rousseau. By William Waring.,Jean-Jacques Rousseau,101,1,1,6,1,1,3,12,0,4,2,0,0,7,1,1,0,0,1,3,0,2,1,0,0,0,0,0,1,0,0,13,1,1,0,0,3,7,0,0,1,0,0,8,0,0,0,0,1,2,0,0,0,0,0,0,0,1,0,0,0,1,6,8,0,1775,1,1,"London : printed for J. French, No. 47, opposite Hatton-Garden, Holborn, [1775?].",London,470,male,1712,1778,TRUE,"we must still be horn to the art , otherwise our works can never mount above the insipid. It is with the composer as with the poet. Nature herself must have formed him so. What I would express by genius is by, no means that strange capricious taste, which spreads"
