0377200101_000012,"The works of the Right Honourable Joseph Addison, Esq; In four volumes. ...",Joseph Addison,49,1,0,2,0,1,0,0,1,0,0,3,0,5,0,2,0,0,0,1,0,0,1,0,0,1,0,0,1,0,0,5,1,1,0,0,0,0,0,1,0,0,0,0,0,0,1,2,4,4,1,0,0,0,1,1,0,0,3,0,1,1,2,1,0,1721,1,4,"London : printed for Jacob Tonson, at Shakespear's-Head, over-against Katharine-Street in the Strand, MDCCXXI. [1721].",London,570,male,1672,1719,TRUE,"Egyptians yealy see their betmads Refreshed with floods, and sail about their ground, Where Persia borders, and the rolling Nile Drives swiftly down the swarthy Indians soil, Till into seven it multiplies its scream, And fattens egypt with a fruitful slime: In this lafi practice all their hope remains, And"
1350400106_000014,"The spectator, in eight volumes.",,58,0,2,2,0,3,0,1,1,3,0,1,0,0,2,3,0,1,1,0,0,3,3,2,0,0,1,1,0,0,0,4,1,0,2,0,0,0,2,2,0,2,0,0,1,0,0,0,3,0,1,0,0,4,0,0,0,2,0,0,0,1,0,3,0,1791,6,8,"Glasgow : printed by David Niven; for J. Duncan, J. & M. Robertson, Dunlop, & Wilson, J. & W. Shaw, R. Farie, A. Orr, A. M'Goun, and A. Macaulay, Glasgow.-J. Dickson, E. Balfour, P. Hill, J. Hunter, and J. & J. Fairbairn, Edinburgh; and W. Coke, Leith, Anno 1791.",Glasgow,308,unknown,,,FALSE,"happens! very luckily, that the Hebrewr idioms run into the English tongue with a particular grace and beauty . Our language has received innumerable elegancies anld improvements from that infusion of Heibrailms which are derived: to it out of the poetical passages in holy writ.i They givec a force and"
0899700301_000194,"Origines hebrææ: the antiquities of the Hebrew republick. In four books. I. The Idolatry of the Hebrews, II. The Ceremonial and Judicial Laws. III. The Arts and Sciences, professed by the Hebrews. IV. The Canon and Writers of the Old Testament, and the Apochryphal Books; with an Account of the Translation of the Septuagint, the Version of Aquila the Jew, and the Targum, or Chaldee Paraphrases. By Tho. Lewis, M.A. ...","Lewis, Thomas",74,0,1,5,0,0,0,0,0,3,1,0,0,0,1,3,0,1,0,1,0,0,0,0,1,0,0,3,0,1,0,8,0,2,0,0,0,3,1,0,1,8,0,9,0,1,0,0,6,0,0,0,0,2,1,0,2,2,4,0,1,0,0,2,0,1725,1,2,"London : printed for Sam. Illidge, under Serle's Gate, Lincoln's-Inn-New-Square; and John Hooke, at the Flower-de-Luce, over-against St. Dunstan's Church, in Fleetstreet, M.DCC.XXV. [1725].",London,849,male,1689,1749,FALSE,"and Syllables , nmakes the Jew answer, That the Scripture Poetry was of a nobler Sort, not formed to tickle the Ear, but to aftfe the Heart , by the great Height and Elevation of the Sense, together with lofty Expicllions, whereby Men were moved to attend to it, and"
0814901200_000010,"An introduction to the history of poetry in Scotland, from the beginning of the thirteenth century down to the present time; together with a conversation on Scotish song, by Alexander Campbell, ... To which are subjoined, Sangs [sic] of the lowlands of Scotland, ...","Campbell, Alexander",61,2,1,1,1,1,0,1,0,1,0,0,1,0,0,1,0,0,0,0,1,0,1,1,0,0,0,2,0,11,2,6,2,0,0,0,1,5,0,0,0,1,0,1,0,1,0,1,2,0,3,0,0,0,0,2,0,0,3,1,0,0,0,4,0,1798,1,1,"Edinburgh : sold by Andrew Foulis, 1798.",Edinburgh,628,male,1764,1824,FALSE,"the 1north high lands, and western Isles, a species of melody , partaking somewhat of the reel, and strathspey, seems more relifled by the natives, to which they dance, in a manner peculiar to these parts of the Iebrides.* The Athol reel is lively, and animating in a high degree."
0891200500_000092,"A general history of music, from the earliest ages to the present period. By Charles Burney, Mus.D. F.R.S. Volume the first.",Charles Burney,65,0,4,2,2,0,2,0,0,1,2,1,5,0,0,1,0,0,1,0,1,4,0,2,0,0,0,1,0,2,2,13,2,0,0,0,0,1,3,1,0,1,0,0,1,0,0,0,1,2,1,0,0,0,0,2,0,1,2,0,0,0,1,0,0,1789,1,1,"London : printed for the author: and sold by Payne and Son, at the Mews-Gate; Robson and Clark, Bond-Street; and G. G. J. and J. Robinson, Paternoster-Row, MDCCLXXXIX. [1789].",London,546,male,1726,1814,TRUE,"as well as of the manner in which it was afterwards patronised by their sovereigns of Greek extraction, many ancient writers who visited Egypt after it was made a Roman province, speak of the inhabitants as the most melancholy and abject race of men upon the globe. According to Am."
0169000202_000023,"Philosophical dissertations on the Greeks. Translated from the French of Mr. de Pauw, ...",Cornelius de Pauw,59,0,0,1,0,0,0,0,1,0,1,0,7,2,1,0,0,1,0,1,0,3,0,5,0,0,1,3,0,0,0,5,1,1,0,1,1,2,0,0,1,2,0,1,0,0,0,4,1,0,1,0,0,0,0,1,3,0,0,0,3,2,0,2,0,1793,2,2,"London : printed for R. Faulder, 1793.",London,311,male,1739,1799,FALSE,"tones and airs, frequently suffers ideas to escape; and in proportion as the fingers of men grow sonorous, said a philosopher of antiquity, their understandings grow mute. Anotherob jection made by Aristotle to the Grecian music , was deduced from the impossibility of understanding distincly what was sung To enjoy"
0620400201_000057,Sketches of the history of Man. Considerably improved in a third edition. In two volumes. ...,"Henry Home, Lord Kames",83,0,2,1,0,2,0,1,0,1,1,0,4,17,3,0,0,0,0,1,1,2,0,2,0,0,0,0,2,8,3,9,2,1,0,0,1,2,0,2,0,0,0,0,0,1,0,1,0,5,0,0,0,3,0,0,0,1,2,1,0,0,0,1,0,1779,1,2,"Dublin : printed by James Williams, 1779.",Dublin,558,male,1696,1782,TRUE,"of thought and style , very difficult to be supported: he finks often into puerile re flecions; witness his encomium on the river Po, M 2 which (') Elements of Critkifm, vol. i. p. zo. edit. 5 which, says he, would equal the Danube, had it the same number of"
0484500202_000050,"Poems on various occasions; with translations from authors in different languages. ... By the Rev. W. Collier, ... In two volumes. ...","Collier, William",61,0,3,1,0,0,0,0,0,4,0,1,0,0,0,3,2,1,0,0,0,1,0,1,0,0,2,0,2,0,5,5,0,0,0,0,0,0,0,0,0,2,2,0,0,0,2,0,0,2,0,1,1,0,0,0,1,0,1,1,16,0,0,1,0,1800,2,2,"London : printed by G. Sidney; for Cadell and Davies; and Robson, 1800.",London,390,male,1742,1803,FALSE,"to have any reference to the strophe and antistrophe of the ancients , but only to guide the musical composer (if ever the hymn should appear in its due form ), in the choice of airs and recitative, as well the simple, as the more adorned species, called accompanied, as"
0265000600_000001,"Experimental essays on divine subjects, in verse and prose: and hymns for social worship. By Joseph Swain, Author of redemption, a poem.",Joseph Swain,59,0,0,0,3,2,0,0,0,0,0,4,0,4,3,3,0,0,0,0,0,1,1,0,0,0,0,1,0,0,1,2,2,1,0,0,0,3,0,1,1,6,0,1,1,0,1,2,2,1,0,2,0,1,1,0,0,4,1,0,3,0,0,0,0,1791,1,1,"London : printed for the author: sold by J. Mathews, No 18, Strand, MDCCXCI. [1791].",London,181,male,1761,1796,FALSE,"; Fits; .j ^, 1 i'  /-' /""' (, /, y' i - -^ ^ EXPERIMENTAL ESSAYS ON DIVINE SUBJECTS, [PRICE is. 6d.] EXPERIMENTAL ESSAYS N DIVINE SUBJECTS, IN VERSE AND PROSE; AND H Y M N S FOR SOCIAL WORSHIP. BY JOSEPH S WA IN, AUTHOR OF REDEMPTION,"
0190800200_000010,"The polite arts, dedicated to the ladies, by Cosmetti.",Cosmetti,55,0,0,4,0,1,0,0,0,0,0,1,1,0,0,2,0,1,0,0,0,1,0,1,0,1,1,1,0,0,0,1,4,0,2,0,1,1,1,1,3,7,1,2,0,4,0,6,1,0,0,0,0,2,1,0,0,0,0,0,0,0,1,0,1,1767,1,1,"London : printed for the author; and sold only by W. Roach, Stationer, near Staple's Inn, and H. Dell, Bookseller, the Corner of Brooke-Street, Holborn-Bars, MDCCLXVII. [1767].",London,48,unknown,,,FALSE,"good chara&ters; for hey generally address each other with noble and virtuou sentiments . But the mixed w wicked personages deliver as base, vile, or tyrannic entences, as they are ill-bred or F ( 4) cruel, which are immediately swallowed up by those who resemble them. The intrigue of a"
1331900106_000014,"The spectator, in eight volumes.",,61,0,1,3,0,3,1,0,1,3,0,1,0,0,2,4,0,0,1,0,1,2,3,1,0,0,1,2,0,0,0,5,1,0,1,0,2,1,2,1,0,2,0,0,0,0,0,0,3,0,2,0,0,4,0,0,0,1,1,1,0,0,0,4,0,1776,6,8,"London : printed for J. Gardner, R. Gray and P. Anderson Luckenbooths Edinburgh, M.DCC.LXXVI. [1776].",London,354,unknown,,,FALSE,"never confider thit prepollerous repugnancy to nature any otherwise, than not only as thle grea test folly, but also one of the moil heinous crimes, since it is a direct opposition to the lifpofition of providence, and (as Tully expresses it) like the sin of the giants, an actual rp"
0670300102_000028,"Letters, addressed chiefly to a young gentleman, upon subjects of literature: including a translation of Euclid's section of the canon; ... with an explanation of the Greek musical modes, ... By Charles Davy, ... In two volumes. ...",Charles Davy,50,0,0,1,0,0,1,1,1,0,0,2,0,1,1,0,0,0,1,0,1,1,1,0,0,0,0,4,1,2,0,5,0,0,0,0,0,2,1,1,0,1,0,0,3,1,0,0,1,4,0,1,0,1,1,2,0,1,2,0,1,0,2,1,0,1787,2,2,"Bury St. Edmund's : printed for the author, by J. Rackham; and sold by Messrs. Payne and Son; T. and J. Merrill, in Cambridge; R. Beatniffe, in Norwich; and R. Cruttwell, Bath, 1787.",,544,male,1723,1797,FALSE,"than the division into verses so disjoins and breaks the sentiment in many initances, as renders it still more difficult to be understood; and the confusion which must unavoidably arise from the quickness of pronouncing some parts of a period which happens to be longer than ordinary, can give the"
0504100102_000117,"Lectures on rhetoric and belles lettres. By Hugh Blair, ... In two volumes. ...",Hugh Blair,71,0,1,0,0,2,1,4,0,4,0,0,1,0,1,3,0,0,1,1,0,0,0,0,6,0,0,4,1,0,0,4,1,0,0,0,0,1,2,0,2,5,1,0,4,0,1,0,0,0,0,0,0,5,3,4,0,3,0,0,1,0,1,3,0,1783,2,2,"London : printed for W. Strahan; T. Cadell; and W. Creech, in Edinburgh, 1783.",London,553,male,1718,1800,TRUE,"measure , to this form of Composition , that our.verfion, though in t in Prose, retains so much of a poetical cast. For the version L E C T. XLI being strictly word for word after the original, the form and, XLI order of the original sentence L preserved; which,"
1725700101_000143,"The history of Great Britain, from the first invasion of it by the Romans under Julius Cæsar. Written on a new plan. By Robert Henry, D.D. one of the Ministers of Edinburgh, Member of the Society of Antiquarians of Scotland, and of the Royal Society of Edinburgh. The second edition.","Henry, Robert",60,0,5,1,0,1,0,5,0,2,0,1,0,0,1,2,0,0,1,0,0,2,1,0,0,0,0,1,1,2,0,1,4,2,1,0,0,2,0,0,3,5,1,1,2,0,0,2,0,1,0,0,0,1,0,2,0,2,0,0,3,0,0,1,0,1789,1,6,"Dublin : printed for P. Byrne, No. 108, and J. Jones, No. III, Grafton-Street, MDCCLXXXIX. [1789].",Dublin,617,male,1718,1790,FALSE,"176:, 1763· (i90) M. Rollin nelles Letters, 1 r. p. 239 (r 1) origin of Laws. Arts , and Sciences, V I, p. 34s> 343 Vox. I. Aa vehen wvhen they are very muchz inflamed, are apt to break out In bold, daring, and, if you please, poetical expressions but"
0137000401_000023,"M. Fabius Quinctilianus his Institutes of eloquence: or, the art of speaking in public, ... Translated into English, ... with notes, critical and explanatory, by William Guthrie, Esq; in two volumes. ...",Quintilian,65,0,1,4,1,0,0,3,0,1,0,0,2,1,0,0,0,0,0,1,0,2,0,0,0,2,0,1,1,1,0,16,1,0,0,0,0,1,0,0,0,0,0,0,0,0,1,1,3,4,1,0,0,0,1,1,0,2,2,0,1,1,7,1,0,1756,1,2,"London : printed for T. Waller, 1756.",London,429,male,35,96,FALSE,"Principles were afterwards imitated by a Harp. And not contented with that Harmony which arises from Sounds differing in themselves, they have assigned a Music to the Movements of the heavenly Bodies. For many of Plato's Works, particularly his i'im4us, is unintelligible, without a thorough Knowledge of this Accomplishment. Need"
0263000100_000107,"A new introduction to the Italian language, grounded on reason and authority. By Henry Marius Tourner, a Native of Rome, Philos. Theolog. & LL. D. Member of the Roman Arcadia, and of several other Literary Societies.","Tourner, Henry Marius",76,1,1,0,1,3,1,0,0,0,0,0,1,1,1,0,1,1,0,0,12,6,1,1,0,0,1,2,0,0,0,2,0,0,0,0,0,3,0,0,5,6,0,0,1,0,0,0,1,0,0,0,0,1,1,1,0,1,0,0,15,0,0,4,0,1794,1,1,"Edinburgh : printed by Neill & Co. for the author. Sold by P. Hill and T. Duncan, Edinburgh; and J. Edwards, Pall Mall, London, M.DCC.XCIV. [1794].",Edinburgh,439,unknown,,,FALSE,"which, dramatic representations were composed, comedies on the fiage, and sacred oratorios were sung in churches ; at length it was found, that this lyrico dramttic p .etrv very well became the sublime gravity of the Corburnus, and that even it was an improvement on the ancient tragedies of the"
1517000102_000050,"The history of Great Britain, From the first invasion of it by the Romans under Julius Cæsar. Written on a new plan. by Robert Henry, D.D. one of the ministers of Edinburgh, member of the Society of Antiquarians of Scotland, and of the Royal Society of Edinburgh. The second edition.","Henry, Robert",72,0,6,4,0,0,0,1,0,0,4,0,1,0,0,0,0,0,0,1,0,0,0,1,0,2,0,0,0,0,0,9,2,0,0,0,0,0,1,1,8,8,1,0,0,0,0,2,3,4,0,0,0,0,0,4,0,0,2,0,3,1,3,0,0,1788,2,12,"London : Printed for A. Strahan; and T. Cadell, in the Strand, MDCCLXXXVIII. [1788].",London,502,male,1718,1790,FALSE,"at length forfeited the public favour "". In this most ancient period, the British Bards seem to have been, in general, men of genius and virtue, who merited the honours which they enjoyed. Though the ancient Britons of the southern None of parti of this island had originally the same"
0538200103_000079,"The complete dictionary of arts and sciences. In which the whole circle of human learning is explained, And the Difficulties attending the Acquisition of Every Art, Whether Liberal or Mechanical, are Removed, in the most easy and familiar manner. Among the various Branches of Literature explained in this Work are the following, viz. Agriculture Algebra Anatomy Architecture Arithmetic Astronomy Botany Catoptrics Chemistry Chronology Commerce Conics Cosmography Dialling Dioptrics Ethics Fluxions Fortification Gardening Gauging Geography Geometry Grammar Gunnery Handicrafts Heraldry History Horsemanship Husbandry Hydraulics Hydrography Hydrostatics Law Levelling Logic Maritime And Military Affairs Mathematics Mechanics Merchandize Metaphysics Meteorology Music Navigation Optics Painting Perspective Pharmacy Philology Philosophy Physic Pneumatics Rhetoric Sculpture Series Statics Statuary Surgery Surveying Theology, &c. The theological, philological, and critical branches, by the Rev. Temple Henry Croker, A. M. Chaplain to the Right Honourable the Earl of Hillsborough. The medicinal, anatomical, and chemical, by Thomas Williams, M. D. The mathematical by Samuel Clark, Author of an Easy Introduction to the Theory and Practice of Mechanics. and the other parts by several gentlemen particularly conversant in the Arts or Sciences they have undertaken to explain.","Williams, Thomas, M.D.",82,1,8,1,1,0,0,0,0,0,1,0,3,0,0,0,1,0,0,0,0,3,2,0,0,0,0,2,3,0,7,8,0,2,0,0,0,3,0,0,0,3,0,0,0,0,1,0,0,3,0,0,0,0,0,2,7,0,0,2,11,1,0,6,0,1764,3,3,"London : printed for the authors, and sold by J. Wilson & J. Fell, Pater-Noster Row; J. Fletcher & Co. St. Paul's Church-Yard; J. Coote, Pater-Noster Row; Mess. Fletcher & Hodson, Cambridge; and W. Smith & Co. Dublin, MDCCLXIV. [1764].",London,603,unknown,,,FALSE,"the horizon; and hence navigators distinguish the rhumbs by the same name as the points and winds. See COMPASS. RHUMB LINE, in navigation, the line which a fhipl de'cribes, keeping in the same collateral point or rhumb. See COURSE. RHYME, in poetry , a similitude of sound between the last"
0103300501_000019,"Paradise lost, by John Milton; with notes, selected from Newton and others, to which is prefixed, the life of the author. With a critical dissertation, on the poetical works of Milton, and Observations on his Language and Versification. by Samuel Johnson, L.L.D.",John Milton,71,0,0,2,0,1,0,0,0,2,2,0,0,0,0,0,0,1,0,1,3,0,7,2,0,0,0,0,2,3,0,3,2,1,0,1,0,0,0,1,2,7,0,1,0,0,2,0,0,1,0,0,0,3,0,0,2,2,0,2,10,0,0,4,1,1796,1,2,"London : printed for J. Parsons, 21, Paternoster Row, 1796.",London,326,male,1608,1674,TRUE,"Milton would not have excelled in dramatic writing; he knew human nature only in the gross, and had never studied the shades of character, nor the combinations of concurring, or the perplexity of contending passions. He had read much, and knew what books could teach; but had mingled little in"
0620400201_000058,Sketches of the history of Man. Considerably improved in a third edition. In two volumes. ...,"Henry Home, Lord Kames",68,0,2,8,2,0,0,2,0,1,4,0,4,1,0,0,0,0,0,1,3,0,0,2,0,0,0,2,0,1,3,9,2,0,0,0,1,1,2,0,2,1,0,0,2,1,0,0,2,0,0,0,0,2,0,0,0,0,4,1,1,0,0,1,0,1779,1,2,"Dublin : printed by James Williams, 1779.",Dublin,558,male,1696,1782,TRUE,"tragedies ot Sophocles and Euripides were for a long course of time the delight of the most refined nation that ever exitted: an Italian opera , on the contrary, never runs * No person will fufpec that under tmin cenfule is comprehended the Co lebrated Metaiafio. runs above a season;"
0250700703_000016,"Critical reflections on poetry, painting and music. With an inquiry into the rise and progress of the theatrical entertainments of the ancients. Written in French by the Abbé Du Bos, ... Translated into English by Thomas Nugent, gent. From the fifth edition revised, corrected, and inlarged by the author.",Jean-Baptiste Dubos,68,0,9,0,2,0,0,0,0,2,0,0,1,0,0,1,0,0,0,2,0,4,0,0,0,0,0,4,0,8,2,12,0,0,1,0,0,2,0,0,1,0,0,0,0,1,0,0,4,3,1,0,1,0,0,0,0,0,1,0,1,1,0,3,1,1748,3,3,"London : printed for John Nourse, 1748.",London,291,male,1670,1742,FALSE,"regard to that melody which was properly a musical song , we are very well informed how it was written. The general fytem, or as Boetius calls it, the Constitution of the music of the ancients , was divided, according to Martianus Capella a, into eighteen sounds , whereof each"
1116300115_000272,"Encyclopaedia; or, A dictionary of arts, sciences, and miscellaneous literature ... Compiled from the writings of the best authors, in several languages ... Illustrated with five hundred and forty-two copperplates. ...",,58,0,6,2,1,1,0,0,0,0,0,2,1,0,1,4,0,1,1,0,0,2,0,0,2,1,4,1,0,0,0,1,0,1,10,0,0,2,0,0,0,3,0,0,0,0,1,1,3,0,1,0,0,1,1,0,0,1,0,1,1,0,0,0,0,1798,15,18,"Philadelphia : Printed by Thomas Dobson, at the stone house, no 41, South Second Street, M.DCC.XCVIII. [1798] (Copy-right secured according to law).",Philadelphia,801,unknown,,,FALSE,"had a psalm of ]avidin his view, which says, that "" the: heavens declare the glory of God , and the firmament fliteeth his handcywoyk."" The spacious firmament on high,, With all the blue.etheriil sky, And fpangled.heav'ns, a fhir i!!g frame) Their great original proclaim: Th' unwearied fun, fri, m"
1420300800_000026,"Clio: or, A discours[e] on taste. addressed to a young lady. By I.U.","Ussher, James",59,0,2,3,0,3,0,2,3,2,2,0,1,5,1,0,0,0,0,0,0,1,1,1,0,1,0,0,0,0,2,3,5,0,0,0,0,1,0,0,0,5,0,0,1,0,1,0,1,1,1,0,0,1,1,1,0,1,3,3,0,0,0,0,0,1778,1,1,"Dublin : Printed by J. Kiernan, for T. Walker, No. 79, Dame-Street, M,DCC,LXXVIII. [1778].",Dublin,262,male,1720,1772,FALSE,"mafic I speak of, was perfetly understood and praaifed by the ancients ; that the muses of the Greeks always sung , and their song was the echo of the fubjec, which swelled their poetry into enthusiasm and rapture. An inquiry into the nature and merits of the, ancient music"
0241200200_000030,An essay towards establishing the melody and measure of speech to be expressed and perpetuated by peculiar symbols.,"Steele, Joshua",87,4,3,1,0,3,0,1,0,0,0,0,6,0,0,0,0,0,0,0,0,2,11,0,0,0,0,2,3,3,0,2,1,1,0,0,0,5,0,0,0,3,1,1,0,1,0,0,0,1,5,0,0,0,0,0,7,2,1,3,6,0,4,4,0,1775,1,1,"London : printed by W. Bowyer and J. Nichols: for J. Almon, in Piccadilly, MDCCLXXV. [1775].",London,213,unknown,,,FALSE,"marked, at least "" in their poetry , by the fupplofo pedis, and from thence, as you ""very ingeniously observe, they had their name.. But there "" was this difference betwixt those bars and such as we have, and "" I believe they had, in music , that they did"
1291300102_000104,"Lectures on rhetoric and belles lettres. By Hugh Blair, D. D. One Of The Ministers Of The High Church, And Professor Of Rhetoric And Belles Lettres In The University, Of Edinburgh. In two volumes. ...",Hugh Blair,60,0,0,1,0,1,0,4,0,3,0,2,0,0,0,1,0,2,0,0,0,3,0,0,2,0,2,1,0,1,1,1,2,1,2,0,0,2,2,0,0,8,0,0,3,0,1,0,4,0,1,1,0,4,2,0,0,0,1,1,0,0,0,0,0,1789,2,2,"Dublin : printed for Messrs. Colles, Moncrieffe, Gilbert, Walker, Exshaw, White and Byrne, M,DCC,LXXXIX [1789].",Dublin,412,male,1718,1800,TRUE,"8oth Psalm, wherein the people of Israel are compared to a vine. Of parables, which form a species of allegory, the prophetical writings are full: and if to us they oimetimes appear obscure, we must remember, that in thefi early times , it was universally the mode throughout all the"
0451800100_000053,"Memoirs of the Rev. Isaac Watts, D.D. By Thomas Gibbons, D.D.",Thomas Gibbons,65,0,0,0,0,3,0,1,0,3,0,2,0,0,2,3,0,2,1,1,0,1,1,1,1,0,5,0,1,0,0,0,0,0,2,1,0,6,0,3,7,5,0,0,0,0,0,0,3,1,0,0,0,1,1,0,0,2,3,1,0,0,0,1,0,1780,1,1,"London : printed for James Buckland in Pater-Noster-Row; and Thomas Gibbons at No. 2, in Norton-Falgate, near Bishopsgate-Street, MDCCLXXX. [1780].",London,511,male,1720,1785,FALSE,"smiling radiance throws, In lovely charms displays celestial truth, And stamps the Maker's image on the heart . Anon each vice in its detested forms Of horror glares malevolent and wild, The monfrrous birth of hell, itself the food Of its own vipers, and by doom divine Condemned to the"
0769400502_000038,"The works of the most celebrated minor poets. Namely, Wentworth Earl of Roscommon, Charles Earl of Dorset, Charles Earl of Hallifax, Sydney Earl of Godolphin, John Lord Somers, Dr. Sprat Bp. of Rochester, Sir Samuel Garth, George Stepney, Esq; William Walsh, Esq; Thomas Tickle [sic], Esq; and Ambrose Phillips, Esq; To which are added, pieces omitted in the works of Sir John Suckling, Mr. Otway. Matthew Prior, Esq; Dr. King, and Dean Swift. In three volumes.","Wentworth Dillon, 4th Earl of Roscommon",69,0,3,0,0,1,1,4,2,0,0,0,6,2,0,1,2,0,0,1,2,1,2,0,0,0,1,0,0,0,7,0,4,4,0,0,0,1,0,0,3,4,0,1,0,0,1,0,0,2,1,0,0,0,0,0,0,0,0,0,11,0,0,1,0,1751,2,3,"London : printed for F. Cogan, at the Middle-Temple-Gate, MDCCLI. [1751].",London,262,male,1633,1685,FALSE,"thousand years, consists but of fifty lines; so that its brevity is no less admirable, than the subjec matter; the noble fashion of handling it, and the Deity speaking . Virgil keeps up his characers in this refpec too, with the ftriteft decency. For poetry and pastime was not the"
0589900801_000002,"A poetical translation of the works of Horace: with the original text, and notes collected from the best Latin and French commentators on that author. By the Revd Mr. Philip Francis, ... In four volumes.",Horace,77,0,0,1,4,0,0,1,1,7,1,1,0,2,0,0,0,0,1,3,0,5,1,2,0,0,3,2,4,0,0,1,5,7,5,1,0,2,0,0,2,5,0,0,1,0,0,0,0,0,0,0,2,0,1,0,0,2,0,2,1,0,0,1,0,1747,1,4,"London : printed for A. Millar, 1747.",London,263,male,,,FALSE,"their' Festivals, where the noblest Precepts of Philosophy were enlivened by Music , and animated by the Language of Poetry . When we therefore confider its Origin and Institution, we may believe, that nothing could enter into its Compositions , but what was chaste and correct; awful and sublime ;"
0476600400_000050,"The evidences of the Christian religion. With additional discourses on the following subjects, viz. Of God, and his attributes. The power and wisdom of God in the creation. The Providence of God The Worship of God. Advantages of Revelation above Natural Reason. Excellency of the Christian Institution. Dignity of the Scripture-Language. Against Atheism and Infidelity. Against the Modern Free-Thinkers. Immortality of the Soul, and a Future State. Death and Judgment. Collected from the writings of the Right Honourable Joseph Addison, Esq;",Joseph Addison,61,0,2,1,1,2,0,1,1,3,0,4,0,0,2,4,0,0,2,0,0,1,1,2,1,0,1,2,0,0,0,6,4,0,1,0,0,0,2,1,0,2,0,0,1,0,1,0,2,0,1,0,0,4,0,0,0,1,0,0,0,1,0,3,0,1772,1,1,"Edinburgh : printed by Gavin Alston. Sold at his printing-house, Fish-Market Close, MDCCLXXII. [1772].",Edinburgh,270,male,1672,1719,TRUE,"is composed in the most elegant and polite forms of speech, which are natural to our tongue, when it is not height. ened by that solemnity of phraet which. m: y be drawn from the sacred writings. It has been said by some of the ancients , that if the"
0595000502_000081,"A poetical translation of the works of Horace: with the original text, and critical notes collected from his best Latin and French commentators. By the Revd Mr. Philip Francis. In four volumes.",Horace,71,0,1,0,0,2,0,1,1,2,1,5,0,0,0,4,0,0,0,0,0,1,0,1,0,0,0,2,4,0,0,1,1,1,6,1,0,3,1,0,8,0,0,0,0,0,0,5,1,0,5,0,5,0,0,1,0,0,0,0,5,2,0,0,0,1753,2,4,"London : printed for A. Millar in the Strand, MDCCLIII. [1753].",London,384,male,,,FALSE,"to invite the whole World to the Celebration of a Fellival, which they had never yet beheld; nor flould ever behold again. 4 Virginiirs pterifrquc.] The secular Poems were sung by fifty-four young Persons of both Sexes, equally divided into two Choirs. I er ngvcni illzh/rcs pferi, cim toti.icm virginibus"
